quotes,authors,categories
"I really like dating stories, like in Betty and Veronica comics; I like David Lynch and H.P. Lovecraft for the dark gut-wrenching stuff, and I'm inspired by Miyazaki's films for the subtle heart-warming moments, as well as the moments that blew up my imagination.",Fred Seibert,Dating
"For me, being a public persona, I was always wondering, 'Was a man dating me for who I was? Was there an agenda? Did he want to be seen with me? Am I arm candy?'",Gina Neely,Dating
Hollywood is a lot like high school. Everyone was interested in what the head cheerleader was doing and what the captain of the football team was doing and if they were dating each other.,Perez Hilton,Dating
Is Amazon truly the best online buying experience? Absolutely not. Is eBay the best platform for auction? Probably not. Are dating sites like match.com really a reflection of the way people date? Probably not.,Danny Rimer,Dating
"In Indonesia, where I am from, the Dutch-imposed Civil Code dating back to the colonial 1870s prevailed until the 1974 Law on Marriage granted married women greater rights, including the ability to open individual bank accounts.",Sri Mulyani Indrawati,Dating
It's just me and my 6-month-old puppy. I am not dating anyone.,Bridget Hall,Dating
I think we are the first feminist or first attempt at a feminist dating app.,Whitney Wolfe Herd,Dating
"I have a Tinder account. Now I've done Bumble, and I've tried this other one, and the way I justified it is that... because I'm on TV, I shouldn't be eliminated from participating in what's going on in the world. But people are always like, 'I can't believe you're on a dating app!'",Eric Stonestreet,Dating
"Dating is hard in general, especially in places like L.A. and New York.",Jordan Fisher,Dating
I've been in plenty of situations where someone I'm dating had more time for a console than me.,Josie Maran,Dating
"Florida wants to get married. We want to stop this every-two-year or every-four-year dating process where, in between those election cycles, investments in our state diminish.",Andrew Gillum,Dating
"Since doing 'Dating in the Dark' and getting engaged, I've become the top agony aunt to all my friends. It's brilliant.",Sarah Harding,Dating
I try not to read the stuff online because it's so hurtful and stuff. There was somebody that said I was messing up my genetics by dating my boyfriend because he's not black. It was an interesting thing to read.,Taylour Paige,Dating
"Look at the Prius. It's a nerd car. Yeah, you're being environmentally friendly, but your dating life is gonna suck.",Xzibit,Dating
"This is what I hate about dating - when you just don't know where you stand. I'm pretty honest, I'll say, 'Hey I don't know what's going on,' but I don't like the game of it. Like, do we like each other? Great, well let's explore that.",Hannah Brown,Dating
I'm not interested in serial dating; I'd honestly rather be single.,Tamsin Egerton,Dating
My dating advice for Paris would be just to take your time.,Kathy Hilton,Dating
A month alone would make me so happy. Not good for my dating prospects.,Barry Jenkins,Dating
"We all make snap judgments on small amounts of information. We do it all the time with online dating, deciding whether to spend time someone on the basis of a short blurb and three pics.",Alice Levine,Dating
"In the age of social media and dating apps, so many people are able to hide behind their Instagram page or their Raya page or Facebook. And it's like, 'Let's set something up! I want to meet face-to-face.' And 'Take Me' was about, 'Are you going to take me out? Do I have to be the first person to make the move?'",AJ Michalka,Dating
"We have known Hillary Clinton both professionally and personally for close to 20 years, dating back to before President Bill Clinton's first trip to Africa in 1998 - a trip that they both acknowledge changed their lives and gave considerable meaning to their post-White House years and to the activities of the Clinton Foundation.",Valerie Plame,Dating
"I've said many times how big a wrestling fan I am, but all my bias aside as her husband, I'm a huge Candice LeRae fan. I was a huge Candice LeRae fan before we started dating. I was a huge Candice LeRae fan before we got married.",Johnny Gargano,Dating
The best companies in the world have all had predecessors. 'YouTube' was a dating site. You always have to evolve into something else.,Kevin Systrom,Dating
"After a number of years dating, we decided we were good partners.",Melinda Gates,Dating
"Married life is the same as dating life, except now you have a ring, and the state of California has a vested financial interest in the outcome of your marriage.",Thomas Middleditch,Dating
"There's nothing wrong with taking yourself out of the dating pool. You don't need to be in a relationship because that's what society expects of you or because your grandmother thinks you need to be married by a certain date. Those days are over. Instead, take a step back and say, 'I'm OK alone.'",Whitney Wolfe Herd,Dating
"My family had a lot to do with 'My Infamous Life.' They were the inspiration behind me starting to write. I had an interesting family life dating way back, and they did a lot in their lifetime.",Prodigy,Dating
"I urge you children to be patient with your parents. If they seem to be out of touch on such vital issues as dating, clothing styles, modern music, and use of family cars, listen to them anyway. They have the experience that you lack.",Joseph B. Wirthlin,Dating
"I'm not traditional at all. It's not that I'm against marriage; it just never mattered that much to me. If I was dating someone who getting married was very important to them, then absolutely. I'd have no problem. I love the idea of finding someone to be a great father figure to Jasper and to share my life with.",Georgina Bloomberg,Dating
"Anything I take up or do, I have to consult Shilpa. From what I wear to who I am dating, I make her a part of everything as I have faith in her judgment.",Shamita Shetty,Dating
"I came out to my parents when I was a junior in college. And it was pretty fine. They were more concerned with why I wasn't dating anyone. But now I'm 36, and I still don't date anyone.",Billy Eichner,Dating
"Dating in Los Angeles can be hard, which makes it all the better when you meet a really nice guy.",Lauren Conrad,Dating
"After my mother passed away, I felt as though I would never have a relationship as strong as the one that I had had with her. Then, after a lot of ups and downs, I started dating again - but I realised pretty quickly that I was never going to write cheesy love songs.",Amber Mark,Dating
Pamela Anderson Lee released a statement confirming that she has had her breast implants removed. Doctors say that Pamela is doing fine and that her old implants are now dating Charlie Sheen.,Conan O'Brien,Dating
"When I first started dating my husband, I had this weird fascination with the circus and clowns and old carnival things and sideshow freaks and all that. About a month after we started dating, he bought me this amazing black-and-white photo book on the circus in the 1930s, and I started sobbing.",Christina Hendricks,Dating
"Dating is hard. It's difficult and not quantity, but quality. Finding a good person.",Chris Harrison,Dating
"I am dating, but it is hard to find someone quick enough and funny enough. I am quite demanding.",Anne Robinson,Dating
Facebook and pictures on the Internet have created such a different way of dating. It's not necessarily good because an obsessive quality can develop in people.,Alexander Koch,Dating
I was so focused on advancing in my career that I didn't have enough emotional capacity for dating.,Yvonne Orji,Dating
"No one knew me until I met my wife Lulu. Lulu's mother used to ask, Which one is Maurice? For six months she thought Lulu was dating Barry.",Maurice Gibb,Dating
"Our nation is built upon a history of immigration, dating back to our first pioneers, the Pilgrims. For more than three centuries, we have welcomed generations of immigrants to our melting pot of hyphenated America: British-Americans; Italian-Americans; Irish-Americans; Jewish-Americans; Mexican-Americans; Chinese-Americans; Indian-Americans.",Ami Bera,Dating
"The way I was raised, you get a new pair of sneakers when the old one gets messed up. But when I got to high school, I started dating girls and trying to fit in, and I realized everybody was collecting Jordans. When I would get my paychecks, I wouldn't even take money. I would just trade them for sneakers.",Kerby Jean-Raymond,Dating
"Sometimes when people start dating a hot piece, they take on some of their boo's characteristics unintentionally.",Phoebe Robinson,Dating
"Everybody dates these days. Like you get to know someone before you end up getting married, committing for a lifetime relationship. So dating is cool, date as much as you want, get to know the person.",Vaani Kapoor,Dating
What does 'dating' mean? I don't know. I couldn't say.,Catherine Hardwicke,Dating
I've never tried to pass myself off as anything more than a comedian who wrote a dating book.,Greg Behrendt,Dating
"The earliest example known to me of replaced body parts is exemplified by a Mayan skull dating back to 1400 BC. In this skull, false teeth made of stone had been implanted.",John Gurdon,Dating
I love having boyfriends. I love dating. I do not want a husband in my house.,Shonda Rhimes,Dating
"Will Bridges, who is the co-creator with me, when we were working on 'SuperBob,' we were just talking about how we like to write about relationships. And we were talking about what love is. We were in very different stages; he was married and was about to have his first child, and I was kind of dating the wrong people.",Brett Goldstein,Dating
"The fact that we have 7 days of the week can be traced to the Babylonian and Jewish civilisations, with the first documented reference dating to 600BC.",Simon Singh,Dating
"Once you're dating already, then you go to dinner. But I've never been on like a, 'I'm getting dressed up for a date. Pick you up at 7.'",Camila Morrone,Dating
"I don't actually watch that much TV, but I was obsessed with 'Dawson's Creek' growing up. And 'Freaks and Geeks.' And '8 Simple Rules for Dating My Teenage Daughter.'",Anya Taylor-Joy,Dating
"Dating, like almost every other male-female interaction in present-day society, is based on outmoded and unequal social roles and expectations.",Lynn Coady,Dating
"You like someone, you court each other, you get into a relationship. You're answerable to each other. Whereas, the non-answerability of dating, my God, I don't know if I would ever be able to.",Priyanka Chopra,Dating
"I'm single, and I hate dating.",Keshia Knight Pulliam,Dating
"I've never been speed dating! I sort of wish I had, just for the experience of it.",America Ferrera,Dating
"I don't talk about who I'm dating because when you break up, you wind up reliving it in the media.",Bridget Fonda,Dating
"When I was a boy, I took over the shed at the bottom of the garden and displayed fossils and potsherds and coins in it and proudly called it my 'museum'. I charged people to come in, and my most prized possession was a Saracen shield dating from the Crusades.",Kevin Crossley-Holland,Dating
"Good-looking individuals are treated better than homely ones in virtually every social situation, from dating to trial by jury.",Martha Beck,Dating
"In dating, the question is how many Tinder knockoffs are we going to have, and are any of them going to take off?",Sam Yagan,Dating
My wife and I started dating in 11th grade.,Walker Hayes,Dating
"Ideally, we date the folks who are dating for the same reason we are.",Amanda Seales,Dating
I don't have dating tips.,Bill Keller,Dating
"Ever since the infamous quiz show scandals of the 1950s, the feds had insisted that TV game shows be honest - or that at least they didn't cheat. So as a 'Dating Game' bachelor, I didn't know what I was going to be asked. The other bachelors and I were required to concoct our answers in real time.",Seth Shostak,Dating
Even when I was dating a man I always said I'd never get married until marriage equality was passed in Australia. It wouldn't feel right.,Jessica Origliasso,Dating
"Dating is kind of hard. Like dinner or something like that. Like a forced awkward situation is very strange. Especially for me, for some reason.",Zac Efron,Dating
"Evolution is unobservable. It's based on blind faith in a few dry bones and on unreliable dating systems in which the gullible trust. Kids should be allowed to make up their own minds about this issue, and not be censored to 'one side is all we will let you hear.'",Ray Comfort,Dating
"Are you kidding? I'm a terrible cook, but John is a really great one. Literally, I never cook. The whole time we were dating, I prepared two officially romantic meals. Both of them were such disasters that he begs me never to go into the kitchen again.",Rebecca Romijn,Dating
"'Dating In The Dark' is a unique show that is going to bring something very new to the table for the audiences. The format will make people look beyond the general dating norms of our society: who knows, maybe even reinvent them.",Nora Fatehi,Dating
"I'm in love with love and totally believe in marriage, but that's not even on my radar right now. I am not putting energy into dating.",Selena Gomez,Dating
"I have used dating apps a couple of times in the past and met people, but it is a difficult thing because you're meeting someone who you really don't know and you have no link to. I have friends who have had great relationships after meeting on Tinder or Bumble, so I'd never say never, but it hasn't worked for me.",Georgina Campbell,Dating
I started dating at 16.,Ashley Graham,Dating
"Even though many couples are choosing to marry later in life, our laws haven't been updated to address dating partner abuse.",Gabrielle Giffords,Dating
"When you're thinking about building your own online dating profile, especially on OkCupid, you should go through the same steps you're thinking about when you're going out to meet someone new. You want to put your best foot forward.",Sam Yagan,Dating
"Frankly, the reason I joined MENSA is because I was dating a guy at the time who spoke five languages and could solve a Rubik's Cube literally with his eyes closed because it's just an algorithm.",Ashley Rickards,Dating
"My own experience of dating cis-hetero men has really been a challenge, because of the stigma they have to endure for attempting to love us.",Trace Lysette,Dating
We don't do 'dating' in Sweden.,Caroline Winberg,Dating
"It's a bit harder being on TV. I would be open to finding dates through Facebook or Instagram though, does that count? I do love flicking through profiles on my friend's dating apps though!",Laura Whitmore,Dating
I guess there are all these women with a big secret - they're hiding men they are ashamed of. They come up to me and say: 'I've been dating this guy for six months in secret but none of my friends know. I can't give him up even though he's embarrassing.',Hannah Simone,Dating
It's incredibly tough dating multiple women and trying to have them enjoy the experience.,Nick Viall,Dating
"My very close friend, Aisha Ahmed... everyone is convinced that I am dating her.",Rohit Saraf,Dating
That's the dating world. You just keep losing. Everyone does.,Riki Lindhome,Dating
Dating is... weird.,Jennifer Coolidge,Dating
"I don't really talk about my personal life. It's a strange and funny and weird thing. Sometimes you have a conversation with someone and the paparazzi snaps a picture of you and people decide you're dating. If I try to answer everything people say, I would be up all night.",Tracee Ellis Ross,Dating
"When I don't have a girlfriend, who I am answerable to, I can go out and hang with people. But whether you go for a movie with someone or a meal or a drive, it is assumed that you are dating that person.",Shahid Kapoor,Dating
"Dating is hard enough in the light, so I can't wait to see what unfolds when the lights are off!",Sarah Harding,Dating
"It's lonely. That's why, in many ways, the CIA is the world's biggest dating agency, I think. I imagine it's much like two actors that get married because they understand that universe. You know, I'm pretty sure the agency's divorce rate is rather high.",Valerie Plame,Dating
"I didn't write my book, 'I Don't Care About Your Band,' in order to give women a brand-new set of dating rules they need to feel terrible about not abiding. I wrote my book to make the women who read it feel good about themselves, and a little more entitled to be treated well by the guys they go out with.",Julie Klausner,Dating
I think it's important to figure out you and to have fun and to be dating and to figure out what you like and what you don't like. It's what growing up is all about.,Lily Collins,Dating
It's tough to be 68 and dating. I've given it up now.,Ian McLagan,Dating
"When I first got started in this whole world of online connecting, we were combating this antiquated stereotype of who used online dating, and we really set out to make it popular with millennials. What I find to be so fascinating now is, I'm seeing an inverse in that trend.",Whitney Wolfe Herd,Dating
"On numerous different occasions I have had people tell me that I am only booked because of my dad, because of who I was dating, or any other exceptions other than my hard work, so in my mind I wanted to put in the extra hours in the ring.",Tessa Blanchard,Dating
Dating is just awkward moments and one person wants more than the other. It's just that constant strangeness. I think it's a very real thing.,Jason Schwartzman,Dating
"You can draw inspiration from anything. If you're a good storyteller, you can take a dirty look somebody gives you, or if a guy you used to have flirtations with starts dating a new girl, or somebody you're casually talking to says something that makes you so mad - you can create an entire scenario around that.",Taylor Swift,Dating
"I have never had any issues with falling in love, dating, sustaining long-term relationships, or attracting great men in my life, who have loved me unconditionally.",Kenya Moore,Dating
"Everyone in the dating business wants to know what women want - it's the billion-dollar question. But it's simple: put one in charge, and you find out.",Whitney Wolfe Herd,Dating
"I was also dating someone from UCLA and also I had another suitor, Jimmy Caan. So it was between my college boyfriend, Jimmy Caan and Hef. And Hef won. Within a few months, we were exclusive.",Barbi Benton,Dating
"Mahesh lays down most of the rules. Even when I was dating him for four years prior to our marriage, he didn't want our relationship to be out in the open.",Namrata Shirodkar,Dating
"I'm enjoying dating. I'm single, though, I'm not in a relationship.",Matt Czuchry,Dating
"I grew up, I had three uncles and... I loved Uncle Donald because he gave me dating advice, and I was, like, 5. But the other thing that I found fascinating about my Uncle Donald is he dressed up like a woman. And so I grew up around all of these men who dressed like women, so when I hear that, I don't hear a cause. I hear my family.",Salim Akil,Dating
"I want my audience to know me for my work, not because of who I'm dating or what drugs I'm on or what club I went to.",Shia LaBeouf,Dating
"I've had two romances since moving to Las Vegas. One was with somebody 12 years older than me, and the other was the same age, and neither worked out. I know people still think of me as one of Hugh Hefner's girlfriends, and he of course was much older than me, but that was a whole different lifestyle and a different kind of dating.",Holly Madison,Dating
"A great time in my life was being totally single and actively not dating. Just saying, 'I'm gonna not be in a relationship. I'm gonna not date.' That was a super fun, awesome time.",Michaela Watkins,Dating
"When a girl is single, everyone wants to find out who she is dating.",Ankita Lokhande,Dating
"I realized I'd built up walls and carried grudges for years. I had a lot of animosity, dating back to when I was growing up, toward people who told me that what I was doing datingwise was wrong.",Rex Chapman,Dating
"I was a weird teenager. My mother was actually worried because I didn't have any interest in dating in my teenage years. I had all this desire to pursue my passions like ballet, then sailing, then music, so I didn't have any emptiness to fill.",Kiesza,Dating
"Dating is a numbers game. What we try to promise is good first dates. Once that first date happens, it's really up to you.",Sam Yagan,Dating
"There were dozens of dating apps when Bumble came on the scene, but they weren't able to attract critical mass in a young professional group.",Whitney Wolfe Herd,Dating
"Dating shows should exist for people who aren't straight. They're out there, there aren't enough of them. Whether you try and squeeze a format that already works into something else. I don't know.'",Olly Alexander,Dating
My parents are conservative. They really weren't in support of us dating before marriage.,Aishwarya R. Dhanush,Dating
I highly suggest marriage to all my friends who are dating.,Jerry O'Connell,Dating
Both the guys in Nightwish and I have experiences with previous band breakups and all emotions that come with it. It's almost like dating.,Floor Jansen,Dating
"Oh, yeah, I did the online dating thing. I did Nerve, I did Match. On Nerve there was this one guy who, when I asked him what he did for a living, said he 'used to be in a band.' I was like, 'That is not an occupation.'",Julie Klausner,Dating
I don't know why anyone would want to ask an actor for dating advice. We are not the poster children for healthy relationships.,Ginnifer Goodwin,Dating
"Getting diagnosed with cancer at 22 really magnified the in-betweenness that I felt. All of my friends were starting careers and going to parties and dating, and I was stuck - literally - in this one hospital bed for weeks on end.",Suleika Jaouad,Dating
"Mum left school at 15, and after a few years of modelling and dating jazz musicians, was married by 21 to my father, Mike Taylor, a journalist on the 'Daily Mirror.' They had my brother and me pretty quickly and had split up by the time I was two. I don't really have any memories of them as a couple.",Natascha McElhone,Dating
"Mary Tyler Moore was a working woman whose story lines were not always about dating and men. They were about work friendships and relationships, which is what I feel my adult life has mostly been about.",Tina Fey,Dating
"As much of a privilege as it is to pass, it's painful. You have to compartmentalize your life. That's awkward. Dating can be horrible.",Trace Lysette,Dating
"I heard on public radio recently, there's a thing called Weed Dating. Singles get together in a garden and weed and then they take turns, they keep matching up with other people. Two people will weed down one row and switch over with two other people. It's in Vermont. I don't think I'd be very good at Weed Dating.","Roy Blount, Jr.",Dating
"I don't really believe in rules, but I do like old-fashioned dating where you don't call the guy until he calls you. I don't think it's like he's got to do this and that's the rule.",Ashley Tisdale,Dating
I'm a South Asian female that talks about relationships and periods and dating and all these things.,Lilly Singh,Dating
I've gotten a lot more disciplined since dating Sue.,Megan Rapinoe,Dating
"When I left Tinder, I had no intention of getting back into the dating industry. What I ultimately wanted to do was start this contagious complimentary social network, where kindness was at the helm.",Whitney Wolfe Herd,Dating
"People usually spend the first two months playing themselves up, not really being themselves. You waste those two months - and then they tell you, 'You're not who I was dating the first month!'",Manny Montana,Dating
"The difference between being a part-time writer and a full-time writer is like the difference between dating someone and living with them. Some of the romance is gone, but you learn things you'd never know just by dating.",Scott Westerfeld,Dating
"I was single for a while and dating and... I just didn't know how to do it! I've always been like that: when I was 15, there was a guy I liked, and we made out, and I thought that meant he was my boyfriend.",Winona Ryder,Dating
"I don't need to make an announcement about who I'm dating. It's up to me to decide when and what I want to share about my personal life, and it is up to the audience to decide how they look at it.",Shibani Dandekar,Dating
"Honestly, I think dating is hard. Period.",Sevyn Streeter,Dating
"Being a drag superstar, traveling the world and touring, it really is not as glamorous as you'd think it is. There's lots of airport drama and bags and buses and hotels. Dating and having a social life are impossible.",Violet Chachki,Dating
"I tried to make up for being 5 ft. 3 in. by affecting a strut and adopting the voice of a much bigger man... dating tall, beautiful women... But nothing I could do, after Ava had left me, would add a single inch to my height.",Mickey Rooney,Dating
"The fact that Manti Te'o thought for a long time that he was dating, like, a fake girl and then that she died and did the tribute and the girl never existed. I mean inherently that's funny.",Dave Portnoy,Dating
The thing about dating someone who listens to a totally different genre than you is they can help you find things to appreciate in that genre.,Hannah Simone,Dating
"It's usually drawing on personal experience. I don't think I could dig deep enough trying to get into somebody else's life. Like 'Far From Me' - I wrote it about this waitress that I was dating when I was fifteen or so, and she broke up with me.",John Prine,Dating
