quotes,authors,categories
"I got to know E'Dawn when he was a trainee, and since becoming friends after performing together, we began dating in May 2016. We began dating after working on our music together.",Hyuna,Dating
"Women in their thirties are much more nervous about dating. They feel time is 'running out for them. They want to get married and have a family. The women I see in their forties and fifties know what they want. They are amazing, confident women with good jobs, but they are just struggling to find someone who is their equal.",Matthew Hussey,Dating
"I got that experience through dating dozens of men for six years after college, getting an entry level magazine job at 21, working in the fiction department at Good Housekeeping and then working as a fashion editor there as well as writing many articles for the magazine.",Judith Krantz,Dating
"The term 'alpha female' originated in my field of animal behavior, but has acquired new meaning. It refers to women who are in charge, for example, by flirting and dating on their own terms. It is also used maliciously for a loud-mouthed, controlling woman who has no patience with deviating opinions.",Frans de Waal,Dating
"Honestly, my dating life according to the tabloids is very exciting, and the most hilarious thing is that it's nowhere near as exciting as the tabloids have ever made it out to be.",Margot Robbie,Dating
I think that dating other musicians can be complicated at times. Especially when they think highly of themselves.,Nick Jonas,Dating
Jon has always been the romantic. He started dating before I did. I was more awkward and nervous in front of girls in high school.,Drew Scott,Dating
"Taylor Swift dates guys so she can write a breakup song about them. I don't think she's dating for love - I think she's dating for creativity. So let's get her off the market and put her in dating detox. If she really wants love, she has to stop writing music about them.",Patti Stanger,Dating
"I haven't been brought down because people are focused on who I'm dating, what I'm eating, or what handbag is the best handbag - that's so cheap to me. But if others want to open up about their personal lives, that is their choice. It's not for me to judge.",Garrett Clayton,Dating
"I'm not interested in dating. I like being with my own best friend, me. Certain women, particularly older women, cannot believe I like going to a social event by myself. But I do.",Gloria Allred,Dating
"I was inspired by the men who walked on the moon. It really was my inspiration, I think, you know, as a kid of 9 years old - I know I'm dating myself, but - I thought, 'What a cool job!'",Peggy Whitson,Dating
That's the awful thing about dating. Tight underwear. We would all like to be in a big bra and pants and when you are in a secure relationship you can do that.,Dawn French,Dating
"I met my future husband Andy fighting for trans equality, and we fell in love. A couple of months after we started dating, Andy was diagnosed with cancer, and despite getting a clean bill of health several months later, eventually his cancer came back, and it was terminal.",Sarah McBride,Dating
"Coming through the fire and through the storm of life with a strong man, my fiance Ashanti, whom I've been dating for eight months and two wonderful children beside me, I'm just so happy that I have been able to maintain my integrity and get to where I am today with the right energy around me.",Angie Stone,Dating
Stuff about me dating Kim Kardashian - I have no idea where that came from and all these other rumors. I don't think I'm that type.,Jeremy Lin,Dating
"'How I Built This With Guy Raz' asks entrepreneurs to tell the story of how they made their name and, in some cases, their fortune. Whether they're in the business of selling burritos or dating apps, there's inevitably something you can learn from their stories.",David Hepworth,Dating
I'm the girl who - I call it girl-next-door-itis - the hot guy is friends with and gets all his relationship advice from but never considers dating.,Taylor Swift,Dating
"I've never done online dating, but first of all, I have a book out called 'Make It Last Forever: The Do's and The Dont's,' which led me to do the online dating thing. A lot of people respect my relationship songs, so they can pretty much trust me.",Keith Sweat,Dating
I don't really comment on my personal life because I feel like any comment at all is opening up a whole can of worms. I'd just rather not talk about who I'm dating.,Josh Hartnett,Dating
"I was tired of a system where women waited around for men to send them a message or ask them out. With Bumble - first a dating app, now a social network that helps you make empowering connections in love, life, and business - women had to make the first move, or the match was void.",Whitney Wolfe Herd,Dating
"I write about what I know: teenage dating, overly charged sexuality, all the things that make you uncomfortable.",Bo Burnham,Dating
"Everybody's got baggage, and not just the classic, 'Oh I have so much baggage,' but everyone comes with so much context, and you're not just dating a person: you're dating all their context, too. Part of relationships is negotiating each other's context.",Emily V. Gordon,Dating
"I have experienced bad dating and ineptitude with women all across the globe, from Vietnam to Paris. When I was 21, women were an enigma; they were this code that had to be cracked. They were 'The Other.' I have often thought writing this stuff into stand-up and shows would be an exorcism, but it hasn't been; it makes no difference.",Stephen Merchant,Dating
"When I started dating I had this kind of Romeo and Juliet, fateful romantic idea about love which was almost that you were a victim and there was a lot of pain involved and that was how it should be.",Emma Watson,Dating
"I'm much more interested in what an actor has to say about something substantial and important than who they're dating or what clothes they're wearing or some other asinine, insignificant aspect of their life.",Ben Affleck,Dating
"My husband, after two weeks of dating, asked me, if our relationship were to work out, would I be OK with our first boy being named Ace.",Jennie Finch,Dating
"Dating co-stars is natural. When you're working with someone, it's habit.",Rachel Bilson,Dating
It's really helpful when you do something you don't like. You won't make that mistake again. It's like dating a bunch of people who are wrong for you - you learn so much more about yourself that way.,Rooney Mara,Dating
"The rich are different. Their wants are very high maintenance. They'll pick eye color and hair color, all the way down to what she does for a living, what school she went to. Their list can be extremely long. But at the end of the day, dating is dating, because they're human beings.",Patti Stanger,Dating
"I think in order to really create something special, it has to be built on some foundation. And I think friendship is a good foundation you could always tap back on if you don't agree. So for me, it's not dating, it's more so friendship.",Omarion,Dating
Golf and dating don't mix.,Larry David,Dating
"I've spoken to over 10,000 guys in my career, so I know what they think when it comes to dating.",Matthew Hussey,Dating
Are we solving the world's problems by allowing women to make the first move on a dating app? No. But I do believe we are helping to change some very archaic norms.,Whitney Wolfe Herd,Dating
"I love 'Threepenny Opera'; I was exposed to it as a little kid because my parents, my mom and my dad, had bonded, when they were dating, over 'Threepenny Opera' and introduced it to me, a child, who could barely understand it. But I immediately gravitated even from that early age.",Sasha Velour,Dating
I'm not very good at dating.,Evan Peters,Dating
"My wife and I got engaged in New Hampshire at this lake house that her family's had forever, and it's on Lake Winnipesaukee. And so we went there every summer as we were dating.",Jimmy Fallon,Dating
"I'm representing the single women out there, dating around, trying to find the right guy who respects you and appreciates you. Maybe I'll settle down somewhere. Gotta keep looking.",Madchen Amick,Dating
"I'm very happy to be part of a generation where you don't have to say that you're gay. It's just like, 'I'm dating a dude,' or, 'I'm dating a girl,' and I love it. I think it's a great time.",Keke Palmer,Dating
"Any online dating profile is about making us more human, more three-dimensional.",Matthew Hussey,Dating
"It's a really deep and layered psychological situation - making music with someone - if they're trying to make something real and personal. It's almost like dating: you allow yourself to be consumed by the other - not in a bad way, but in a way that happens in nature.",Arca,Dating
"I don't have much experience, but the few times when I would go on a date with a girl - like when I was 12 - there was a lot of sharing, and a lot of talking, and a lot of asking how I am. They thought we were dating, and I was sort of hoping to meet their brothers.",Anderson Cooper,Dating
"I think we live in the fast instant gratification generation. We want our love like our food, our films, our deliveries... fast and instant. Dating can be quite disposable now, with a swipe of a finger you're gone.",Asim Chaudhry,Dating
"I started dating JD Samson from Le Tigre, and suddenly I was listening to more up-tempo music and old dance music, like ESG and Gang of Four, and I thought, 'Wow. This is fun.'",Sia,Dating
"Well, dating has become a sport and not about finding the person you love.",Rashida Jones,Dating
"People say, 'Just say who you're dating. Then people will stop being so ravenous about it.' It's like, No they won't! They'll ask for specifics.",Kristen Stewart,Dating
All my freakouts have been pretty private and directed at family pets and/or people I have been dating for too short a time to freak out at in that way.,Lena Dunham,Dating
"I'm very heterosexual, so dating women is something I'm not ashamed of. But my love life is not as exciting as it is reported to be.",Ranbir Kapoor,Dating
"When I was in high school, the genders were so separate from each other. If you weren't 'dating' somebody, you couldn't just be friends with somebody.",S. E. Hinton,Dating
"Dating in college and dating in Hollywood are actually really similar in that the relationships don't last long. Other than that, lots of people in Hollywood tend to be narcissistic, and it's hard to have a relationship with someone like that.",Julia Stiles,Dating
"Early on, when my wife and I were dating, we went to the grocery store, and I told her that sometimes I just buy birthday cakes, and I eat them. And she said: 'Really? I do, too.'",Tom Cotton,Dating
"I had a crazy life for a teenager. I lived in New Jersey, but I'd go to Vermont for three weeks, join a commune, take pictures with the guy I was dating, come back home, and post photos.",Halsey,Dating
"When my parents were dating, they were very poor, so my dad couldn't take my mom out. They would go to the grocery store and pick out funny looking vegetables. When I grew up, we'd still go and find the ones with personality.",Parker Posey,Dating
"I went through child abuse, and I also went through abuse with dating a couple of boyfriends in high school. I also have gone through a divorce.",Cheryl Burke,Dating
"My parents always looked like they loved being together. That's what I took from them, and that's how my wife and I are. I still feel like we're dating.",Billy Crystal,Dating
I have put gay dating on the map.,Patti Stanger,Dating
"First and foremost when you're doing comedy, you gotta be relevant and applicable to the times that you're living in. When you try and just do comedy about who is dating who and lifestyle jokes, it gets tiring after a while. It's hard to be funny in that realm.",Adam McKay,Dating
"I used to do people's online dating for them. I had clients in San Francisco, L.A., New York and they'd pay me $800 a month to basically make them profiles on all the best websites for the demographics for them.",Vick Hope,Dating
"My mum wants me to get married - and have children, of course. She's met Gaga; we've been dating a while. We're in a committed relationship, and I'm really happy in my relationship. I'm a very lucky guy. As far as having more of a domestic life and settling down into my relationship, we have to see what happens.",Taylor Kinney,Dating
"When it comes to dating, I'm straightforward and traditional with a twist.",Luke Pasqualino,Dating
"When you are young, do not get involved in steady dating. When you reach an age where you think of marriage, then is the time to become so involved.",Gordon B. Hinckley,Dating
"As far as dating is concerned, I'm not a casual dating person.",Divyanka Tripathi,Dating
"I always wanted so much glamour in my life, so I have always been obsessed with class, and from dating a few people who were from old money and a few from new money in my 20s, I just sort of became obsessed with this idea of clueless rich people.",Natasha Leggero,Dating
"I ain't scared to do another dating show, but I ain't really trying to. I want to do a talk show or something. I've done enough dating on television. I'm ready to spread my wings, and go down other avenues.",Flavor Flav,Dating
Going through a breakup in the middle of a pandemic/quarantine has really put a crimp on dating.,Becca Kufrin,Dating
"A lot of people - boys - look at me differently. They think that if they date me, they are gay because they are dating another boy. In instances like this, I feel almost excluded, if that's the right word. I feel like I'm being put on a different shelf.",Jazz Jennings,Dating
"For a long time, I had a crazy girl dating habit.",Eli Roth,Dating
I am just scared to death of online dating.,Michaela Watkins,Dating
"I am a young girl, and I am open to dating, but at the risk of sounding cliched, I really don't have the time for it.",Bhumi Pednekar,Dating
"Whenever you have an ex, and they're like, 'I hope we can still be friends!' and you weren't friends before you started dating, then what do you go back to, really?",Ed Sheeran,Dating
"Anybody I'm dating, I don't want them to talk about my music. I don't talk about my music to them.",Nas,Dating
A seersucker suit is one of the most iconic styles dating from the 1920s and is still a gentleman's best bet when it's hot and sticky.,Roger Stone,Dating
"You may hear the most beautiful things, you may hear promises, you may hear everything you want to hear but if the person you're dating is not following up with their actions then they're just words.",Nancy Juvonen,Dating
"When I was first divorced, I started dating younger women, and it was really exciting. But after a while I was like, 'This is just dumb.'",Louis C. K.,Dating
"I've had a little bad, bad media luck the new year. Well, apparently I'm dating Bill Clinton, which makes me nervous. I didn't know, though.",Julie Bowen,Dating
"Someone who'll bring some normalcy into my life and help me stay in touch with reality. That is something I'm curious about. There are so many actors who are married to people from non-film backgrounds, and their marriages are successful. I'm tired of dating actresses.",Shahid Kapoor,Dating
You're talking to someone who has been married to various people for the last 40 years of her life. Dating is not really something familiar. I've never really been a dater.,Stockard Channing,Dating
Wedding dress shopping is basically like dating. You pick the one based on how you feel.,Brooke Baldwin,Dating
"I have very little experience with dating websites. My feeling toward dating websites is what most people's is: If it works, great. If you're serious and legitimate about it and know what you're looking for, then from what I hear, it's definitely effective.",Nev Schulman,Dating
I love dating. Where else can you go and talk about yourself for three hours?,Gok Wan,Dating
"I give dating advice on a regular basis. It's not that I'm any expert, but it's always nice to share that with your friends.",Ashley Tisdale,Dating
I normally don't ever talk about my dating life or anything super personal in the press just because I feel like there's this fine line between what to keep to myself and what to share.,Lizzie Velasquez,Dating
Dating is all about the chase. It's fun!,Lauren Conrad,Dating
"There was a difference between the rock 'n' roll royalty, the woman who was married to or dating a rock star and the girl that hung out and just wanted sex.",Bebe Buell,Dating
I started my blog back in 2009 because every Internet business and marketing seminar I watched at the time told me I had to. I had been trying to get a business started selling dating and life advice and was struggling.,Mark Manson,Dating
"The learned are not agreed as to the time when the Gospel of John was written; some dating it as early as the year 68, others as late as the year 98; but it is generally conceded to have been written after all the others.",Simon Greenleaf,Dating
"'Dating Game' wasn't social commentary, political analysis, Shakespearean-level drama or even blunt-force comedy. It was just the televised equivalent of meeting someone at a bar. But it appealed to our most basic Darwinian instinct: selecting a good mate. You can't go wrong when a show's premise is hard-wired into human DNA.",Seth Shostak,Dating
People do struggle to meet a partner in the 21st Century with online dating and people not really being who they seem to be.,Anna Richardson,Dating
"Oh, my dating skills are the worst. No, I pick the wrong men; it's amazing. I am awful, the worst dater.",Paget Brewster,Dating
"I tried to tell them about the dating process because I'm single now and how horrible it is and how many foolish experiences I had had dating. So I was really selling him hard, but the whole time he really wanted me!",Andie MacDowell,Dating
"The woman I am currently crazy about was a vegetarian for a year until I started dating her. As is the case with most vegetarians, she had never eaten properly prepared meat, only commercially packaged or otherwise abused flesh.",Steve Albini,Dating
"So my favorite online dating website is OkCupid, not least because it was started by a group of mathematicians.",Hannah Fry,Dating
It's always been like this since the beginning of time. You interact with one female or somebody that people will think you'll cute with and everybody either assumes that you're dating or they want you date. It's just how it all works.,David Dobrik,Dating
"During my initial days of modeling, I started dating men much older than my age who would pamper me silly with expensive gifts.",Sherlyn Chopra,Dating
I get to be the nosiest friend or acquaintance that anyone has because it's - my job is to ask you about your dating life all the time.,Sam Yagan,Dating
"I know some people who've gotten tattoos that they probably shouldn't have, like the name of somebody they were dating, and that never ends well.",Nikki Sixx,Dating
"For a lot of the time I was in Berkeley, I was single. I was living in a kind of collegiate apartment by myself - it was like a protracted summer vacation. So at least in hindsight, I have gloomy emotions attached to Berkeley, whereas I started coming to New York because I was dating someone, and it was very exciting and romantic.",Adrian Tomine,Dating
"I think Jules has gotten hotter, with age. I mean you should've seen her when I first started dating her - not hot. I've told her that.",Guy Sebastian,Dating
I think a nice romantic dinner should be saved for when you and the girl you're dating or seeing have something special and it's a more special occasion.,Ben Savage,Dating
"No matter how liberal or modern a family is, there will always be resistance when someone discloses that they are dating someone.",Gautham Menon,Dating
I love being a single mom. But it's definitely different when you're dating.,Brooke Burns,Dating
"While my husband and I were still just dating, we courted over Popeyes fried chicken. What better way to really get to know someone than by getting elbows-deep in biscuit crumbs and chicken grease?",Sohla El-Waylly,Dating
"Honestly, Tarek and I met through work, so we worked together before we even started dating - it's our normal.",Christina Anstead,Dating
I have an urge to communicate. I think I'm a change from what it would be like dating a normal guy who doesn't talk too much.,Drake,Dating
"Some black women hug me and walk away. A lot of black men talk about dating white women and how they've been there, too. People open up about their racial experiences. I feel like I'm a walking therapy session. It's quite intense. But it means a lot to people.",Daniel Kaluuya,Dating
"It took years of psychotherapy before I even considered dating. I lost weight, replaced my glasses with contact lenses and felt a lot more confident. But I find it really hard to hold down a relationship.",Anne Hegerty,Dating
"Being a woman in a power position and dating someone, in my experience, is hard.",Alana Haim,Dating
"But I am not a serial dater or anything like that. Maybe when lockdown is over, I can do speed dating for weeks on end!",Gethin Jones,Dating
"With all the things like Tinder and these different online sites that people use, 'Love Island' actually goes back to the traditional side of dating.",Caroline Flack,Dating
I was a late starter on the romantic front. I didn't start dating until I was in my 30s.,Geri Halliwell,Dating
"If we made the 'Batman' games more realistic, you'd have to be Bruce Wayne for half the game, counting his money and dating supermodels.",Paul Dini,Dating
"I got married at 18 after dating my boyfriend for about a year. It was quick, I know. My husband joined the Army, and I thought I'd go to college. But we moved to Fort Hood for his job with no money, not even a car.",Anna Todd,Dating
"I can literally count on one and a half hands how many people in WWE treated me the same pre-Mark and post-Mark. Michelle McCool didn't change, I'm still me. There were a ton of people that found out I was dating Mark and was like, 'Oh, I better change my tune and be super nice.'",Michelle McCool,Dating
"I think that we all have to have that rite of passage of dating the tortured artist who seems cooler than we think we are; we aspire to be like them, and we're excited that somebody is turning us on to new music or a new lifestyle.",Drew Barrymore,Dating
"After you're dating someone for a few weeks, you often don't become exclusive until you give yourself more time to know what a relationship could be like in the future. You can't get too excited too quickly.",Eniola Aluko,Dating
"It is not a shocker to me that a film went out of my hands, not because I was not credible, but because I was not so-and-so's daughter or sister or dating so-and-so.",Taapsee Pannu,Dating
"I grew up in the world of bad television, on my dad's sets and then as a young schmuck on dating shows and so on.",George Clooney,Dating
"I truly believe that what we're seeing with online dating is very similar to what happened with the Myspace-Facebook era, where Myspace was once this place for online connecting for a very select group of young people. And then Facebook kind of hit at this moment where it was acceptable for everybody to do it.",Whitney Wolfe Herd,Dating
"Dating, to people, can mean completely different things.",Jay Ellis,Dating
"I wouldn't tell you anything about anybody I cared about because it becomes entertainment for other people, and it sort of just cheapens everything in your life. I would never tell you if I was dating anybody.",Kristen Stewart,Dating
I have spent a decade of my life dating. I am thrilled about never going on another bad date for the rest of my life. I'm also so excited to learn and grow with the person I respect most in this world.,Leah Pipes,Dating
"In this day and age, I ask anyone I date right away: 'Are you married? Are you in a relationship with anyone? Does anyone think they're in a relationship with you?' And by the way, if someone says, 'Yes, I am dating other people,' that's not necessarily a deal breaker. But you have to communicate it, not hide it.",Tracee Ellis Ross,Dating
"I remembered, like, when 'Not When My Daughter' came out, I'm serious, I think dating for Iranian men became a lot harder. Dude's name, Shahrokh - became Tony. Mehsud became Mike.",Maz Jobrani,Dating
"If you're in the music to move to Hollywood and be in 'People' magazine dating an actress or dating some Hollywood celebrity, are you into it for that side of it? Are you in it to be a millionaire? Or are you in it because you love it and you like playing music and you like going on tour?",Chad Gilbert,Dating
"I think feminism's a bit misinterpreted. It was about casting off all gender roles. There's nothing wrong with a man holding a door open for a girl. But we sort of threw away all the rules, so everybody's confused. And dating becomes a sloppy, uncomfortable, unpleasant thing.",Zosia Mamet,Dating
I want to start dating the man that I'm gonna marry. I want to start having some fun with someone that I know I'm gonna be with. I don't play any games. I'm too old for that. I've been there; I've been around the block.,LisaRaye McCoy-Misick,Dating
"The presence of industrial quantities of Byzantine pottery dating from the sixth century AD on the headland at Tintagel, Chinese silk in the tombs around Mecca and 'Arabic' numerals in the 13th-century beams of Salisbury Cathedral tell us we have been interdependent not for decades but across millennia.",Bettany Hughes,Dating
"Yeah, I think everybody has the crises of questioning themselves at some point or other in their lives. Is this where I should live? The job I should have? The girl I should be dating? Is this the friend I should have?",Chris Messina,Dating
