quotes,authors,categories
"I must have been yearning for some Jewish content beyond my genetic makeup because soon after my 21st birthday, I noticed I was no longer dating WASPs.",Susan Isaacs,Dating
I can't imagine dating someone famous. I try to stay away from that as much as I can.,Dylan Penn,Dating
"I've always been intellectually restless, but it is the building part of it that most interests me. It is the constructing of the team that is my favorite part. Anyone who is familiar with the history of the A's franchise, even dating back to Philadelphia, knows that every five or 10 years, you have to tear it apart and rebuild it.",Billy Beane,Dating
"If you're dating the quarterback and then you go out with the hockey player, you just go to the hockey games. I don't think I'll still go to the football games.",Nicolle Wallace,Dating
"I knew a ton of actors and was friends with them, but I never dated actresses. I tried to date 'normal' people because the Hollywood dating rule is 'one star per couple' because it's quite a challenge to match the egos of two actors.",Zach Galligan,Dating
"OKCupid's model is almost entirely based on advertising, which is the way most online media is monetized these days, whether it's the news or whether it's sports, and we think online dating is going to evolve in the exact same way.",Sam Yagan,Dating
"I think for marketplace businesses, and when you think about online dating, it's not a social network. It's not a place where you go to talk to people you already know; it's a place you go to interact with someone you've never met before.",Sam Yagan,Dating
Your goal in an online dating profile and in your first message to somebody is to strike up a conversation.,Sam Yagan,Dating
"We sold OkCupid to Match in January of 2011. In September of 2012, I became CEO of all of Match, which is the operating segment of IAC that contains all of the dating properties.",Sam Yagan,Dating
"My friends and the people I know understand that I'm going to ask them what they're doing, how they're dating, who they're dating, where they're going and what they're doing. I'm constantly asking those questions and making sure I'm in touch with the customer.",Sam Yagan,Dating
"One thing matters more than anything else for a dating product, and that is the quantity and quality of the people who use the product. It's really freaking hard to get critical mass.",Sam Yagan,Dating
"We were intrigued by the fact that we had so much actual behavior among people on our dating site, OKCupid.",Sam Yagan,Dating
"My work involves online dating, but I believe almost every behavior exhibited online has an offline corollary. Really, the medium doesn't change human nature.",Sam Yagan,Dating
"When people talk about the impact of mobile dating, everyone focuses on real-time meeting - this idea that my pocket will vibrate every time a hot girl walks by. That's important. But it's not transformative.",Sam Yagan,Dating
"That's the miracle of Amazon! It's like Internet dating. In the early days, you could get slimed as an author on Amazon by someone bearing a grudge, or jealous, or whatever. And because there were so few reviews posted, this stank.",Nigel Hamilton,Dating
"Julianne Moore and Michael Keaton began in 1980s soap operas and 1970s sitcoms, respectively, such ancient history by show business standards that you need carbon dating to measure their careers.",Steve Erickson,Dating
"Insider trading by hedge funds has a long and distinguished history, dating to the days when people didn't know that there was such a thing as a hedge fund.",Gary Weiss,Dating
"While actors are great and awesome, writers literally create new worlds from scratch. What is sexier than that? Personally, I don't know why every last person out there isn't dating a writer.",Rachel Bloom,Dating
"I don't do a lot of dating. I guess it's kind of like everyone is always trying to set me up with somebody, so we go out and hang out at a club or somewhere. I think dates are weird.",Matt Cohen,Dating
"I've surfed the Web and the whole dating connection. I find that pretty fascinating, but no real leads.",Taylor Hicks,Dating
I had to deal with being somewhat of an outcast because it's not socially acceptable to be a struggling musician. There have been times where I've felt sorry for the person I was dating. I felt she deserved better.,Taylor Hicks,Dating
"As I've told Tyler, there's not a really easy place between being single and being married for us now. We're just so busy that the logistics of our career make dating impossible. I think I'll find a girl at some point that makes all of the extra work and effort that needs to be put into it worth it. But for right now, I just date my drums.",Josh Dun,Dating
I believe that often people even stay in bad relationships longer than they should because the fear of the pain of dating is scarier than the pain of a bad relationship!,Karen Salmansohn,Dating
"My views are very fluctuating. I have very contradictory takes on the subject. Dating is easier, while marriage is hard work. You see your friends having early divorces, and on the other hand, you see your parents having a successful marriage.",Kangana Ranaut,Dating
Comedy helped me out in my teenage years. It saw me through puberty and helped me to deal with dating.,Rhys Darby,Dating
"Everybody knows now that Marie Lightfoot, the true crime writer, is dating Franklin DeWeese, the state attorney of Howard County, Florida. They know I'm a white woman; they know he's a black man. That's not news anymore.",Nancy Pickard,Dating
I have no dating life.,Sara Sampaio,Dating
"With the release of her fourth album, 'Red,' in 2012 and a handful of highly publicized romances, Taylor was criticized by the press and other entertainers for such sinful acts as dating people and writing songs about it, gaining a reputation as boy-crazy and love-ridden.",Tavi Gevinson,Dating
Wells Fargo's internal review only covers unauthorized accounts dating back to 2011. News reports and court documents suggest these problems might have existed long before then. The 2013 'Los Angeles Times' articles led to the L.A. city attorney's office investigation into Wells Fargo's sales practices.,Richard Shelby,Dating
"Kathie Lee and I were working together on our 'Live' morning show when she started dating Frank. I always loved trying to get her to tell me about her new romance, and it wasn't long before we were watching them take their vows in front of close friends in Southhampton.",Regis Philbin,Dating
I hate dates. It becomes a weird auditioning process. And I've never had normal dating.,Juliette Lewis,Dating
Our countries have been friends dating to the very existence of the United States. France is the only power that has never been at war with the United States.,Marine Le Pen,Dating
"The best dating advice I can give is... are you going in it for marriage, or are you going in it for just a date? You've got to be open about it right away, because the other person could be in it for marriage, but you're not.",Kendra Wilkinson,Dating
My boyfriend and I are not good at fighting. We're better than we were when we started dating - two breakups and three years ago - but it's never come naturally to either of us. I have often wished we fought like I imagine Pink and Carey Hart fight.,Nikki Glaser,Dating
The trail of dating sites relying heavily on Facebook is littered with failures.,Sunil Nagaraj,Dating
"I wouldn't mind telling my five good friends that I'm dating, but I don't want my loose connections to know.",Sunil Nagaraj,Dating
"I personally have always hated dating. I was never vulnerable or insecure in any part of my life, but I would become that way with a guy because they have control, according to society, when it comes to dating.",Whitney Wolfe Herd,Dating
"When you're setting up your dating profile, choose the photos according to who you are today. A variety of recent shots that are a true representation of your character.",Whitney Wolfe Herd,Dating
The Bachelor'... and 'The Bachelorette'... and 'Bachelor in Paradise'... and the 'After the Final Rose ceremony'. I love a competition dating show.,Erin Foster,Dating
I have run from a lot of relationships in favor of being alone. And I tend to find men who use their money and status as a dating tool to be unattractive.,Erin Foster,Dating
"I've never dated anywhere else, so I only know L.A. dating, and I wouldn't wish it upon my worst enemy. I've pulled back and taken the pressure off of myself to figure it out, because there's so much pressure about status that dating has become this game where you pull out all your tricks.",Erin Foster,Dating
"The thing is, in the dating profiles it says 'spiritual,' but not with a specific religion. And so I pretty much try to meditate, but I have a very hard time concentrating on things other than me.",Lisa Lampanelli,Dating
"I'm way too famous and rich to be on a dating app, but if I get very desperate by the time I'm 60, I'll go on Tinder. Or I'll go on 'Millionaire Matchmaker'; I'll call Patti Stanger.",Lisa Lampanelli,Dating
"The United States has a long tradition of preserving the all-American outdoor experience, dating back to the days of President Theodore Roosevelt.",Sarah Huckabee Sanders,Dating
"I was dating girls who were actresses, and that was fun, so I took a playwriting class. But that was short-lived. That was one year. Around that time, I was seeing movies that were making me think in terms of images.",Richard Linklater,Dating
"When I went off to college in 1997, I didn't go back and watch 'Conan.' I was out partying and dating women.",Jason Momoa,Dating
"I do bits about dating but mainly about what I did and how incompetent I am, not any genuine people writing to me.",James Veitch,Dating
"There are hundreds of millions of people on dating apps every day, but apparently, no such apps cater solely to sports fans.",Rich Eisen,Dating
"There's kind of no rhyme or reason to what is appealing to any given actor. It just is, or it isn't. It's kind of like dating. You either connect to someone or you don't. You can't really say why.",Katherine Waterston,Dating
"When you're really young, dating girls, and trying to explain Kiss, they just look at you like you're kind of crazy. I think they got so big in the Seventies and were such a phenomenon - they did the 'Kiss Meets the Phantom of the Park' movie, the solo records - some people only know the merchandising stuff.",Mike McCready,Dating
"I don't hate dating people, but I'm not on social media or anything.",Jonathan Groff,Dating
"Dating can be painful, can be great, can be confusing, can be weird, but I don't do it online because I'm not really an online person.",Jonathan Groff,Dating
"The women's movement gave me a set of tools to think about things like my body and how people react to me and the way that my dating life was going. It's a very practical movement - yes, it's about issues like how we can get more women MPs elected, but it's also about how feminism affects things like your relationship.",Naomi Alderman,Dating
"People get married for a wide array of reasons and have all sorts of expectations of how marriage will change the relationship. And while it's true that turning the person you're dating into a legal partner does affect certain things, those who expect marriage to be a cure-all for all your relationship woes are sorely mistaken.",Emily V. Gordon,Dating
"Sometimes we put so much effort into things we're doing, like dating or wedding planning, that we don't stop to think about whether or not we even want the results of that effort.",Emily V. Gordon,Dating
Every single young person is reachable. Ask them what dating is like in their country. Ask them if they have a girlfriend. Ask them what their type is. There's nobody who's too conservative to talk about that.,Jared Cohen,Dating
"Dating in the closet is torture. It's one of the most difficult things, especially if you are completely closeted.",Gus Kenworthy,Dating
There isn't a way to depict the gay community without at least mentioning the existence of online dating apps like Grindr.,Andrew Keenan-Bolger,Dating
Anyone who has to have the word 'charming' in their name probably isn't - just take a look at any dating site where men use 'prince charming' in their description.,Sarah Pinborough,Dating
"The whole thing about dating was the scariest thing in the world. And I would tell my friends, 'I'm never going to find anyone. Where am I going to find someone? By now, I'm 59 years old. Where do you meet men?' It was really funny. So I just focused on myself.",Tina Knowles,Dating
"I always say, if a guy writes the same lead female character type over and over, we are not seeing their writing chops so much as their dating website wishlist.",Gail Simone,Dating
"Sometimes people will approach me on the street and ask me very personal questions about my dating life. Fans talk to me like they know me, and it's like, 'You don't know me. You know my character, but you really don't know me.'",Lili Reinhart,Dating
"I run a dating site, but I will gladly tell someone, 'Do not date someone if it's not right.' And don't settle. This settling thing is insane. I've literally had to force friends out of relationships because they want to be married by a certain age, so they just date these guys that are not right for them.",Whitney Wolfe Herd,Dating
"I've thought long and hard about this, and I think a lot of the dysfunction around dating has to do with men having the control.",Whitney Wolfe Herd,Dating
"I always felt that, for me, as a woman, I always had to wait around. In all other arenas, I was ambitious and a go-getter, but when it came to dating, I wasn't supposed to go after what I wanted.",Whitney Wolfe Herd,Dating
"Saks helps to empower women through how they look and feel - and Bumble wants to give all women a platform to connect with other empowered women, whether that's in dating, friendship, or business.",Whitney Wolfe Herd,Dating
Dating a creative pushes me to think outside the box.,Hannah Bronfman,Dating
"Dating apps are brilliant for expanding your actual social network, which leads you to meet other people.",Joanna Coles,Dating
"If you keep dating and keep out there, you keep a higher level of hope, and also, your skills at doing it improve because you're doing it more often, and you are bringing less anxiety to the table.",Joanna Coles,Dating
'In the Pines' is a very old song dating back to slavery. Lead Belly made it popular.,Fantastic Negrito,Dating
I think dating apps are keeping us apart.,Karamo Brown,Dating
I was raised middle-class in a small town. I have all my same friends from high school. I'm close with my family. I'm dating a normal girl. So I want to feel people think I'm a man of the people. Because I feel that way.,Miles Teller,Dating
"Dating back at least as far as the Luddites of early 19th-century Britain, new technologies cause fear about the inevitable changes they bring.",Moshe Vardi,Dating
"Growing up, dating seemed pretty straightforward: If someone was interested in getting to know you on a romantic level, they approached, exchanged info, and proceeded to communicate with you in a consistent fashion between outings of various natures.",Amanda Seales,Dating
"If you are dating someone in New York City, and they invite you over to watch a movie, they don't really want to watch a movie.",Chris Gethard,Dating
"My past business dealings, my personal life, who I'm dating, the details of my divorce, other business matters that I've had - all that should be completely off-limits.",Michael Avenatti,Dating
"Trans-dating is hardcore, and it's really scary. And that's coming from me, someone who couldn't be dating in a more open-minded Manhattan pool of artsy boys and creative folk. Not saying it all sucks. I'm just saying it's not easy.",Hari Nef,Dating
"For a long time, I have been wanting to write a book for singles that would help them in the dating process and in getting ready for marriage. Most of my writing, I've written to couples who are already married, because I've been doing marriage counseling for 35 years.",Gary Chapman,Dating
I'm not really on dating apps. I used to be when I was younger. I'd rather meet people in real life.,Noah Centineo,Dating
"Honestly, even if I was dating someone, I will not talk about it unless I am 100 per cent sure about it, because I am a private person.",Hina Khan,Dating
"I saw a lot of people asking who am I dating. It's not that I ever wanted to hide it from anybody, but it's not something to be talked about.",Shweta Tripathi,Dating
"I just felt like women love musicians, so I thought that we should become musicians. It'll help my dating life.",Jonathan Scott,Dating
"I'm not waiting for Mr Right. I'd be open to dating, but I'm happy not. I'm not on Tinder or anything.",Tamzin Outhwaite,Dating
Dating isn't easy.,Julian Edelman,Dating
"I always felt most at home on a basketball court, dating all the way back to when I was growing up in Brooklyn.",Chris Mullin,Dating
I'm dating my iPhone.,iJustine,Dating
I never did video dating.,Adam F. Goldberg,Dating
"I don't think I'm misunderstood, but there is definitely a certain side of me that the press focuses on - my body, my hair, or who I'm dating - which has never really served me as an actor. It's served me in the commercial world, making money as a model, but the media perception has really hindered my acting career.",Kelly Brook,Dating
"I took my wife to a really expensive hotel in Dubai. This was when we were first dating, so I wanted to impress her. I had scallops, and after that, I went to the bathroom to be sick. I realised I had just paid 300 or 400 on scallops just to throw it up. My wife and I then talked about it; I knew I had a problem.",Andrew Flintoff,Dating
"I was great mates with Muttiah Muralitharan, dating back to the days when we both played together at Lancashire.",Andrew Flintoff,Dating
"I think back to when I was in high school, to 17-year old Daria, who was dating guys and thought that that was the only way of life. I was very confused, and it was definitely manifesting itself in other parts of my life that were unhealthy.",Sonya Deville,Dating
"First of all, there's the celebrity thing. Like, who are you here for, are you dating me or are you trying to date my dad? These men either just want to be there for one thing and don't want to stay for the real relationship part or they just want to ride the wave and be bougie and bomb and have their picture taken and do all of that.",EJ Johnson,Dating
It's horrible dating with Mama Mai! She is nosy. When I was a kid she would be the first one eavesdropping on my phone calls: 'Hello? Who you call for? Huh?',Jeannie Mai,Dating
I stay away from online dating. Interacting with the person right in front of you is a much easier way to talk.,Marcus Mariota,Dating
"Whenever I am dating somebody, I want her to take care of me like my mother.",Saqib Saleem,Dating
"In March 2008, when I was 24 years old, a man I had been dating arranged for an accomplice to throw sulphuric acid in my face.",Katie Piper,Dating
"It took me until my 40s to realize the five essential areas that are important to at least have a real dating chance. Obviously, beyond the physical compatibility, which is where we all start in junior high school, I think that intellectual compatibility and spiritual compatibility, emotional intelligence, and financial compatibility are important.",Malik Yoba,Dating
No way will I put my family and my life on the TV or be involved with something like a dating show or any type of reality show.,Donovan McNabb,Dating
I'm not dating Prateik; he is just a good acquaintance.,Amyra Dastur,Dating
"I had looked at dating sites and niche communities like BlackPlanet, AsianAvenue, and MiGente, as well as Friendster, and I thought, 'They're thinking way too small.'",Tom Anderson,Dating
We had a much bigger vision than creating a dating site.,Tom Anderson,Dating
"I think the good thing about 'Take Me Out', which is kind of a compliment to us really, is that when it started doing well round about the second series and people started getting into it, all of a sudden every time you turned over a channel there's a new dating show on.",Paddy McGuinness,Dating
"Because bisexual people almost have a foot in the gay and the straight world, their friends can misunderstand them too. Like if a bisexual man starts dating another man, people are like 'Ah, he's gay,' but you know, bisexual people remain bisexual, and their attractions can change and flux over time.",Courtney Act,Dating
"It's a common misunderstanding, that when a bisexual person is dating someone of the opposite sex that they are now straight, or if they are dating someone of the same sex they are now gay.",Courtney Act,Dating
"I met Adrienne Bailon a bit over two years ago, we worked together and became friends. Our circles connected and we remained good friends. From a friendship, as two single adults we have very recently begun to explore a dating relationship.",Israel Houghton,Dating
I go out to dinner occasionally and that's the sum of my dating life.,Sophie Dahl,Dating
Trade protectionism has an American lineage dating back to the Founders; that lineage is distinct from white nationalism.,Heather Mac Donald,Dating
Google is not my friend. I've been way too open in my career. Google has killed any shot I have on the dating apps.,Jim Norton,Dating
"I've always been fascinated by memory and I remember Jonah, when we first started dating, was working on something involving memory. It was early on in our relationship and I was like, damn it, I wanted to do a movie on memory. That was 'Memento.'",Lisa Joy,Dating
"I shocked my parents with a lot of things, whether it was becoming an actor or when I was dating someone outside the Egyptian community or when I moved away from home before getting married.",Mena Massoud,Dating
"Once a date asked me what I do, so I said that my company empowers women in their dating lives. Her response? 'Aw, that's so cute!' Cute is how my babysitter described me when I was 7 years old. Simple fix: Replace cute with hot and he'll feel like James Bond.",Matthew Hussey,Dating
"Halloween might be a time that's renowned for ghosts, but we no longer experience ghosts only on Halloween. In our dating lives, we are now used to being 'ghosted' the whole year round.",Matthew Hussey,Dating
One of the most overwhelming things about dating is imagining going on an entire dinner date for an evening with someone you don't even know you have chemistry with yet.,Matthew Hussey,Dating
I honestly believe there is nothing more important in a person's life than love and I want to show women how to have fun and get the best out of dating.,Matthew Hussey,Dating
"I was dating someone and wanted to get married to him. But just because casting couch exists in TFI and I work here, he didn't respect me.",Tejaswi Madivada,Dating
I left my husband and I thought 'I'm never dating ever again.',Lady Colin Campbell,Dating
It's a hard business this dating business! Love is complicated!,Scarlett Moffatt,Dating
It's not always the case that when you're dating someone that the family likes you.,Shibani Dandekar,Dating
"The day Tarek and I officially started dating, which was October 9, 2006, we moved in together.",Christina Anstead,Dating
"There are lots of variables that come into play in the industry, like attending parties and dating actors. When you don't indulge in all this, you tend to get affected in some way.",Priyanshu Chatterjee,Dating
"I did feel support right from the start from LeBron. He's always shown me a great deal of respect dating back to our battles when I was in Indiana and competing with the Heat in the conference finals, and coaching him in the All-Star Game.",Frank Vogel,Dating
"In this day and age of Internet, where we have several dating sites, it is bizarre to say the audience is not ready to watch bolder themes.",Vikram Bhatt,Dating
One can't plan marriage or dating.,Koena Mitra,Dating
"Just about every young model and actress is dating somebody in the entertainment field, because these are the people you meet. You're not going to very easily meet a normal person in this line of work.",Bebe Buell,Dating
"I was 34 years old, and I knew that I wanted a possibility of having a family one day, but I wasn't dating anyone obviously because I'm living at the mansion. But I just wanted to make sure I had the possibility, so I froze my eggs back then and that was my insurance policy for later on in life.",Bridget Marquardt,Dating
"People often misuse the term 'Regency' to describe art or antiques dating from a vague period between the 1790s and the 1830s, but technically the period only lasted between 1811 and 1820.",Lucy Worsley,Dating
"Let me tell you, NBA free agency is wild. It's like an even worse version of speed dating.",Jared Dudley,Dating
"I'm a one-woman guy, so dating multiple women was hard.",Nick Viall,Dating
Dating is for children. Dating is for kids.,Travis Browne,Dating
"Yeah, actually, I don't want to admit that I like 'Girls', but a girl I was dating a while ago got me to start watching 'Girls.' It's really well-written and I enjoy that.",Big E,Dating
I've been a huge fan of 'Dating In The Dark' and I'm totally excited to be presenting the third supersized series.,Sarah Harding,Dating
To be honest though I've never really been one for dating. I'm not used to it at all.,Maura Higgins,Dating
"Today, at age 24, when my peers are dating, marrying and having children of their own, my cancer treatments are causing internal and external changes in my body that leave me feeling confused, vulnerable, frustrated - and verifiably unsexy.",Suleika Jaouad,Dating
Dating means hope.,Stephanie Land,Dating
