quotes,authors,categories
"I have a notebook, and I know what decisions will be made in pre-production. Everything is pre-determined in the pre-production period. I visually design the whole thing, and I know when things will happen.",Alejandro Gonzalez Inarritu,Design
"There are people who design buildings that are not technically and financially good, and there are those who do. Two categories - simple.",Frank Gehry,Design
"Multitasking, throughput, efficiency - these are excellent machine concepts, useful in the design of computer systems. But are they principles that nurture human thought and imagination?",Ellen Ullman,Design
"I like entertainment and think mastery is good, though I don't feel like a master. If a theme means having a story that's legible, then that's certainly what we do. But we don't treat design as an add-on layer.",David Rockwell,Design
"When I design and wonder what the point is, I think of someone having a bad time in their life. Maybe they are sad and they wake up and put on something I have made and it makes them feel just a bit better. So, in that sense, fashion is a little help in the life of a person. But only a little.",Miuccia Prada,Design
"I think of makeup as more like a design, decoration, or jewelry. I mean, it's literally paint; it's art. I don't prefer to use it as concealing anything because it influences the illusion of standardized perfection.",Indya Moore,Design
"'Design Star' was incredible, and I didn't think it could get any better, and then 'Color Splash' happened.",David Bromstad,Design
"I have lived with my husband more than I have with my parents... I live beside him, and know his worries, his hopes, and his dreams for his nation. We believe that things happen by design, not in an arbitrary way. And we believe it is our duty to make things happen.",Moza bint Nasser,Design
The clothes that I design and everything I've done is about life and how people live and how they want to live and how they dream they'll live. That's what I do.,Ralph Lauren,Design
"The problem is, in software design, often the consequences of your decisions don't become apparent for years.",Kent Beck,Design
"Leopard is an animal design, and my designs come from nature.",Roberto Cavalli,Design
"We are actors who show up for work in our sloppy gear, and we've got this extraordinary tailor. It's someone else who's done the design; someone else who's cut the suit; someone else who's measured it. Basically, your job is to just wear it.",Colin Firth,Design
"By fundamentally changing how we design the places and systems that enable our daily lives, we can slash emissions way beyond the immediate carbon savings - because our own personal emissions are just the tip of a vast iceberg of energy and resources consumed far from our view.",Alex Steffen,Design
"The math you need for most of finance is ninth-grade algebra, and most people feel reasonably comfortable with that. But I think the financial world there has been - I don't know if it's by design, or this is how it's evolved - there are bad actors who have wanted to obfuscate because you can benefit from the lack of transparency.",Sal Khan,Design
Everyone by now presumably knows about the danger of premature optimization. I think we should be just as worried about premature design - designing too early what a program should do.,Paul Graham,Design
"Whether one believes in evolution, intelligent design, or Divine Creation, one thing is certain. Since the beginning of history, human beings have been at war with each other, under the pretext of religion, ideology, ethnicity and other reasons. And no civilization has ever willingly given up its most powerful weapons.",Mohamed ElBaradei,Design
"The design of Rhetoric is to remove those Prejudices that lie in the way of Truth, to Reduce the Passions to the Government of Reasons; to place our Subject in a Right Light, and excite our Hearers to a due consideration of it.",Mary Astell,Design
"I'm not the expert on the great gameplay. I come in for the character design, monsters, atmosphere. I'm not the technician.",Clive Barker,Design
By means of tracing-paper I transfer my design to the wood and draw on that.,John Tenniel,Design
The dreaded phrase in design circles is 'show and tell.',David Carson,Design
"When he entered the Oval Office - by fate, not by design - Citizen Ford knew that he was not perfect, just as he knew he was not perfect when he left. But what president ever was?",Tom Brokaw,Design
"I would have killed to do 'Beauty And The Beast' at Warners, which went away. I would have killed to do 'The Witches' at Warners that went away. God knows there are many, many of them. All I can do is diligently do the screenplay, diligently do the design work, deliver a budget, and then await a decision.",Guillermo del Toro,Design
"In most people's vocabularies, design means veneer. It's interior decorating. It's the fabric of the curtains and the sofa. But to me, nothing could be further from the meaning of design.",Steve Jobs,Design
The only important thing about design is how it relates to people.,Victor Papanek,Design
"The great majority of Baghdad is a slum - a lot of it's new, but it's still slum. It's usually this concrete-block, one-room design with a door and a window, arranged one-up, one-down, often with a shop with nothing in it on the first floor, and then a one-room apartment above it. There's street after street after street of that stuff.",P. J. O'Rourke,Design
I like to choreograph and create and design the costumes and do it all and then step back and watch it and then move on to the next project.,Abby Lee Miller,Design
"Pictures, abstract symbols, materials, and colors are among the ingredients with which a designer or engineer works. To design is to discover relationships and to make arrangements and rearrangements among these ingredients.",Paul Rand,Design
"I like to do interior design, I love to quilt, I love to see different colors together, and I love to match things up.",Mary J. Blige,Design
"The level of detail and craft is something that's inscribed within the original design concept. And so when I begin to draw, I know what kind of detailing I want the building to have.",Tadao Ando,Design
I don't design houses with the nuclear family idea because I don't believe in it as a concept.,Peter Eisenman,Design
I am always locked in my design studio.,Valentino Garavani,Design
"I was going to design sports cars, but my father came to my college to visit me. At the time he was making a picture in Sweden and he took me there with him. I got to see Ingmar Bergman's company and I thought, 'Gee, filmmaking is a lot more fun than sports cars,' so I decided to follow him and go into acting.",James Cromwell,Design
"Let's be realistic, how many people are buying a $2,000 skirt? I love to design things that people can actually buy. I'm staggered by what a boot costs today.",Vera Wang,Design
"Just as predatory animals follow a similar general design and behave in similar ways, so organizations, especially those in competition with one another, must follow certain design principles if they are to succeed and prevail.",Robert Shea,Design
I'd like to design something like a city or a museum. I want to do something hands on rather than just play golf which is the sport of the religious right.,Brad Pitt,Design
"My place in design history is to sort of interpret youth culture, and I think we've seen that done in fashion before - it's not a new concept - but it hasn't been done with the same vigour in a modern context.",Virgil Abloh,Design
My mantra is: 'Good design accelerates the adoption of new ideas.',Yves Behar,Design
There is an immediate payoff to intelligent design: it destroys the atheistic legacy of Darwinian evolution. Intelligent design makes it impossible to be an intellectually fulfilled atheist.,William A. Dembski,Design
"Few developments central to the history of art have been so misrepresented or misunderstood as the brief, brave, glorious, doomed life of the Bauhaus - the epochally influential German art, architecture, crafts, and design school that was founded in Goethe's sleepy hometown of Weimar in 1919.",Martin Filler,Design
Design and style should work toward making you look good and feel good without a lot of effort so you can get on with the things that matter.,Donna Karan,Design
"This is very much my philosophy as a fashion designer. I have never believed in design for design's sake. For me, the most important thing is that people actually wear my clothes. I do not design for the catwalk or for magazine shoots - I design for customers.",Giorgio Armani,Design
Apple's goal isn't to make money. Our goal is to design and develop and bring to market good products.,Jonathan Ive,Design
The very design of neoliberal principles is a direct attack on democracy.,Noam Chomsky,Design
"Whether it's an $11 flip-flop or a $2 key ring or a $2,000 dress, they're all done with integrity. They're all done with a design sense. As long as the creativity exists, then I don't think it's a sellout. A sellout is putting your name on any piece of crap and then expecting people to buy it because it's got your name on it.",Marc Jacobs,Design
"I don't design. I get what I think is a big idea, and I put the idea down. I'm not a designer. I'm a communicator.",George Lois,Design
I always look forward to the next project. That is one of the wonderful things about architecture - you always can hope for another project to design.,Cesar Pelli,Design
"Even before I was discovered in 1966, I used to make my own clothes. I learned how to sew early on, and it's still my passion now. I constantly have ideas in my head about clothes so jumped at the chance to do my own collection and am very hands-on. Everything I design, I wear and I love.",Twiggy,Design
"I've always thought that design can have equal importance to the idea of internal architecture. Professionally, things can be very dogmatic - you do the architecture, someone else does the interiors, someone else does the furniture, the fabric, etc. But I think design is all-encompassing.",Zaha Hadid,Design
"I see the Beijing National Stadium as an architectural project. I accepted Herzog and De Meuron's invitation to collaborate on the design, and our proposal won the competition. From beginning to end, I stayed with the project. I am committed to fostering relationships between a city and its architecture.",Ai Weiwei,Design
"When I announced the development of Perl 6, I said it was going to be a community design. I designed Perl, myself. It's limited by my own brain power. So I wanted Perl 6 to be a community design.",Larry Wall,Design
"At the University of Maryland, my first year I started off planning to major in art because I was interested in theatre design, stage design or television design.",Jim Henson,Design
I love math. I have little secret number tattoos everywhere. I design them.,Pauley Perrette,Design
"By design, Bitcoin is a scarce resource with a predictable supply of new issuance. And it is this scarcity and predictable supply that make it so attractive as an underlying asset to bind to economic activity and trade.",Jeremy Allaire,Design
"I thank Marc Jacobs so much for giving me the opportunity to design a shoe for Louis Vuitton, but the thing that broke my heart most was when they said, 'You're finished. The shoe's finished.'",Kanye West,Design
Videogames are indeed design: They're sophisticated virtual machines that echo the mechanical systems inside cars.,John Maeda,Design
It would be nice to design a real briefcase - you open it up and it's your computer but it also stores your books.,Steve Wozniak,Design
There are really two things that have to occur in order for a new technology to be affordable to the mass market. One is you need economies of scale. The other is you need to iterate on the design. You need to go through a few versions.,Elon Musk,Design
I have always had an interest in fashion and design and I appreciate style and timelessness within my footwear and accessories both on and off the court.,Maria Sharapova,Design
"'Commercial' is not the word that has to be said only by CEOs. It has to be something that is maybe the essence of design, because design has some sort of art in it and creation, but it's also some object that you have to use. There is also this pragmatic end to it.",Alber Elbaz,Design
"Biomimicry is basically taking a design challenge and then finding an ecosystem that's already solved that challenge, and literally trying to emulate what you learn.",Janine Benyus,Design
"In just six weeks from the time the design was started, we had the motor on the block testing its power.",Orville Wright,Design
Interior design is a business of trust.,Venus Williams,Design
"No architect troubled to design houses that suited people who were to live in them, because that would have meant building a whole range of different houses. It was far cheaper and, above all, timesaving to make them identical.",Michael Ende,Design
"Also note that invariably when we design something that can be used by those with disabilities, we often make it better for everyone.",Donald Norman,Design
"My job is to make desirable, luxurious, beautiful clothing and accessories women want to buy. My first decision is always based on, 'Can I do this in a more sustainable way without sacrificing design?' If I can, then there is no reason not to.",Stella McCartney,Design
"I have no problem with the idea of comfort, but it is not an important thing aesthetically. If you look at a shoe and immediately say it looks very comfortable, in terms of design, it is not going to excite me. Of course, I am not putting nails in my shoes to ensure everybody is in pain, but a heel is not a pair of slippers and never will be.",Christian Louboutin,Design
"Books are but waste paper unless we spend in action the wisdom we get from thought - asleep. When we are weary of the living, we may repair to the dead, who have nothing of peevishness, pride, or design in their conversation.",William Butler Yeats,Design
People believe the only alternative to randomness is intelligent design.,Richard Dawkins,Design
I tried a dozen different modifications that were rejected. But they all served as a path to the final design.,Mikhail Kalashnikov,Design
"My stylist has really great taste - Petra Flannery has really great taste. I mean, I am opinionated, and as time goes on, as I've gotten to see more dresses or more clothes, it's easier to say, 'I like that' or 'I don't like that,' but it's nothing I would ever, you know, design.",Emma Stone,Design
"Sculptures created from found materials like ice and thorns, driftwood, and even bleached kangaroo bones all presuppose that artistic design will yield to the cycles of time and climate, whether over an hour or a decade.",Simon Schama,Design
"If you have total freedom to design, you won't get anything interesting. So I give myself restraints in order to kind of push myself through, to create something new. It's the torture that I give myself, the pain and the struggle that I go through.",Rei Kawakubo,Design
"I run a design studio in New York. Every seven years, I close it for one year to pursue some little experiments, things that are always difficult to accomplish during the regular working year. In that year, we are not available for any of our clients. We are totally closed. And as you can imagine, it is a lovely and very energetic time.",Stefan Sagmeister,Design
I'm not really a fashion designer. I just love clothes. I've never been to design school. I can't sketch. I can't cut patterns and things. I can shorten things. I can make a dress out of a scarf.,Kate Moss,Design
"I believe consistency and orthogonality are tools of design, not the primary goal in design.",Yukihiro Matsumoto,Design
"I think there is always a need for pure design. With pure design, you don't need so much decoration.",Jil Sander,Design
"By 1970, the first stirrings of the revolt against Modernist orthodoxy in architecture had been felt, although it would be several years more until Postmodernism was widely accepted and made classical motifs permissible in high-style building design for the first time in decades.",Martin Filler,Design
"America glories in its tradition of the self-made individual. Political candidates compete to be a friend to entrepreneurs, and policymakers, imagining the next Microsoft or Google, design laws to back the innovator in the garage.",Mark McKinnon,Design
"Whenever I design any variant, or when anybody sends me one, I always say if at all possible within the context of the game don't have two home supply centers touching each other.",Fred Davis,Design
"I changed the layout of comic books in general. When I came in, layout design wasn't really part of what you did. It was all just panels, panels, panels. So when I came in, I thought, 'Nah, let's change that,' and I designed the page.",Neal Adams,Design
"Design and branding are inextricably linked to the way in which society, culture, the environment, and business interact.",Debbie Millman,Design
"The thing that makes my clothes really different is that, number one, they are really great designs; they're not tacky; they are very professional; the design is made from lots of decisions.",Vivienne Westwood,Design
I have always been fascinated by the way things work and how they came to take the form that they did. Writing about these things satisfies my curiosity about the made world while at the same time giving me an opportunity to design a new explanation for the processes that shape it.,Henry Petroski,Design
All those years of skating and dancing have carried over. I can't design anything without thinking of how a woman's body will look and move when she's wearing it.,Vera Wang,Design
"Even private persons in due season, with discretion and temper, may reprove others, whom they observe to commit sin, or follow bad courses, out of charitable design, and with hope to reclaim them.",Isaac Barrow,Design
"The design of a dress, furniture, a house, a room, a street and a city are all the same process.",Gianfranco Ferre,Design
Good design should be honest.,Ferdinand Porsche,Design
"Through no divine design or cosmic plan, we have inherited the mantle of life's caretaker on the earth, the only home we have ever known.",Michael Shermer,Design
"The design of the Mac wasn't what it looked like, although that was part of it. Primarily, it was how it worked. To design something really well, you have to get it. You have to really grok what it's all about. It takes a passionate commitment to really thoroughly understand something, chew it up, not just quickly swallow it.",Steve Jobs,Design
"I was just taught very early that if I didn't solve problems, I was headed for a very dark path. Problems were everywhere. Now, even if there are no problems, I look for problems. I'm like, 'You know what? I don't like the way this spoon works. I want to design a new spoon.'",Homaro Cantu,Design
I wish someone would ask me to design a cathedral.,Philip Johnson,Design
"I hate going out for lunch during a workday because it slows down my pace and ruins my rhythm. I prefer to eat at my desk. Actually, I wander around the design studio with a plate in my hand as I dine on, for example, salmon sashimi and a salad of tomatoes and mozzarella. I often have a bit of dark chocolate after lunch.",Tom Ford,Design
It's aggravating that Hollywood has never gotten credit for the role it played in promoting modern design.,Camille Paglia,Design
"I have always been interested in design, but in the beginning I didn't set out to make jewelry specifically.",Paloma Picasso,Design
"Music is where I have the most creative freedom, but I love producing. To me, that's kind of where all the action is. You get a chance to have your hands in every aspect of a film. From picking a director, sometimes picking a writer, to the actors, the wardrobe, set design, editing, music, and marketing.",Ice Cube,Design
"We are very proud of our design for the Transbay Transit Center. This will be a beautiful, functional and sustainable building for San Francisco.",Cesar Pelli,Design
"Design is about point of view, and there should be some sort of woman or lifestyle or attitude in one's head as a designer.",Vera Wang,Design
"Even as a young boy, my passion was to design, and I have been very lucky to be able to do what I have loved all my life. There can be few greater gifts than that.",Valentino Garavani,Design
"Everyone wants an iPhone, but it would be impossible to design an iPhone in China because it's not a product; it's an understanding of human nature.",Ai Weiwei,Design
"For many years, I have lived uncomfortably with the belief that most planning and architectural design suffers for lack of real and basic purpose. The ultimate purpose, it seems to me, must be the improvement of mankind.",James Rouse,Design
Nothing they design ever gets in the way of a work of art.,Robert Hughes,Design
"French architecture always manages to combine the most magnificent underlying themes of architecture; like Roman design, it looks to the community.",Stephen Gardiner,Design
"When I was very, very young, seven years old, I heard there was school where you could go to learn to draw. That was my absolute driven passion, to become an artist or a painter. So the romantic realist in me, I studied to be a graphic design artist and an art teacher.",David Coverdale,Design
"I design from instinct. It's the only way I know how to live. What feels good. What feels right. What is needed. Give me a problem and I will approach it creatively, from my gut.",Donna Karan,Design
My graphic design skills are superior to a lot of other things I can do; I use it as a part of my tool kit.,Virgil Abloh,Design
London is one of the most civilised places in the world for the procedure of making architecture and urban design.,Renzo Piano,Design
"Wearing a bold print gets harder as you get older. It's safer to stick to subtle prints or block colours. I have always found prints quite tricky. My daughter Carly, who is on the design team at Stella McCartney, is obsessed with them.",Twiggy,Design
"I do quite like Gehry's Guggenheim. But where in Bilbao it's seen as an outgrowth of years of investment in urban design and engineering, in Britain it's seen as the catalyst for urban regeneration rather than the icing on the cake.",David Chipperfield,Design
"I had given a presentation on design and happiness for quite a long while at design conferences. I had found thinking about the topic helpful for my own practice, as it forced me to consider the fundamentals, and the feedback from the audience was always enthusiastic.",Stefan Sagmeister,Design
"I want my clothes, my stores, everything I design to have that feeling of being natural and easy. And that takes effort, but you try not to have it show.",Ralph Lauren,Design
"You think about the beauty and what you want to transmit. If I think about designing, I can't design.",Elsa Peretti,Design
"Visual storytelling combines the narrative text of a story with creative elements to augment and enhance the traditional storytelling process. By design, it is a co-creative process resulting in an intimate, interpretive, expressive technique.",Debbie Millman,Design
"People say I design architectural icons. If I design a building and it becomes an icon, that's ok.",Zaha Hadid,Design
User-centered design means working with your users all throughout the project.,Donald Norman,Design
"In the mid-1970s, I was teaching design at the Academy of Applied Arts in Budapest.",Erno Rubik,Design
"Until I was eighteen, I did not know that you could study fashion design or art. I really didn't know. I already had my nose in the art world; I was already looking at things, but I didn't really get it that you could study that because my school was a very different environment.",Raf Simons,Design
So we originally expected to make about 35 gigawatt hours at the cell level and about 50 gigawatt hours at the module or pack level. Now we are expecting to do about 150 gigawatt hours in the same volumetric space as the original design.,Elon Musk,Design
People who run a ready-to-wear company are businessmen rather than production or design people.,Calvin Klein,Design
"All those involved in the construction of an architectural design, from the architect to the builder, have an attachment to the architecture, although it's difficult to quantify the attachment.",Tadao Ando,Design
You have to design and program differently. Combat action in an MMO is so different to combat in a first-person shooter.,John Romero,Design
"The principle of the design - the harmony, rhythm and balance are all the same with interior and fashion design.",Venus Williams,Design
"Pete Dye introduced me to golf course design back in the 1960's. He came to my hometown Columbus, Ohio to work on The Golf Club.",Jack Nicklaus,Design
"I am a fashion designer. I'm not an environmentalist. When I get up in the morning, number one I'm a mother and a wife, and number two I design clothes. So the main thing I need to do is create, hopefully, exquisitely beautiful, desirable objects for my customer.",Stella McCartney,Design
"As an industrial designer, you design the thing by yourself, and then it goes away from you, whereas fashion is in constant relation to the body and to psychology. It makes it more complicated, and it makes it more challenging.",Raf Simons,Design
"After 1980, you never heard reference to space again. Surface, the most convincing evidence of the descent into materialism, became the focus of design. Space disappeared.",Arthur Erickson,Design
"I fervently believe in research as a necessity for good design, and I teach it that way.",Brenda Laurel,Design
