quotes,authors,categories
Ever since I was young I loved making things and being part of the design process.,Maria Sharapova,Design
"I wound up studying art and design, got a job at Lonely Planet Publications as a designer, cartographer and illustrator.",Trudi Canavan,Design
I had been impressed by the fact that biological systems were based on molecular machines and that we were learning to design and build these sorts of things.,K. Eric Drexler,Design
"Martha Stewart is extremely talented. Her designs are picture perfect. Our philosophy is life is messy, and rather than being afraid of those messes we design products that work the way we live.",Kathy Ireland,Design
"Borderline embarrassing fact: I used to have a pseudo line when I was seven called Zizzy Fashion. I love clothing, and I would eventually like to design as well as act.",Zoey Deutch,Design
"Different people have different styles, but there is an opportunity as a director to be a writer in every moment, with every visual cue and every piece of production design. Everything is a decision, and everything can be obsessed over.",B. J. Novak,Design
"When the Great Fire of London destroyed most of the medieval city in 1666, Christopher Wren was invited to design a new one. Within days, he had drawn up an elegant grid of broad boulevards leading to majestic squares, but it came to nothing - the existing landowners wanted things as they had been.",Norman Foster,Design
"When you as a designer design something that burdens a community with maintenance and old world technology, basically failed developed world technology, then you will crush that community way beyond bad design; you'll destroy the economics of that community, and often the community socially is broken.",Cameron Sinclair,Design
"If I was influenced by anything, it was architecture: structure having to do with logic. If you don't do it right, the whole thing is going to cave in. In a certain sense, you can carry that to graphic design. Fortunately, however, nobody is going to die if you do it wrong.",Paul Rand,Design
"Deep down, creationists realize they will never win factual arguments with science. This is why they have construed their own science-like universe, known as Intelligent Design, and eagerly jump on every tidbit of information that seems to go their way.",Frans de Waal,Design
"I've always loved to paint - I was studying to do an art degree when I was approached to become a model - and I've being doing some design work as well. I also love just having a quiet time, sitting in my little library at home in Brooklyn and reading or watching documentaries or listening to music.",Alek Wek,Design
I design my start-up ventures around my own personal beliefs and values.,Cindy Gallop,Design
"As an architect, I learned to think and express myself on flat forms, on paper, and to imagine the contour of the lines of a design.",Gianfranco Ferre,Design
"What I love most about Her Majesty is that she has kept hats alive in people's minds for more than 60 years. You can't think of her without imagining her with a hat or a crown. I would, of course, love to design one for her.",Philip Treacy,Design
It's about the power of design and the power of the human spirit. It's above paying anybody to do something stupid for money like reality television does - like ambushing people.,Genevieve Gorder,Design
"As an actor, you see a sliver of how the show is made, but to see the actual writing process and the re-writing process and the casting process and art direction and set design - all of this is happening in a very intense period.",John Slattery,Design
Organisms by their design are not made to adapt too far.,Kevin Kelly,Design
"I want to have all that scientific information that we're building be used in designing the future so that people who make geographic decisions - and here it's not just land-use planners, but it's everyone: foresters, transportation engineers, people who buy a house - can analyze all of these information layers and design a future.",Jack Dangermond,Design
In architecture the idea degenerated. Design allows a more direct and pleasurable route.,Charles Eames,Design
"I noticed when I was at Stanford, there was a class called the persuasive technology design class, and it was a whole lab at Stanford that teaches students how to apply persuasive psychology principles into technology to persuade people to use products in a certain way.",Tristan Harris,Design
"I never like to think that I design for a particular person. I design for the woman I wanted to be, the woman I used to be, and - to some degree - the woman I'm still a little piece of.",Diane von Furstenberg,Design
The success stories in biotechnology are mainly due to the straightforward application of design thinking in both the business and science aspects of our lean startups.,Ryan Bethencourt,Design
"My closet is organized by tops, pants, and outerwear, but not a lot of dresses. Gowns are in another room because I don't often dress formally, even though I design gowns. Like most designers, I have a uniform, and mine is a legging.",Vera Wang,Design
"There's always so much more that can be conveyed on screen visually in the expressions of people's faces, in their bodies, in their body language. And also with sound design, with music.",Lynn Shelton,Design
Eighteenth century American furniture and the design of the architects Greene and Greene are my special love.,Barbra Streisand,Design
"I have too much product, and I'm trying to rein it in and sell more of my main collection. I wish you didn't have to design so often; it would be good if you could keep on selling the same things for a few years and not have to do new things all the time.",Vivienne Westwood,Design
A challenging economy is always good for design. It unites necessity and functionality. You are forced to be creative with poor materials.,Diane von Furstenberg,Design
"Maybe at some subconscious level, things are done to upset somebody - part of me continues to see no valid reason for many of the accepted rules of design.",David Carson,Design
"From the outset, MoMA followed the Bauhaus's strict prohibition against design that even hinted at the decorative, a prejudice that skewed the pioneering museum's view of Modernism for decades.",Martin Filler,Design
I love the idea of couture and its emphasis on creation. There's where I made my name - in design - and there's where I'd like to stay.,Jimmy Choo,Design
"I look at each episode in two ways - from a design standpoint and from an entertainment standpoint - this is TV, after all. We usually succeed on at least one of the levels.",Douglas Wilson,Design
"I do not discriminate about size. I design dresses to accentuate a woman's positives, whether you are a size 0 or a size 3X.",Tadashi Shoji,Design
"I mean, I think about it, but I don't design my record to get a certain public response.",Liz Phair,Design
"I would like to design what people generally call streetwear. I'd like to dress skateboarders, or whatever the older equivalent of skateboarders are. I pay more attention to that stuff than anyone would ever imagine because I'm watching what the designers do.",William Gibson,Design
"I like the gritty parts of fashion, the design, the studio, the pictures.",Vera Wang,Design
"What I've learned from different designers is that it's key to be true to who you are and your vision. That's always been my line of thinking. Working through the whole design process, I don't want to create something I wouldn't be proud to wear.",Kellan Lutz,Design
It is very important to lead the field and innovate in game design.,John Romero,Design
"I wouldn't say design has become strictly functional. A lot of cars these days look downright comic book to me, and the info-gadgets with which late industrial people spend the most time - phones, music players, etc. - are blobjects.",Scott Westerfeld,Design
"If you have to design something, choose things that we need as opposed to frivolous things that we might just want for a month or two for bragging rights.",Saul Griffith,Design
"Numbers can't speak for themselves, and data sets - no matter their scale - are still objects of human design.",Kate Crawford,Design
"Ninety percent of games lose money; 10 percent make a lot of money. And there's a consistency around the competitive advantages you create, so if you can actually learn how to do the art, the design, and the programming, you would be consistently very profitable.",Gabe Newell,Design
There is no reason we can't design a car to last for 35 years instead of six or seven.,Vaclav Smil,Design
"I went to high school in Ellicott City, Maryland, and I felt pretty ambivalent about the whole thing. It just took time away from my doing things on the Internet - like creating clans in Quake II or starting a Web design nonprofit. In school, I was just a kid. Online, I had authority.",Alexis Ohanian,Design
"It is so important to be really true to yourself in design, and I am.",Thom Browne,Design
"The way I define 'intelligent design' is that when people started out, we wanted to make sense of the world we lived in, so we created stories about how things worked.",George Lucas,Design
What's nice about experiments is that they are much more closely tied to what theorists think about the world than normal empirical research. You can design your experiment to exactly ask the question you want to ask. This is not true about normal empirical research.,Abhijit Banerjee,Design
"We all have our preferences - some people go for birds - but for me, there's just something about the wolf; the design of it is really aesthetically pleasing.",Sarah Hall,Design
"I don't like the idea that the first preparation when you start to design your building has to put your label. I think this is not fair. It's not fair to the building or to the people, to the client, because every building tells a different story.",Renzo Piano,Design
"I was very interested in theatre, mostly in stage design. I did a little bit of acting.",Jim Henson,Design
"Java the language is almost irrelevant. It's the design of the Java Virtual Machine. And I've seen compilers for ML, compilers for Scheme, compilers for Ada, and they all work. Not many people use them, but it doesn't matter: they all work.",James Gosling,Design
I definitely want to design clothes at one point.,Kendall Jenner,Design
"Once the product's task is known, design the interface first; then implement to the interface design.",Jef Raskin,Design
The world of design has been subjugated by the rigors of manufacturing and mass production.,Neri Oxman,Design
"Empathy is key in the design process, especially when you start expanding outside of your comfort zone to new languages, cultures, and age groups. If you try to assume what those people want, you're likely to get it wrong.",Mike Krieger,Design
God didn't design an elevator for me. It's great because I'm climbing stairs and learning with every step.,Pratik Gandhi,Design
"One thing about costume design - and I think design in general - but especially costume design, is people have a misconception that it's very glamorous work.",Colleen Atwood,Design
"I grew up in a modernist house, in a modernist culture. There was a love for modernism everywhere - the furniture, the books, the food, even the cutlery. So I learned very early to appreciate the value of design and the value of architecture.",Neri Oxman,Design
"The evidence in this universe for design - or, if you will, the fine-tuning that cannot be explained by chance or by 'enough time' - is so compelling that the only way around it is to suggest that our universe is only one of an infinite number of universes.",Dennis Prager,Design
I was a directing student and a production design student at Carnegie Mellon. I went in as a production design student and became a directing student.,John Wells,Design
"Internet safety begins at home and that is why my legislation would require the Federal Trade Commission to design and publish a unique website to serve as a clearinghouse and resource for parents, teachers and children for information on the dangers of surfing the Internet.",Mike Fitzpatrick,Design
"I am quite familiar with Dubai and its design scene. I have been a regular visitor for more than 10 years. It is hard to name an area where hospitality, friendship, culture, ambition, and beauty are so highly regarded.",Marcel Wanders,Design
I believe that human beings are born first and given passports later. I'm really thankful for my journey. And it's a journey I didn't design.,Alfonso Cuaron,Design
"My architectural drive was to design new types of buildings to help poor people, especially following natural disasters and catastrophes... I will use whatever time is left to me to keep doing what I have been doing, which is to help humanity.",Frei Otto,Design
The real opportunity is to harness the inventive power of the world to locally design and produce solutions to local problems.,Neil Gershenfeld,Design
"There is a lot of interest in the arts, music, theatre, filmmaking, engineering, architecture and software design. I think we have now transitioned the modern-day version of the entrepreneur into the creative economy.",John Baldacci,Design
"If I wanted to do clothes or if I wanted to make a building or design a choreography, you are able to do that - they are all under a similar kind of design umbrella.",Zaha Hadid,Design
"CSS is the design language of the web, and it is not as easy to use as it ought to be, and it can be confusing, especially if you are new to it.",Jeffrey Zeldman,Design
"Practically, systemic thinking can be used to identify problems, analyze their boundaries, design strategies and policy interventions, forecast and measure their expected impacts, implement them, and monitor and evaluate their successes and failures.",Paul Polman,Design
"Italy is full of historical buildings. And Europe holds a great history of philosophy from Greece until today. I read all those books and see these buildings, and I think of where I stand when I design my architecture.",Tadao Ando,Design
"The way we want to look at it is we would like to do end-to-end design in India. We've invested for many years, and so at some point, to do end-to-end product in India is very much a possibility.",Lisa Su,Design
"Juicero is the first company to make cold-pressed juice something that people can make themselves at home. The challenges to design and engineer a press that can deliver 8,000 pounds of force are tremendous.",Yves Behar,Design
"Advertising is, of course, important because advertise is the final design. It's the last layer that speaks to the customer, that tells them what you have.",Tom Ford,Design
I wanted to be a decorator. I wanted to interior design homes and do everything myself.,Ursula Andress,Design
The age of recalcitrance is over. The best solution is no longer just to regurgitate a 19th-century design.,Thom Mayne,Design
"I love fashion, and I simply enjoy good design in clothes and regard that as one of my hobbies.",Martha Nussbaum,Design
My design process never starts or finishes. I am always hoping to find something through the mere act of living my daily life. I do not work from a desk and do not have an exact starting point for any collection.,Rei Kawakubo,Design
I'm afraid that it's not possible to design a defense against every conceivable threat that you can think of.,Steven Weinberg,Design
The theory of mechanism design can be thought of as the 'engineering' side of economic theory.,Eric Maskin,Design
"If you're writing a screenplay for a feature, you don't have any involvement with the casting process, the editing process, the set design, the costume design, or any of that stuff.",David Benioff,Design
"I design all of my costumes. I like to go out there and feel like I have contributed to every part of what I do. I choose the music, the choreographer, I've obviously chosen my coach, my costumes - all if that falls under my realm of power, my realm of influence.",Johnny Weir,Design
"While doing my architecture from the Parsons School of Design, I also did theatre.",Kalyani Priyadarshan,Design
"I studied fine arts and architecture, but I decided to move into movie design because I grew up in a small town in the Marche region and spent a lot of time after school in the movie theater.",Dante Ferretti,Design
"I find, in merchandising and design and creative, a business school degree isn't particularly helpful.",Mickey Drexler,Design
I think the good thing about Dogme is that it forces you into an extreme sense of reality because there's no artificial light and no set design and all of those icings on the cake that you usually have on a movie.,Susanne Bier,Design
I've generally got a good eye for design and proportion.,Bruce Oldfield,Design
Design can change how you look at yourself.,Ty Pennington,Design
"I went to my boss, and I said, 'Look, I'd like to design these ties because I think they could be new.' He said, 'The world isn't ready for Ralph Lauren.' I never forgot that because... I thought that was a compliment.",Ralph Lauren,Design
"To be able to design for the plus-sized consumer, for me, that's just beyond. It's a dream.",Khloe Kardashian,Design
I believe there's still room for the dream a lot of people in the industry have - to design and build your own cars.,Henrik Fisker,Design
Nothing I do is by design. It's always the result of a happy accident. I didn't have a career plan. It has just become the way it is. It's all good fun.,Lena Headey,Design
"All those lessons that I've learned on the court, I have applied them to my life outside of the court in business, my company, called V Starr interiors, an interior design company, and EleVen, which I wear on court.",Venus Williams,Design
Democratic strategists and operatives should not design a strategy based off today's conditions. They should be setting a strategy for where the trajectory of polling is headed.,James Carville,Design
"I was very much inspired by the things that I'd seen and done in politics, but I was also desperate for a complete departure from the reality of my political experience. 'It's Classified' and my previous book 'Eighteen Acres' are both works of fiction, but if they do seem realistic, it's by design.",Nicolle Wallace,Design
People kind of tend to mystify design and architecture by suggesting you need to train.,Marc Newson,Design
I come from a different era and I design clothes for our era. I think of people I want to dress when I design.,Alexander McQueen,Design
I have a background in graphic design and have been designing t-shirt graphics for years.,Manila Luzon,Design
"It seems to be a law of design that for every advantage introduced through redesign, there is an accompanying unintended disadvantage.",Henry Petroski,Design
"That's the challenge you take as a player, coach, whatever... executive... that you're gonna have to perform at a high level, whether that's by luck or whatever, by design, it has to get up there, otherwise it's not gonna be the most pleasant experience, but it's a challenge. And I think everybody would love a challenge like that.",Mike D'Antoni,Design
"The design of 'Love Actually,' the typeface, the basic line of that poster and that DVD cover has been ripped off so many times.",Martin Freeman,Design
"Genome design is going to be a key part of the future. That's why we need fast, cheap, accurate DNA synthesis, so you can make a lot of iterations of something and test them.",Craig Venter,Design
"Design has become a universal medium for expressing ideas, raising fundamental questions, and addressing social challenges.",Jens Martin Skibsted,Design
"I don't think I have a sense of fashion. But I do have an aesthetic, which I feel is an offshoot of me working in the design industry. For example, if I am mixing and matching prints on my sofas and cushion covers, I tend to do that with my wardrobe as well.",Twinkle Khanna,Design
"There are many designers who have much greater talent as a designer than I do, but they may not have my drive, they may not work as hard, they may not have the focus, the desire... You have to have a talent because, at the end of the day, if the pants you design don't make someone's butt look great, they're not going to buy them.",Tom Ford,Design
"Looking back, video game design seems a natural fit, although there was no such thing when I was growing up. I built a Tic-Tac-Toe playing machine in my teens which went up in smoke on the night it was scheduled to go to a science fair.",David Crane,Design
"I'd already decided I wanted to design shoes after I saw a sign in the Museum of African and Oceanic Art forbidding high heels. Well, who could resist?",Christian Louboutin,Design
My inspiration for interior design is more historical than traditional.,Patrick Cox,Design
"I approve designs not because I think I am more gifted or somebody who can see ahead three or four years from now, but just to make sure that the design is a logical, rational decision, taken after analyzing pros and cons.",Carlos Ghosn,Design
"To nourish children and raise them against odds is in any time, any place, is more valuable than to fix bolts in cars or design nuclear weapons.",Marilyn French,Design
"Well, I never studied design and I went to art school to study art, you know, sculpture and things like that, and ended up making things like sculpture and started making chairs and jewelry together and that's how I started.",Marc Newson,Design
"Integrating breakthrough technology into everyday products is always a challenge; at the same time, this is exactly how design makes tech products easily adoptable in life.",Yves Behar,Design
"When I was in high school in England, I wasn't sure that you could have a career in fashion. In those days, there were very few fashion magazines. I didn't realize there was a school where you could go and learn how to make clothes and design. I thought you just had to be discovered somewhere, like a film.",Maria Cornejo,Design
Design has taken the place of what sailing used to be.,Dennis Conner,Design
"Design, in its broadest sense, is the enabler of the digital era - it's a process that creates order out of chaos, that renders technology usable to business. Design means being good, not just looking good.",Clement Mok,Design
"The interesting thing is when we design and architect a server, we don't design it for Windows or Linux, we design it for both. We don't really care, as long as we're selling the one the customer wants.",Michael Dell,Design
"I don't set goals. Like, that's what I want to be doing however many years from now. I do what I love to do at the moment. If I wake up tomorrow and decide I want to dance, that's what I'd do. Or design clothes.",Ayumi Hamasaki,Design
"When you design it, think how you would feel if you had to fly it! Safety first!",Donald Wills Douglas,Design
"It was always my goal to 'up the ante' on good design, and I've devoted much of my career to this.",Michael Graves,Design
I have never seen a game's graphics look so sharp and clean. The sound design for the game is also unique on the Xbox. The memory on this system allowed us to provide the user with 5.1 Dolby surround sound for home theatre owners.,Don Bluth,Design
It would have been difficult to design a path out of communism worse than the one that has been followed.,Aleksandr Solzhenitsyn,Design
"Throughout the country, I see the same design problems and solutions over and over.",Douglas Wilson,Design
"Being in the design industry, I've tended to meet more people who are affected by HIV and AIDS.",Douglas Wilson,Design
Beautiful Evidence is about the theory and practice of analytical design.,Edward Tufte,Design
"I do believe that there are some universal cognitive tasks that are deep and profound - indeed, so deep and profound that it is worthwhile to understand them in order to design our displays in accord with those tasks.",Edward Tufte,Design
"Last year, Congress gave the Department of Defense the authority to design a new civilian personnel system for its employees as part of the defense authorization bill.",Norm Dicks,Design
"I am persuaded, that if any attempt is made to improve the education of the poor, and such an unmanly spirit should guide the resolution of a society or committee for that purpose, it would render the design abortive.",Joseph Lancaster,Design
My background is in hardware design. I found hardware work to be a welcome change from thousands of hours of programming and that led to the designs you mentioned.,David Crane,Design
But my point is that you design something in the end that precludes any unhealthy trading practices that are not going to serve your environmental or your economic objectives but now is not the time to do it.,John Anderson,Design
"That's something I learned in art school. I studied graphic design in Germany, and my professor emphasized the responsibility that designers and illustrators have towards the people they create things for.",Eric Carle,Design
We opened a design center in the South of England last year as part of our strategy for being close to our customers and developing innovative products for exciting new markets.,David Milne,Design
"Through the harsh design of fate, Florida was dealt the unfortunate circumstances of bearing the brunt of not one but two hurricanes, and it appears more dark clouds are poised to visit the Sunshine State.",Ginny Brown-Waite,Design
My biggest role as director on the film is keeping a sense of the overview - how to cast the movie and shoot it in such a way that it will cut together. And how to design the style and tone.,Jay Roach,Design
