quotes,authors,categories
"I want young people to be able to buy into what I design. When I was young, I wanted to buy designer brands even if all I could afford was the cheapest wallet, the cheapest pen, the cheapest T-shirt because I wanted to be a part of it.",Nicola Formichetti,Design
I'm always thinking about whatever game I'm working on. My brain works subconsciously on design pretty much every hour I'm awake.,Jane McGonigal,Design
"I don't differentiate game design and script; it is one and only document. I think that one of the biggest problem with storytelling in games is that people tend to separate story and interactivity. Both should be conceived as one entity, each using the other.",David Cage,Design
"I do what I love to do at the moment. If I wake up tomorrow and decide I want to dance, that's what I'd do. Or design clothes. I think I'd throw myself into whatever I'm doing now. It's not about abandoning what I was doing before, or giving up. It's about knowing that if I die tomorrow, I lived the way I wanted to.",Ayumi Hamasaki,Design
"If you write your own tools, you can sort of see new things, design new things.",Saul Griffith,Design
"It was by design that we mostly used pictures that you could not necessarily see what was going on, and that didn't really focus in on the band, but instead focused in on a theme.",Mike McCready,Design
"With increasing fervor since the 1980s, sustainability has been the watchword of scientists, environmental activists, and indeed all those concerned about the complex, fragile systems on the sphere we inhabit. It has shaped debates about business, design, and our lifestyles.",Jamais Cascio,Design
I finished high school there and then I went to Rhode Island School of Design.,Stephen Sprouse,Design
It's one thing to make financial aid available to students so they can attend college. It's another thing to design forms that students can actually fill out.,Cass Sunstein,Design
"I'm always up for collaborating with brands and people who actually design, but doing your own line is a whole other beast. I don't think I could deal with the criticism.",Travis Scott,Design
"As a director, I design every movie to be true to itself, and damn it if they like it, and damn it if they don't.",Guillermo del Toro,Design
"To me, form doesn't always follow function. Form has a life of its own, and at times, it may be the motivating force in design. When you're dealing with form as a sculptor, you feel that you are quite free in attempting to mould and shape things you want to do, but in architecture, it's much more difficult because it has to have a function.",I. M. Pei,Design
"We must carefully consider card security solutions, such as adding photographs or machine-readable electronic strips, so to prevent further breaches of individual privacy that could result from changes to the design of Social Security Cards.",Ron Lewis,Design
"But active programming consists of the design of new programs, rather than contemplation of old programs.",Niklaus Wirth,Design
"When something's made in the smallest volume - as a one-off couture piece - or in large quantities, deep care is critical to determine authentic, successful design and, ultimately, manufacture.",Jonathan Ive,Design
"Design is important, it's an important dimension in the car. It's not the only one.",Carlos Ghosn,Design
"I was always interested in art at school, and after year twelve, senior year, I spent three years studying graphic design at college. I worked in advertising for two years but didn't like it much, then began doing a bit of illustration work for various publishers.",Graeme Base,Design
"I wish you didn't have to design so often. Try to do quality and cut down on quantity. I think fashion is very, very important.",Vivienne Westwood,Design
"I always design the hat with the wearer in mind; otherwise, it's an inanimate object.",Philip Treacy,Design
Safety is not just about trying really hard and being really careful. You have to design technology that makes it possible for a computer to be safe.,Jensen Huang,Design
English is taking over the world. I just wrote a piece about it. And it's not by design. The United States dominates because it's the biggest market.,Norman Spinrad,Design
"I can design a collection in a day and I always do, cause I've always got a load of Italians on my back, moaning that it's late.",Alexander McQueen,Design
"I don't like the collusion between high fashion design and high street. You have to know where you stand. I belong to luxury fashion. That's what I've always felt and embraced. I like the best quality, the best fabrics and the most creative field in fashion. I will stay consistent. I belong to this world.",Hedi Slimane,Design
"My favorite days are the ones where I deal only with my own team, design, marketing, working on the next accessories collection.",Diane von Furstenberg,Design
"When I first started my graphic design career, and 'Beach Culture' magazine, I pretty much ran from the surfer label. It was hard to get people to take you seriously.",David Carson,Design
"If we don't have accurate information, if we are not able to tell difficult truth one to another, we will never be able to effectively design a policy for Iraq.",Jack Reed,Design
I help design my own tennis clothes.,Maria Sharapova,Design
You can make people feel valued or cared for by design alone. It's not purely about money. It's about how we choose to value human experience.,Thomas Heatherwick,Design
"One of the things I've learned from animation is that some guys are really good at writing, some guys are really good at design, some guys are really good at directing. It's almost like working in a band - not everybody plays every instrument.",Paul Dini,Design
"If you want to communicate something, you'd better make sure that your design piece is well-dressed and that its teeth are fixed. At the same time, I still believe that if it is only stylistically great and it has nothing to say, it still is not going to make a lasting impression on anybody.",Stefan Sagmeister,Design
I didn't want to be an actor. I wanted to design historical movies like 'Ben-Hur'. I saw this as my life.,Dante Ferretti,Design
"Give us detailed, testable, mechanistic accounts for the origin of life, the origin of the genetic code, the origin of ubiquitous bio macromolecules and assemblages like the ribosome, and the origin of molecular machines like the bacterial flagellum, and intelligent design will die a quick and painless death.",William A. Dembski,Design
"I do very little industrial design. I'm asked a lot, but I certainly don't see myself as an industrial designer.",David Chipperfield,Design
"Of course, I did lots of what would be called graphic design now, what used to be called commercial art.",Leonard Baskin,Design
"For me, unemployment and poverty in the Greater Montreal area is not mainly a problem of structure, or design, or statistics. It is a profoundly human situation.",Kim Campbell,Design
"Because every design must satisfy competing objectives, there necessarily has to be compromise among, if not the complete exclusion of, some of those objectives, in order to meet what are considered the more important of them.",Henry Petroski,Design
"When you're making a TV drama, the showrunner is God, and so however onerous and difficult and consuming that responsibility is, you're being treated with respect, so it changes your whole outlook to the production. You're being asked about costumes, set design, music, every aspect of the show.",Michael Hirst,Design
A rational model of software is to design it quickly - the economic pressure to improvise presents an interesting challenge.,Kent Beck,Design
"Any set of decisions about design is inevitably influenced by cultural prejudice, no matter how intent an architect might be to avoid it.",Martin Filler,Design
"And I think my sexuality was heavily repressed by the church, by the, you know, the design of the mortal sins.",Thomas Keneally,Design
"I wanted to be a writer as a teen... so storytelling was my first love. In my late teens, design became an obsession as I realized that I could express myself through the medium. Much later, when I founded Fuseproject in 1999, our slogan became 'design brings stories to life.'",Yves Behar,Design
"As an artist, as I design and lay out a page, the less-important things, things I want you to spend less time looking at, I draw them very small, maybe even silhouette them. The more-important pivotal scenes, I draw them larger, maybe even a double-page spread.",Jim Lee,Design
"To go back to architecture, what's organic about architecture as a field, unlike product design, is this whole issue of holism and of monumentality is really our realm. Like, we have to design things which are coherent as a single object, but also break down into small rooms and have an identity of both the big scale and the small scale.",Greg Lynn,Design
"And then, build a bustling wonderful city of the 21st century, with a restoration of a spectacular skyline, which Manhattan, of course, needs. So, that is really the design as a whole.",Daniel Libeskind,Design
"I always like to do sound design, and in movies, you have more leeway with that, but I don't really notice that sound design is being used in TV other than just location sound.",Reed Morano,Design
"Design can never be an ultimate explanation for anything. It can only be a proximate explanation. A plane or a car is explained by a designer but that's because the designer himself, the engineer, is explained by natural selection.",Richard Dawkins,Design
"I have made bouquets of pleats, bouquets of flowers, bouquets of ruffles, bouquets of feathers. Often I design in mousseline, held tightly around the waist, and with something else going on all around.",Giambattista Valli,Design
"I would never design anything. I just think that's kind of wack. I hated every rapper fashion line that ever came out, you know what I'm saying? I would never try.",Danny Brown,Design
I've always wanted to design clothes.,Skai Jackson,Design
"I do love DVD and I've always taken them seriously. You know, on the Austin things, we really put a ton of work into them because there's so much design involved. And in this one, we thought a lot about it and what could go in.",Jay Roach,Design
"I really appreciate artists of the 20th century, and I can see a lot of their influence on my work, but to suggest that my design only fits within an 'ism' kind of bothers me.",Michael Arad,Design
"When you buy things that are expensive, like a sofa or something that really feels like an investment, you need to keep it as plain as possible, as simple as possible. Make sure that it's a clean design that will work with whatever style you want it to.",Nate Berkus,Design
"Urban design as a discipline barely exists in most American and Canadian cities. In Singapore, there are innovative transportation strategies at work.",Moshe Safdie,Design
I would love to design a maternity clothing line. It is so hard to find stylish clothes for pregnant people... I would say 99 percent of the clothes I wore were not maternity because I couldn't find anything I liked.,Kourtney Kardashian,Design
"In two days, it's hard to to get the quality you would normally want for a design project.",Douglas Wilson,Design
"I'm involved in everything from highly progressive lighting systems to airline interiors. In the field of transportation I can go from the micro to the macro: architecture, transportation, industrial product design, right across the board. It's Russian dollism, because they all interrelate: one goes into the other.",Ross Lovegrove,Design
"I don't have a background in design, so I think it's always about what I see in the world and what inspires me. So yes, I am designing for myself. I'm going through this whole evolution, which is a process of growing up and going from modeling to styling to designing.",Erin Wasson,Design
"The basic problem is that web 2.0 tools are not supportive of democracy by design. They are tools designed to gather spy-agency-like data in a seductive way, first and foremost, but as a side effect they tend to provide software support for mob-like phenomena.",Jaron Lanier,Design
Design is a tool that either allows us to create new markets or disrupt existing ones.,Yves Behar,Design
They say that the best furniture and clothing design from the '50s and '60s is Scandinavian or Milanese.,Christian Lacroix,Design
"I like to think that the Internet and file sharing, if utilized properly and embraced, and I emphasize properly, is a high-powered marketing design.",Seal,Design
"If there is a gay uniform, the differences are in how each man coordinates the details: the brand and cut of the jeans, the design of belts and boots, the haircut, the number and size of earrings.",Lance Loud,Design
"So many designers only sketch and leave pattern-making to others. Pattern-making is important so you know the structure. Then if someone tells me, 'I can't make a pattern from that sketch,' I can tell them, 'I will make it' and then they are quiet. If I can't make it, I don't design it.",Tadashi Shoji,Design
"By divine design, men and women are intended to progress together toward perfection and a fulness of glory. Because of their distinctive temperaments and capacities, males and females each bring to a marriage relationship unique perspectives and experiences.",David A. Bednar,Design
"Being a sculptor who uses found objects, all the objects I use in my work have been designed by other people. So I'm tweaking them in some way by squashing them or throwing them off cliffs! Then I formalise my damage by suspending them or arranging them in some kind of way. So I'm using other people's design in a way, so I'm an 'un-maker.'",Cornelia Parker,Design
"By no definition of any modern scientist is intelligent design science, and it's a waste of our students' time to subject them to it.",Lawrence M. Krauss,Design
"When you say 'design,' everybody thinks of magazine pages. So it's an emotive word. Everybody thinks it's how something looks, whereas for me, design is pretty much everything.",James Dyson,Design
"At age 12 or 13, I wanted to design for showgirls - for the theater!",Christian Louboutin,Design
"Watching my dad, Ralph Lauren, design clothes when I was young, I was always inspired.",Dylan Lauren,Design
"Art has definitely influenced how I think of design, both as individual items and as a body of work.",Cynthia Rowley,Design
I am equally proud of all of my architectural projects. It's always rewarding to see an ambitious design become reality.,Zaha Hadid,Design
"I went through the workroom at Central Saint Martins in London, which is the most competitive workroom of a design school in the world. Very high creativity, very conceptual, very international, age-diverse and cutthroat - people who have master degrees reapplying into a foundation there is just wild to me to launch their careers.",Zac Posen,Design
"Design schools are good, I guess, sometimes I visit schools, but they are very very limiting.",Marc Newson,Design
"The sky is a free asset in design, and nothing unnecessary should be planted that takes away the sky.",Rachel Lambert Mellon,Design
"You have to have talent to design and to dress thousands of women or millions of women around the world. And you know very well, the only thing they want is to look more beautiful.",Carolina Herrera,Design
"If you want to make computers that really work, create a design team composed only of healthy, active women with lots else to do in their lives, and give them carte blanche.",Brian Eno,Design
"Brizo has been my single biggest sponsor since I began as a designer. Brizo wanted to be involved in many different areas of design - they had already worked with several architects, and fashion was an area they were interested in moving into.",Jason Wu,Design
The federal debt in this country is principally of Republican design.,Daniel Keys Moran,Design
I'm into designing houses and interior design. I like change. I like creating things out of nothing.,Chris Kirkpatrick,Design
Species go extinct because there are historical contraints built into a given body or a given design.,Kevin Kelly,Design
It turns out it's not rocket science to design a sacred space.,Greg Lynn,Design
"I like to be surrounded by books. My wife Evelyn has a Ph.D. in comparative literature, so we have a lot of her Spanish and German literature books which are wasted on me, plus a lot of novels and books on art and architecture shared by us both. Evelyn used to edit an art magazine called 'FMR,' so we have a common interest in design.",David Chipperfield,Design
McSweeney's as a publishing company is built on a business model that only works when we sell physical books. So we try to put a lot of effort into the design and production of the book-as-object.,Dave Eggers,Design
"When clients come to my design agency and say 'I want to be the Apple of this or that,' we say 'Okay, are you ready to be the Steve Jobs?' Few are up to the task.",Yves Behar,Design
"A Nicklaus Design golf course is done by the guys in my company that I work with, that have been trained in my vision, and they do what they think I might do. They might come in the office and ask me questions and I'd certainly answer their questions, but I'm not involved in the site visits or anything else.",Jack Nicklaus,Design
"It was something I was more interested in myself. When I went to see my sister dance at ballet, I was really into costumes and the arts, and my family was also supportive of whatever me and my sister wanted to do. I would say I pushed myself the most to be into design.",Christian Siriano,Design
"Graphic Design, which fulfills aesthetic needs, complies with the laws of form and exigencies of two-dimensional space; which speaks in semiotics, sans-serifs, and geometrics; which abstracts, transforms, translates, rotates, dilates, repeats, mirrors, groups, and regroups, is not good design if it is irrelevant.",Paul Rand,Design
I think a lot of times people design restaurants with flash in mind. I think you should design restaurants with function in mind. Make sure it's functional and works with what you're trying to accomplish. Design can come later.,Bobby Flay,Design
I could design an $800 shoe line; it's easy. You use the best materials and you can make beautiful shoes. It's easier than making great shoes for $90.,Steve Madden,Design
"The first 10 years of my professional life had only to do with running away from my father. He was a wonderful cabinet-maker, and me being the eldest son, I had to take over his shop, his profession and so on and so on. I tried to escape by going to art school and then going on to industrial design and then interior design.",Peter Zumthor,Design
I love every period in design history. Even the ugly ones.,Catherine Martin,Design
Readers always seem to think that the author has some control over the design of their books.,Donald Norman,Design
"A new 'look' for any organization cannot be a papier-mache cover, tacked on with Scotch tape under the heading of 'beautification.' It has to be based on a probing examination of the company and the people who work for it. As a result, the eventual external visual design becomes the graphic extension of the internal realities of a company.",Saul Bass,Design
Eight years of work can be copied in six months. It wasn't inevitable that it was going to work. A stolen design is stolen time.,Jonathan Ive,Design
"Can you design a Rorschach test that's going to make everyone feel something every time - and that looks like a Rorschach test? It's easy to show a picture of a kitten or a car accident. The question is, how abstract can you get and still get the audience to feel something when they don't know what's happening to them?",Jason Reitman,Design
I think taking design out of the studio and really having a relationship with the people that you're making it for really convinced me of how powerful a thing design is. It's not just an aesthetic decoration.,Genevieve Gorder,Design
When we were in the design studio I always was pretending like I was in a closet asking my friend before I step out into the world what do I look like? And everybody wants that honest friend before they go and go to dinner or go to an event.,Nicole Richie,Design
"I never wanted to work in fashion. At age 12 or 13, I wanted to design for showgirls - for the theater! And I was crazy for the Hollywood of the 1950s: Dietrich, Elizabeth Taylor, Jennifer Jones. They were my idea of glamour - and Sylvie Vartan, the French singer.",Christian Louboutin,Design
Longhorns are unique - each and every one of them is a different color with a different design.,Janine Turner,Design
"The problem with State of the Union speeches is that they are, by their nature and design, alphabet soup. It's hard to know what a president really cares about when they run down a laundry list and check every issue box under the sun for fear they will offend some constituency if they don't.",Mark McKinnon,Design
"Received wisdom is that if you spend time up front getting the design right, you avoid costs later. But the longer you spend getting the design right, the more your upfront costs are, and the longer it takes for the software to start earning.",Kent Beck,Design
"Usually I design the lighting and when I have the physical set there, I'm not good at going out loosely and saying, 'Do you what you want, give it to the editor, and he'll figure it out.' I physically then walk on with the actors and I say, 'Let's walk until you guys feel the space works for you, and tell me when all that happens.'",Tarsem Singh,Design
"I'm not really well educated - other than an art survey course at the High School of Art and Design in New York when I was, like, 15. I don't know the history of art, but I got over intimidation from the art world when I realized that I was allowed to feel whatever I want and like whatever I want.",Marc Jacobs,Design
"Many, many times I find that whatever is looking good on the screen doesn't always look or feel good on the body. So who do we design for - do we design for the screen, or do we design for women?",Alber Elbaz,Design
"To me, 'design thinking' is another way of saying empathize with the customer. It's consideration for the person you're designing for.",Joe Gebbia,Design
"Independent graphic novelists have already achieved good work in terms of design, but all these great minds are writing in English. There is a need for people to write in Hindi.",Anurag Kashyap,Design
"I love the creative outlet of designing, and I love make-up and products and feel like I find so many great products around the world that I want to recreate, so I want to do that or design.",Jessica Hart,Design
"I'm experimenting in public. At the design grad schools, these are people sitting around in groups, putting their work on a wall, analyzing it and putting it back in a drawer. I think there's little risk in that.",David Carson,Design
"We are not inferring design to account for a black box, but to account for an open box.",Michael Behe,Design
I design for the working girl.,Elsa Peretti,Design
"I wouldn't like to live in a castle now, but I'd enjoy a visit to Restormel in Cornwall in its 13th century prime. It's a circular castle with the rooms built against the outer walls and quite intimate in size. Life there wouldn't follow the pattern of more classic castle design.",Jo Beverley,Design
I'm opinionated. I always stick to my design plan. I don't waver.,Douglas Wilson,Design
"The New Testament evinces its universal design in its very, style, which alone distinguishes it from all the literary productions of earlier and later times.",Philip Schaff,Design
"I don't know whether the universe contains any evidence of intelligent design, but I can assure you that thousands of everyday products do not.",Gary Hamel,Design
"Actually, I didn't make the claim that Ruby follows the principle of least surprise. Someone felt the design of Ruby follows that philosophy, so they started saying that. I didn't bring that up, actually.",Yukihiro Matsumoto,Design
"I'm fascinated by furniture design and interiors, and I want to try designing all that stuff.",Prabal Gurung,Design
"I always try to design fashion that is interesting and innovative, and I like to break traditions and challenge people's expectations.",Jonathan Anderson,Design
"Snohetta promotes a more democratic workplace atmosphere than most other architectural offices. This may merely reflect prevalent employment practices in Scandinavia, but Snohetta places a stronger emphasis on group participation in the design process than typical high-style firms.",Martin Filler,Design
Building design isn't trendy.,Kevin McCloud,Design
"You can almost say that a design error is a human error because, after all, it's we humans who do the designing.",Henry Petroski,Design
"Developing games for the PC and consoles is all about everything and the kitchen sink. In many ways, you don't have design decisions to make. You do it all. So I enjoy going back to making decisions about what's important as I'm working on a game.",John Carmack,Design
"I'm going to design again, but I come back when it's the right project, so I keep my passion for it intact.",Hedi Slimane,Design
"If you want to come up with a really original design idea, and you want to capture a whole new design direction, perhaps the best way to arrive at that is not by acting and thinking and doing like everybody else. That's all.",Peter Marino,Design
I was asked to design the tuxedo for Mr. Peanut. They're rebranding him. That was probably the most interesting request. I didn't spend a long time considering it.,Thom Browne,Design
