quotes,authors,categories
"I became an actor, and because I had success as an actor, I became famous. I was acting for quite a while before I got famous; television made me famous. I guess that it's television that is responsible for everybody's desire to be famous.",Kelsey Grammer,Famous
On the corner of 57th and 7th Avenue sits the most famous concert hall in the world. No less a figure than when Tchaikovsky led the first performances in 1891. Virtually every major artist has performed there. There is simply no place like it. The first time I stepped foot in Carnegie Hall was in 1964.,Leonard Slatkin,Famous
I ain't expect it. I just expected to be Chicago famous - 'hood famous. I ain't expect to be outside-of-Chicago famous.,Lil Durk,Famous
"I was getting a lot of editorial, as in lots of pages in 'Vogue,' but it's far more important to get your dresses on the back of a famous person. Charlotte Rampling in Bruce Oldfield. That sells.",Bruce Oldfield,Famous
You can get rich or famous by doing the same thing.,Ang Lee,Famous
I just don't feel much interested in the lifestyles of the rich and famous.,Michael Cunningham,Famous
"I don't want to be famous as a movie star and have the whole world love me, I want to be a creative actress.",Juliette Lewis,Famous
"I married a pretty famous girl, and when we drive through town there's usually a car following us, when I walk out of my front door in Chelsea there's six guys waiting for me.",Kevin Pietersen,Famous
"Kids will keep it real. If I've ever had in my life a great anchor, it's them. They get in your head, 'don't get too famous.' If you think you're really famous and think you're really hip, go hang out with your kids for an afternoon. That's about as earthbound as it's going to get.",Lionel Richie,Famous
"I remember, when I was an up-and-coming comic, how annoyed I would be when the famous guys would show up and just take everyone's spots.",Seth Rogen,Famous
"No matter how famous and established they were or however blessed they were with great songs or long careers, if they lived alone, they lived alone. That's not the way I wanted to live prior to the tour or after.",Edie Brickell,Famous
"'Strictly' is a bit like scoring the winning goal in the FA Cup Final or sinking the final putt in the Ryder Cup - only a few people get the opportunity to do it, and they have got to be famous.",Anton du Beke,Famous
I love being famous - it's phenomenal.,Dave Chappelle,Famous
"What I do is what I like; if I'm not as famous as I'd like to be, I've done it to myself.",Blake Shelton,Famous
"I can't advise any of the young ones, because I don't know what their background was, but I would suggest that anyone who wants to be famous more than anything - there's a real problem.",Shirley MacLaine,Famous
I still think it's mind-blowing when famous people know who I am.,Jayson Tatum,Famous
"I didn't start out to become famous, so when it disappeared, I thought, well, that happens sometimes.",Leon Russell,Famous
"I certainly don't want a child of mine to be famous, or anyone I was very close to who isn't yet... It's the worst thing to be trapped in your house not be able to leave.",Elizabeth Hurley,Famous
"I do know something about the news world. I was sitting on the floors of newsrooms since I was seven years old, and I've been around them my whole life. I understand that someone looks at a story with famous people in it, and you want to put it out.",George Clooney,Famous
"I served the famous professors and scholars, and eventually they learned that the Reverend Moon is superior to them. Even Nobel laureate academics who thought they were at the center of knowledge are as nothing in front of me.",Sun Myung Moon,Famous
"I became famous, I think, really because of the interpretation of other people's songs, way back when, and that's what I enjoy the most. And I'm a lazy bugger.",Rod Stewart,Famous
"I don't know if this is the kind of retrospective analysis that people are fond of applying to their work or actions, but it feels like I knew I was going to be famous and I knew that an element of that would be traumatic, so that if I could make myself something big and otherworldly, it would be a kind of defence.",Russell Brand,Famous
I think that people who are famous tend to be underdeveloped in their humanity skills.,Diane Keaton,Famous
"I think anybody who's famous has to deal with their fame in their own way, and I dealt with it by making a film about a kid who's looking out into the world of celebrity obsession.",Adrian Grenier,Famous
"I keep saying I'm not at all famous in my own country, because people do not think I have done anything for India.",Freida Pinto,Famous
"But to this day I am convinced that the real reason we met was because Alexander is from Nebraska, and he was completely fascinated that I was about to go off and make a movie with Brando - perhaps the most famous Nebraskan of all.",Thomas Haden Church,Famous
"Normally, I name my characters after famous comedians.",Paula Danziger,Famous
"Ibiza is a popular vacation place for a lot of the players in Spain. If you go in the summer, there are some of the world's most famous movie and music stars, so nobody cares about soccer players.",Xavi,Famous
"My father was famous for his photographic memory. He was in the OSS. They trained him to be captured on purpose and to read upside down and backwards and commit to memory every document in Germany he saw as he was being interrogated - every schedule on every wall. So, that photographic memory somehow made its way to me when I was young.",Mark Helprin,Famous
"I don't know how to construct a career that'll make me famous. Except maybe get my ears pinned back, get my teeth done, and go to America. But then I'll be competing with billions of actors who haven't got false teeth, and who are 25.",Ian Hart,Famous
"I lead a unique existence as someone who is famous for being young on film, or young in the minds of everyone.",Ralph Macchio,Famous
"They saw me, those reckless seekers of beauty, and in a night I was famous.",Lillie Langtry,Famous
"Thank God I arrived the day before yesterday, the first of the month, at this port of San Diego, truly a fine one, and not without reason called famous.",Junipero Serra,Famous
"I may not be the most famous songwriter in the world, but you know a David Friedman song when you hear it. It took me a long time to appreciate that.",David Friedman,Famous
"I just turned 40, and I look at so many performers and so many people who are actually always on time and always have an album out. They don't have actual lives, in my opinion. I feel like I'm so much more than being famous and meeting a musical quota. And I don't know, just the weight of the scrutiny and attention is too weird for me.",Maxwell,Famous
I never thought about being famous.,Damon Wayans,Famous
"I mean he's a very famous director... they're not going to put their... and he's very tough, he doesn't like interference at all, so he kept them at bay.",Ronald Harwood,Famous
"I always regarded people who want fame with a lot of suspicion. Unless you have a product to sell, I don't know why anyone would want to be famous. I can't imagine what need that would fill.",Jessica Cutler,Famous
"We had an interesting thing at that first dinner. It was prior to the availability of several new hotels in Los Angeles, and we were more or less committed to the old Ambassador Hotel that has the famous Coconut Grove.",Lew Wasserman,Famous
I'm in that comfortable niche where I'm not that famous and sometimes people do need to put a barrier between them and their followers. When you're real famous you need to do that but I'm not that famous so I don't need that kind of barrier.,Tony Levin,Famous
I'm famous for splurging at fast-food places. I'm currently obsessed with Taco Bell's bean and cheese burritos with extra green sauce and extra cheese. Gluttony!,Fergie,Famous
"I also want to go to an Italian island and do cuisine properly with some famous Italian chef and, like, his mother.",Elizabeth Olsen,Famous
"HBO is really famous for hiring good people and staying out of their way until they ask for help, or need it. And that reputation is earned.",Richard Russo,Famous
"I look at other people my age in this industry, other famous people my age, and they've just got famous friends. Which is cool, but I love being normal and just chilling at mine.",Maisie Williams,Famous
"I want to thank all the women who have worn my clothes, the famous and the unknown, who have been so faithful to me and given me so much joy.",Yves Saint Laurent,Famous
I wanted to be famous. I wanted people to talk about me.,Haile Gebrselassie,Famous
"I know I'm not a self-indulgent idiot; I also know I'm not the second coming of Deepak Chopra. If I had believed either of those, or both, as some people do when they get famous, that's when the mental illness arrives.",Elizabeth Gilbert,Famous
"There's so many things I want to do. I want to work with great filmmakers, great actors, great scripts. And there's no reason for me to do anything short of that, because I'm 24, I don't have a family, I don't need to make tons of money, and I'm not dying to get famous.",Tobey Maguire,Famous
"Pulp existed for 12 years before we got famous. Now, you could say that was just lack of imagination, but it's some kind of quality isn't it? Tenacity. You could also say it was sloth.",Jarvis Cocker,Famous
Jason Lee is the most famous actor from Hawaii I can think of.,Tia Carrere,Famous
"After 'Skins' I became mildly famous, which was a bit of a disaster.",Nicholas Hoult,Famous
Why does anybody want to be famous? You know what's important to me? Having lunch! Pasta! Seeing my friends! Is that so crazy?,Sherry Stringfield,Famous
"Dates with actors, finally, just seemed to me evenings of shop talk. I got sick of it after a hile. So the more famous I became, the more I narrowed down my choices.",Hedy Lamarr,Famous
"Sometimes people offer you plays, they offer you parts, but they only offer it because I'm famous.",Chris Rock,Famous
"Lance Armstrong, the famous cyclist and more importantly, cancer survivor, has said 'if you ever get a second chance for something, you've got to go all the way.'",Michael N. Castle,Famous
"That's what we were exploring on 'Larry Sanders' - the human qualities that have brought us to where we are now in the world: the addiction to needing more and wanting more and talking more. We were examining the labels put on success - is it successful to be on TV every day, to be famous, to have a paycheck?",Garry Shandling,Famous
"I begged the universe to make me a famous comedian, and it did. So I tend not to ask for any more.",Ron White,Famous
"To be fair to David Brent, he wants to be famous for doing something, for being a musician, but he's just not good enough.",Ricky Gervais,Famous
"I got very famous for a minute and then it just all went away, you know? And for the last 20 years - you've got to pick yourself up and dust yourself off and then go on your merry way and start again, in a sense, and that's what I've been doing.",Colin Hay,Famous
"To my surprise, the more I searched about Qi Xiangfu, the more I found of a life lived partly online. He once wrote a short memoir in which he described himself in the third person, with the formality usually reserved for China's most famous writers.",Evan Osnos,Famous
"So I'm a young boy in the 1940s growing up, seeing Ralph Bunche on a regular basis, seeing Duke Ellington on a regular basis. We know that these people are famous. They're living in the same community as we live in. They go to the same stores and shops.",Ed Smith,Famous
"When I was younger, I used to say, One day I'll be famous.",Katie Price,Famous
"In approaching our subject it will be best, without attempting to shorten the path by referring to famous theories of the drama, to start directly from the facts, and to collect from them gradually an idea of Shakespearean Tragedy.",Andrew Coyle Bradley,Famous
"Do you want to be famous, or do you want to have actual money to take care of your family down the line? I'd say it's a case by case call there. Some guys fight for different reasons. What do you fight for? Do you fight for this reason or for that reason.",Benson Henderson,Famous
"They used to but not any more. You kind of get used to it - you accept it is part of your job - if you're famous and you want this life, you have got to accept this part of it as well.",Charlotte Church,Famous
Many medal winners dream of competing in a sport other than the one they're famous for.,Mary Lou Retton,Famous
I'm English. Our dentistry is not world famous.,Christian Bale,Famous
"I'm not unknown, yet I'm not super famous where I can't go anywhere.",Justin Guarini,Famous
"Yankee Stadium, and the Yankees are so famous for Mickey Mantle, Joe DiMaggio, Lou Gehrig, all of those guys.",Bert Campaneris,Famous
"I don't like to think of myself as famous because us skaters, we think of ourselves as normal people. But I really do have to be more careful about what I do and the way I set examples for everybody.",Nyjah Huston,Famous
"If you think Abraham Lincoln became famous for inventing the town car, it is time to spend a few hours on history.",Bo Bennett,Famous
I was never famous as a kid. That's the biggest difference between me and any other kid actor is that I wasn't famous as a kid.,Seth Green,Famous
"Celebrity culture, it's everywhere, isn't it? It's reality TV, Big Brother. I didn't become a footballer to be famous, I became a footballer to be successful. I didn't want to be famous. Now people want to be famous. Why? Why would you want people following you about all day?",Ryan Giggs,Famous
"Being famous is great, it's not like bad or horrible or anything.",Dave Chappelle,Famous
I've noticed that once you leave London you do kind of become a bit more famous. People in London are a bit too cool for school. It's not so unusual to see someone from London in the street. But outside of London people are a bit more excited to see you and come out and support you.,David Walliams,Famous
I've always been more drawn to being normal than being famous.,Vince Gill,Famous
Sonny and another Hells Angel who was at the meeting thought they were beyond a little patch so they headed down to a local tattoo shop in Oakland and were the first to get the famous One Percent tattoos.,Chuck Zito,Famous
"I know I have this level of celebrity, of fame, international, national, whatever you want to call it, but it's a pretty surreal thing to think sometimes that you're in the middle of another famous person's life and you think to yourself, 'How the hell did I get famous? What is this some weird club that we're in?'",Kevin Costner,Famous
I think there are a lot more writers who are actors than you know; they just don't have roles on famous TV shows that you recognize.,Danny Strong,Famous
"I would like to prove that on TV, everyday lives can be as compelling as the life-styles of the rich and famous. Especially lives that we catch at extraordinary moments.",Jane Pauley,Famous
I wasn't a kid who moved out from Iowa with aspirations of becoming a famous star - I was intrigued by the idea of filmmaking and by the idea of what it would be like to play a character in a movie.,Jason Lee,Famous
"I did grow up next door to Steve McQueen, who was a very famous movie star at the time, but as a kid it didn't impress me. We always had great fun with him. He would take us out on Sundays on his motorcycles, riding around in the desert; he was like a second father.",Herb Ritts,Famous
"I really don't know anything else because my brothers were famous when I was two years old. So I know nothing else, no other life.",Janet Jackson,Famous
I never set out to be rich and famous. I wanted to follow my own path.,Matthew Modine,Famous
I am not a name-dropper. I can't help it if everybody I know is famous.,Zsa Zsa Gabor,Famous
"I always loved working as an actress, but I didn't understand why I couldn't just opt out of being famous. And then I realized you can, and I think I did. And eventually, I came to understand that you can do that and also keep working.",Debra Winger,Famous
"I don't really know a lot of famous people. I've met a lot of famous people. If I ran into Tom Hanks today, I would have to remind him who I was and he would then remember me. But he wouldn't come up to me and say, 'Hi Dave!'",David Zucker,Famous
"I'm busier than ever and it's led to new opportunities. But I've never worried about being rich or famous - for me, it's all about the dancing.",Anton du Beke,Famous
"I'd grown up with a lot of women. My mother was a famous lesbian in the '20s and '30s, and I grew up with only women, so I was used to getting on with them.",Patrick Macnee,Famous
One of the pleasant duties of America's most famous announcers during the relatively short swing era of the big bands was to host late-night remotes from some of the most famous ballrooms throughout the country.,Nick Clooney,Famous
"My philosophy was, if I just do good work, someone will like it enough to employ me. It never made me famous. And I'm way, way too old now, mate. That boat's sailed.",Ian Hart,Famous
People don't get through to the essence of you right away - it's always the famous 'girl' or the famous 'girlfriend'. I'd rather be known for myself.,Vanessa Paradis,Famous
"In American military cemeteries all over the world, seemingly endless rows of whitened grave markers stand largely unvisited and in silence. The gardeners tend the lawns, one section at a time. Even at the famous sites, tourism is inconstant.",Mark Helprin,Famous
It's not my goal to be a famous actor.,Gavin DeGraw,Famous
"I know somebody from university who's called Phil Collins, and I think there's something terribly unfortunate about sharing a name with somebody who either is famous or becomes famous.",David Walliams,Famous
"There's the famous thing that the A&R man from the record company is supposed to do: He's supposed to come into the studio and listen to the songs you've been recording and then say, 'Guys, I don't hear any singles.' And then everybody falls into a terrible depression because you have to write one.",Jarvis Cocker,Famous
"I'm largely interested in people who are just great actors, and they're not necessarily hugely famous.",Tobias Menzies,Famous
I'm as famous as I want to be.,Tracey Ullman,Famous
"Some of the things I've seen a lot of my female-actress friends who are relatively famous receive - I've seen some hideous things. Like some really, really bad things... like, the FBI should be contacted immediately.",Elisha Cuthbert,Famous
I never pursued being 'famous.',Francesca Annis,Famous
"I've walked with very famous people down red carpets over to the crowd of thousands of people, and you'll reach out to shake their hand and they've got a camera in their hand. And they don't even get their hand out, because they're recording the whole time.",George Clooney,Famous
"I have actor friends, but they're not famous. I feel like if you're an actor or - famous, you have to overly prove that you're a normal, cool person.",Amanda Bynes,Famous
"When I was about to be famous, I feared it on a few levels. I feared it because I didn't want people to lump me in with those people who'd do anything to be famous. I didn't like the word 'celebrity.' I feared intrusion, you know? Make me famous, and suddenly you can go through my trash bins.",Ricky Gervais,Famous
A lot of young people have not a clue what being famous entails. When you lose your anonymity you can't walk down the street without people looking at you.,Tricky,Famous
A lot of people these days are not music lovers - they just want to be famous which is a very different thing to what I grew up believing in.,Shirley Manson,Famous
You aren't famous until my mother has heard of you.,Jay Leno,Famous
All I say is that I don't go out with famous men.,Samantha Mumba,Famous
We cannot create the perception that if you're rich or famous or both that you got one set of justice - and for everybody else it's something much harsher. That won't do and we need to make sure that we have a criminal justice system that has integrity.,Lori Lightfoot,Famous
I am famous because I am an African American jazz artist.,Nat King Cole,Famous
"There has been a time on earth when poets had been young and dead and famous - and were men. But now the poet as the tragic child of grandeur and destiny had changed. The child of genius was a woman, now, and the man was gone.",Tom Wolfe,Famous
I hate being famous. You have no freedom. You can't do anything.,Niki Lauda,Famous
"Before I got famous, I was like a rake. When I was a teenager, I lived on nervous energy. And I always forgot to eat. It was not something I was obsessed with. And then suddenly I got famous, people started taking me out to fancy joints. And the pounds pile on. So I'm much more conscious now about when I eat. How I eat. What I eat.",Boy George,Famous
"I've been accustomed to being famous and having a certain level of attention for 14 years, but in the last few months, it's changed. It's like on the arcade game, I've gone up to the next level.",Kylie Minogue,Famous
I want to be so famous that drag queens will dress like me in parades when I'm dead.,Laura Kightlinger,Famous
I had no desire to be famous; I just wanted to make the greatest music ever made. I didn't want anyone to know who I was.,Robert Smith,Famous
I'm actually about as famous as a fourth division footballer from the 70s.,Dylan Moran,Famous
I imagine that I'm less famous than the 15th ranked bowler in the world.,David Berman,Famous
I don't feel famous.,Ninja,Famous
"With brain hacking experiments, I've hacked into Morgan Freeman's brain. He was the most famous and the most nerve wracking because I got really awestruck when I met him, and the moment I was introduced to him, he challenged me there and then to hack his brain.",Keith Barry,Famous
"People laughed at him and said, 'you'll never be famous, your name is too hard.' But everybody knows who Arnold Schwarzengger is. I'm far, far away from where he is.",Hafthor Bjornsson,Famous
"They eat the dainty food of famous chefs with the same pleasure with which they devour gross peasant dishes, mostly composed of garlic and tomatoes, or fisherman's octopus and shrimps, fried in heavily scented olive oil on a little deserted beach.",Luigi Barzini,Famous
"I remember when the photograph was taken. The famous one, I mean. The one of me being rushed from the Boston Marathon bombing without my legs.",Jeff Bauman,Famous
"I grew up with Forrest J. Ackerman's 'Famous Monsters of Filmland' along with a plethora of movie tomes and wanted to write about film with a sense of personality, passion, and humor.",Harry Knowles,Famous
"Whereas you have someone like Houdini, who works really, really hard to get really, really famous, and then has actual intellectual ideas that he puts into the culture that stay there.",Penn Jillette,Famous
"People think Selena and The Weeknd are dating for publicity, and that's not how things works. These are real human beings. They don't just date to get more famous. They're already the most famous artists!",Madison Beer,Famous
"My mother used to say that when I told her that I wanted to be an artist, her famous line was, 'The only artists I've ever heard of are dead.' It just wasn't in her experience... I don't think she had a sense that one could be an artist, because there wasn't anyone in my family who had done that.",Glenn Ligon,Famous
"I never wanted fame, of all things, and I'm not just being cheeky. There are benefits that come with being famous, but there's also confusion. It's important to make sure your feet stay on the ground.",Grace Park,Famous
"I would love to do a biopic of a famous singer, like Diana Ross or Donna Summer, or an old jazz story that we haven't seen before. I would love to do that! I would love to play Diana Ross 'cause she's an icon. I'm salivating to do that.",Taraji P. Henson,Famous
"'Leave It To Beaver' is a fairly famous show in America, but I don't think it travelled. It was one of those typical '50s family comedies. I was in the pilot episode as sort of the dark presence: my character was called Eddie Haskill.",Harry Shearer,Famous
KKJZ is a very famous jazz station and there aren't many more around like them.,Frank Sinatra Jr.,Famous
I'm coming out with a wine... I'm actually a restaurateur. I have Famous Famiglia Pizzeria that has opened up in the Sacramento airport. I'm also working with my business partner on opening up the Linnethia Lounge.,NeNe Leakes,Famous
I didn't want to be famous. I just wanted to earn enough money to have a nice life and enjoy acting.,David McCallum,Famous
I don't like being famous - it is like a prison. And driving for Ferrari would make it far worse.,Valentino Rossi,Famous
"When you're rich and famous you are the dominant force in a relationship, even if you try hard not to be. I've talked of sacrificing everything for Fleetwood Mac, but I realize now that it is simply the only thing I've ever wanted to do.",Stevie Nicks,Famous
I don't feel famous.,Tamara Feldman,Famous
1988 Olympic Champion Brian Boitano was famous for doing a Lutz with one arm over his head. And I wanted to build on that.,Adam Rippon,Famous
"I've had the chance to work with Christopher Plummer, one of the great stage and film actors, a couple of times, including on 'Prototype,' the first TV movie I ever did. It was science fiction in the Ray Bradbury sense, written by the famous team who created Columbo, Levinson, and Link.",David Morse,Famous
