quotes,authors,categories
"Since the tragedies, the Department of Homeland Security was established to prevent terrorist attacks within the United States, and most importantly, to share intelligence information among government agencies and departments.",Randy Forbes,Intelligence
"As a member of the House Select Committee on Intelligence, I will be participating in several hearings on the startling revelations contained in the report.",Charles Bass,Intelligence
"If you look at military and intelligence positions from the 1950s, the Israeli-Palestinian conflict has always been against American national interests.",Abdullah II of Jordan,Intelligence
"Oprah is so bright, and her intelligence is so piercing that I don't think anyone who spends a few minutes with her isn't struck by that.",Victoria Principal,Intelligence
I did my military service from 1989 - 92 and I was never shot at or had to fire on anybody. I was very lucky. I was more involved in intelligence and counter-intelligence.,Oded Fehr,Intelligence
"In Spain, we should have enough intelligence, enough sense of individual and collective responsibility to do for ourselves that which would be imposed upon us by a dictatorship.",Federica Montseny,Intelligence
"It is only when you watch the dense mass of thousands of ants, crowded together around the Hill, blackening the ground, that you begin to see the whole beast, and now you observe it thinking, planning, calculating. It is an intelligence, a kind of live computer, with crawling bits for its wits.",Lewis Thomas,Intelligence
The accidental causes of science are only accidents relatively to the intelligence of a man.,Chauncey Wright,Intelligence
I'm much better informed than Mr. Clarke ever was about the nature of the intelligence that was available again Osama bin Laden and which was consistently denigrated by himself and Mr. Tenet.,Michael Scheuer,Intelligence
I have great faith in the intelligence of the American viewer and reader to put two and two together and come up with four.,Jim Lehrer,Intelligence
"We are not a country that subscribes to policing any part of the world. The areas we are comfortable with are capacity building, intelligence sharing, exchange of ships, call on each other's ports, joint training and exercises.",Salman Khurshid,Intelligence
"The United States has done more for the war crimes tribunal than any other country in the world. We're turning over all the information we have, including intelligence information.",Warren Christopher,Intelligence
"The 9/11 Commission strongly recommends that the National Intelligence Director be fully in control of the budget, from developing it to implementing it, to ensuring that the National Intelligence Director has the clout to make decisions.",Leonard Boswell,Intelligence
"Alas, nothing reveals man the way war does. Nothing so accentuates in him the beauty and ugliness, the intelligence and foolishness, the brutishness and humanity, the courage and cowardice, the enigma.",Oriana Fallaci,Intelligence
"The Patriot Act removed major legal barriers that prevented the law enforcement, intelligence, and national defense communities from talking and coordinating their work to protect the American people and our national security.",Jon Porter,Intelligence
"I laugh all the time about our investigation, especially about making a fool of David Duke, who likes to think I don't have the intelligence of an ape because he thinks I'm genetically inferior.",Ron Stallworth,Intelligence
Louis Freeh said on national TV that actionable intelligence could have allowed us to stop the hijackings.,Curt Weldon,Intelligence
"The trouble with people like Tony Blair is they get confused, they think intelligence is education when they're two different things.",David Bailey,Intelligence
My intention when I make a film is very clear. I make it for a certain kind of people who have average intelligence - because I am also like that. I have an average sense of humor and an average brain.,Priyadarshan,Intelligence
I certainly believe that improving our intelligence is of important national interest.,Jeff Sessions,Intelligence
"Well, our position, and our chairman has talked about this extensively, is that we had a lot of intelligence prior to 9/11. We knew that two al Qaeda operatives who ultimately participated in the 9/11 disaster were in the United States. We didn't find them.",Richard Ben-Veniste,Intelligence
"Quality in a classical Greek sense is how to live with grace and intelligence, with bravery and mercy.",Theodore White,Intelligence
"Although I do use some of my psychology training in comedy, but it's more like pop psychology, not a course of treatment or anything. To me, it's more like social intelligence.",Matt Walsh,Intelligence
"I try to put all I am as a person into what I do. My intelligence, my emotion. I've done that in everything.",Tom Heinsohn,Intelligence
It is conceded by all that man is the very highest type of all living creatures on the earth. His intelligence is far superior to that of any other earthly being.,Joseph Franklin Rutherford,Intelligence
You don't have to sugar coat things for kids. If you make something for them with intelligence they will show that intelligence in ways that will sometimes shock you.,Alex Hirsch,Intelligence
"Well, I think there's a distinction between sexing-up the intelligence and sexing-up the presentation of the intelligence.",John Major,Intelligence
"While the intelligence profession oftentimes demands secrecy, it is critically important that there be a full and open discourse on intelligence matters with the appropriate elected representatives of the American people.",John O. Brennan,Intelligence
"My father ran London Films. He made films like 'The Red Shoes,' 'The Third Man.' And he had had a long career in the film business, which was bifurcated with a career in intelligence. He had to deal with gangsters, and sometimes he would take me with him. Also, I went to school with their children.",Mark Helprin,Intelligence
"We regard intelligence as man's main characteristic and we know that there is no superiority which intelligence cannot confer on us, no inferiority for which it cannot compensate.",Henri Bergson,Intelligence
"But by providing the background picture - the universal situational awareness that we desire - by showing the anomalies, the Space-Based Radar will change the nature of how we do our analysis and our intelligence.",Stephen Cambone,Intelligence
"I look for kindness, honestly, integrity, intelligence, humor and good values, and of course, a fun, loving guy! And yes, I believe he exists!",Shamita Shetty,Intelligence
It's not just Bin Laden or just those that are involved in the counterterrorism effort. We've gotta cast the net broader than that. But I think it's a - very special tribute that we all owe to the bravery and courage of the men and women in the intelligence and military business who performed so well to finally get it done.,Dick Cheney,Intelligence
A German immersed in any civilization different from his own loses a weight equivalent in volume to the amount of intelligence he displaces.,Jose Bergamin,Intelligence
Human folk are as a matter of fact eager to find intelligence in animals.,Edward Thorndike,Intelligence
Intelligence is enormously sexy.,Frank Langella,Intelligence
"You'll remember Dr. Rice said that several times: It was not a warning about the place and the method and the time - it was a general warning. And that points out the imperfection, if you would, of our intelligence.",Lee H. Hamilton,Intelligence
Most good actors have a huge intelligence about the human condition and a real open heart to different kinds of people and behavior.,Tim Robbins,Intelligence
"Ron Howard is as good a person as you could want to work with on film. He never lost his cool. He's the most easygoing, lovely man, but he's got this enormous intelligence and a wonderful humanity.",Christine Baranski,Intelligence
You can't get closer to the heart of national sovereignty than national security and intelligence services.,Gijs de Vries,Intelligence
"For the several thousands of years before they became firefighters and physicians, women were sirens, enchantresses, snares. At times it seems as if female powerlessness is male self-preservation in disguise. And for millennia, this has made for a zero-sum game: A woman's intelligence was a man's deception.",Stacy Schiff,Intelligence
"To understand a difficult topic like Iraq takes patience and care. Unfortunately, you rarely hear a patient, careful or thoughtful discussion of intelligence these days.",George Tenet,Intelligence
Artificial intelligence... I've been following that since I was in high school.,Paul Allen,Intelligence
I do not - I never believed it's better to kill a terrorist than to detain him. We want to detain as many terrorists as possible so we can elicit the intelligence from them in the appropriate manner so that we can disrupt follow-on terrorist attacks.,John O. Brennan,Intelligence
"I was an intelligence officer, not a policy-maker.",Cofer Black,Intelligence
A great many people think that polysyllables are a sign of intelligence.,Barbara Walters,Intelligence
I think America has more than enough maturity and intelligence to start exercising its world leadership responsibly.,Cristina Kirchner,Intelligence
"Job plunges into a series of demands on and accusations of God which may be and indeed are epigrams of high intelligence, but are not noticeably patient.",Charles Williams,Intelligence
We are moving towards a new form of collective intelligence.,Jane McGonigal,Intelligence
"I have this assemblage of small facts, which looks like intelligence but no real depth of knowledge about anything. That's why I'm an actor.",Wayne Knight,Intelligence
A chief of station is the head of all intelligence operations in any given country.,Valerie Plame,Intelligence
People's intelligence tends to be in inverse proportion to their number. People don't tend to get smarter as they get into bigger groups.,Robyn Hitchcock,Intelligence
But the same intelligence compels Germany to practise the same policy.,Pierre Laval,Intelligence
"The Clinton White House today said they would start to give national security and intelligence briefings to George Bush. I don't know how well this is working out. Today after the first one Bush said, 'I've got one question: What color is the red phone?'",Bill Maher,Intelligence
"I had been involved in U.S. intelligence in Berlin, Germany, while in the military and had worked with a contact with the Central Intelligence Agency office there.",George J. Mitchell,Intelligence
The history of the intelligence community is replete with violations of the trust of the American people.,James Clapper,Intelligence
I never threatened him and no Syrian intelligence officer has ever pointed a gun to his head.,Rafik Hariri,Intelligence
I absolutely don't think a sentient artificial intelligence is going to wage war against the human species.,Daniel H. Wilson,Intelligence
"We must develop as quickly as possible technologies that make possible a direct connection between brain and computer, so that artificial brains contribute to human intelligence rather than opposing it.",Stephen Hawking,Intelligence
"I don't deny that there are problems in the intelligence world, but I would argue that in the UK we try to uphold the highest standards in the world.",William Hague,Intelligence
I love comedy. I love the absurdity of it. I love the kind of intelligence that's required to be dumb in comedy.,Craig Mazin,Intelligence
"American political elites feel very empowered to criticize the American intelligence community for not doing enough when they feel in danger, and as soon as we've made them feel safe again, they feel equally empowered to complain that we're doing too much.",Michael Hayden,Intelligence
"I also believe that it is time to begin the fundamental analysis of how we got here, what led us here and what we need to do in order to ensure that we are equipped with the best possible intelligence as we face these issues in the future.",David Kay,Intelligence
"If you were to get a seminar in MMA, I think you'd want one from me over Mark Hunt. I'm more efficient and my understanding of the art is deeper, and I'm still only growing in terms of my intelligence in combat.",Frank Mir,Intelligence
"Well, first of all, we did lots of studies where we show practical intelligence doesn't correlate with G. We have probably two dozen studies that practical intelligence better predicts job success than IQ.",Robert Sternberg,Intelligence
We cannot blindly pursue the goal of machine intelligence without pondering its consequences.,Moshe Vardi,Intelligence
"I don't underestimate audiences' intelligence. Audiences are much brighter than media gives them credit for. When people went to a movie once a week in the 1930s and that was their only exposure to media, you were required to do a different grammar.",Michael Mann,Intelligence
You can't come forward against the world's most powerful intelligence agencies and be completely free from risk.,Edward Snowden,Intelligence
"An aria in an opera - Handel's 'Ombra mai fu,' for example - gets along with an incredibly small number of words and ideas and a large amount of variation and repetition. That's the beauty of it. It's not taxing to the listener's intelligence because if you haven't heard it the first time round, it'll come around again.",James Fenton,Intelligence
"Lincoln's stature and strength, his intelligence and ambition - in short, all the elements which gave him popularity among men in New Salem, rendered him equally attractive to the fair sex of that village.",John George Nicolay,Intelligence
"You have multiple intelligence agencies. They all ultimately report to the director of national intelligence but, you know, it never comes in neat packages. So you have to make judgments on what you have, and it's not easy to do.",Raymond Kelly,Intelligence
"The National Intelligence Director needs the authority to do the job we are asking him to do. That means power over the intelligence budget. And to be effective, to be allowed to do his or her job, they must have authority over the budget.",Leonard Boswell,Intelligence
"Well look, CIA is an agency that has to collect intelligence, do operations. We have to take risks and it's important that we take risks and that we know that we have the support of the government and we have the support of the American people in what we're doing.",Leon Panetta,Intelligence
"Collecting intelligence information is like trying to drink water out of a fire hydrant. You know, in hindsight It's great. The problem is there's a million dots at the time.",Louis Freeh,Intelligence
"Prediction is not just one of the things your brain does. It is the primary function of the neo-cortex, and the foundation of intelligence.",Jeff Hawkins,Intelligence
"Within thirty years, we will have the technological means to create superhuman intelligence.",Vernor Vinge,Intelligence
The measure of and self-congratulation for our own intelligence should have its basis in our moral behavior as well as our smarts.,April Gornik,Intelligence
"The right of each individual in any relation to secure to himself the full benefits of his intelligence, his capacity, his industry and skill are among the inalienable inheritances of humanity.",Leland Stanford,Intelligence
"Before 9/11 there were weak procedures, willingness, and mechanisms for communicating among agencies for foreign intelligence and the FBI with its focus on law enforcement. The domestic-vs.-foreign barrier has been solved by the reforms after 9/11 that established the DNI.",Dennis C. Blair,Intelligence
"If a brain is exercised properly, anyone can grow intelligence, at any age, and potentially by a lot. Or you can just let your brain idle - and watch it slowly, inexorably, go to seed like a sedentary body.",Michael Merzenich,Intelligence
"One of the great intellectual failures of the American intelligence community, and especially the counterterrorism community, is to assume if someone hasn't attacked us, it's because he can't or because we've defeated him.",Michael Scheuer,Intelligence
"The Committee's review of a series of intelligence shortcomings, to include intelligence prior to 9/11 and the pre-war intelligence on Iraq, clearly reveal how vital a diverse intelligence workforce is to our national security.",Jane Harman,Intelligence
"I became interested in AI in high school because I read 'Goedel, Escher, Bach,' a book by Douglas Hofstader. He showed how all their work in some ways fit together, and he talked about artificial intelligence. I thought 'Wow, this is what I want to be doing.'",Oren Etzioni,Intelligence
"The close Turkish-Israeli relations go back to the late 1950s - military intelligence, commercial, more recently, tourism and cultural relations.",Noam Chomsky,Intelligence
In our society those who are in reality superior in intelligence can be accepted by their fellows only if they pretend they are not.,Marya Mannes,Intelligence
Intelligence we gathered at the time indicated that this was in fact leadership and we struck the leadership.,Peter Pace,Intelligence
"Making use of human weaknesses in intelligence work is a logical matter. It keeps coming up, and of course you try to look at all the aspects that interest you in a human being.",Markus Wolf,Intelligence
"The intelligence community, for the most part, has no accountability at all; to the Congress, to us the American people, and so they feel that they above the law.",Gloria Naylor,Intelligence
"It is difficult, if not impossible, to argue that laws written in the 1970s are adequate for today's intelligence challenges.",Bob Barr,Intelligence
"A lot of the time, you're supposed to play to the top of your intelligence, as truthful as possible. But when you're on stage making people laugh, you're still acting. I think it helped me a bunch to go on stage two or three times a week.",Ben Schwartz,Intelligence
"In the so-called age of girl power, we have failed to cut loose our most regressive standards of female success - like pleasing others and looking sexy - and to replace them with something more progressive - like valuing intelligence and hard work.",Rachel Simmons,Intelligence
"We are proactively training and upscaling thousands of people in key areas such as cloud, artificial intelligence, and robotics.",Pierre Nanterme,Intelligence
"My biggest turn-on has to be brains, intelligence.",Liz Vassey,Intelligence
"When we see animals doing remarkable things, how do we know if we're simply seeing tricks or signs of real intelligence? Are talented animals just obeying commands, or do they have some kind of deeper understanding? One of the biggest challenges for animal researchers is to come up with tests that can distinguish between the two.",Neil deGrasse Tyson,Intelligence
"The only path to build intelligent machines is to enable it with powerful visual intelligence, just like what animals did in evolution.",Fei-Fei Li,Intelligence
"Advertising must respect the intelligence of its audience and if it does not prompt them to think, it will be instantly dismissed.",Maurice Saatchi,Intelligence
"I've always been fascinated by intelligence and how our brains work, and how they can be improved.",Clare Balding,Intelligence
"We have been working hard to think about what our combined needs are going to be in the way of intelligence capabilities, not today but 15 to 20 years in the future.",Stephen Cambone,Intelligence
"I want to improve TSA's counterterrorism focus through intelligence and cutting edge technology, support the TSA workforce, and strengthen the agency's relationships with stakeholders and the traveling public. All of these priorities are interconnected and are vital to TSA's mission - and I would say, all of our collective mission.",John Pistole,Intelligence
"Of course it is a very simple matter to identify genes which might modify intelligence or memory and start thinking about whether you want to enhance a human, and the next generation is going to have to deal with that issue. Should we be trying to enhance humans rather than trying to educate them and so on?",Robert Winston,Intelligence
Elia Kazan understood my problems. He was able to bring out the very best in me. He gave me credit for my intelligence.,Ethel Waters,Intelligence
"In other cases, when the medium becomes entranced, the demonstration of a communicator's separate intelligence may become stronger and the sophistication less.",Oliver Joseph Lodge,Intelligence
"There is no question that creative intelligence comes not through learning things you find in books or histories that have already been written, but by focusing on and giving value to experience as it happens.",Antony Gormley,Intelligence
"They say military have the so-called 'secret intelligence' - this amount of intelligence must be very secret, since I've never seen any intelligent military person, nor I have seen any sense in the bloody stupid wars.",Ozzy Osbourne,Intelligence
"If you look at the publishers I've worked with, generally, they're a great bunch. Creation is unlike any other publishing house you can think of. The people I've worked with have integrity and intelligence and, almost always, less money than ideas.",Peter Sotos,Intelligence
"Black girls are punished, many times violently so, for questioning and challenging authority, which is something that is often celebrated and encouraged as a sign of intelligence and critical thinking in white boys.",Kimberle Williams Crenshaw,Intelligence
"I think for leadership positions, emotional intelligence is more important than cognitive intelligence. People with emotional intelligence usually have a lot of cognitive intelligence, but that's not always true the other way around.",John Mackey,Intelligence
"Not all intelligence can be artificial now, so if we make a mistake, the consequences are no longer simply located within an institution or a national culture.",William Irwin Thompson,Intelligence
I feel audiences are not given enough credit for their intelligence.,Tony Goldwyn,Intelligence
There are a lot of obstacles in the way of our understanding animal intelligence - not the least being that we can't even agree whether nonhuman species are conscious. We accept that chimps and dolphins experience awareness; we like to think dogs and cats do. But what about mice and newts? What about a fly? Is anything going on there at all?,Jeffrey Kluger,Intelligence
"People are very ready to criticize other people's accents. There's no correlation between accents and intelligence or accents and criminality, but people do make judgments.",David Crystal,Intelligence
The plan we developed to deal with al Qaeda depended on developing sources of human and technical intelligence that could give us insights into his plans at the tactical level. This is easy to say but hard to accomplish.,Cofer Black,Intelligence
Perhaps measuring animal intelligence by comparing it to human intelligence isn't the best litmus test.,Ingrid Newkirk,Intelligence
The object of pure physics is the unfolding of the laws of the intelligible world; the object of pure mathematics that of unfolding the laws of human intelligence.,James Joseph Sylvester,Intelligence
We can no longer expect an Intelligence Community that is mostly male and mostly white to be able to monitor and infiltrate suspicious organizations or terrorist groups.,Jane Harman,Intelligence
"The intelligence investigation under the leadership of Senator Church, which I know has helped cause this investigation by you, points out that the agencies did not disclose certain facts to us and that certain plots were going on.",John Sherman Cooper,Intelligence
Too many problem-solving sessions become battlegrounds where decisions are made based on power rather than intelligence.,Margaret J. Wheatley,Intelligence
"The Intelligence Committee will also examine present counterintelligence programs for the Department of Energy, the National Laboratories, and the Department of Defense.",Charles Bass,Intelligence
The exact measure of the progress of civilization is the degree in which the intelligence of the common mind has prevailed over wealth and brute force.,George Bancroft,Intelligence
"In the future, I think it's pretty plausible that collective intelligence tools and skills will be important in order to be a part of global dialog, global business, and global creativity. People who know how to negotiate collective intelligence networks are going to be in a good position to contribute to global society.",Jane McGonigal,Intelligence
"Intelligence alone does not get us where we need to go or even necessarily where we want to go. For that, the human creature must exercise harder-won capacities of wisdom, and wise action.",Krista Tippett,Intelligence
"I've gotten to go wonderful places, meet interesting and intelligent people, and I started of course in the theatre and continue to work in the theatre where there is some intelligence involved in it.",Jeffrey Jones,Intelligence
"In November, they transferred control of Abu Ghraib to the military intelligence command completely; it was, after all, the center for interrogations for Iraq.",Janis Karpinski,Intelligence
"I have met with some of them - very honest fellows, who, with all their stupidity, had a kind of intelligence and an upright good sense, which cannot be the characteristics of fools.",Giacomo Casanova,Intelligence
"I will not, nor will I ever, publicly divulge sensitive intelligence sources and methods. For when that happens, our national security is endangered and lives can be lost.",John O. Brennan,Intelligence
