quotes,authors,categories
"As beavers build dams and bees build hives, human beings have spears. Or take the high intelligence of human beings, the ability to make plans, to transmit information - that was also there before, but that, together with the tools, was not enough to make man special.",Yuval Noah Harari,Intelligence
"God does not require you to follow His leadings on blind trust. Behold the evidence of an invisible intelligence pervading everything, even your own mind and body.",Raymond Holliwell,Intelligence
"We will have to continue to improve our human intelligence system-something that was, unfortunately, lacking in the years which led up to September 11. This is going to be a continuing process of change.",John Sununu,Intelligence
"I can tell you, all the intelligence services in the world were running my name through their databases to see did anyone by this name come in the country? When? Do we know anything about it? Where did she stay? Who did she see?",Valerie Plame,Intelligence
"It takes intelligence to make real comedy, and it takes a reality base to create all that little stuff I like to do that makes you giggle inside.",Chris Tucker,Intelligence
The employer class is less indispensable in the modern organization of industries because the laboring men themselves possess sufficient intelligence to organize into co-operative relation and enjoy the entire benefits of their own labor.,Leland Stanford,Intelligence
I think there can be a positive sort of futurism even in a presentist society. But I think it's a kind of futurism that envisions augmenting human ability and intellect rather than creating some artificial machine intelligence that displaces us.,Douglas Rushkoff,Intelligence
"In the fight against terrorism, national agencies keep full control over their police forces, security and intelligence agencies and judicial authorities.",Gijs de Vries,Intelligence
"My experience is the White House is not a very good place to coordinate intelligence, much less to integrate it.",Dennis C. Blair,Intelligence
"I sought Ben Affleck because I needed an everyman for this role. Ben appeals to men and women. He gives you a sense of intelligence, the notion of a guy who can think on his feet.",John Frankenheimer,Intelligence
"No man likes to have his intelligence or good faith questioned, especially if he has doubts about it himself.",Henry Adams,Intelligence
"Character robotics could plant the seed for robots that actually have empathy. So, if they achieve human level intelligence or, quite possibly, greater than human levels of intelligence, this could be the seeds of hope for our future.",David Hanson,Intelligence
"We know that there are unaccounted-for Scud and other ballistic missiles in Iraq. And part of the problem is that, since 1998, there has been no way to even get minimal information about those programs except through intelligence means.",Condoleezza Rice,Intelligence
"Daniel Goleman has proven that two-thirds of the success in business is based upon our Emotional Intelligence as opposed to our IQ or our level of experience. As we look for the next crop of future CEOs, maybe it's time for America's corporations to start interviewing grads from the psychology master's programs rather than the M.B.A. programs.",Chip Conley,Intelligence
Terrorists continue to exploit divisions between law enforcement and the intelligence communities that limit the sharing of vital counterterrorism information.,Jim Sensenbrenner,Intelligence
"Yes; we have a specific procedure which we follow in all cases where the Agency is in contact, for the purposes of acquiring intelligence or whatever the case may be, with an individual.",Richard Helms,Intelligence
"Legislation passed in the aftermath of September 11, 2001 enhanced our intelligence capabilities and strengthened our national defense, but until now our nation's immigration policies have not adapted to the needs of a post-September 11th world.",Chris Chocola,Intelligence
"We have three centers: the emotional center, the intellectual center, and the physical body center. Each one of them has its own intelligence. How much better would we be if all three were working in unison?",Erin Gray,Intelligence
Could it be that all those reports coming from our own intelligence that Bush ignored was right all along? Could it be that the UN was right all along?,Peter Schuyler,Intelligence
"I combine magic and science to create illusions. I work with new media and interactive technologies, things like artificial intelligence or computer vision, and integrate them in my magic.",Marco Tempest,Intelligence
"Growing up with dyslexia and struggling in the classroom because of it, I know how infuriating and frustrating it can be to be treated wrongly as though you're of below par intelligence.",Toyah Willcox,Intelligence
"Among many other things, a smartphone functions as a handheld digital sensor for the physical world. In other words, we don't necessarily need our real world things to be directly connected, when the Web interface in our mobile devices provides the network access and intelligence.",Andy Hobsbawm,Intelligence
"The 'Robben Island Bible' has arrived at the British Museum. It's a garish thing, its cover plastered with pink and gold Hindu images, designed to hide its contents. Within is the finest collection of words generated by human intelligence: the complete works of William Shakespeare.",Daniel Hannan,Intelligence
"I've always chosen my band members based on their sense of humor. It might sound stupid, but it means not only are they fun to live with on a tour bus for years, but humor implies intelligence.",Kristin Hersh,Intelligence
"The 21st century - and the atheists - needs the presence of religion, just as religion must deal with the real challenges and the thinkers of the day in order to sharpen the conscience and the intelligence of those who study the timeless sacred texts in a spirit of responding to the questions of their time.",Tariq Ramadan,Intelligence
"Others can challenge and motivate us, but we must reach down deep into our souls and call forth our God-given intelligence and capabilities. We cannot do this when we depend on the efforts of someone else.",James E. Faust,Intelligence
"The popular dystopian vision of AI is wrong for one simple reason: it equates intelligence with autonomy. That is, it assumes a smart computer will create its own goals and have its own will and will use its faster processing abilities and deep databases to beat humans at their own game.",Oren Etzioni,Intelligence
"When I went on to write my next book, Working With Emotional Intelligence, I wanted to make a business case that the best performers were those people strong in these skills.",Daniel Goleman,Intelligence
"For some, the very act of intelligence gathering seems illegitimate when applied to the crime of terrorism.",Raymond Kelly,Intelligence
I never think of myself as wise. I think of myself as possessing a critical intelligence which I intend to allow to operate.,Harold Pinter,Intelligence
There is no such thing as an underestimate of average intelligence.,Henry Adams,Intelligence
"When a decision is made to go to war based on intelligence, it is a fateful decision. It has ramifications and impacts way beyond the current months and years.",Carl Levin,Intelligence
There's some way in which we would prefer not to see very clearly the immense gifts and intelligence of some of the people who live in our most abject conditions. Maybe there are some things at work in deciding who gets to be society's winners and who gets to be society's losers that don't have to do with merit.,Katherine Boo,Intelligence
The ability to take pleasure in one's life is a skill and is a kind of intelligence. So intelligence is a hard thing to evaluate and it manifests itself in so many different ways. I do think the ability to know how to live a life and not be miserable is a sign of that.,Todd Solondz,Intelligence
To lack intelligence is to be in the ring blindfolded.,David M. Shoup,Intelligence
"We will strengthen our security by building missile defense, restoring our military might, and standing by and strengthening our intelligence officers.",Mitt Romney,Intelligence
"There is no part of the executive branch that more exists on the outer edge of executive prerogative than the American intelligence community - the intelligence community, CIA, covert action. My literal responsibility as director of CIA with regard to covert action was to inform the Congress - not to seek their approval, to inform.",Michael Hayden,Intelligence
"Our intelligence community needs better coordination of operations and exchange of information, and that's why we need an overall director of national intelligence and a national counterterrorism center.",Jim Ramstad,Intelligence
"I do not want to go into its physical reasons: the construction of the human body is different from that of carnivorous animals. But man's intelligence is such that it can be utilised to defend any-thing he does, whether right or wrong.",Morarji Desai,Intelligence
"I feel that I, and the people under my command, tried to use all the traditional methods of recruiting agents which were also used by other intelligence services; adopting also means like pressure, money, sex - but that did not characterize my service.",Markus Wolf,Intelligence
"I'm the chairman of the intelligence committee. We don't only get formal briefings, but we collect our information from the intelligence community in a variety of ways.",Mike Rogers,Intelligence
"I can remember when I was National Security Adviser, the intelligence community told us... they put out an intelligence report saying that Iran would never back off from attacks on shipping in the Gulf if we use force.",Frank Carlucci,Intelligence
"It is by developing the individual that he is prepared for that wonderful manifestation of the human intelligence, which drawing constitutes. The ability to see reality in form, in color, in proportion, to be master of the movements of one's own hand - that is what is necessary.",Maria Montessori,Intelligence
"I am sure that in Canada the people appreciate this principle, and the general intelligence which prevails over that country is such that I am sure there is no danger of a reactionary policy ever finding a response in the hearts of any considerable number of our people.",Alexander Mackenzie,Intelligence
"Counterintelligence is, in effect, chasing ghosts, which is why the tools used to investigate foreign intelligence activity are secret, like human sources or electronic surveillance.",Asha Rangappa,Intelligence
The qualities I am looking for in Miss Right are intelligence and humour.,Brendan Coyle,Intelligence
There is a real danger that computers will develop intelligence and take over. We urgently need to develop direct connections to the brain so that computers can add to human intelligence rather than be in opposition.,Stephen Hawking,Intelligence
"I wrote 'The Spy Who Came in from the Cold' at the age of 30 under intense, unshared personal stress and in extreme privacy. As an intelligence officer in the guise of a junior diplomat at the British Embassy in Bonn, I was a secret to my colleagues, and much of the time to myself.",John le Carre,Intelligence
For 13 to be unlucky would require there to be some kind of cosmic intelligence that counts things that humans count and that also makes certain things happen on certain dates or in certain places according to whether the number 13 'is involved' or not (whatever 'is involved' might mean).,Douglas Hofstadter,Intelligence
"When Russia's intelligence agencies obtained some of the National Security Agency's secrets about its own cyberweapons, it appeared to do so by manipulating a virus protection program sold by Kaspersky, a Russian firm.",David E. Sanger,Intelligence
"Deep learning is a subfield of machine learning, which is a vibrant research area in artificial intelligence, or AI.",Oren Etzioni,Intelligence
Police can only act on intelligence.,P. Chidambaram,Intelligence
"I use a lot of different words for God - infinite intelligence, primordial, perfection or universal creativity. All of these, to me, are God. And 'God' is a word, I think, that some people feel uncomfortable with, so they can use another word, you know? It's the great mystery.",Alex Grey,Intelligence
"Strange indeed would it be if all the space around us be empty, mere waste void, and the inhabitants of Earth the only forms in which intelligence could clothe itself.",Annie Besant,Intelligence
"Regarding Wikileaks, I have profound ambivalent feelings about it. I am a firm believer in a strong intelligence service. There's a need for classified information.",Valerie Plame,Intelligence
We worked to develop our own operations to advance U.S. counterterrorism objectives by penetrating terrorist safe havens and collecting intelligence that would inform policy and enable our own operations.,Cofer Black,Intelligence
"The iPhone is made on a global scale, and it blends computers, the Internet, communications, and artificial intelligence in one blockbuster, game-changing innovation. It reflects so many of the things that our contemporary world is good at - indeed, great at.",Tyler Cowen,Intelligence
"I know from my own experience that there is much more to 'intelligence' than an IQ number. In fact, I hesitate to believe that any system could really reflect the complexity and uniqueness of one person's mind, or meaningfully describe the nature of his or her potential.",Daniel Tammet,Intelligence
"I always felt the 'X-Men,' in a subtle way, often touched upon the subject of racism and inequality, and I believe that subject has come up in other titles, too. But we would never pound hard on the subject, which must be handled with care and intelligence.",Stan Lee,Intelligence
"It is a curious thing: man, the centre and creator of all science, is the only object which our science has not yet succeeded in including in a homogeneous representation of the universe. We know the history of his bones, but no ordered place has yet been found in nature for his reflective intelligence.",Pierre Teilhard de Chardin,Intelligence
"If you look back today over the last 25 years, it is a fact that we have had a progressive degeneration of our intelligence community in general; in particular in the field of human intelligence.",Paul Bremer,Intelligence
"To young people born under the weird planet of the SAT, intelligence was equated with agility, with raw acuity. It produced a certain sort of person of which I was a typical specimen: the mental contortionist, able to rise to almost every challenge placed before him, except the challenge of real self-knowledge.",Walter Kirn,Intelligence
"The intelligence of the lower forms of animal life, like a great deal of human intelligence, does not involve a self.",George Herbert Mead,Intelligence
"Intuition enlightens and so links up with pure thought. They together become an intelligence which is not simply of the brain, which does not calculate, but feels and thinks.",Piet Mondrian,Intelligence
"In archaeology, context is the basis of many discoveries that are imputed to the deliberate workings of intelligence. If I find a rock chipped in such a way as to give it a sharp edge, and the discovery is made in a cave, I am seduced into ascribing this to tool use by distant, fetid and furry ancestors.",Seth Shostak,Intelligence
"Smart vacations lead to greater happiness and energy at work and, therefore, greater productivity, intelligence, and resilience.",Shawn Achor,Intelligence
I now bid farewell to the country of my birth - of my passions - of my death; a country whose misfortunes have invoked my sympathies - whose factions I sought to quell - whose intelligence I prompted to a lofty aim - whose freedom has been my fatal dream.,Thomas Francis Meagher,Intelligence
"There's a lot of neuroscience now raising the question, 'Is all the intelligence in the human body in the brain?', and they're finding out that, no, it's not like that. The body has intelligence itself, and we're much more of an organic creature in that way.",Joel Kinnaman,Intelligence
"Which, autocracy or democracy, is really better suited to modern China? If we base our judgment upon the intelligence and the ability of the Chinese people, we come to the conclusion that the sovereignty of the people would be far more suitable for us.",Sun Yat-sen,Intelligence
"One is to ensure that the war fighters and the intelligence analysts get the information that they need when they need it, in a format that's useful to them.",Stephen Cambone,Intelligence
Intelligence augmentation decreases the need for specialization and increases participatory complexity.,Jamais Cascio,Intelligence
"Intelligence is the ability to solve problems, whereas consciousness is the ability to feel things such as pain, joy, love, and anger. Throughout history, intelligence always went hand in hand with consciousness.",Yuval Noah Harari,Intelligence
Truth knows no color; it appeals to intelligence.,James Hal Cone,Intelligence
"I love my career. I thought, if I was lucky, I would retire as a senior intelligence officer, still working on the issues of counterproliferation. But that didn't happen, so - new chapter.",Valerie Plame,Intelligence
"One may have broad or narrow talents, but only education renders them useful. Schools set up to train people will develop the intelligence of those who have it and end the stupidity of those who do not, providing a specialty to those who have narrow talent and broad knowledge to those with all-around ability.",Sun Yat-sen,Intelligence
"I think that AI will lead to a low cost and better quality life for millions of people. Like electricity, it's a possibility to build a wonderful society. Also, right now, I don't see a clear path for AI to surpass human-level intelligence.",Andrew Ng,Intelligence
People have taught me not to look for intelligence in rockmusic.,Andrew Eldritch,Intelligence
Everybody has a hacking capability. And probably every intelligence service is hacking in the territory of other countries. But who exactly does what? That would be a very sensitive piece of information. But it's very difficult to communicate about it. Because nobody wants to admit the scope of what they're doing.,Henry Kissinger,Intelligence
"All of our intelligence agencies, our Department of Defense, are all working to meet this threat. But it's a fast moving world; it's a place where offense is easier than defense, and keeping up with the next innovation in cyber-warfare is an enormous challenge.",Mike Pompeo,Intelligence
I know from personal experience that the abuse of prisoners will produce more bad than good intelligence.,John McCain,Intelligence
"Nerds... the 'nerd' has never been precisely defined, thanks to the psychological complexity of the creature. The word has connotations of some level of intelligence. The typical nerd is a male with intelligence but no sense of giving it a manly face.",Tom Wolfe,Intelligence
"When our governments want to sell us a course of action, they do it by making sure it's the only thing on the agenda, the only thing everyone's talking about. And they pre-load the ensuing discussion with highly selected images, devious and prejudicial language, dubious linkages, weak or false 'intelligence' and selected 'leaks.'",Brian Eno,Intelligence
"What interests me is whatever it is that allows the heart to continue to yearn for something the intelligence knows is impossible to have: a lost love, a shelter from life's blows, the return of a time past, even a connection to the dead.",Alice McDermott,Intelligence
"Fluid intelligence is not a Big Five personality trait: It's a measurement of one's ability to rapidly learn and apply a rule set. As an entrepreneur, you're rapidly dealing with different issues, and your ability to switch from one issue to another is very important.",Adeo Ressi,Intelligence
"Physics is a hobby of mine, as much as a person of limited intelligence can understand physics.",Arthur D. Levinson,Intelligence
"Certainly, if we had not invaded Iraq on intelligence that was clearly manipulated and cherry picked, we would be in a different position today.",Valerie Plame,Intelligence
I work for the British people. I do not gather intelligence so the government can lie to the British people.,Katharine Gun,Intelligence
"Understanding of natural language is what sometimes is called 'AI complete,' meaning if you can really do that, you can probably solve artificial intelligence.",Oren Etzioni,Intelligence
"Over the course of two years, we arrived at a point where we began to look at the value added by making information more easily accessible across the intelligence community, both defense and national.",Stephen Cambone,Intelligence
We work with the Mexican authorities. We have our own intelligence architecture. And we are aware of the involvement of smuggling organizations in irregular migration and the misinformation that they disseminate to vulnerable populations.,Alejandro Mayorkas,Intelligence
"Many openly show discontentment with their looks, but few with their intelligence. I, however, assure you there are many more plain minds than faces.",Bryant H. McGill,Intelligence
"In a poem, the words happen; they just come. I let them. Otherwise, I wouldn't write. To interfere with what is happening is to distort the poem. Just a very small degree of intelligence and supervision is necessary. Very tactful. Any revision later that violates the text as it came, that begins rewriting the words, is fake.",Louis Dudek,Intelligence
"I need to add that my work on multiple intelligences received a huge boost in 1995 when Daniel Goleman published his book on emotional intelligence. I am often confused with Dan. Initially, though Dan and I are longtime friends, this confusion irritated me.",Howard Gardner,Intelligence
"Prior to the passage of the Patriot Act, it was very difficult - often impossible - for us to share information with the Central Intelligence Agency, with NSA, with the other intelligence agencies, and likewise, for them to share information with us.",Robert Mueller,Intelligence
"When I think about strong innovations in term of automation, robotics, cognitive computing, and artificial intelligence, they are coming a lot from the Philippines and from India as well.",Pierre Nanterme,Intelligence
"It should tell you something that Pakistan's Inter-Services Intelligence (ISI) agency invented the Taliban in the early 1990s only because Hekmatyar, its primary U.S.-bankrolled proxy in the war for control of Afghanistan, had proved too bloodthirsty after the Soviets withdrew, even by the low standards of the ISI's ghastly generals in Rawalpindi.",Terry Glavin,Intelligence
"With respect to Iraq, I did favour the continuity of American forces to work with the new Maliki government. They had enormous needs for intelligence, for training on everything from airplanes to more sophisticated ground equipment and the like.",Hillary Clinton,Intelligence
Music is an art that expresses the inexpressible. It rises far above what words can mean or the intelligence define. Its domain is the imponderable and impalpable land of the unconscious.,Charles Munch,Intelligence
I think anybody with any intelligence sits down and sees Star Trek not a kids' show.,Nichelle Nichols,Intelligence
"Blessed with intelligence, beauty and undeniable talent, Vidya Balan can work wonders if she receives the right script and a sensible director.",Waheeda Rehman,Intelligence
"Why have I been chosen to deliver the message of female intelligence and its divinity to a deaf world of males? I have asked my god that question and She answered, 'Hey, why not you Roseanne?' Indeed, why not each of us?",Roseanne Barr,Intelligence
I'm not going to argue with people about the existence of God. I have not the vaguest idea of whether the universe was created by an intelligence.,Leonard Susskind,Intelligence
Emotion is often what we rely upon to carry us across the unfathomable voids in our intelligence.,Bryant H. McGill,Intelligence
"We have no regulation of drones in the United States in their commercial use. You can see drones some day hovering over the homes of Hollywood luminaries, violating privacy. This question has to be addressed. And we need rules of operation on the border, by police, by commercial use, and also by military and intelligence use.",Dianne Feinstein,Intelligence
"I think there's a supreme power behind the whole thing, an intelligence. Look at all of the instincts of nature, both animals and plants, the very ingenious ways they survive. If you cut yourself, you don't have to think about it.",Clyde Tombaugh,Intelligence
"Genomics, Artificial Intelligence, and Deep Machine learning technologies are helping practitioners deliver better diagnosis and actually freeing up time for patient interaction.",Frans van Houten,Intelligence
"Cultures are never merely intellectual constructs. They take form through the collective intelligence and memory, through a commonly held psychology and emotions, through spiritual and artistic communion.",Tariq Ramadan,Intelligence
"Some of our best and unexpected discoveries have been born out of crises - from the Second World War, for example, came Alan Turing's decoding machine, widely considered as the precursor to modern day computers and artificial intelligence.",Alok Sharma,Intelligence
"Reputation is favorable notoriety as distinguished from fame, which is permanent approval of great deeds and noble thoughts by the best intelligence of mankind.",George William Curtis,Intelligence
