quotes,authors,categories
"I don't believe in regretting - one should try to move on. My mum was good at that. She was deeply in love with my father, and he died when I was nine. She remarried, and her second husband died, too. I saw the grieving process she went through. My mother had this way of moving on. It was a fine trait.",Robert Winston,Moving On
"All of the sports have a safety net, but boxing is the only sport that has none. So when the fighter is through, he is through. While he was fighting his management was very excited for him, but now that he is done, that management team is moving on.",Gerry Cooney,Moving On
"I'm moving on in years, but I tell you I still want to kick the devil before I kick the bucket.",Reinhard Bonnke,Moving On
"I'm moving on. I should have made that clear when I made the announcement. I guess I wasn't clear. If people think you're leaving a show after all these years, you might be retiring. So I understand where they're coming from, but I should have impressed the fact that I hope I'm just moving on right now.",Regis Philbin,Moving On
Part of the game is moving on. And you do.,Chris Hughton,Moving On
"Many of us are experiencing a phase of change, shedding outdated patterns and liberating ourselves from the old by moving on to the new. The year 2012 is an important one for mankind, a pivotal year. The potential for this exists in the mere fact that the majority of us are yearning for change.",Shari Arison,Moving On
"All kids of all races need to understand, not just about black history but their own history. It's something that will help you in the future, just in terms of moving on in life, understanding the things your ancestors had to go through.",Andre Gray,Moving On
"As far as friendships go, things change even without the fame. People start moving on. I have a few friends that are married and are starting to have kids and I'm like, 'Oh my goodness gracious - that's so insane.' I also have friends who are just doing their own thing, which is cool.",Jordin Sparks,Moving On
"Many movies about people recovering, moving on, and redeeming themselves are really wonderful and inspiring. But I think the more sentimental ones that are less good make me feel isolated - like, if you can't pull yourself up by your bootstraps like the guys in the movies, there is something wrong with you. That's a shame.",Kenneth Lonergan,Moving On
"I don't think God said we should all be soft. My job is to compete, and the best prevails. I will continue to play, and that's the way I'm succeeding in my life. If I hit you by mistake, all I can say is 'I'm sorry,' and I keep moving on.",Dikembe Mutombo,Moving On
"Moving on' is a concept invented by Housewives. Housewives who behave so appallingly all they can do is say they are moving on, preferably in a place where everyone can hear them. To stay put and acknowledge that their actions have consequences and to accept responsibility is simply too painful for this particular brand of narcissist.",Carole Radziwill,Moving On
"It is very clear that voice communications is moving on to the Internet. In the end, the price that anyone can provide for voice transmission on the Net will trend toward zero.",Meg Whitman,Moving On
"I started my career at the Wall Street Journal, before moving on to CNBC and NBC.",Martha MacCallum,Moving On
"I love to fight, and I'm looking forward to being back in the ring, getting the victory, and moving on to challenge for the World Heavyweight title.",Dillian Whyte,Moving On
"In the theater, it's about taking time in a musical segment, a pause in a musical way and then moving on.",Marcia Gay Harden,Moving On
"I could be shooting myself in the foot, but in some ways, I feel I've said all I've needed to say when to comes to, say, the 'X-Men.' I think I've hit the bright points, I think I've hit what I wanted to hit, and I can be happy moving on doing other things.",Marjorie Liu,Moving On
"We are also fortunate in being in quite a sheltered environment, in terms of people moving on to do other things, because there are relatively few companies in Scotland that are looking for the skill set that we've developed.",David Milne,Moving On
"With more than 67 percent of the Nation's freight moving on highways, economists believe that our ability to compete internationally is tied to the quality of our infrastructure.",Dennis Hastert,Moving On
I can see that if this was an album done 10 or 15 years ago we could see we were moving on to some place else.,Wayne Coyne,Moving On
"If it were the Clinton people, they'd be sitting around figuring out how to pull themselves out. Instead the president is continuing to go around the country and peddling Social Security, which the needle is not moving on.",Gwen Ifill,Moving On
"I can tell you one thing, Iran is closer to developing nuclear weapons today than it was a week ago, or a month ago or a year ago. It's just moving on with its efforts.",Benjamin Netanyahu,Moving On
"But you know, if you live an affluent lifestyle, there are all types of trappings that are there that you have to be cognizant of, and you've got to try and communicate freely and gain understanding about and then keep moving on, because you know, sometimes lifestyles are chosen for us as opposed to us choosing them.",Julius Erving,Moving On
"So I won an Oscar. It's amazing. I've got that for the rest of my life for a performance I am proud of. It nearly killed me. I am really proud of the film. That's it, moving on.",Kate Winslet,Moving On
"I like to edit my sentences as I write them. I rearrange a sentence many times before moving on to the next one. For me, that editing process feels like a form of play, like a puzzle that needs solving, and it's one of the most satisfying parts of writing.",Karen Thompson Walker,Moving On
The only reason I wanted 'Making Toast' as the title is that it is a simple gesture of moving on. Every morning there's the bread and you make the toast and you start the day.,Roger Rosenblatt,Moving On
"I think fashion is actually very good training for being in the tech world, because it's all about moving on to the next thing, looking for the next thing, not getting stuck in the past.",Natalie Massenet,Moving On
"There will always be excuses, arguments, and questions of timing when moving on difficult and controversial issues.",Lara Giddings,Moving On
"I tried to go to Kosovo to establish a statue to commemorate those who died during the wars, and to discuss moving on, so we could move into a new era. But I was banned from there.",Ivica Dacic,Moving On
"In the world of opinion writing, there's something called the 'to be sure' paragraph. A sort of rhetorical antibiotic, it seeks to defend against critics by injecting a tiny bit of counter-argument before moving on with the main point.",Meghan Daum,Moving On
The day a character becomes predictable is the day a writer should think about moving on - because the reader certainly will.,Mark Billingham,Moving On
"My genuine belief is that if we can get through the eurozone crisis from a political point of view, we've got a lot of engines that can drive our economy, that will restore confidence and get us moving on.",Enda Kenny,Moving On
"I'm just fighting a lot of high-level guys. I feel everyone is trying to be tactical, everyone is trying to put their A-game out there, and I have to find a way to win. I'm all about moving on and trying to get better.",Robbie Lawler,Moving On
"Not fighting, avoiding talking to fans... that's when the thoughts creep in about retiring and moving on to something else.",Andre Ward,Moving On
"I remember this song by Clay Walker that came out in the '90s called 'This Woman and This Man,' and it was about breaking up, loss, the pain of moving on, and my parents were just getting divorced at the time, so I listened to it over and over again.",Cole Swindell,Moving On
"Late August still feels like summer here in the Ozarks, but it is the time of year the nighthawks are moving on to their South American wintering grounds.",Sue Hubbell,Moving On
"People actually aren't moving on from companies much more quickly than in the past, but there's a perception that they do, so companies are investing less in talent on the assumption that young employees won't stay long.",Kathryn Minshew,Moving On
"Six years of your life is a long time to do anything, and especially in this business, where you get so used to being nomadic and moving on to different jobs.",Busy Philipps,Moving On
The strange thing about living somewhere for a couple of years and then moving on and not returning is that those locations become ghosts of themselves in your mind.,Sarah Pinborough,Moving On
"I'm the kind of person who, if I like one song, will listen to all of the band's work before moving on to another group.",Alexis Bledel,Moving On
"I remember when 'I'm Moving On' came out, and we got the response we did, I thought, 'Man, this could be for real.' That was the first time it dawned on me what we had.",Jay DeMarcus,Moving On
"It's weird that I'm putting my old green and gold jersey, and I'm moving on to the cardinal and white. I'm a Stanford Cardinal.",Devon Cajuste,Moving On
I unknowingly accepted impermissible benefits from my summer landlord. I look forward to moving on from this incident and to supporting my alma mater for many years to come.,Devon Cajuste,Moving On
My family is really good at letting go of things and moving on.,Meghan McCain,Moving On
Anything I wrote before the age of 17 is probably worth putting a pin in and moving on.,Lewis Capaldi,Moving On
I'm about creating a body of work and moving on to the next thing.,Mark Lanegan,Moving On
"If I want to pad the record, just fight pretenders, get a quick paycheck and keep moving on and racking up wins, that's not something I want to be known for.",Mikey Garcia,Moving On
"Obviously it's hard to lose a coach; that's not fun for anybody because you care about him and you have a relationship with him. But as players, we just have to keep moving on.",Derek Carr,Moving On
"You see stuff that is cheating, no question, and it needs to be sorted out. The biggest thing is moving on the shot by an opponent.",Neil Robertson,Moving On
"Every player, when you get released, you feel like you still have a lot to offer. And that team is telling you, 'No, you don't have a lot to offer, so we're moving on.'",Charles Woodson,Moving On
The only criteria I have with every new album is to keep moving on from what I've done before.,Bonobo,Moving On
"To those who criticise me for leaving Serie A at just 31 years old, I have nothing to say because I am happy with the decision I made and I am moving on.",Lorenzo Insigne,Moving On
