"From the age of fifteen, dogma has been the fundamental principle of my religion: I know no other religion; I cannot enter into the idea of any other sort of religion; religion, as a mere sentiment, is to me a dream and a mockery.",John Henry Newman,Religion
"I have a problem with religion that makes it so, like, 'We are the ones. We are the chosen ones.'",Cher,Religion
"Religion is the belief in an ever-living God, that is, in a Divine Mind and Will ruling the Universe and holding moral relations with mankind.",James Martineau,Religion
"My dad's Jewish and my mum is Christian, so I grew up with no religion. Just whatever religion I wanted.",Nikki Reed,Religion
"I started seeing in the monsters as a more sincere form of religion because the priests were not that great, but Frankenstein was great.",Guillermo del Toro,Religion
"Religion, oh, just another of those numerous failures resulting from an attempt to popularize art.",Ezra Pound,Religion
"We need leadership that can elevate religion and morality to their position of paramount importance and thus eliminate growing selfishness, immorality and materialism.",George W. Romney,Religion
"Religion is there to say, 'Hey, you don't have to worry - there's an afterlife.'",Peter Greenaway,Religion
"I agree with people like Richard Dawkins that mankind felt the need for creation myths. Before we really began to understand disease and the weather and things like that, we sought false explanations for them. Now science has filled in some of the realm - not all - that religion used to fill.",Bill Gates,Religion
The truths of religion are never so well understood as by those who have lost the power of reason.,Voltaire,Religion
Men despise religion. They hate it and are afraid it may be true.,Blaise Pascal,Religion
It is a masterpiece of the devil to make us believe that children cannot understand religion. Would Christ have made a child the standard of faith if He had known that it was not capable of understanding His words?,Dwight L. Moody,Religion
"I ask you to pray for me, for once age has overtaken us, we find consolation only in religion.",Paul Cezanne,Religion
Religion has stayed with me even though I rebelled.,Grace Jones,Religion
"By religion, then, I understand a propitiation or conciliation of powers superior to man which are believed to direct and control the course of nature and of human life.",James G. Frazer,Religion
"Martial arts, for me, is not just some kind of job to gain some money or whatever. No, martial arts, for me, is my lifestyle, my religion, my philosophy... Martial arts are everything for me.",Valentina Shevchenko,Religion
"To be Catholic puts a lot of fear in you. It's a great religion, but also one that can limit your experience. You fear experience because everything is a sin.",Donatella Versace,Religion
Those who say religion has nothing to do with politics do not know what religion is.,Mahatma Gandhi,Religion
It's simply untrue that religion provides the only framework for a universal morality.,Sam Harris,Religion
"I have never been converted to or even had much interest in spiritualism, occultism, Swedenborgianism or any particular religion. And I never, except occasionally for a laugh, visit the quacks who call themselves psychics.",Dick Cavett,Religion
"It is possible that mankind is on the threshold of a golden age; but, if so, it will be necessary first to slay the dragon that guards the door, and this dragon is religion.",Bertrand Russell,Religion
"Everything is a risk in Pakistan: If you defend women, it's a risk. If you defend non-Muslims it's a risk. If you discuss religion, it's a risk. But you can't really sit there like a vegetable in your own society. And I'm committed to that society... and I feel I need to turn around and speak as I should.",Asma Jahangir,Religion
A man will do more for his stubbornness than for his religion or his country.,E. W. Howe,Religion
"I have said it previously and saying it again... my government will work for betterment of all, irrespective of caste or religion.",Yogi Adityanath,Religion
"As soon as beauty is sought not from religion and love, but for pleasure, it degrades the seeker.",Annie Dillard,Religion
"The true face of religion belongs to the re-enchantment of our injured civilization; faith is a way of filling all the spiritual spaces in our damaged world with the vision of a loving God, the God described in the Qur'an as al-Rahman al-Rahim.",Roger Scruton,Religion
I don't think the 9/11 attacks taught us anything we didn't already know about religion. It has long been obvious - even to the deeply religious - that religious fanaticism is an extremely dangerous deranger of otherwise sane and goodhearted people.,Daniel Dennett,Religion
"I've got no problem with anybody's religion. But if you go claiming the Earth is only 10,000 years old, that's just wrong.",Bill Nye,Religion
No one should interfere in the religion of another.,Mayawati,Religion
I don't feel the need for religion. But I went on a yoga retreat last year and I do believe slightly in the karma thing and just being good and true unto yourself. And I slightly believe that you can attract good and bad to you.,Imelda Staunton,Religion
I would no more quarrel with a man because of his religion than I would because of his art.,Mary Baker Eddy,Religion
"The day is not far off when the economic problem will take the back seat where it belongs, and the arena of the heart and the head will be occupied or reoccupied, by our real problems - the problems of life and of human relations, of creation and behavior and religion.",John Maynard Keynes,Religion
"At the heart of 'The Famished Road' is a philosophical conundrum - for me, an essential one: what is reality? Everybody's reality is subjective; it's conditioned by upbringing, ideas, temperament, religion, what's happened to you.",Ben Okri,Religion
"I do not have the slightest bit of racism in me. I do not judge people with regards to the colour of their skin, their origin, or their religion. I defend them all, because I defend French people. And, of course, I defend the interests of France, the interests of French people.",Marine Le Pen,Religion
Religion is to mysticism what popularization is to science.,Henri Bergson,Religion
"Commodities such as gold and silver have a world market that transcends national borders, politics, religions, and race. A person may not like someone else's religion, but he'll accept his gold.",Robert Kiyosaki,Religion
"We all dream. We dream vividly, depending on our nature. Our existence is beyond our explanation, whether we believe in God or we have religion or we're atheist.",Anthony Hopkins,Religion
"In my view, the Christian religion is the most important and one of the first things in which all children, under a free government ought to be instructed.",Noah Webster,Religion
My sense of religion is Einstein's sense of relativity. I don't believe in God. I believe that energy never dies. So the possibility exists that you might be breathing in some other form of Moses or Buddha or Muhammad or Bobby Kennedy or Roosevelt or Martin Luther King or Jesus.,Mandy Patinkin,Religion
The Establishment Clause prohibits government from making adherence to a religion relevant in any way to a person's standing in the political community.,Sandra Day O'Connor,Religion
God's love is too great to be confined to any one side of a conflict or to any one religion.,Desmond Tutu,Religion
"Freedom of speech, freedom of the press, and freedom of religion all have a double aspect - freedom of thought and freedom of action.",Frank Murphy,Religion
Superstition is the only religion of which base souls are capable of.,Joseph Joubert,Religion
"I'm fascinated by the business of belief, obviously, because it's so ever present with humanity anyway. And, you know, when you have science, which constantly talks of proofs, you have religion, which constantly talks of beliefs and faith and so on.",John Hurt,Religion
"Our religion is itself profoundly sad - a religion of universal anguish, and one which, because of its very catholicity, grants full liberty to the individual and asks no better than to be celebrated in each man's own language - so long as he knows anguish and is a painter.",Charles Baudelaire,Religion
I'm an atheist. I don't have a religion.,Aleister Black,Religion
"If you have a particular faith or religion, that is good. But you can survive without it.",Dalai Lama,Religion
"We ministers have undoubtedly failed to connect and apply Christianity to the practical everyday problems of the average man. In this, we have failed to follow in Christ's footsteps. For the religion which He taught and revealed in His own life and ministry was an intensely practical and down-to-earth affair.",Peter Marshall,Religion
"Religion is a huge part of me; I'm a practicing Muslim. I'm pretty much open about it if people were to answer questions. At the end of the day, I'm just a normal girl. I have my own beliefs just like everyone else. I have a strong belief in something, but I also love music.",Yuna,Religion
"In England, football is a religion. In France, football is not a religion. It's wine and food.",Robert Pires,Religion
"I'm fascinated by religion, but I'm not particularly religious.",Mika,Religion
"Tolerance says I am just going to stomach your right to be different. That if you disappear from the face of the earth, I am no better or worse off. But love - love knows that every American has worth and value, no matter what their background, race, religion, or sexual orientation.",Cory Booker,Religion
"I have faith, but I'm not the biggest fan of organised religion. There's a lot of hypocrites in church. A lot of hypocrites.",Ncuti Gatwa,Religion
"The great redemptive religion which has always been known as Christianity is battling against a totally diverse type of religious belief, which is only the more destructive of the Christian faith because it makes use of traditional Christian terminology.",John Gresham Machen,Religion
"The habit of religion is oppressive, an easy way out of thought.",Peter Ustinov,Religion
Real religion is no religion at all.,Lauryn Hill,Religion
"I tell my children what I think myself: That religion is not necessarily convincing, but it is still interesting and not to be laughed at or denigrated.",Alain de Botton,Religion
"The earth is the Lord's fullness thereof: this is no longer a hollow dictum of religion, but a directive for economic action toward human brotherhood.",Lewis Mumford,Religion
"Existentialism is about being a saint without God; being your own hero, without all the sanction and support of religion or society.",Anita Brookner,Religion
My religion would be a gentle faith that believed in the sacredness of leisure. Napping as a form of prayer.,Garrison Keillor,Religion
Prisons are built with stones of Law. Brothels with the bricks of religion.,William Blake,Religion
"Religion comes from the word 're' or again and 'ligare' meaning to bind or tie back. The purpose of religion is to unite the self with God or the creative force. Music, sacred spaces, and meaningful icons are the way we conjoin our minds with the transcendental.",Alex Grey,Religion
"If there is a God, it's going to be a whole lot bigger and a whole lot more incomprehensible than anything that any theologian of any religion has ever proposed.",Richard Dawkins,Religion
There is no religion in which everyday life is not considered a prison; there is no philosophy or ideology that does not think that we live in alienation.,Eugene Ionesco,Religion
"I was never pushed into the religion by my mother or anyone else. I made up my own mind when I was old enough. I am not a religious person, but I am spiritual.",Janet Jackson,Religion
"Something happens in school sometimes where you're like, 'Oh, I'm not an expert, and I have to defer to people who are.' And it happens not just in school: it happens in religion, too. Defer to the experts. A printing press is a big deal - they got the Bible, and all of a sudden they could read it for themselves.",Sal Khan,Religion
"I know it's very idealistic and utopian, but I believe we need to just let everyone not be judged in terms of religion, groups or nations or region.",Shah Rukh Khan,Religion
"Not longer loved or fostered by religion, beauty is lifted from its face as a mask, and its absence exposes features on that face which threaten to become incomprehensible to man.",Hans Urs von Balthasar,Religion
"When a fan buys a ticket for a cricket match or a movie, he is not worried about the colour, creed, or religion of the person sitting next to him. If you look at any actor's fan base in India, you will find that they are from different regions.",Ajith Kumar,Religion
"Art is exalted above religion and race. Not a single solitary soul these days believes in the religions of the Assyrians, the Egyptians and the Greeks... Only their art, whenever it was beautiful, stands proud and exalted, rising above all time.",Emil Nolde,Religion
"I know America is very nice and very good people. I'm a professional athlete. I come here. I never have a problem with somebody about my religion, about my name. I am happy. I'm always comfortable because I never do anything wrong. All the time I do something right. I follow all the rules.",Khabib Nurmagomedov,Religion
"Religion is a very scary thing, because a pastor is in a position of power. And if you use that power badly, you ruin people's lives, and you ruin your own life.",Eugene H. Peterson,Religion
"The history of our spiritual life is a continuing search for the unity between ourselves and the world. Religion, art, and science follow, one and all, this aim.",Rudolf Steiner,Religion
Freedom prospers when religion is vibrant and the rule of law under God is acknowledged.,Ronald Reagan,Religion
Religion has caused more misery to all of mankind in every stage of human history than any other single idea.,Madalyn Murray O'Hair,Religion
"Joy in the universe, and keen curiosity about it all - that has been my religion.",John Burroughs,Religion
"Of all the tyrannies that affect mankind, tyranny in religion is the worst.",Thomas Paine,Religion
"Passion is universal humanity. Without it religion, history, romance and art would be useless.",Honore de Balzac,Religion
Religion is the impotence of the human mind to deal with occurrences it cannot understand.,Karl Marx,Religion
"You won't see Christians violently attacking people for criticising their religion like you do with Islam, things like the Charlie Hebdo attack.",Lauren Southern,Religion
"You know, I get much more Jewish in Israel because I like the way that religion is done there.",Natalie Portman,Religion
"Whereas religious prayers sing of peace and harmony, religion has divided human beings through an atrocious history of enmity and bloodshed. Yet, behind the veil of superficiality and hypocrisy, I always believed in the inherent beauty of God that lies at the essence of all true spiritual paths.",Radhanath Swami,Religion
Religion is not going to come up with any new arguments.,Christopher Hitchens,Religion
"And what is religion, you might ask. It's a technology of living.",Toni Cade Bambara,Religion
"Indians today are governed by two different ideologies. Their political ideal set in the preamble of the Constitution affirms a life of liberty, equality and fraternity. Their social ideal embodied in their religion denies them.",B. R. Ambedkar,Religion
"No great advance has been made in science, politics, or religion without controversy.",Lyman Beecher,Religion
"I have the highest respect for the concept of 'Advait' - the oneness of all humans - that is central to Indian culture, thought, and religion.",Rajkumar Hirani,Religion
"But let's just say, I'm Irish. I grew up in the 1950s. Religion had a very tight iron fist.",Liam Neeson,Religion
Genghis Khan decreed religious tolerance for all of his conquered peoples. So I think he definitely would approve of our constitutional protections of freedom of religion. I think he would also approve of the way the U.S. has been able to attract talented people from all over the world.,Amy Chua,Religion
"When theology erodes and organization crumbles, when the institutional framework of religion begins to break up, the search for a direct experience which people can feel to be religious facilitates the rise of cults.",Daniel Bell,Religion
"Young people all over the world are very frustrated. They are very disillusioned. Many of them are turning their backs on religion. They are walking away from the faith of their parents, and most of this is because religion has failed them.",Myles Munroe,Religion
"I'm a Sufi Muslim, I would say. I believe in using the medium to create a good vibration because art is so important to society. Some projects I don't do because I feel that it's going to create a bad vibe. I don't do propaganda films that are anti another religion, anti-Muslim or anti-Hindu.",A. R. Rahman,Religion
"As a politician who cherishes religious conviction in his personal sphere, but regards politics as a domain belonging outside religion, I believe that this view is seriously flawed.",Recep Tayyip Erdogan,Religion
"My faith is very private to me. It plays an important part in my life, but I do not try and throw my beliefs at others. I have tremendous respect for all faiths and beliefs, but have a deep concern that religion and faith are currently a long way apart from each other.",Rick Wakeman,Religion
I am fascinated with religion or things that people believe in and question that. I think it's interesting.,Patrick Wilson,Religion
"Galileo was no idiot. Only an idiot could believe that science requires martyrdom - that may be necessary in religion, but in time a scientific result will establish itself.",David Hilbert,Religion
The Coptic Church respects the law but it does not accept rulings that go against the Bible and our freedom of religion.,Pope Shenouda III,Religion
"It is a fine thing to establish one's own religion in one's heart, not to be dependent on tradition and second-hand ideals. Life will seem to you, later, not a lesser, but a greater thing.",D. H. Lawrence,Religion
"I am a proud Hindu, but that doesn't I mean I disrespect others' religion.",Payal Rohatgi,Religion
I think the church and the religion right now have a lot more to be worried about than SLAYER.,Kerry King,Religion
"That I am not a member of any Christian church is true; but I have never denied the truth of the Scriptures, and I have never spoken with intentional disrespect of religion in general, or of any denomination of Christians in particular.",Abraham Lincoln,Religion
"If a man reaches the heart of his own religion, he has reached the heart of the others, too. There is only one God, and there are many paths to him.",Mahatma Gandhi,Religion
I'm not really into religion.,Harry Dean Stanton,Religion
"To repay evils with kindness is the religion I was taught to practise, and this will forever be my rule.",John James Audubon,Religion
"Government is a true religion: it has its dogmas, its mysteries, its priests. To submit it to the individual discussion is to destroy it; it is given life only through the national mind, that is to say, by political faith, which is a creed.",Joseph de Maistre,Religion
"Wherever there is a settled society, religion is necessary; the laws cover manifest crimes, and religion covers secret crimes.",Voltaire,Religion
"Themes of redemption, temptation, and faith don't necessarily apply directly to religion. A lot of people find faith in their lives outside of God and still deal with notions of temptation and redemption that aren't religious.",Will Poulter,Religion
"Unless we place our religion and our treasure in the same thing, religion will always be sacrificed.",Epictetus,Religion
Such are the heights of wickedness to which men are driven by religion.,Lucretius,Religion
"Whether you call it Buddhism or another religion, self-discipline, that's important. Self-discipline with awareness of consequences.",Dalai Lama,Religion
A religion without mystery must be a religion without God.,Jeremy Taylor,Religion
It is the test of a good religion whether you can joke about it.,Gilbert K. Chesterton,Religion
"The problem with writing about religion is that you run the risk of offending sincerely religious people, and then they come after you with machetes.",Dave Barry,Religion
"I was born poor and without religion, under a happy sky, feeling harmony, not hostility, in nature. I began not by feeling torn, but in plenitude.",Albert Camus,Religion
"I find religion and spirituality fascinating. I would like to believe this isn't the end and there's something more, but I can't convince the rational part of me that that makes any sense whatsoever.",George R. R. Martin,Religion
"The Christian religion, though scattered and abroad will in the end gather itself together at the foot of the cross.",Johann Wolfgang von Goethe,Religion
The Conservative Party is a religion in that they are bound together by belief. Almost any organization has its religious aspects.,Alan Moore,Religion
It is in our lives and not our words that our religion must be read.,Thomas Jefferson,Religion
"Religion, to me, is a bureaucracy between man and God that I don't need.",Bill Maher,Religion
"We eat, drink, and sleep religion, but we do not do good.",Asma Jahangir,Religion
I am a deeply religious nonbeliever - this is a somewhat new kind of religion.,Albert Einstein,Religion
Without philosophy man cannot know what he makes; without religion he cannot know why.,Eric Gill,Religion
"When I got religion, I found some work to do to benefit somebody.",Sojourner Truth,Religion
Religion is the most important of all things: the great point of discrimination that divides the man from the brute. It is our special prerogative that we can converse with that which we cannot see and believe in that the existence of which is reported to us by none of our senses.,William Godwin,Religion
"Many churches of all persuasions are hiring research agencies to poll neighborhoods, asking what kind of church they prefer. Then the local churches design themselves to fit the desires of the people. True faith in God that demands selflessness is being replaced by trendy religion that serves the selfish.",Billy Graham,Religion
The problem is that religion tends to give people bad reasons to be good.,Sam Harris,Religion
"Religion is simply one of a multitude of factors - economic political, cultural, social, tribal, racial - which shape and drive human action and reaction and often is the least important of those factors.",Mehdi Hasan,Religion
True character arises from a deeper well than religion.,E. O. Wilson,Religion
"Moreover, behind this vague tendency to treat religion as a side issue in modern life, there exists a strong body of opinion that is actively hostile to Christianity and that regards the destruction of positive religion as absolutely necessary to the advance of modern culture.",Christopher Dawson,Religion
"Music is the most powerful form of communication in the world. It brings us all together. Even religion separates us, but a hit record unites us across religious beliefs, race, politics.",Sean Combs,Religion
Nothing has done more to separate and divide human beings one from another than exclusivist organized religion.,Neale Donald Walsch,Religion
A strong argument for the religion of Christ is this - that offences against Charity are about the only ones which men on their death-beds can be made - not to understand - but to feel - as crime.,Edgar Allan Poe,Religion
"Communism, like any other revealed religion, is largely made up of prophecies.",H. L. Mencken,Religion
"Christianity began as a religion of the poor and dispossessed - farmers, fishermen, Bedouin shepherds. There's a great lure to that kind of simplicity and rigor - the discipline, the call to action.",Camille Paglia,Religion
I have been astonished that men could die martyrs for religion - I have shuddered at it. I shudder no more - I could be martyred for my religion - Love is my religion - I could die for that.,John Keats,Religion
"I am not an atheist; I believe in God. But my religion ends there. I have my own personal belief system that is so strong it allows me to do what I do. I don't have to worry about going to Hell because of Slayer, you know? Everyone has a personal belief system and believes in life somehow.",Tom Araya,Religion
Religion leaves no room for human complexity.,Daniel Radcliffe,Religion
One of the most important concepts of revealed religion is that of a sacred covenant.,Russell M. Nelson,Religion
"Of course God is endlessly multi-dimensional so every religion that exists on earth represents some face, some side of God.",Aleksandr Solzhenitsyn,Religion
The Lord's prayer contains the sum total of religion and morals.,Duke of Wellington,Religion
I always say that people should not rush to change religions. There is real value in finding the spiritual resources you need in your home religion.,Dalai Lama,Religion
"Let's face it: There are people who are extremists in every corner of society, and whatever flag they're waving is something Bad Religion has stood against.",Greg Graffin,Religion
"I treat politics kind of like my religion. It's something I believe in, but I don't want to have to make a living at it, because if you make a living at it, you somehow become dishonest.",Jerry Springer,Religion
"What religion a man holds, to what race he belongs, these things are not important; the really important thing is this knowledge: the knowledge of God's plan for men. For God has a plan, and that plan is evolution.",Jiddu Krishnamurti,Religion
