"I don't care what the religion is called; as far as I'm concerned, one God, the God I adhere to, is in charge of all of them.",Charley Pride,Religion
"The Americans combine the notions of religion and liberty so intimately in their minds, that it is impossible to make them conceive of one without the other.",Alexis de Tocqueville,Religion
"I increasingly see organized religion as actually my enemy. They treat me as their enemy. Not all Christians, of course. Not all Jews, not all Muslims.",Ian Mckellen,Religion
"There's naught, no doubt, so much the spirit calms as rum and true religion.",Lord Byron,Religion
God did not intend religion to be an exercise club.,Naguib Mahfouz,Religion
"In the New Testament, religion is grace and ethics is gratitude.",Thomas Erskine,Religion
"The truth is nobody was a Muslim until Public Enemy came out. Then, everybody was Muslim this and Muslim that. It's a bandwagon thing. Islam is a way of life... it's a religion. It's not just something you put on a record.",KRS-One,Religion
"My religion encompasses all religions. I believe in God, I believe in the universe. I believe you are god, I believe I am god; I believe the earth is god and the universe is god. We're all god.",Ray Bradbury,Religion
I used to think religion was just more of the same thing. Dump responsibility on the big guy. Now I see an importance in that. It's a relief to accept that not everything is under your control.,Barbara Kingsolver,Religion
Religion is a very sensitive subject and reason for wars all over the world.,Yolanda Hadid,Religion
"The difference between a saint and a hypocrite is that one lies for his religion, the other by it.",Minna Antrim,Religion
Organized religion: the world's largest pyramid scheme.,Bernard Katz,Religion
"I hate organized religion. I think you have to love thy neighbor as thyself. I think you have to pick your own God and be true to him. I always say 'him' rather than 'her.' Maybe it's because of my generation, but I don't like the idea of a female God. I see God as a benevolent male.",Julia Child,Religion
"I am determined that my children shall be brought up in their father's religion, if they can find out what it is.",Charles Lamb,Religion
"Religion is the solid basis of good morals; therefore education should teach the precepts of religion, and the duties of man toward God.",Gouverneur Morris,Religion
In Christianity neither morality nor religion come into contact with reality at any point.,Friedrich Nietzsche,Religion
"Like religion, politics, and family planning, cereal is not a topic to be brought up in public. It's too controversial.",Erma Bombeck,Religion
The first time I sang in the church choir; two hundred people changed their religion.,Fred Allen,Religion
I was sort of born into a Subud cult that has ties to Islam and Indonesia and Middle Eastern spiritualism. My parents were kind of trial-and-error when it came to religion.,Sufjan Stevens,Religion
God requireth not a uniformity of religion.,Roger Williams,Religion
"People can be only divided into good or bad; their race, religion, nationality don't matter.",Irena Sendler,Religion
"With a Catholic mother and a Muslim father, I've always had a great interest in religion, but I've never practiced one myself. After I received a diagnosis of an aggressive form of leukemia at the age of 22, I put my faith in medicine.",Suleika Jaouad,Religion
"Don't try to tear down other people's religion about their ears, Build up your own perfect structure of truth, and invite your listeners to enter in and enjoy its glories.",Brigham Young,Religion
North Korea is a religion. We are told that Kim is a god and that he knows what you are thinking and how many hairs are on your head. It is the only country which talks about 'thought crime' - even thinking is a crime.,Park Yeon-mi,Religion
"I think regardless of what your religion is or what you believe, you try to treat people in a positive way, and that's all you can do in life.",Scott Eastwood,Religion
"The constitution of the universe is total natural law. 'Natural law,' we say from the field of science. 'Will of God,' we say from the field of religion. It's the same thing.",Maharishi Mahesh Yogi,Religion
"I just think religion is something... It could be a beautiful thing for the individual, but when it becomes organized, that's when religion starts taking a kind of ugly turn to me.",Daron Malakian,Religion
"If there is any fixed star in our constitutional constellation, it is that no official, high or petty, can prescribe what shall be orthodox in politics, nationalism, religion, or other matters of opinion, or force citizens to confess by word or act.",Robert Jackson,Religion
"There are things about organized religion which I resent. Christ is revered as the Prince of Peace, but more blood has been shed in His name than any other figure in history. You show me one step forward in the name of religion, and I'll show you a hundred retrogressions.",Frank Sinatra,Religion
"Religion is not a burden, not a weight, it is wings.",Harry Emerson Fosdick,Religion
"We want, as the Saudi people, to enjoy the coming days and concentrate on developing our society and developing ourselves as individuals and families while retaining our religion and customs.",Mohammad bin Salman,Religion
"The importance that our society attaches to sport is incredible. After all, is football a game or a religion? The people of this country have allowed sports to get completely out of hand.",Howard Cosell,Religion
"Religion is the sigh of the oppressed creature, the heart of a heartless world, and the soul of soulless conditions. It is the opium of the people.",Karl Marx,Religion
I think religion is a mistake - I'm exhausted by its self-righteousness. I think atheists should start screaming for attention like religious folks do.,Bjork,Religion
"I'm not a big fan of religion for that reason. But I am a true believer in God, and I have great faith, and I think that a spiritual connection with something is a really important part of our experience. That doesn't necessarily have anything to do with the church.",Shaun Cassidy,Religion
Nothing can be more contrary to religion and the clergy than reason and common sense.,Baron d'Holbach,Religion
"To the man who reads 'Scouting for Boys' superficially, there is a disappointing lack of religion in the book. But to him who tries it in practice, the basic religion underlying it soon becomes apparent.",Robert Baden-Powell,Religion
"Religious tolerance is something we should all practice; however, there have been more persecution and atrocities committed in the name of religion and religious freedom than anything else.",Walter Koenig,Religion
"Religion is doing; a man does not merely think his religion or feel it, he lives his religion as much as he is able, otherwise it is not religion but fantasy or philosophy.",George Gurdjieff,Religion
There's no religion but sex and music.,Sting,Religion
"We must fix our broken immigration system. That means stopping illegal immigration. And it means welcoming properly vetted legal immigrants, regardless of their race or religion. Just like we have for centuries.",Nikki Haley,Religion
"Before anything else, I'm a Muslim. As a Muslim, I try to comply with the requirements of my religion. I have a responsibility to God, who created me, and I try to fulfill that responsibility. But I try now very much to keep this away from my political life, to keep it private.",Recep Tayyip Erdogan,Religion
"The whole essence of the Christian religion is based on the atonement of Christ, his death and his resurrection.",Gordon B. Hinckley,Religion
Some of you say religion makes people happy. So does laughing gas.,Clarence Darrow,Religion
I don't normally talk about my religion publicly because I don't want people to associate me and my flaws with this beautiful thing. And I believe it is beautiful if you learn it the right way.,Dave Chappelle,Religion
The idea that religion and politics don't mix was invented by the Devil to keep Christians from running their own country.,Jerry Falwell,Religion
"I say you don't need religion, or political ideology, to understand human nature. Science reveals that human nature is greedy and selfish, altruistic and helpful.",Michael Shermer,Religion
"The one thing that unites all human beings, regardless of age, gender, religion or ethnic background, is that we all believe we are above-average drivers.",Dave Barry,Religion
"Morality without religion is only a kind of dead reckoning - an endeavor to find our place on a cloudy sea by measuring the distance we have run, but without any observation of the heavenly bodies.",Henry Wadsworth Longfellow,Religion
I care not much for a man's religion whose dog and cat are not the better for it.,Abraham Lincoln,Religion
"Islam is a violent, I was going to say religion, but it's not a religion. It's a political system. It's a violent political system bent on the overthrow of the governments of the world and world domination. That is the ultimate aim.",Pat Robertson,Religion
I find the whole idea of religion overwhelming and frightening and not for me.,Cody Fern,Religion
"I'm not a New Age person, but I do believe in meditation, and for that reason I've always liked the Buddhist religion. When I've been to Japan, I've been to Buddhist temples and meditated, and I found that rewarding.",Clint Eastwood,Religion
"I am a spiritual person in an eastern religion kind of way. I learned that happiness for all of us is a switch that you flick in your brain. It doesn't have anything to do with getting a new house, a new car, a new girlfriend, or a new pair of shoes. Our culture is very much about that; we are never happy with what we have today.",Tom Ford,Religion
"No, the religion of Jesus is a social religion.",George Whitefield,Religion
"I love the idea of the teachings of Jesus Christ and the beautiful stories about it, which I loved in Sunday school and I collected all the little stickers and put them in my book. But the reality is that organised religion doesn't seem to work. It turns people into hateful lemmings and it's not really compassionate.",Elton John,Religion
"When law and duty are one, united by religion, you never become fully conscious, fully aware of yourself. You are always a little less than an individual.",Frank Herbert,Religion
"Supreme serenity still remains the Ideal of great Art. The shapes and transitory forms of life are but stages toward this Ideal, which Christ's religion illuminates with His divine light.",Franz Liszt,Religion
Indonesia is the world's third-largest democracy. And we also have the world's largest Muslim population. This demonstrates that democracy and Islam are not incompatible. Terrorism is not associated with any religion.,Joko Widodo,Religion
"I remember the first time going to St. Jude. I didn't like going there because the children were ill, and it just broke my heart. It makes you test your religion when you see something like that. But the Lord doesn't want just old people. You know, He wants some young people, too, and good people. He takes care of them. He takes care of them.",Lee Trevino,Religion
I am fundamentally an anthropologist and a rationalist. What I say is that human societies are very different from what specialists call 'animal society' because the former have religion.,Rene Girard,Religion
"Twin-sister of Religion, Selfishness.",Percy Bysshe Shelley,Religion
To know a person's religion we need not listen to his profession of faith but must find his brand of intolerance.,Eric Hoffer,Religion
You don't have to be a religious person to be affected by religion or a religious movement.,Jim Starlin,Religion
There is no cure for the pride of a virtuous nation but pure religion.,Reinhold Niebuhr,Religion
Religion and art spring from the same root and are close kin. Economics and art are strangers.,Nathaniel Hawthorne,Religion
Behaving morally because of a hope of reward or a fear of punishment is not morality. Morality is not bribery or threats. Religion is bribery and threats. Humans have morality. We don't need religion.,Penn Jillette,Religion
"9/11 was a deliberate, carefully planned evil act of the long-waged war on the West by Koran-inspired soldiers of Allah around the world. They hated us before George W. Bush was in office. They hated us before Israel existed. And the avengers of the religion of perpetual outrage will keep hating us.",Michelle Malkin,Religion
Human rights is a universal standard. It is a component of every religion and every civilization.,Shirin Ebadi,Religion
"We grew up Amish, but my parents left the religion when I was a child. The Amish have lots of rules, and my dad thought many people in the faith were hypocritical because they'd tell others not to do something and then do it themselves.",Verne Troyer,Religion
My religion consists of a humble admiration of the illimitable superior spirit who reveals himself in the slight details we are able to perceive with our frail and feeble mind.,Albert Einstein,Religion
"Our rights are interconnected and inseparable. When freedom of expression is threatened, the rights to freedom of association and assembly, of thought, conscience and religion, are also compromised.",Nazanin Boniadi,Religion
Religion is love; in no case is it logic.,Beatrice Webb,Religion
My religion is based on truth and non-violence. Truth is my God. Non-violence is the means of realising Him.,Mahatma Gandhi,Religion
"I left my husband a year after 9/11. Not because he was an American and I an Egyptian, nothing to do with culture or religion, nothing to do with 9/11. We brought out the worst in each other. But before we separated, we visited N.Y.C. one more time together for a friend's engagement, and we went to pay our respects at the site of the attacks.",Mona Eltahawy,Religion
The equation of religion with belief is rather recent.,Arnold J. Toynbee,Religion
The most important part of my religion is to play guitar.,Lou Reed,Religion
Love and business and family and religion and art and patriotism are nothing but shadows of words when a man's starving!,O. Henry,Religion
"Personally, I don't choose any particular religion or symbol or group of words or teachings to define me. That's between me and the most high. You know, my higher self. The Creator.",Erykah Badu,Religion
"I'm still very much an atheist, except that I don't necessarily see religion as being a bad thing. So, that's a weird thing that I'm struggling with that seems to be offending both atheists and people that are religious.",Patton Oswalt,Religion
"Violence against women in all its forms is a human rights violation. It's not something that any culture, religion or tradition propagates.",Michelle Bachelet,Religion
"Animals have come to mean so much in our lives. We live in a fragmented and disconnected culture. Politics are ugly, religion is struggling, technology is stressful, and the economy is unfortunate. What's one thing that we have in our lives that we can depend on? A dog or a cat loving us unconditionally, every day, very faithfully.",Jon Katz,Religion
"More than this, even in those white men who professed religion we found much inconsistency of conduct. They spoke much of spiritual things, while seeking only the material.",Charles Eastman,Religion
"As a religion, bilingualism is the god that failed. It has led to no fairness, produced no unity, and cost Canadian taxpayers untold millions.",Stephen Harper,Religion
"If there is a God, atheism must seem to Him as less of an insult than religion.",Edmond de Goncourt,Religion
I'm a practicing Christian - and I'm going to keep practicing till I get it right - but I don't feel everyone has to practice the same religion that I do. You have a right to worship who you choose and how you choose to.,Jane Elliot,Religion
"I maintain that Truth is a pathless land, and you cannot approach it by any path whatsoever, by any religion, by any sect.",Jiddu Krishnamurti,Religion
"I am somebody who believes that every political direction is valid, as with every religion. The basis of Christianity is perfect, just like the basis of Islam. But then the leaders change the direction, and lose the quality.",Demis Roussos,Religion
"The Charter of the United Nations expresses the noblest aspirations of man: abjuration of force in the settlement of disputes between states; the assurance of human rights and fundamental freedoms for all without distinction as to race, sex, language or religion; the safeguarding of international peace and security.",Haile Selassie,Religion
"I just don't like the separatism that comes from religion, and, without fail, the need to put your beliefs on someone else. When you start telling someone else how to live, you should check yourself, man.",Brad Pitt,Religion
"I don't go by my caste, creed or religion. My works speak for me.",Shashi Tharoor,Religion
"Although my family attended the same church as everyone in our town, our religion was not the same. I could stand with my family or with the gentiles... but there was no foothold in between.",Tara Westover,Religion
Your daily life is your temple and your religion. When you enter into it take with you your all.,Khalil Gibran,Religion
"Democracy, pure democracy, has at least its foundation in a generous theory of human rights. It is founded on the natural equality of mankind. It is the cornerstone of the Christian religion. It is the first element of all lawful government upon earth.",John Quincy Adams,Religion
"Women have been the most persecuted people throughout all of recorded history, more than any race or religion.",Leonardo DiCaprio,Religion
"If I don't talk about my religion, if I say I'm not discussing it or different humanitarian things I'm working on, they're like, 'He's avoiding it.' If I do talk about it, it becomes, 'Oh, he's proselytizing.'",Tom Cruise,Religion
My philosophy is that the most important aspect of any religion should be human kindness. And to try to ease the suffering of others. To try to bring light and love into the lives of mankind.,Steven Seagal,Religion
"All human beings have an innate need to hear and tell stories and to have a story to live by. religion, whatever else it has done, has provided one of the main ways of meeting this abiding need.",Harvey Cox,Religion
Religion is excellent stuff for keeping common people quiet.,Napoleon Bonaparte,Religion
"When you look at the decline of church attendance in America, or when you look at the decline of millennials that are not going to church in America, you want to have the conversation that a lot of times people are hit more with religion and rules and the systems than they are with the love of God and having a personal relationship with Christ.",Kirk Franklin,Religion
"Religion and philosophy, philosophy and religion - they're two words which are both... different. In spelling.",Eddie Izzard,Religion
"I'm still a person, a human being, no matter what religion I am.",T-Pain,Religion
It was once religion which told us that we are all sinners because of original sin. It is now the ecology of our planet which pronounces us all to be sinners because of the excessive exploits of human inventiveness.,Hans Jonas,Religion
"Communism has decided against God, against Christ, against the Bible, and against all religion.",Billy Graham,Religion
"Religion and gods and beliefs - for me, it all comes down to your brother. And your brother might be the brother in your family, or it might be the guy next to you in the foxhole - it's about human connections.",Eric Kripke,Religion
"Out of all the ridiculous religion stories - which are greatly, wonderfully ridiculous - the silliest one I've ever heard is, 'Yeah, there's this big, giant universe, and it's expanding, and it's all going to collapse on itself, and we're all just here, just 'cuz. Just 'cuz.' That to me, is the most ridiculous explanation ever.",Trey Parker,Religion
"Religion and philosophy are to be preserved distinct. We are not to introduce divine revelations into philosophy, nor philosophical opinions into religion.",Isaac Newton,Religion
"The latest rule is: you cannot have protectionism - otherwise you will get a world war. Other rules say you cannot have collective ideas that involve the surrender of the individual to the group - otherwise, you get totalitarianism or, even worse, religion.",Adam Curtis,Religion
"Baseball is more than a game to me, it's a religion.",Bill Klem,Religion
"Twelve-step promotes spirituality, not religion. It gives a practical, day-to-day spirituality that tells me what I can and cannot control. There is room to be imperfect and to be someone who struggles to find God.",Melody Beattie,Religion
"I'm not a religious person, and I'm not too interested in being a part of a religion, but I do like having some sort of communal gathering, and having some sense of peoples.",Ian MacKaye,Religion
Religion is not changed as easily as a shirt.,Henry IV,Religion
"War is the greatest plague that can afflict humanity, it destroys religion, it destroys states, it destroys families. Any scourge is preferable to it.",Martin Luther,Religion
I've had trouble now and again in Nigeria because I have spoken up about the mistreatment of factions in the country because of difference in religion. These are things we should put behind us.,Chinua Achebe,Religion
I never found much comfort in overly organized religion of any sort.,Jewel,Religion
I am fully aware that cricket is like a second religion in Pakistan.,AB de Villiers,Religion
India is a country in which every great religion finds a home.,Annie Besant,Religion
"I'm not religious. I was as a child, and like lots of people, I suppose, rapidly became very disillusioned with the whole thing. I also feel that organised religion has caused far more problems than it has solved.",Natascha McElhone,Religion
"If religion has given birth to all that is essential in society, it is because the idea of society is the soul of religion.",Emile Durkheim,Religion
"I know Marco Rubio very well. He's a friend of mine. He's a man of deep faith. He is a man who follows Catholic dogma and - you know, for whom religion is very important.",Ana Navarro,Religion
"Every man lives in two realms: the internal and the external. The internal is that realm of spiritual ends expressed in art, literature, morals, and religion. The external is that complex of devices, techniques, mechanisms, and instrumentalities by means of which we live.","Martin Luther King, Jr.",Religion
"Secularism is categorically not saying that the religious may not speak out publicly or have a say in public life. It is about saying that religion alone should not confer a privileged say in public life, or greater influence on it. It really is as simple as that.",Richard Dawkins,Religion
"There is no religion without love, and people may talk as much as they like about their religion, but if it does not teach them to be good and kind to man and beast, it is all a sham.",Anna Sewell,Religion
"We can live without religion and meditation, but we cannot survive without human affection.",Dalai Lama,Religion
"My social philosophy may be said to be enshrined in three words: liberty, equality and fraternity. Let no one, however, say that I have borrowed by philosophy from the French Revolution. I have not. My philosophy has roots in religion and not in political science. I have derived them from the teachings of my Master, the Buddha.",B. R. Ambedkar,Religion
"In politics, as in religion, it is equally absurd to aim at making proselytes by fire and sword. Heresies in either can rarely be cured by persecution.",Alexander Hamilton,Religion
We need to reject any politics that targets people because of race or religion. This isn't a matter of political correctness. It's a matter of understanding what makes us strong. The world respects us not just for our arsenal; it respects us for our diversity and our openness and the way we respect every faith.,Barack Obama,Religion
I honor the sanctity of all religions - I'm not here to put them down. But the only religion that I personally embrace is the religion of kindness.,Leslie Jordan,Religion
The Grateful Dead are our religion. This is a religion that doesn't pay homage to the God that all the other religions pay homage to.,Ken Kesey,Religion
"No matter the nationality, no matter the religion, no matter the ethnic background, America brings out the best in people.",Arnold Schwarzenegger,Religion
"Every theistic religion, including Catholicism, Mainline Protestantism, Judaism, Mormonism, and Islam, has traditionally held homosexual congress in moral opprobrium.",Michael J. Knowles,Religion
"Science attempts to analyze how things and people and animals behave; it has no concern whether this behavior is good or bad, is purposeful or not. But religion is precisely the quest for such answers: whether an act is right or wrong, good or bad, and why.",Warren Weaver,Religion
"As Juan Gabriel, music is my religion, and mariachi is my devotion. And my songs are my prayers.",Juan Gabriel,Religion
"Just as Darwin discovered the law of development of organic nature, so Marx discovered the law of development of human history: the simple fact, hitherto concealed by an overgrowth of ideology, that mankind must first of all eat, drink, have shelter and clothing, before it can pursue politics, science, art, religion, etc.",Friedrich Engels,Religion
"No human heart is denied empathy. No religion can demolish that by indoctrination. No culture, no nation and nationalism - nothing can touch it because it is empathy.",Dayananda Saraswati,Religion
