"I would rather live my life as if there is a God and die to find out there isn't, than live as if there isn't and to die to find out that there is.",Albert Camus,Religion
When the missionaries came to Africa they had the Bible and we had the land. They said 'Let us pray.' We closed our eyes. When we opened them we had the Bible and they had the land.,Desmond Tutu,Religion
Aim at heaven and you will get earth thrown in. Aim at earth and you get neither.,C. S. Lewis,Religion
My religion is very simple. My religion is kindness.,Dalai Lama,Religion
"Religion is regarded by the common people as true, by the wise as false, and by the rulers as useful.",Lucius Annaeus Seneca,Religion
"For God so loved the World that he gave his only Son, that whoever believes in him should not perish but have eternal life.",Jesus Christ,Religion
"When I do good I feel good, when I do bad I feel bad, and that's my religion.",Abraham Lincoln,Religion
Religion is what keeps the poor from murdering the rich.,Napoleon Bonaparte,Religion
We must seek the loving-kindness of God in all the breadth and open-air of common life.,George A. Smith,Religion
Heaven is under our feet as well as over our heads.,Henry David Thoreau,Religion
"The World is my country, all mankind are my brethren, and to do good is my religion.",Thomas Paine,Religion
To be a Christian without prayer is no more possible than to be alive without breathing.,Martin Luther,Religion
A thorough knowledge of the Bible is worth more than a college education.,Theodore Roosevelt,Religion
"Just as a candle cannot burn without fire, men cannot live without a spiritual life.",Buddha,Religion
"Prayer does not change God, but it changes him who prays.",Soren Kierkegaard,Religion
"I do not feel obliged to believe that the same God who has endowed us with sense, reason, and intellect has intended us to forgo their use.",Galileo Galilei,Religion
You cannot believe in God until you believe in yourself.,Swami Vivekananda,Religion
I prayed for twenty years but received no answer until I prayed with my legs.,Frederick Douglass,Religion
"I like the religion that teaches liberty, equality and fraternity.",B. R. Ambedkar,Religion
"Science without religion is lame, religion without science is blind.",Albert Einstein,Religion
All religions must be tolerated... for every man must get to heaven in his own way.,Epictetus,Religion
"When I admire the wonders of a sunset or the beauty of the moon, my soul expands in the worship of the creator.",Mahatma Gandhi,Religion
Within the covers of the Bible are the answers for all the problems men face.,Ronald Reagan,Religion
One act of obedience is better than one hundred sermons.,Dietrich Bonhoeffer,Religion
"It is wonderful how much time good people spend fighting the devil. If they would only expend the same amount of energy loving their fellow men, the devil would die in his own tracks of ennui.",Helen Keller,Religion
"The Kingdom of Heaven is not a place, but a state of mind.",John Burroughs,Religion
"When we blindly adopt a religion, a political system, a literary dogma, we become automatons. We cease to grow.",Anais Nin,Religion
"I love you when you bow in your mosque, kneel in your temple, pray in your church. For you and I are sons of one religion, and it is the spirit.",Khalil Gibran,Religion
Let your religion be less of a theory and more of a love affair.,Gilbert K. Chesterton,Religion
"We are punished by our sins, not for them.",Elbert Hubbard,Religion
Human beings must be known to be loved; but Divine beings must be loved to be known.,Blaise Pascal,Religion
"There are many of us that are willing to do great things for the Lord, but few of us are willing to do little things.",Dwight L. Moody,Religion
"If, then, you are looking for the way by which you should go, take Christ, because He Himself is the way.",Thomas Aquinas,Religion
Preach the Gospel at all times and when necessary use words.,Unknown,Religion
Prayer is aligning ourselves with the purposes of God.,E. Stanley Jones,Religion
"Religion is part of the human make-up. It's also part of our cultural and intellectual history. Religion was our first attempt at literature, the texts, our first attempt at cosmology, making sense of where we are in the universe, our first attempt at health care, believing in faith healing, our first attempt at philosophy.",Christopher Hitchens,Religion
I am thankful I can see much to admire in all religions.,Alfred Russel Wallace,Religion
"We can only learn to know ourselves and do what we can - namely, surrender our will and fulfill God's will in us.",Saint Teresa of Avila,Religion
"We have to pray with our eyes on God, not on the difficulties.",Oswald Chambers,Religion
Science can purify religion from error and superstition. Religion can purify science from idolatry and false absolutes.,Pope John Paul II,Religion
The more I study religions the more I am convinced that man never worshipped anything but himself.,Richard Burton,Religion
"A religious man is a person who holds God and man in one thought at one time, at all times, who suffers harm done to others, whose greatest passion is compassion, whose greatest strength is love and defiance of despair.",Abraham Joshua Heschel,Religion
Religion is the idol of the mob; it adores everything it does not understand.,Frederick the Great,Religion
We are always on the anvil; by trials God is shaping us for higher things.,Henry Ward Beecher,Religion
The Son of God became man so that we might become God.,Athanasius,Religion
"This is my simple religion. There is no need for temples; no need for complicated philosophy. Our own brain, our own heart is our temple; the philosophy is kindness.",Dalai Lama,Religion
My life was changed in one breath from God.,Donna Summer,Religion
The glory of Christianity is to conquer by forgiveness.,William Blake,Religion
There is nothing evil save that which perverts the mind and shackles the conscience.,Saint Ambrose,Religion
"Religion is everywhere. There are no human societies without it, whether they acknowledge it as a religion or not.",Octavia E. Butler,Religion
Prayer is the key of the morning and the bolt of the evening.,Mahatma Gandhi,Religion
Religion is the everlasting dialogue between humanity and God. Art is its soliloquy.,Franz Werfel,Religion
"See, I have set before you this day life and good, death and evil... I have set before you life and death, blessing and curse; therefore choose life.",Moses,Religion
Jesus does not give recipes that show the way to God as other teachers of religion do. He is himself the way.,Karl Barth,Religion
"The framers of our Constitution meant we were to have freedom of religion, not freedom from religion.",Billy Graham,Religion
"God made everything out of nothing, but the nothingness shows through.",Paul Valery,Religion
"True religion is real living; living with all one's soul, with all one's goodness and righteousness.",Albert Einstein,Religion
"Just as the soul fills the body, so God fills the world. Just as the soul bears the body, so God endures the world. Just as the soul sees but is not seen, so God sees but is not seen. Just as the soul feeds the body, so God gives food to the world.",Marcus Tullius Cicero,Religion
Anti-religious sneers are a hallmark of perpetual adolescents.,Camille Paglia,Religion
"I'm a Muslim, but I think Jesus would have a drink with me. He would be cool. He would talk to me.",Mike Tyson,Religion
"There is no need for temples, no need for complicated philosophies. My brain and my heart are my temples; my philosophy is kindness.",Dalai Lama,Religion
The Bible is worth all the other books which have ever been printed.,Patrick Henry,Religion
"Jesus is ideal and wonderful, but you Christians - you are not like him.",Mahatma Gandhi,Religion
Prayer is the spirit speaking truth to Truth.,Philip James Bailey,Religion
Toleration is the best religion.,Victor Hugo,Religion
Teach us to give and not to count the cost.,Saint Ignatius,Religion
Religion is about turning untested belief into unshakable truth through the power of institutions and the passage of time.,Richard Dawkins,Religion
"It is easy to talk on religion, but difficult to practice it.",Ramakrishna,Religion
"My mom's a Catholic, and my dad's a Jew, and they didn't want anything to do with anything.",Isabelle Huppert,Religion
"Recounting of a life story, a mind thinking aloud leads one inevitably to the consideration of problems which are no longer psychological but spiritual.",Paul Tournier,Religion
"Religion's in the heart, not in the knees.",Douglas William Jerrold,Religion
"Whether one believes in a religion or not, and whether one believes in rebirth or not, there isn't anyone who doesn't appreciate kindness and compassion.",Dalai Lama,Religion
"I was raised Catholic, but my father's people were Methodist, so we went to both churches.",Aaron Neville,Religion
The Bible is the fountain of truth.,Joseph Franklin Rutherford,Religion
Where it is a duty to worship the sun it is pretty sure to be a crime to examine the laws of heat.,John Morley,Religion
Work out your own salvation. Do not depend on others.,Buddha,Religion
It is only when men begin to worship that they begin to grow.,Calvin Coolidge,Religion
Only a god can save us.,Martin Heidegger,Religion
"Earth changes, but thy soul and God stand sure.",Robert Browning,Religion
"Religion in its humility restores man to his only dignity, the courage to live by grace.",George Santayana,Religion
"My country is the world, and my religion is to do good.",Thomas Paine,Religion
Nothing is so fatal to religion as indifference.,Edmund Burke,Religion
More and more people care about religious tolerance as fewer and fewer care about religion.,Alexander Chase,Religion
This is all the inheritance I give to my dear family. The religion of Christ will give them one which will make them rich indeed.,Patrick Henry,Religion
"Muslims must believe that all power, success and victory comes from God alone.",Abu Bakar Bashir,Religion
Worship means reverence and humility it means revering your real self and humbling delusions.,Bodhidharma,Religion
"Morality is of the highest importance - but for us, not for God.",Albert Einstein,Religion
Disturbances in society are never more fearful than when those who are stirring up the trouble can use the pretext of religion to mask their true designs.,Denis Diderot,Religion
God is a thought who makes crooked all that is straight.,Friedrich Nietzsche,Religion
"So I say to you, Ask and it will be given to you; search, and you will find; knock, and the door will be opened for you.",Jesus Christ,Religion
"Rivers, ponds, lakes and streams - they all have different names, but they all contain water. Just as religions do - they all contain truths.",Muhammad Ali,Religion
"The Bible shows the way to go to heaven, not the way the heavens go.",Galileo Galilei,Religion
It's wonderful to climb the liquid mountains of the sky. Behind me and before me is God and I have no fears.,Helen Keller,Religion
God is a metaphor for that which transcends all levels of intellectual thought. It's as simple as that.,Joseph Campbell,Religion
No man ever believes that the Bible means what it says: He is always convinced that it says what he means.,George Bernard Shaw,Religion
"God is to be worshipped as the one beloved, dearer than everything in this and next life.",Swami Vivekananda,Religion
Worship is a way of seeing the world in the light of God.,Abraham Joshua Heschel,Religion
I don't believe in God but I'm very interested in her.,Arthur C. Clarke,Religion
Religion is not a department of life; it is something that enters into the whole of it.,Alan Watts,Religion
"Being religious means asking passionately the question of the meaning of our existence and being willing to receive answers, even if the answers hurt.",Paul Tillich,Religion
"Since many of you do not belong to the Catholic Church and others are non-believers, from the bottom of my heart I give this silent blessing to each and every one of you, respecting the conscience of each one of you but knowing that each one of you is a child of God.",Pope Francis,Religion
I hope I never get so old I get religious.,Ingmar Bergman,Religion
"However many holy words you read, however many you speak, what good will they do you if you do not act on upon them?",Buddha,Religion
Religion is essentially the art and the theory of the remaking of man. Man is not a finished creation.,Edmund Burke,Religion
"The Sabbath is a weekly cathedral raised up in my dining room, in my family, in my heart.",Anita Diament,Religion
"If the grandfather of the grandfather of Jesus had known what was hidden within him, he would have stood humble and awe-struck before his soul.",Khalil Gibran,Religion
"Let us not seek to bring religion to others, but let us endeavor to live it ourselves.",Paul Tournier,Religion
The God who existed before any religion counts on you to make the oneness of the human family known and celebrated.,Desmond Tutu,Religion
I know the Bible is inspired because it inspires me.,Dwight L. Moody,Religion
To gather with God's people in united adoration of the Father is as necessary to the Christian life as prayer.,Martin Luther,Religion
I never knew how to worship until I knew how to love.,Henry Ward Beecher,Religion
We are a religious people whose institutions presuppose a Supreme Being.,William O. Douglas,Religion
Wonder is the basis of worship.,Thomas Carlyle,Religion
"Even if a unity of faith is not possible, a unity of love is.",Hans Urs von Balthasar,Religion
"I think you can judge from somebody's actions a kind of a stability and sense of purpose perhaps created by strong religious roots. I mean, there's a certain patience, a certain discipline, I think, that religion helps you achieve.",George W. Bush,Religion
"Religion kept some of my relatives alive, because it was all they had. If they hadn't had some hope of heaven, some companionship in Jesus, they probably would have committed suicide, their lives were so hellish.",Octavia E. Butler,Religion
Christianity helps us face the music even when we don't like the tune.,Phillips Brooks,Religion
"I was always respectful of people who were deeply religious because I always felt that if they gave themselves to it, then it had to be important to them. But if you can go through life without it, that's OK, too. It's whatever suits you.",Clint Eastwood,Religion
"There must be freedom for all to live, to think, to worship, no book, no avenue must be closed.",James Larkin,Religion
Doubt is part of all religion. All the religious thinkers were doubters.,Isaac Bashevis Singer,Religion
"I call religion a natural authority, but it has usually been conceived as a supernatural authority.",Herbert Read,Religion
There seems to be a terrible misunderstanding on the part of a great many people to the effect that when you cease to believe you may cease to behave.,Louis Kronenberger,Religion
"Many good sayings are to be found in holy books, but merely reading them will not make one religious.",Ramakrishna,Religion
"The Godhead consists of the Father, the Son, and the Holy Spirit. The Father is a material being.",Orson Pratt,Religion
"A just laicism allows religious freedom. The state does not impose religion but rather gives space to religions with a responsibility toward civil society, and therefore it allows these religions to be factors in building up society.",Pope Benedict XVI,Religion
"This is God's world, not Satan's. Christians are the lawful heirs, not non-Christians.",Gary North,Religion
"Every man, either to his terror or consolation, has some sense of religion.",Heinrich Heine,Religion
"Give yourself entirely to God, enter and hide in the hidden ground of your soul.",Johannes Tauler,Religion
Religion is more like response to a friend than it is like obedience to an expert.,Austin Farrer,Religion
"Krishna children were taught that in the spiritual world there were no parents, only souls and hence this justified their being kept out of view from others, cloistered in separate buildings and sheltered from the evil material world.",Mary Garden,Religion
"Myself, first of all, I am a Jew. And that is the most important thing for me.",Ariel Sharon,Religion
"I believe in a religion that believes in freedom. Any time I have to accept a religion that won't let me fight a battle for my people, I say to hell with that religion.",Malcolm X,Religion
"To the first class belong the Gospels and Acts; to the second, the Epistles; to the third, the Revelation.",Philip Schaff,Religion
"I wasn't really too hyped on religion. I don't really believe in a religion like that. I just believe that there is a God. There's just somebody up there that listens to me, and they can show me better if I talk to them and build a relationship with them.",NLE Choppa,Religion
"We live in a society that wants to label you with a color, sexuality, religion, or ethnicity. It divides us, but it also allows us to find pride in our identity.",Logan Browning,Religion
I believe in the religion of Islam. I believe in Allah and peace.,Muhammad Ali,Religion
"For the record, I don't worship the devil. I just hate religion.","Tyler, The Creator",Religion
Religion is the opium of the masses.,Karl Marx,Religion
I don't have a religion. I believe in a God. I don't know what it looks like but it's MY god. My own interpretation of the supernatural.,Jennifer Aniston,Religion
Fascism is a religion. The twentieth century will be known in history as the century of Fascism.,Benito Mussolini,Religion
"There should be no discrimination against languages people speak, skin color, or religion.",Malala Yousafzai,Religion
"When it is a question of money, everybody is of the same religion.",Voltaire,Religion
"I have no religion, and at times I wish all religions at the bottom of the sea. He is a weak ruler who needs religion to uphold his government; it is as if he would catch his people in a trap.",Mustafa Kemal Ataturk,Religion
There is no higher religion than human service. To work for the common good is the greatest creed.,Woodrow Wilson,Religion
"We have enslaved the rest of the animal creation, and have treated our distant cousins in fur and feathers so badly that beyond doubt, if they were able to formulate a religion, they would depict the Devil in human form.",William Inge,Religion
My idea of religion is we are supposed to bring people together. We are not supposed to judge other people.,Charles Barkley,Religion
"I come from a Catholic religion, but I'm not Catholic.",Monica Bellucci,Religion
Religion is all-too-often a refuge for scoundrels.,Neal Boortz,Religion
There is no surer sign of decay in a country than to see the rites of religion held in contempt.,Niccolo Machiavelli,Religion
"I think we need to do some deep soul searching about what's important in our lives and renew our spirit and our spiritual thinking, whether it's through faith-based religion or just through loving nature or helping your fellow man.",Louie Schwartzberg,Religion
"The more powerful and original a mind, the more it will incline towards the religion of solitude.",Aldous Huxley,Religion
Music is my religion.,Jimi Hendrix,Religion
Religion is dangerous because it allows human beings who don't have all the answers to think that they do.,Bill Maher,Religion
"Religious wars are not caused by the fact that there is more than one religion, but by the spirit of intolerance... the spread of which can only be regarded as the total eclipse of human reason.",Montesquieu,Religion
I am against religion because it teaches us to be satisfied with not understanding the world.,Richard Dawkins,Religion
"Religion is the organization of spirituality into something that became the hand maiden of conquerors. Nearly all religions were brought to people and imposed on people by conquerors, and used as the framework to control their minds.",John Henrik Clarke,Religion
"A little philosophy inclineth man's mind to atheism, but depth in philosophy bringeth men's minds about to religion.",Francis Bacon,Religion
"I never considered a difference of opinion in politics, in religion, in philosophy, as cause for withdrawing from a friend.",Thomas Jefferson,Religion
No religion has mandated killing others as a requirement for its sustenance or promotion.,A. P. J. Abdul Kalam,Religion
"A tyrant must put on the appearance of uncommon devotion to religion. Subjects are less apprehensive of illegal treatment from a ruler whom they consider god-fearing and pious. On the other hand, they do less easily move against him, believing that he has the gods on his side.",Aristotle,Religion
"We must respect the other fellow's religion, but only in the sense and to the extent that we respect his theory that his wife is beautiful and his children smart.",H. L. Mencken,Religion
Science is a differential equation. Religion is a boundary condition.,Alan Turing,Religion
"Religion is the masterpiece of the art of animal training, for it trains people as to how they shall think.",Arthur Schopenhauer,Religion
"It's not surprising, then, they get bitter, they cling to guns or religion or antipathy to people who aren't like them or anti-immigrant sentiment or anti-trade sentiment as a way to explain their frustrations.",Barack Obama,Religion
"When man fell from grace, he lost a kingdom, not a religion. He lost dominion over the earth; He did not lose Heaven. Therefore, mankind's search is not for a religion or for Heaven but for his kingdom.",Myles Munroe,Religion
Let us with caution indulge the supposition that morality can be maintained without religion. Reason and experience both forbid us to expect that national morality can prevail in exclusion of religious principle.,George Washington,Religion
My concern with religion is that it allows us by the millions to believe what only lunatics or idiots could believe on their own. That's not to say that all religious people are lunatics or idiots. It's anything but that.,Sam Harris,Religion
Religion is all bunk.,Thomas A. Edison,Religion
"Any religion that professes to be concerned about the souls of men and is not concerned about the slums that damn them, the economic conditions that strangle them and the social conditions that cripple them is a spiritually moribund religion awaiting burial.","Martin Luther King, Jr.",Religion
The same thing which is now called Christian religion existed among the ancients. They have begun to call 'Christian' the true religion which existed before.,Saint Augustine,Religion
"Every religion is true one way or another. It is true when understood metaphorically. But when it gets stuck in its own metaphors, interpreting them as facts, then you are in trouble.",Joseph Campbell,Religion
"All religion, my friend, is simply evolved out of fraud, fear, greed, imagination, and poetry.",Edgar Allan Poe,Religion
Religion is an illusion and it derives its strength from the fact that it falls in with our instinctual desires.,Sigmund Freud,Religion
"There is only one religion, though there are a hundred versions of it.",George Bernard Shaw,Religion
"Religion, in any form, is always interesting to me because of how powerful it is. Not even the religion itself, but to the people that follow it... The effect that it has had on people's minds.",Chino Moreno,Religion
"God does not discriminate against people, regardless of color, religion, social class, or gender and sexual preferences.",Rodrigo Duterte,Religion
"Leave the matter of religion to the family altar, the church, and the private school, supported entirely by private contributions. Keep the church and state forever separate.",Ulysses S. Grant,Religion
"All these walls that keep us from loving each other as one family or one race - racism, religion, where we grew up, whatever, class, socioeconomic - what makes us be so selfish and prideful, what keeps us from wanting to help the next man, what makes us be so focused on a personal legacy as opposed to the entire legacy of a race.",Kanye West,Religion
Religion is just mind control.,George Carlin,Religion
"Surely the day will come when color means nothing more than the skin tone, when religion is seen uniquely as a way to speak one's soul, when birth places have the weight of a throw of the dice and all men are born free, when understanding breeds love and brotherhood.",Josephine Baker,Religion
"Religion is something left over from the infancy of our intelligence, it will fade away as we adopt reason and science as our guidelines.",Bertrand Russell,Religion
"I don't think that people accept the fact that life doesn't make sense. I think it makes people terribly uncomfortable. It seems like religion and myth were invented against that, trying to make sense out of it.",David Lynch,Religion
The world is divided into men who have wit and no religion and men who have religion and no wit.,Avicenna,Religion
"I'm in favour of religion as a tamer of arrogance. For a Greek Orthodox, the idea of God as creator outside the human is not God in God's terms. My God isn't the God of George Bush.",Nassim Nicholas Taleb,Religion
"There is one thing higher than Royalty: and that is religion, which causes us to leave the world, and seek God.",Elizabeth I,Religion
"I am an Anglo-Catholic in religion, a classicist in literature and a royalist in politics.",T. S. Eliot,Religion
"It is a truism that almost any sect, cult, or religion will legislate its creed into law if it acquires the political power to do so.",Robert A. Heinlein,Religion
"Where knowledge ends, religion begins.",Benjamin Disraeli,Religion
Religion without humanity is very poor human stuff.,Sojourner Truth,Religion
"Beauty has no boundaries, no rules, no colors. Beauty is like a religion. You can include everything inside it.",Alessandro Michele,Religion
