quotes,authors,categories
"My father always wanted to be the corpse at every funeral, the bride at every wedding and the baby at every christening.",Alice Roosevelt Longworth,Wedding
I was married by a judge. I should have asked for a jury.,Groucho Marx,Wedding
"Love is the master key that opens the gates of happiness, of hatred, of jealousy, and, most easily of all, the gate of fear.","Oliver Wendell Holmes, Sr.",Wedding
Bride: A woman with a fine prospect of happiness behind her.,Ambrose Bierce,Wedding
"It's a funny thing that when a man hasn't anything on earth to worry about, he goes off and gets married.",Robert Frost,Wedding
"The real act of marriage takes place in the heart, not in the ballroom or church or synagogue. It's a choice you make - not just on your wedding day, but over and over again - and that choice is reflected in the way you treat your husband or wife.",Barbara De Angelis,Wedding
Music played at weddings always reminds me of the music played for soldiers before they go into battle.,Heinrich Heine,Wedding
"I'd imagine my wedding as a fairy tale... huge, beautiful and white.",Paris Hilton,Wedding
The chain of wedlock is so heavy that it takes two to carry it - and sometimes three.,Heraclitus,Wedding
"There's a big difference between falling in love with someone and falling in love with someone and getting married. Usually, after you get married, you fall in love with the person even more.",Dave Grohl,Wedding
Many people spend more time in planning the wedding than they do in planning the marriage.,Zig Ziglar,Wedding
Weddings are important because they celebrate life and possibility.,Anne Hathaway,Wedding
"When I decided to get married at 40, I couldn't find a dress with the modernity or sophistication I wanted. That's when I saw the opportunity for a wedding gown business.",Vera Wang,Wedding
A bride at her second marriage does not wear a veil. She wants to see what she is getting.,Helen Rowland,Wedding
Monica Seles: I'd hate to be next door to her on her wedding night.,Peter Ustinov,Wedding
That is ever the way. 'Tis all jealousy to the bride and good wishes to the corpse.,James M. Barrie,Wedding
A man's got two shots for jewelry: a wedding ring and a watch. The watch is a lot easier to get on and off than a wedding ring.,John Mayer,Wedding
"When the wedding march sounds the resolute approach, the clock no longer ticks, it tolls the hour. The figures in the aisle are no longer individuals, they symbolize the human race.",Anne Morrow Lindbergh,Wedding
A gloomy guest fits not a wedding feast.,Friedrich Schiller,Wedding
The Wedding March has a bit of a death march in it.,Brian May,Wedding
"Personally, I'm an advocate for short engagements. Long sometimes means there is a reason for it. Two years engaged and no wedding... I'd be upset.",Emily Blunt,Wedding
Our dog died from licking our wedding picture.,Phyllis Diller,Wedding
Falling in love was the easy part; planning a wedding - yikes!,Niecy Nash,Wedding
Saw a wedding in the church. It was strange to see what delight we married people have to see these poor fools decoyed into our condition.,Samuel Pepys,Wedding
"Of course, I do have a slight advantage over the rest of you. It helps in a pinch to be able to remind your bride that you gave up a throne for her.",Edward VIII,Wedding
"I remember when I was in school, they would ask, 'What are you going to be when you grow up?' and then you'd have to draw a picture of it. I drew a picture of myself as a bride.",Gwen Stefani,Wedding
"Getting married, for me, was the best thing I ever did. I was suddenly beset with an immense sense of release, that we have something more important than our separate selves, and that is the marriage. There's immense happiness that can come from working towards that.",Nick Cave,Wedding
"I am about to be married, and am of course in all the misery of a man in pursuit of happiness.",Lord Byron,Wedding
"One tradition I have with my friends is that when one of us gets married, we have a ton of fragrance oils and pretty bottles at the bachelorette party. Everyone puts a drop or two in a bottle for the bride and makes a wish, and the bride wears our creation on her wedding day.",Jennifer Aniston,Wedding
"I sang a song at my sister's wedding. My mother forced me into that, too. But that one felt all right.",Adam Sandler,Wedding
Women who marry early are often overly enamored of the kind of man who looks great in wedding pictures and passes the maid of honor his telephone number.,Anna Quindlen,Wedding
"My mother says I didn't open my eyes for eight days after I was born, but when I did, the first thing I saw was an engagement ring. I was hooked.",Elizabeth Taylor,Wedding
"In Hollywood, brides keep the bouquets and throw away the groom.",Groucho Marx,Wedding
"In the '50s, a lot of girls never saw beyond the wedding day.",Helen Reddy,Wedding
A woman seldom asks advice before she has bought her wedding clothes.,Joseph Addison,Wedding
An invitation to a wedding invokes more trouble than a summons to a police court.,William Feather,Wedding
"I chose my wife, as she did her wedding gown, for qualities that would wear well.",Oliver Goldsmith,Wedding
The Wedding March always reminds me of the music played when soldiers go into battle.,Heinrich Heine,Wedding
There's a higher form of happiness in commitment. I'm counting on it.,Claire Forlani,Wedding
I believe that anybody who gets married should go to a counselor for months before the wedding. I think that's going to save guys a lot of money and the ladies a lot of heartbreak.,James Brolin,Wedding
I'm getting married because I'm in love with a girl and want to spend my life with her. You can't live your life doing what other people want you to or you'll be miserable. At some point you just have to be yourself.,Dan Marino,Wedding
Christmas carols always brought tears to my eyes. I also cry at weddings. I should have cried at a couple of my own.,Ethel Merman,Wedding
"If it were not for the presents, an elopement would be preferable.",George Ade,Wedding
I have great hopes that we shall love each other all our lives as much as if we had never married at all.,Lord Byron,Wedding
"I think a lot of people get so obsessed with the wedding and the expense of the wedding that they miss out on what the real purpose is. It's not about a production number, it's about a meaningful moment between two people that's witnessed by people that they actually really know and care about.",Jane Seymour,Wedding
"For me, life has either been a wake or a wedding.",Peter O'Toole,Wedding
"I see an insidious problem in the marketing of weddings as 'the happiest day of your life.' The pressure that is placed upon this event to be the alpha and omega of your entire existence makes it, I think, into a kind of nuptial New Year's Eve, and we all know how that usually turns out.",Jessi Klein,Wedding
I want the big drama. I always said I don't want a wedding I want a parade.,Star Jones,Wedding
A person's character is but half formed till after wedlock.,Charles Simmons,Wedding
"I really did put up all my wedding pictures on my website. And I swear to you, my wedding pictures got downloaded just as much as my bikini pictures.",Cindy Margolis,Wedding
Wedding: the point at which a man stops toasting a woman and begins roasting her.,Helen Rowland,Wedding
The first thing I did when I sold my book was buy a new wedding ring for my wife and asked her to marry me all over again.,Nicholas Sparks,Wedding
Quarrels often arise in marriages when the bridal gifts are excessive.,Antisthenes,Wedding
The trouble with wedlock is that there's not enough wed and too much lock.,Christopher Morley,Wedding
I'm one of those people who has always been a bridesmaid.,Piper Laurie,Wedding
I don't think it's possible to have a wedding without it being stressful!,Debra Messing,Wedding
O month when they who love must love and wed.,Helen Hunt Jackson,Wedding
"The press is just not your friend when it comes to a marriage. That's why we didn't sell the pictures of our wedding, and we got offered millions of dollars for them, millions.",Katy Perry,Wedding
"All weddings, except those with shotguns in evidence, are wonderful.",Liz Smith,Wedding
I don't ever really feel that wearing my wedding ring is what determines me being married or not.,Jessica Simpson,Wedding
I don't know nothing about no marriages or nothing. I ain't even never been to a wedding.,Mike Epps,Wedding
A young bride is like a plucked flower; but a guilty wife is like a flower that had been walked over.,Honore de Balzac,Wedding
No wedding bells for me anymore. I've been happily married to my profession for years.,Shirley Bassey,Wedding
I think that weddings have probably been crashed since the beginning of time. Cavemen crashed them. You go to meet girls. It makes sense.,Christopher Walken,Wedding
"When I design a wedding dress with a bustle, it has to be one the bride can dance in. I love the idea that something is practical and still looks great.",Vera Wang,Wedding
"For a girl, the wedding is when you're married. For a guy, it's when you get engaged. It takes a real aggressive human being to back out between the ring and the wedding.",Max Greenfield,Wedding
I get very nervous when I have to take my wedding ring off.,Jerry O'Connell,Wedding
A wedding is such a girl thing.,Selma Blair,Wedding
It was only literally hours after the wedding when he felt he didn't have to keep up the facade.,Trisha Goddard,Wedding
You may invite the entire 35th Division to your wedding if you want to. I guess it's going to be yours as well as mine. We might as well have the church full while we are at it.,Bess Truman,Wedding
"People always complain, 'you never invited me to your wedding', but I prefer casual weddings.",Sinead O'Connor,Wedding
I think a lot of people who feel as though they desperately want to be married oftentimes simply desperately want to have a wedding.,Elizabeth Gilbert,Wedding
"When he came back from downtown, he had forgotten to bring his license, his identification, the $2 for the wedding license. So we got married two days later.",Eydie Gorme,Wedding
"No jealousy their dawn of love overcast, nor blasted were their wedded days with strife; each season looked delightful as it past, to the fond husband and the faithful wife.",James Beattie,Wedding
"A wedding anniversary is the celebration of love, trust, partnership, tolerance and tenacity. The order varies for any given year.",Paul Sweeney,Wedding
I'm not really that girl who dreams about her wedding day.,Taylor Swift,Wedding
"Fabrics such as raw silk, velvet, shimmer, satin and georgette work well for the wedding season.",Masaba Gupta,Wedding
"The four rings on my wedding finger are all very significant - my wedding ring, my mum's wedding ring and the engagement rings of my granny and mother-in-law.",Mary Nightingale,Wedding
"We all have special numbers in our lives, and 4 is that for me. It's the day I was born. My mother's birthday, and a lot of my friends' birthdays, are on the fourth; April 4 is my wedding date.",Beyonce Knowles,Wedding
"The pilot is the wedding, and the series is the relationship.",Thomas Gibson,Wedding
A wedding dress is both an intimate and personal for a woman - it must reflect the personality and style of the bride.,Carolina Herrera,Wedding
The most dangerous food is wedding cake.,James Thurber,Wedding
For years my wedding ring has done its job. It has led me not into temptation. It has reminded my husband numerous times at parties that it's time to go home. It has been a source of relief to a dinner companion. It has been a status symbol in the maternity ward.,Erma Bombeck,Wedding
"When I was a seminarian, I was dazzled by a girl I met at an uncle's wedding. I was surprised by her beauty, her intellectual brilliance... and, well, I was bowled over for quite a while.",Pope Francis,Wedding
"When I got married, the Sun ran the headline: 'Here comes the bride, all fat and wide.' Luckily, it was a few days after the wedding - but it was still hideous to read at a great romantic moment.",Jo Brand,Wedding
"You can give poor people this royal wedding to watch and make them feel good about themselves, or you can give them something useful like, I don't know... a toaster.",Bo Burnham,Wedding
"He is a Hindu NRI and I am a Christian, so I did a court marriage and had a Catholic wedding. The wedding was intimate with just family members.",Rakhi Sawant,Wedding
A wedding is a funeral where you smell your own flowers.,Eddie Cantor,Wedding
"I've chosen my wedding ring large and heavy to continue forever. But exactly because of that all the time that Dave and I have an argument I feel it like handcuffs, and on anger time I throw it in a basket. Poor Dave, he bought me three wedding rings already!",Carmen Miranda,Wedding
"Personally, I would miss a wedding. I would miss childbirth. I would miss a bar mitzvah just to see me talk at all.",Maxwell Jacob Friedman,Wedding
"Wedding is destiny, and hanging likewise.",John Heywood,Wedding
I wore a $30 vintage wedding dress for my 8th birthday in an underground jazz club in Seattle. This was what I wanted.,Dove Cameron,Wedding
"In Italy, they say rain on your wedding day is symbolic of fresh beginnings, cleansing, a pure marriage, and also a wet knot that can't be untied.",Whitney Wolfe Herd,Wedding
I tie my wedding ring around my neck with an old shoelace. It's to remind me of why I play cricket: for my family - my wife Ruth and my boys Sam and Luca.,Andrew Strauss,Wedding
"When widows exclaim loudly against second marriages, I would always lay a wager than the man, If not the wedding day, is absolutely fixed on.",Henry Fielding,Wedding
Gene Mean. He come to my wedding. He always make the Sheikie Baby look No. 1 on the promo. He know the camera zoom... it make the legend the real. Forever nobody better than the Gene Mean. I love him forever.,The Iron Sheik,Wedding
I've been in a couple of weddings where the coolest people that were the most day before so mellow and then the day of the wedding freaking out.,Matthew McConaughey,Wedding
"Our whole wedding cost 180 bucks. Afterward, we re-heated lasagna for everyone and set off fireworks.",Larry the Cable Guy,Wedding
"I am happy. I have a wonderful marriage. I was in a not-great second marriage for 20 years, then I fell in love with Steve, my first husband, again, and we remarried. I wore the dress from our first wedding in 1982 - it was tight, but I could get into it.",Marie Osmond,Wedding
I hated the royal wedding.,Morrissey,Wedding
"I cannot stand when you go to a wedding and get fed tiny portions. I want everyone to have a good feed on my wedding day, so I plan on having several types of sausage, mash, and gravy up for grabs. Every guest will have a Yorkshire pudding, too!",Jon Richardson,Wedding
I only wear two rings: a wedding ring and my World Series ring.,Joe Garagiola,Wedding
"My uncle was an Elvis impersonator - his name was Perry, and he went by 'Elvis Perry' - and my work as a wedding singer landed me a spot in his act.",Ryan Gosling,Wedding
"Well the wedding in the words of the Archbishop of Canterbury was a fairy tale and there was a huge public impress, investment of goodwill, affection and indeed money in this Institution. It was a huge success at the time.",Anthony Holden,Wedding
My favourite flowers are English country roses - I had a bouquet of them for my wedding.,Kate Moss,Wedding
"Do I believe in coupling? Do I believe in commitment? Do I believe in co-parenting, raising children together, having a family, and growing old with someone? I absolutely believe in all of those things. I just don't believe that you need to be married to do that. I love going to weddings, though. I do love a good wedding.",Laura Wasser,Wedding
"I've always dreamt about having kids more so than my wedding day. When it comes to colors, flowers, dresses... no idea. But if you ask me about kids; how many I want, names, genders? I'll have a full list for you!",Kaitlyn Bristowe,Wedding
"Neil Gaiman is a star. He constructs stories like some demented cook might make a wedding cake, building layer upon layer, including all kinds of sweet and sour in the mix.",Clive Barker,Wedding
"There was no relationship between a wedding dress and fashion. There was no good taste, either. I realized that I could make an impression in terms of changing and readdressing the whole industry of bridal.",Vera Wang,Wedding
I would have been happy being in a wedding band.,Lewis Capaldi,Wedding
"We Georgians are really into food and drink. We would never have finger food at a party or a wedding - celebrations are always one long meal, on one long table, with endless toasts.",Katie Melua,Wedding
"The prenup needs to be drawn up months before the wedding, not days - it's not something you slap together and sign in the car on the way to the ceremony. A shotgun prenup might not hold up in court.",Suze Orman,Wedding
"I think the biggest thing that I have to do is to remind people that poetry is there for us to turn to not only to remind us that we're not alone - for example, if we are grieving the loss of someone - but also to help us celebrate our joys. That's why so many people I know who've gotten married will have a poem read at the wedding.",Natasha Trethewey,Wedding
Your wedding can be the most memorable day and night of your life... or just another party.,Steven Crowder,Wedding
I wore an Urban Outfitters dress on my wedding day. It was one I had in the back of my wardrobe. It was white. We went to City Hall here in New York. I wore it with blue velvet boots my husband bought for me. I loved it. It was my favorite thing. It was chilled and spontaneous.,Kaya Scodelario,Wedding
"Things like, when a total stranger says, 'I want you to record something for my forthcoming wedding,' that can be a bit tiresome. But it's a high-class problem. It doesn't hurt my feelings.",Matt Berry,Wedding
"I learned hard lessons in life; I had to because I had so much happen: My mother died my sophomore year in high school. The next year, same day, my brother dropped dead. Two years after that, I got married because my girlfriend got pregnant. The year after my wedding, my father - who I had only recently met - died.",Bernie Mac,Wedding
I really was about to pass out during my entire wedding. I just didn't know if I could marry anybody.,Patricia Richardson,Wedding
I wish I could wear 10 dresses to my wedding. It's so sad that you put it in storage and then never see it again. I am going to sleep in mine after I wear it.,Eva Longoria,Wedding
"I spent thousands of thousands of hours playing the piano, and by thousands of hours, I mean playing in cover bands or wedding bands or disco bands or original bands or playing cabaret for Todd McKenney.",Tim Minchin,Wedding
"Sepia in particular tends to make everything look a bit romantic and almost sentimental, hence the fact that it remains such a popular choice for wedding photographs.",Martin Parr,Wedding
"Fantasies can be great, but we shouldn't make the wedding a fantasy, because the wedding is the gateway to married life. It shouldn't be a moment of illusion; it should be a moment of preparation.",Alain de Botton,Wedding
"I wanted to define the vocabulary of a wedding both visually and intellectually. The book is about more than weddings or wedding dresses. It's a metaphor for women's lives, their creativity.",Vera Wang,Wedding
"When I was little, I watched a lot of Disney movies - so I always imagined a big fairytale wedding as a kid. But when marriage became real, I felt an intimate wedding with close family and friends would be better.",Hazel Keech,Wedding
"I use Pinterest for everything. Book collections, trips, hobbies. It's all there. I planned my wedding on it. When I had a kid, I planned all his stuff on it. So it was nice to discover that I wasn't the only one.",Ben Silbermann,Wedding
"I can't tell you how lucky I feel. I've gotten to work Peter Facinelli 'American Odyssey,' and I got to do 'My Big Fat Greek Wedding 2' - which really gave me such a tremendous amount of pride and patriotism, and it was very close to my heart. I've really had such great support, so many great teachers, and so many wonderful people surrounding me.",Elena Kampouris,Wedding
"If I felt, in the event of a royal wedding, inspired to write about people coming together in marriage or civil partnership, I would just be grateful to have an idea for the poem. And if I didn't, I'd ignore it.",Carol Ann Duffy,Wedding
"I mean, I do wear a wedding ring and take it off when I shoot.",Henry Ian Cusick,Wedding
"It's always great to have things from France at a wedding. It's symbolic of style, of culture, of taste.",Andre Leon Talley,Wedding
"I did calligraphy for the invitations for, like, Robin Thicke and Paula Patton's wedding.",Meghan Markle,Wedding
Sometimes it hurts when I see my role being edited. But that wasn't the case with '15 Park Avenue... ' or 'Monsoon Wedding.',Shefali Shah,Wedding
"Weddings are such a microcosm of norms, of traditions, and in those traditions, there are a lot of things that have been sort of codified: misogyny and ownership and the patriarchy. So what happens when two very, very disparate families come together for one wedding?",Peter Paige,Wedding
"It happened in Miami, in Coral Gables, a great big ol' Cuban wedding. It was pretty intense.",Jon Secada,Wedding
"I met Jason on a charity walk in 2001, and we got married on a friend's boat in Panama two years later. It was the perfect wedding for two people who'd already been married and who weren't teenagers.",Mariella Frostrup,Wedding
After 'Wedding Crashers' I was just surprised as to the lack of comedic female material there is. So I had to start working and getting stuff out there for myself.,Isla Fisher,Wedding
God forbid I do the 'Electric Slide' at a wedding or something. People would lose their minds.,Cris Collinsworth,Wedding
"I've always wanted to get married and have a family, but I'm not the girl who sat down and planned out her wedding, her dress, or how everything would go with the proposal.",Rachel Lindsay,Wedding
"I have a memory of my mother kneeling in front of a cabinet in our home, tenderly cradling her wedding china. We never used the plates; she died in her 40s without ever letting herself enjoy these gorgeous pieces. I told myself that I would use my precious items.",Roma Downey,Wedding
I don't really have many regrets. I did miss a lot of the events in the days leading up to my sister's wedding because I was at a U17 camp. There were moments like that growing up when I felt like I focused too much on soccer. But that's probably the reason I am where I am today.,Alex Morgan,Wedding
I'd hesitated to have a wedding because my gay and lesbian friends don't have that right.,Kathy Najimy,Wedding
"It gave me a lot of pleasure and pride that 90 percent of the crew for 'Monsoon Wedding,' and most of my film, are women. We get the work done, you know, much lesser play of ego... And I really believe in harmony, I believe in working in a spirit of egolessness and that the film is bigger than all of us.",Mira Nair,Wedding
"At my wedding, I was dancing so furiously that I fell hard on my kneecaps. The next morning, my knees were so swollen that I had to get a wheelchair at the airport to go on my honeymoon.",Casey Wilson,Wedding
"Frankly, there is not much demand from home and I don't socialise much - no partying, get-togethers and very rare wedding appearances.",Sudha Murty,Wedding
"'Through sickness and through health' sounds so simple on your wedding day, but in reality, they become significant words that are a huge responsibility and show true character to navigate.",Yolanda Hadid,Wedding
"You know that scene in 'Runaway Bride' when Julia Roberts puts on the amazing wedding dress and looks at herself in the mirror and goes, 'Swish, swish'? I loved that moment so much when I was a little girl.",Lily James,Wedding
"From the beginning, I knew I wanted a beach wedding so I'm thankful looking back that this is how everything turned out.",Maria Taylor,Wedding
"When I had a job catering, I catered a wedding for the Smashing Pumpkins bassist in Indiana. And I served Billy Corgan shrimp off a tray.",Amy Poehler,Wedding
I love the emotional symbolism of the eternity band as a wedding band. It's like wearing the infinity sign on your finger and represents the cyclical and enduring aspect of love.,Louise Linton,Wedding
There's something about wedding dresses that turn you into Cinderella a little.,Jedediah Bila,Wedding
"There is such an emotional connection between the bride and her wedding dress, whereas in ready-to-wear you may just be focusing on color or prints for that particular season.",Jenny Packham,Wedding
"I get people using my admin skills to try to basically plan their wedding or stag night. They say, 'Can you just come up with six tasks for us on our hen night?'",Alex Horne,Wedding
"I try to remember, as I hear about friends getting engaged, that it's not about the ring and it's not about the wedding. It's a grave thing, getting married. And it's easy to get swept up in the wrong things.",Gwyneth Paltrow,Wedding
"The key to a happy marriage is myself being absent for long periods of time. My wife Leesa and I will celebrate our tenth wedding anniversary next year, but if my comedy gigs petered out and I was around the house more, we'd 100% be getting divorced.",Romesh Ranganathan,Wedding
"I'm the person who will go to a wedding and switch the place cards around because I don't want to sit next to someone I don't know, because I'm so bad at chatting to strangers.",Sharon Horgan,Wedding
"It is my childhood dream to have a Christian-style wedding, just like the fairy tales.",Sushmita Sen,Wedding
