quotes,authors,categories
"My father and mother were not that compatible. I don't think they had a good wedding night, and I was the product of that. We weren't close.",Harry Dean Stanton,Wedding
"I myself have never been enchanted by the dream of the white wedding, and, heaven help us, the expectation that this exquisitely catered event should be 'the happiest moment' of one's life.",Elizabeth Gilbert,Wedding
"Come on, planning a wedding, let's be honest, it's not fun. It's not fun being in a wedding.",Wendi McLendon-Covey,Wedding
"I don't follow trends. I make each cake for a particular wedding, or event.",Ron Ben-Israel,Wedding
What happened between the sheets on the night of the royal wedding I cannot tell you. I was not there.,Gyles Brandreth,Wedding
When planning your wedding you make so many decisions: 'Do I want this fork or that fork?' But in the end people aren't going to remember what napkin holder you choose.,Lara Stone,Wedding
I don't think physical therapy is part of most people's wedding routines.,Margaret Brennan,Wedding
"Growing up, most girls have this image of how they want their wedding to be and things like that. I had none of that except for the cake I wanted, and that's what I got. The cake was the first thing we ordered.",Elana Meyers,Wedding
"I love 3-D. I have been a big fan of 3-D for a long, long time. I took my 1988 wedding pictures in 3-D!",John Lasseter,Wedding
"I couldn't tell you my wedding anniversary (although I seem to remember it was in June. Or maybe July. Definitely a month beginning with a 'J,' anyhow. But not January. Um. I think) and people I went to school with get extremely fed up with me when I bump into them in the street and have absolutely no recollection of their faces.",Claudia Winkleman,Wedding
"I wasn't always overweight. I was a skinny little punk of a kid with severe asthma. When I got married at the age of 22, I wore a cut-down size eight wedding gown.",Mary Kay Andrews,Wedding
"The day of my wedding, I got a FedEx in the mail. It was my termination papers. I was fired... on my wedding day.",CM Punk,Wedding
"I'd probably say Bryan Adams I'm Ready.' I love that song, I want it played at my wedding, whenever I get married if I get married!",Maura Higgins,Wedding
It will be a Maharashtrian wedding that will happen in early 2020; I plan to wear a saree for the main rituals. This is what we are looking at right now. But we have to take a call on whether we will go all out or to make it a small family affair.,Neha Pendse,Wedding
"When I auditioned for 'Wedding Crashers,' the producers had never seen any of my other work except for Bond. I got 'Wedding Crashers' partly because I was a Bond girl.",Jane Seymour,Wedding
"We all went to Kelsey's wedding, and yeah, we go to parties. We also go to each other's house. A group of us got together over at Kelsey's and just read through some plays just for the fun of it. That may not be everyone's idea of a good time, but we had a good time.",David Hyde Pierce,Wedding
"The Red Wedding was an amazing experience I'll never forget. We rehearsed it like a play over one whole day, and then shot it over five days.",Michael McElhatton,Wedding
"So I would like my wedding day to be low-key. And maybe I would not wear a wedding dress but something chic and simple, like vintage Chanel.",Jessica Barden,Wedding
"I first got engaged when I was 19, but I just knew there was more of life out there for me. I called it off six weeks before the wedding. I felt terribly guilty because he was such a nice boy, and I was in love with him. But it was the wrong time.",Anita Dobson,Wedding
"I myself was a wedding photographer when I was, like, 16.",Kacy Hill,Wedding
"An embellished top with slim pants is great, even for a wedding.",Brad Goreski,Wedding
"I always have room for another ring, unless it's a wedding ring.",Robert Parish,Wedding
I was a wedding singer as a teenager.,John Legend,Wedding
Disha and I have always been in favour of a close-knit wedding. We want our loved ones to attend our big day and bless us.,Rahul Vaidya,Wedding
I wore one of my own designs on my wedding day.,Emilia Wickstead,Wedding
I'm the sort of person who wants to wear a wedding dress to a wedding.,Sharon Needles,Wedding
"I get offered: 'Here's a girl who's mad at another girl for having a wedding on the same day.' That'll be a big hit, but I don't want to do that.",Amy Heckerling,Wedding
"When it comes to wardrobe essentials, a man should have a well-fitted suit that he can wear to work or a wedding.",Nandita Mahtani,Wedding
"I had always wanted a small, private wedding.",Vatsal Sheth,Wedding
"I've been sober for two-and-a-half years, My children are happy. In August, my wife and I will celebrate our fifteenth wedding anniversary. My band is back together with a sold-out tour.",Trey Anastasio,Wedding
"At the end of the day, whether it was in a little church or Westminster Abbey didn't matter: it was me, as a brother, doing a reading for my sister and her husband at their wedding, and I wanted to do it right.",James William Middleton,Wedding
"Kareena and Saif want to have a small, private wedding, and only the immediate relatives of the Kapoors and the Khans, and friends close to my children have been invited.",Randhir Kapoor,Wedding
"Young people: marry simply, start your life, and party later. Think of how much babysitting for your future colicky baby you could buy with that wedding budget. Think of how much marriage therapy you could buy. Invest in your marriage, not your wedding.",Glennon Doyle Melton,Wedding
"Part of me believes that Beyonce and Jay-Z were naive when they chose to celebrate their five-year wedding anniversary in Cuba. However, as the daughter of a former political prisoner in Cuba, I would argue that they should have known better than to travel to the island and support its repressive regime.",Mercedes Schlapp,Wedding
"People ask if my parents are hippies, but they're actually very conservative. A girl called Rebel sang at their wedding, and that's where my name came from.",Rebel Wilson,Wedding
"My problem with the wedding industry started when I studied in college and liked to have the television on in the background, and 'A Wedding Story' on TLC always came on, and I'd get irritated that the story of two people making a lifelong commitment to each other could be encapsulated in a half-hour show about the party they throw.",Jessica Valenti,Wedding
"My husband and I click wedding rings sometimes and say, 'By the power of the Castle of Greyskull!'",Tamora Pierce,Wedding
My attachment to my wedding ring is a powerful symbol of the infinite love that I have for my wife and children.,Gad Saad,Wedding
I just wasn't one of those girls who dreamt of her wedding day and the birth of her first child.,Sarah Jessica Parker,Wedding
The most precious item I have is my wedding dress.,Monica Galetti,Wedding
"I like Shane and Falguni Peacock. I keep telling girls that if I marry them, I'll buy them wedding trousseau from Peacock.",Sooraj Pancholi,Wedding
"One of the most common reasons people renovate their homes is a change in their lifestyle - an upcoming wedding, a new baby, or grown children moving away.",Candice Olson,Wedding
I refuse to sing at wedding functions even if I'm offered 1 crore.,KK,Wedding
"The first wedding dress I ever made was for myself. It was at a time when I had my business up and running, but it was still very early days, and I thought, 'This is my moment to do whatever I like.'",Emilia Wickstead,Wedding
"I'm quite sure we all have a sweet love song that we dance to or recall from our wedding or something, like 'At Last,' but I think that it is the love-gone-wrong songs that touch even men.",Jennifer Holliday,Wedding
"With a wedding gown, I have to make sure that people fall in love with it and that the details are very specific and special. There has to be a big story behind it and a great deal of integrity when it comes to the design.",Jenny Packham,Wedding
My grandfather Frank Lloyd Wright wore a red sash on his wedding night. That is glamour!,Anne Baxter,Wedding
"Think about the energy that you want to bring and create for everyone and stay true to that. At our wedding, we wanted everyone to enjoy the party and dance!",Jenna Johnson,Wedding
I found my wedding dress about a week after we got engaged.,Kiki Bertens,Wedding
"On my wedding day, I gifted my wife a platinum ring.",Vijender Singh,Wedding
"Hats are the epitome of Englishness, and a royal wedding is the penultimate moment for a hat designer. I'm Irish, but I am a royalist and I believe in fantasy.",Philip Treacy,Wedding
"One time when somebody showed up in a wedding dress, but I never knew if it was a joke, or she was serious. She asked me to marry her. She was serious. It was pretty funny.",Bryan White,Wedding
You can easily take photographs at a wedding - no one would question it. But funerals are different.,Martin Parr,Wedding
I think a perfect wedding would be where only your close family and friends are there.,Disha Parmar,Wedding
"I wanna stay an eternal girlfriend. I want to have my boyfriend's children, but I don't think we need a piece of paper to regulate the game, and we don't have to go through the whole stress of a wedding and suffering to throw a good party.",Shakira,Wedding
"On my wedding day. I didn't want a natural, blushing-bride look - I had a full-on hairdo and red lips. I thought it would be disingenuous to do the whole virginal look, so even though I had the white dress, I had pink net underneath.",Sophie Ellis-Bextor,Wedding
"In the Mexican culture, we never miss a baptism, a birthday, a baby shower, a wedding shower, a wedding. You must show up. Otherwise, you'll be in big trouble.",Eva Longoria,Wedding
"I hope that when I'm 80 years old, people will still be talking about my wedding.",Jennifer Hudson,Wedding
"Sure, men like a challenge - but so do women. And nobody likes to be challenged all the time. I know plenty of long-standing happy couples who slept together right away, spent hours yakking on the phone, split checks down the middle, and lived together for years before the wedding.",Katha Pollitt,Wedding
So many of our businesses rely on green card holders - how are we supposed to attract these people if they think they'll be detained at the airport if they go abroad for a wedding or just to show their baby to relatives?,Raja Krishnamoorthi,Wedding
"It's interesting because a lot of my 16-year-old kids' friends know me from 'Wedding Crashers,' and not so much Bond. My kids have a good laugh. I was 20 then. The look I had then was the look that a lot of their friends are assuming now. They think it's cool. What goes around comes around.",Jane Seymour,Wedding
"Narciso Rodriguez was my first fashion big brother. He made my wedding dress, which was wonderful.",Claire Danes,Wedding
We're pretty sure Liz fell pregnant on our wedding night.,Kelvin Fletcher,Wedding
"As I grew up and began identifying myself as a feminist, there were plenty of issues that continued to make me question marriage: the father 'giving' the bride away, women taking their husband's last name, the white dress, the vows promising to 'obey' the groom. And that only covers the wedding.",Jessica Valenti,Wedding
"I'm used to being in front of camera and knowing what to think. But if you're asking me to be me, I get very self-conscious. My job isn't to be me. Being an actor, people think you can do a eulogy at a funeral, a speech at a wedding. I find all that very nerve-racking.",Eddie Marsan,Wedding
"Celebrities work all their lives for attention, so I never get bothered about the attention on our relationship or wedding.",Rahul Vaidya,Wedding
"Growing up, I had one very specific idea of what a wedding should be, and that was the wedding of Fraulein Maria and Captain von Trapp in 'The Sound of Music.'",Ellie Kemper,Wedding
"My wedding dress was featured by 'Vogue' and 'American Town and Country,' and from there, people started to come to us because they had seen that dress.",Emilia Wickstead,Wedding
I was working for Martin Finnegan. He was my best mate in racing. I went to his wedding in November 2007. No-one else from the racing world was invited apart from me and my girlfriend. The funeral was the following May.,Guy Martin,Wedding
"We had already planned my wedding when my brother passed away in 2012. When you're grieving, you don't necessarily want to think about something like that, but my brother told me that he wanted me to, so we went ahead and did it.",Yaya DaCosta,Wedding
"As difficult as it was to break off the wedding, we wanted to be in a better place together - especially when you go through a life-changing event like a wedding.",Maria Taylor,Wedding
I was never the girl who tore pictures out of wedding magazines.,Camila Alves,Wedding
"In the late '80s, as a child, I used to shoot short films on my friend's wedding camera.",Sajid Khan,Wedding
Christmas Eve is my wedding anniversary so it is a double whammy.,Sheila Hancock,Wedding
I'm not into being all 'film-y' and going to the premieres and parties. I tend to feel like the embarrassing uncle at a wedding.,Simon Beaufoy,Wedding
I can wear a sexy dress to any red carpet event. My wedding is my chance to go all the way and wear a princess silhouette.,Roselyn Sanchez,Wedding
"I never wear any makeup over the weekend, unless I'm going to a wedding!",Holly Willoughby,Wedding
"My husband and I got married in D.C. at the Decatur House. We met here, we got married here - our wedding pictures have the White House in the background.",Margaret Brennan,Wedding
"I had all kinds of fantasies, like a lot of girls, but did I actually go through the motions of planning a wedding and buying bridal magazines and imagining things and setting up who would play what role? No. Because as I grew up, I started to believe that I would be one of those gals that never got married.",Sara Ramirez,Wedding
"You know, my endeavour is to blend into the larger picture. That was one of the strengths of my acting in 'Monsoon Wedding.'",Shefali Shah,Wedding
"It's not that I think weddings - or marriages - are letdowns. It's just that I want to see my wedding as one awesome achievement on a continuum of achievements, all of which were, in their way, just as beautiful and profound for having led me to the current one.",Jessi Klein,Wedding
"In marriage there are no manners to keep up, and beneath the wildest accusations no real criticism. Each is familiar with that ancient child in the other who may erupt again. We are not ridiculous to ourselves. We are ageless. That is the luxury of the wedding ring.",Enid Bagnold,Wedding
"The Queen's wedding dress in 1947, there was some embroidery on the train which was definitely there to illustrate new dawn/post-war optimism, that sort of thing.",Kate Reardon,Wedding
"I like wearing my wedding ring, it's nice.",Jerry O'Connell,Wedding
I've always worn my wedding band when I'm working out. A few years ago I realized how dangerous wearing a metal band could be and switched to silicone.,Rich Froning Jr.,Wedding
"I think the only consistent thing is that I like projects that explore different social themes. 'Our Family Wedding' is a comedy, but it deals with two different cultures coming together. It's also about people letting go.",Forest Whitaker,Wedding
"No matter how you handle alcohol at your wedding, you will most likely be upsetting someone.",Emily V. Gordon,Wedding
"Poor people have to pay high rents to marriage halls for conducting functions like wedding. Therefore, to benefit them, I have directed constructing 'Amma Marriage Halls.'",J. Jayalalithaa,Wedding
"I'd been a wedding singer through college, but after a few years of doing my best renditions of jazz standards to clinking glasses and the sound of forks on salad, I thought, 'Oh God, if this is all I do, I'll never be able to live with myself.'",Idina Menzel,Wedding
"The wedding ring on my left hand was bought by my grandfather, Samuel Miliband, in Brussels in 1920. I never knew him, as he died when I was one. But his ring was kept by my aunt until it was placed on my finger by my wife Louise 32 years later.",David Miliband,Wedding
"I'm a jewelry girl. I became with friends with designer Irene Neuwirth a few years ago. At that point, I just used to wear my wedding rings. Very low key. Now, if I could, I'd be draped from head to toe in her jewelry all the time. Everything she makes is beautiful.",Busy Philipps,Wedding
"My friends asked me to be a reverend at their wedding in France a few years ago. I went on the Internet, and within 15 seconds, I was printing out a certificate which allowed me to officiate at their wedding.",Lucy Punch,Wedding
"A tradition I remember from my childhood was that when there was a wedding in any one family, the entire village shared the responsibility and contributed. Regardless of the caste or community, the bride became the daughter of not just a single family but of the entire village.",Ram Nath Kovind,Wedding
"Prop 8 did something that no other state in the history of this country has done. It took away the rights of people that already were legally affirmed. Imagine someone putting something on the ballot saying your wedding, your marriage is no longer valid.",Gavin Newsom,Wedding
"Even under the best circumstances, speaking at your own wedding ceremony is a high pressure endeavor. What even constitutes a vow? I always picture them as exclamations you bellow at the sky.",Josh Gondelman,Wedding
"All the information you could want is constantly streaming at you like a runaway truck - books, newspaper stories, Web sites, apps, how-to videos, this article you're reading, even entire magazines devoted to single subjects like charcuterie or wedding cakes or pickles.",Mario Batali,Wedding
"I am usually part of any disaster at a wedding if I'm a bridesmaid, which I've been lucky enough to be several times.",Jennifer Garner,Wedding
I don't want a huge wedding. I don't want it to be some huge spectacle.,Kristin Cavallari,Wedding
I didn't know the colors of my wedding or what my bouquet would look like!,Gail Kim,Wedding
I sang 'All Of Me' at the wedding. I sang 'Stay With You' from my first album. And then Stevie Wonder came up and sang 'Ribbon In the Sky.' It was impromptu... It was cool... He's always been a friend and a mentor to me.,John Legend,Wedding
Kanye has been a good friend for ten years. He flew back from London to Los Angeles for 24 hours just to go to my wedding.,Harley Pasternak,Wedding
I love a black wedding dress.,Vera Wang,Wedding
"In my head, at least, the business of spinning stories has no closing time. Twists in my characters' lives, glimpses of their secrets, obstacles to their dreams... all arrive unbidden when I'm getting cash at the ATM, walking my son to camp, singing a hymn at a wedding.",Julia Glass,Wedding
"Seriously I suspected I was a good actor, though I didn't know it during 'Monsoon Wedding.' Now I realize the more I learn, the less I know about acting... and life.",Randeep Hooda,Wedding
"I used to work all the time, and now if there is a wedding, there's a concert, I'm there.",Petra Nemcova,Wedding
"So many people say you have to remember to grab hold of your bride or groom and spend time with them. I think if we had done a traditional wedding, we would have been doing it for everyone else, but this was about the two of us.",Katherine Kelly,Wedding
I'm taking one thing at a time. With the children and launching my solo career it would drive me to a nervous breakdown if I tried to organise a wedding on top of that.,Natasha Hamilton,Wedding
I was a bridesmaid at a wedding in one picture.,Dorothy Malone,Wedding
Well... Actually I got picked because I was the only one who fit the wedding gown - they had my size.,Kevin McDonald,Wedding
I'll get pretty much everything the way I want it. I've always dreamed of a beach wedding.,Nicole Appleton,Wedding
The one thing that I'm in charge of in this wedding is the food.,Rob Mariano,Wedding
We are all so close. We are godfather to each others' kids. I was the best man at Jesus' wedding.,Juan Marichal,Wedding
"I saw a photograph of a wedding conducted by Reverend Moon of the Unification Church. I wanted to understand this event, and the only way to understand it was to write about it.",Don DeLillo,Wedding
"I've never crashed a wedding. When I was a kid I, of course, used to crash parties. Crashing a wedding is difficult though because you have to have the suit, and you have to have information in case someone catches you. You have to know at least some names and something.",Christopher Walken,Wedding
"I feel as though my career really hit its high point when I was cast as a supporting actress in 'American Wedding'. I thought the script had a lot of depth and intelligence, and it really just jumped off the page.",January Jones,Wedding
"I've been looking at some video clips on YouTube of President Obama - then candidate Obama - going through Iowa making promises. The gap between his promises and his performance is the largest I've seen, well, since the Kardashian wedding and the promise of 'til death do we part.",Mitt Romney,Wedding
"I was the official wedding photographer at one of my best friends' weddings. Fortunately she was one of the most easygoing brides ever, so she made it easy for me.",Natalie Coughlin,Wedding
"My biggest blast-off hit was 'You Raise Me Up.' If you ever have a wedding or a funeral, it's a good pick.",Josh Groban,Wedding
I want a big church wedding.,Sienna Miller,Wedding
I think everyone dreams of that nice romantic wedding.,Lance Bass,Wedding
"I use filming as an excuse to take classes. I got my certification in sailing for 'Wedding Crashers,' and now I can handle a 26-foot boat. I played a seamstress once, so I took sewing classes. I love dipping into these other lives.",Rachel McAdams,Wedding
"On the publicity tour of 'My Big Fat Greek Wedding,' I was asked over and over again, if, as the writer, I felt it was a fair depiction of real life to have someone of my er, below average looks, hook up with hottie John Corbett.",Nia Vardalos,Wedding
I thought I was attractive when I shot 'My Big Fat Greek Wedding.' Studio executives and movie reviewers let me know I had a confidence in my looks that was not shared by them.,Nia Vardalos,Wedding
I went looking for dresses and realized there was a niche I could fill in the wedding dress market.,Monique Lhuillier,Wedding
"That to me was the most poignant part of Diana's wedding; as she was walking up the aisle and her eyes were going left to right, looking at people and smiling in the way that Diana did - and that diamond tiara glittering like mad. It was great.",Bruce Oldfield,Wedding
"When I celebrated my bar mitzvah, there was no cake. Today, there is no such thing as a bar mitzvah in the United States without a special cake. It can be even more complicated and expensive than a wedding cake, because bar-mitzvah cakes are often based on a particular theme.",Ron Ben-Israel,Wedding
"It's important to still look like yourself on your wedding day, so I didn't do anything drastic.",Lily Aldridge,Wedding
"I would absolutely, definitely never sell my wedding pictures to a magazine. I'd like it to be a special day, not a photo shoot. And once you've done that, your marriage becomes everybody else's business.",Katherine Jenkins,Wedding
"I love doing comedy. Absolutely love it. After 'Wedding Crashers,' people suddenly realized that it was something I could do.",Jane Seymour,Wedding
"My wedding was at home, so I didn't really want to wear a veil in my house. Instead I wore a lot of diamond hair clips. They were brooches, actually, designed by Lorraine Schwartz.",Georgina Chapman,Wedding
I think if you're at the point where you're popular enough to sell your wedding photos to OK! Magazine then you don't need the money.,Johnny Vegas,Wedding
"I was never a girl who dreamed about what her wedding day would be like, but I've always dreamed about decorating my baby's nursery.",Rebecca Romijn,Wedding
"I got my first big paycheck for 'My Best Friend's Wedding.' This was in the days when you actually did get paid to have a supporting role. It just doesn't happen like that anymore, but this was in the '90s. It was the golden age!",Carrie Preston,Wedding
"Jody Hill, who I created 'Eastbound And Down' and 'Fist Foot Way' with, was my best man at my wedding.",Danny McBride,Wedding
You have to make your wedding day all about you.,DJ Jazzy Jeff,Wedding
"If you're going to plan a wedding, then a certain amount of suffering is not a choice.",Ellie Kemper,Wedding
"When I planned my wedding the first time, my ex-husband and I, we were both struggling comics. I had a TV show that had gotten cancelled. Basically, I rented a wedding gown; the reception hall smelled like feet.",Sherri Shepherd,Wedding
"For my first wedding, I cried all the way down the aisle. My fake eyelash came off. My nose was red. My eyes were swollen. I'm not one of those pretty criers.",Sherri Shepherd,Wedding
"I had a 2-week courtship with a fellow student in the fiction workshop in Iowa and a 5-minute wedding in a lawyer's office above the coffee shop where we'd been having lunch that day. And so I sent a cable to my father saying, 'By the time you get this, Daddy, I'll already be Mrs. Blaise!'",Bharati Mukherjee,Wedding
"My family is almost exactly like the one in 'Monsoon Wedding'. We are very open, fairly liberal, loud people.",Mira Nair,Wedding
"I usually have a few coins in my pocket when I'm playing, but the one I use to mark my ball on the green is a special silver coin that my wife designed for me. It has our wedding date inscribed on it.",Louis Oosthuizen,Wedding
