quotes,authors,categories
"My mom used to make my costumes when I was little; she sews a lot. One year, I was a bride and I had a big wedding dress and a bouquet. Another year I was a medieval princess with a long teal dress and a veil. It was a little extravagant, but it was cute!",Sasha Pieterse,Wedding
My mother and father had a terrible marriage. They celebrated their wedding anniversary one year with their friends. Why did they celebrate? Maybe because they had lasted so many years without killing each other.,Marina Abramovic,Wedding
"I haven't made many wedding dresses. It's a dress very, very important for the girl; it's important to know the person, I believe, but at the same time it should be a shock to the person - the person should be shocked to be suddenly revealed. That's the work of a designer sometimes, to propose an ID of look.",Olivier Theyskens,Wedding
It was never important for a wedding to be about anything other than me and my partner. A big celebration was never my cup of tea.,Mandy Moore,Wedding
"I'd like to do 'My Best Friend's Wedding,' 'Pretty Woman,' Meg Ryan type stuff. Romantic comedies. I'd love to do some action stuff as well.",Jennifer Love Hewitt,Wedding
I do not have a bride gene. I haven't been planning a wedding since I was 3. I never put a sheet on my head and pretended that it was a veil.,Niecy Nash,Wedding
"When I got married in 1991, I had never been to a wedding, so I didn't know that my wedding was tacky. I didn't know that I was getting married in a quinceanera dress, because there was nobody there to cry over me and tell me I look like a fool.",Niecy Nash,Wedding
I don't want to be Carrie Bradshaw. I don't want the wedding to be bigger than Big. I'm just grateful to know that the first time I fell in love wasn't the last time.,Niecy Nash,Wedding
The most terrifying thing in the world was having to give a speech at my girlfriend's wedding. I was physically shaking and sweating the entire time.,Lindy Booth,Wedding
I've worn a dress at my wedding. I've worn 6-inch Louboutins. I've got no fear and no shame.,A. J. McLean,Wedding
"As a child, as a cinemagoer, I think there is nothing better than being in a cinema or watching a film. I think it's just a while magical... it almost feels like you're at a big party in India, where you're singing, you're dancing, you're laughing, you're crying, you feel like you're at a wedding because our films invariably cover all emotions.",Karan Johar,Wedding
I want John Legend to sing at my wedding.,Sloane Stephens,Wedding
"We rent one in three tuxedos in the U.S. and Canada, and if we make a mistake, our employees will deliver to the customer's home, office, or wedding. We get a couple hundred letters a week praising the service in our stores.",George Zimmer,Wedding
"I always had boyfriends, but I never imagined a proposal or a wedding. To me, that was like having a ball and chain round your neck.",Sandra Bullock,Wedding
Wedding fever is one of the scariest diseases I have ever seen.,Jessica Valenti,Wedding
"I've always had a propensity for getting the cursive down pretty well. What it evolved into was my pseudo-waitressing job when I was auditioning. I didn't wait tables. I did calligraphy for the invitations for, like, Robin Thicke and Paula Patton's wedding.",Meghan Markle,Wedding
"One of the great things about being a writer/journalist is that my boss loves me to go out and do features on being someone else. I did a feature on Kate Middleton, where I went to an incredible fancy state home in the countryside, put on a wedding dress and posed for engagement pictures with a fake Prince William.",Caitlin Moran,Wedding
"My brother liked sewing and sculpting and making things, and my sister sewed and painted and cooked and baked. She's a professional baker now and makes the most gorgeous sculpture-like cakes. She's the queen of wedding cakes in the Lake Tahoe area.",John Lasseter,Wedding
"I love dress shopping, and I love talking about the wedding food. That's what makes me happy.",Chrissy Teigen,Wedding
"Often, what makes my job so exciting is designing for the mother whose dream has been to wear one of my hats at her child's wedding. I feel as responsible for making her feel like a million dollars as I do for somebody in the public eye.",Philip Treacy,Wedding
"If you write a song, and you go into a restaurant, and there's a guy with a piano singing and he's playing piano, singing your song, or you hear it at a wedding or at an airport... it's fun!",Jesse Harris,Wedding
"Whenever I get married, it will be a Bengali wedding. If I won't have a Bengali wedding, my mother won't come. She has warned me. So, I am going to have a Bengali wedding for sure.",Bipasha Basu,Wedding
I want to be a simple bride when I get married. I want a beach wedding where I am running around on the sand in a white dress.,Sonakshi Sinha,Wedding
"Recently, I was preparing to sing Springsteen's 'If I Should Fall Behind' for a wedding and was unable to get through it without tears. My wife handed me 'Love You Forever.' I read it. I cried. But that cry somehow cured me of crying while singing the song. Go figure.",Clyde Edgerton,Wedding
"My sister really drooled a lot when she was younger. For her wedding, I was going to get her one of those lace drool cups that go around the ears.",Cheri Oteri,Wedding
The best thing I ever bought is a vintage Oscar de la Renta short gingham dress that I wore to my rehearsal dinner the night before my wedding.,Kelly Wearstler,Wedding
"I love rings, but I can't wear them. I mean, look at my knuckles. My fingers and joints are so swollen from years of playing. That means no wedding band, either. Luckily, I have a very understanding wife.",Justin Tuck,Wedding
"I love Spanish cities, particularly Barcelona, Madrid and Palma, which has the most amazing cathedral that I once went to for a wedding.",Louise Nurding,Wedding
"When I got married, I hired a great choir - the St. James Choir, an all-black gospel choir - to sing at my wedding.",Brad Paisley,Wedding
"I love dress shopping, and I love talking about the wedding food. That's what makes me happy. If you tell me to do a guest list, I cry. I hate it.",Chrissy Teigen,Wedding
"The proposal is the only thing that the guy has control over in the entire wedding deal. It is your one chance to make this moment stand out, not only for you, but for her.",Drew Seeley,Wedding
"I worked a lot with Nick Knight and John Galliano when John was at Dior. He also made my wedding dress. He'll always hold a special place; I have most of my memorable, iconic moments in fashion with him.",Liberty Ross,Wedding
"I ate no butcher's meat, lived chiefly on fruits, vegetables, and fish, and never drank a glass of spirits or wine until my wedding day. To this I attribute my continual good health, endurance, and an iron constitution.",John James Audubon,Wedding
I can see why people love the idea of a big white wedding - it is a day when they are the centre of attention and get to wear a beautiful dress. But that sounds awful to me because that is like getting ready to walk down the red carpet.,Lucy Punch,Wedding
"Me and the Dap-Kings, the whole band is playing a wedding band in 'The Wolf of Wall Street.'",Sharon Jones,Wedding
"I had a Hebraic wedding in New York, so I'm definitely Jewish.",Amar'e Stoudemire,Wedding
"I think my first experience of art, or the joy in making art, was playing the horn at some high-school dance or bar mitzvah or wedding, looking at a roomful of people moving their bodies around in time to what I was doing. There was a piano player, a bass player, a drummer, and my breath making the melody.",Robert Pinsky,Wedding
"I'm still waiting for someone to call me to cater their wedding. But that's gonna cost you. If you want my cousin Jerez to play the sax, that's going to cost you a little more. The sky's the limit after that.",Coolio,Wedding
Just because marriage didn't work for us doesn't mean we don't believe in the institution. Just because our own marital track records are mixed doesn't mean our hearts don't lift at the sight of our daughters' Tiffany-blue wedding invitations.,Sandra Tsing Loh,Wedding
"I'd want it to be really special to both of us, but I'm a huge fan of 'At Last' as a wedding song. But what's also really cool is songs that no one else would have at their wedding, like an obscure Radiohead song.",Mary Lambert,Wedding
Each youth betrays considerable anxiety about the wedding night ahead.,Gore Vidal,Wedding
"I grew up in a very small town, but it happened to be in western Massachusetts, where there were a lot of gay people. I remember my aunt going to a gay wedding when I was 11, and I thought it was the coolest thing.",Elizabeth Banks,Wedding
"About 80 percent of the photos on Flickr are public and searchable by everyone. In one sense, it's a place where people upload snapshots from the family reunion, wedding or the birth of a baby or something like that, but it's also a place where people go to show what the world looks like to them.",Stewart Butterfield,Wedding
"If I do find myself walking up the aisle and dancing at my own wedding reception, I want the first dance to be both spontaneous and dramatic.",Anton du Beke,Wedding
"I try to study the background of the country I am in and what were my hits there, so I can at least give them some of what they want. It's like a wedding - give them something old, something new, something borrowed and definitely something blue!",Betty Wright,Wedding
"I just went to a wedding of a friend of mine who happens to be gay. Because somebody doesn't think the way I do, doesn't mean that I can't care about them or can't love them.",John Kasich,Wedding
"In 1966, I bought my parents a carriage clock for their silver wedding anniversary. It was last wound 30 years later, in December 1996, the month my father died.",Clive Sinclair,Wedding
"People didn't just wear wedding dresses in the past. They also wore plain cotton shifts beneath them. As pretty as the dresses might be, and as lovely as they might look on display, if a museum doesn't hang the shifts beside them or acknowledge that the shifts existed, that exhibit's incomplete.",Susanna Kearsley,Wedding
"Somebody ripped their pants open at my wedding, dipping my mother. My mother is not a lady who throws herself into a dip that often, so I don't think he thought she was really going to do it.",Melissa McCarthy,Wedding
"I'm obsessed with Kate Middleton. Obsessed. I loved the Royal Wedding. I was so cynical going into it, and pseudo-political about the whole thing, but as soon as I saw her, I was utterly charmed. I'm just completely enchanted by Kate and William.",Anne Hathaway,Wedding
"My five best friends, who were my bridesmaids in my wedding, are still my best friends.",Jill Kargman,Wedding
"What the bride should do is call guests who have young children and say: 'I'd love to have the kids at the wedding, but we won't have room. Would you get a baby sitter, and when we get back from our honeymoon, we'll have you guys over?'",Letitia Baldrige,Wedding
You can have a wedding at Fenway Park.,Mike Barnicle,Wedding
"I believe the wedding vows are sacred and precious, and it's been one of my goals as a writer to portray the kind of marriages I've seen modeled in my family - my parents and grandparents, who all celebrated fifty-year anniversaries and well-beyond.",Deborah Raney,Wedding
"Growing up, I had one very specific idea of what a wedding should be, and that was the wedding of Fraeulein Maria and Captain von Trapp in 'The Sound of Music.'",Ellie Kemper,Wedding
"It took two months from the day my fiance proposed to my first Google search for 'wedding planning: how?' Now, let me interrupt myself here and share how much I hate using the word 'fiance.' It's so fancy, and it's hard not to sound like a jerk saying it. Which is why I will be using my own word for fiance: gloob.",Ellie Kemper,Wedding
"I am fully anticipating that something - perhaps many things - will not go according to plan on our actual wedding day. If some of the flowers are wilted, or there aren't enough vegetarian meals, or the priest calls me the wrong name, I will embrace these errors.",Ellie Kemper,Wedding
"I met Kanye. I'm starstruck, man, but I stayed away from that guy. I didn't want him to go on a rant, go off on me. He did it at his wedding.",Jay Pharoah,Wedding
I've already been married six times in my career as an actress - twice as Becky - so I think a wedding of my own might feel too much like work!,Katherine Kelly,Wedding
"Ever since I was a little girl, I wanted Valentino to design my wedding dress. Valentino is the definition of timeless elegance. I don't think there's another couture house like it.",Nicky Hilton,Wedding
"I saw a photo of a Christian Lacroix couture dress when I was in my teens and decided right then that that's how I wanted to look on my wedding day. In my mind, that's what angels looked like.",Margherita Missoni,Wedding
"I loved everything about my wedding look, but, in retrospect, I would have changed the position of where we attached the veil on my head. Make sure you test a few different placements and styles before the big day to make a clear vision and plan with your hairstylist.",Margherita Missoni,Wedding
I don't talk about my personal life in the press; that's how I kept my wedding a secret.,Kerry Washington,Wedding
We served Twinkies and Sno Balls at our wedding. We put them on silver trays so they looked elegant - but they were the real deal!,Dylan Lauren,Wedding
"I'm old school. We're from a small town in Georgia, and I think if we do pictures before the wedding, I think I'm gonna be blindfolded.",Brantley Gilbert,Wedding
"Whenever I went to a wedding or a party, girls kept complaining about their shoes. I love to dance, and I wanted them to have shoes they could keep on all night.",Edgardo Osorio,Wedding
"Ariel may look a lot like Barbie, and her adventure may be limited to romance and over with the wedding bells, but unlike, say, Cinderella or Sleeping Beauty, she's active, brave and determined, the heroine of her own life. She even rescues the prince. And that makes her a rare fish, indeed, in the world of preschool culture.",Katha Pollitt,Wedding
"If you're engaged more than a year, there's something up. There's lot of debate as to whether one should or shouldn't get married, but when you get engaged, it's a promise to get married, and if you don't just do it within a year, one of the parties is using the excuse of, like, 'I can't find the right venue' to put off the wedding.",Nicholas Stoller,Wedding
"Since the day Brahma created the world to this day, no one's ever been able to satisfy a wedding guest. They always find some opportunity or other to find fault and criticise. One who can't even afford a dry piece of bread at home becomes a lord at the wedding party.",Munshi Premchand,Wedding
"I'm really close to my family, and I really want one of my own. But the wedding, it's not necessary for me.",Julia Restoin Roitfeld,Wedding
"There is no way in the world anyone else could do my wedding other than myself, along with whomever I select to do various things.",Aretha Franklin,Wedding
"I was in a fertility situation publicly, so I disappeared. I was very satisfied just being to able to creatively express myself with writing. The white hot publicity that came from 'My Big Fat Greek Wedding' was appreciated but not sought, so I was happy to walk away from it and then write.",Nia Vardalos,Wedding
"It was about 2012, 2013. I started from zero. Small fashion shows, small photoshoots. I've seen a lot. I've seen a lot of things up close. I married my sister off; I gave jahez for her wedding. I tried to keep relations going with my family. I bought a house for them in Multan. My parents are settled in Multan; my house is there.",Qandeel Baloch,Wedding
"I am a celebrity, but I don't want people standing outside my wedding venue.",Divyanka Tripathi,Wedding
"Jo Sykes made these incredible leather jackets: the leather was like butter. I had one, but I lost it at a wedding in Ibiza. It was so sad; I've not been able to replace.",Poppy Delevingne,Wedding
"I still love touring rock clubs around the world, and that's something that's really a part of me. I love making albums, and I'm a wedding singer on the side; that's my parallel career. So I love all those aspects of making music.",Jens Lekman,Wedding
"I didn't go abroad until quite late. A friend drove us to Amalfi, Italy, for his sister's wedding when I was a teenager. It was exciting driving through Europe.",David Harewood,Wedding
I loved 'Monsoon Wedding' and 'Lunchbox' because they had 'real' stories. I wish there are more films made like them.,Garth Davis,Wedding
The first thing I ever saw Bradley Cooper in was 'Wedding Crashers.',Ed Weeks,Wedding
I don't understand why you have to wear a wedding ring to warn people off. You should be able to be faithful to that person without anything on your body to show that you are with someone.,Sam Smith,Wedding
"My wedding was a very private affair for close family and friends, so I had decided to hold a reception in my native town.",Mohit Chauhan,Wedding
I never wanted a big wedding. I never wanted to wear a white dress or throw a bouquet.,Taylor Jenkins Reid,Wedding
"The vibe of my wedding is kind of going to be ethereal. Simple and modern, in a way, but with a lot of greenery. So, eucalyptus, olive branches, moss, and candles - it's going to be very... I want it to feel very comfortable, but obviously sleek.",Sasha Pieterse,Wedding
Onassis told me. He begged me to come to the wedding.,Lee Radziwill,Wedding
"'Endless Love' is such a perfect love song for a wedding or for a Valentine, because that is the committed kind of endless love. All the lyrics are perfect.",Delilah,Wedding
There's no scenario in which I wouldn't want my entire family at a wedding.,Jordan Rodgers,Wedding
The most important item on my desk is a picture of my husband and three kids making kooky faces at my niece's wedding. We all look silly and happy.,Shira Goodman,Wedding
"A delicious smoothie is a really easy way of taking on lots of amazing skin boosting ingredients and was my first port of call every morning in the run-up to my wedding - I'll throw in frozen berries, banana, spinach, almond butter, almond milk, and oats for a quick breakfast quite often.",Ella Woodward,Wedding
"I think when wedding dresses are talked about, every woman has a different set of factors in her mind of what it could be because they've been thinking about it possibly for such a long time.",Giles Deacon,Wedding
I don't want to write poems about the royal wedding. I would have to be moved by the event.,Derek Walcott,Wedding
"Neither my fiance nor I take ourselves too seriously, and we want our wedding to reflect our lightheartedness.",Leah Pipes,Wedding
"I'm definitely willing to film it for sure. I feel like I've taken people on this incredible journey on 'Total Divas' and 'Total Bellas.' They have seen me cry, get angry, and be so many different ways about marriage. I feel like for my fan base, my Bella Army, I should let them tune in to my wedding.",Nikki Bella,Wedding
"I do not want my man to be exhausted for our wedding day, especially our wedding night.",Nikki Bella,Wedding
"About my love life, I would like to say I am single till I have a ring on the right finger and a wedding date.",Krystle D'Souza,Wedding
I love the royal family. I even got up in the middle of the night to watch Kate and William's wedding. And I never miss the Queen's speech on Christmas Day. I feel it's my duty as an English-born woman to watch.,Lily Collins,Wedding
"It's mutual respect and love that are important, not a wedding.",Christie Hefner,Wedding
"I once accidentally 'replied all' and sent an email complaining about my then-boyfriend to a bunch of strangers. It was meant for my friend who was a bride, but I ended up addressing her entire wedding party. Her marriage lasted; my relationship didn't.",Faith Salie,Wedding
"Your wedding day is supposed to be your big day, and yet a lot of engaged couples find that instead of creating an event that will be important to them, they're dodging through a minefield of modern etiquette traps.",Emily V. Gordon,Wedding
"Sometimes we put so much effort into things we're doing, like dating or wedding planning, that we don't stop to think about whether or not we even want the results of that effort.",Emily V. Gordon,Wedding
"I haven't worn make-up since my wedding, and my husband loves me a lot.",Leandra Medine,Wedding
"Biggest rival is Kaillie Humphries of Canada, and we are actually training partners. She was at my wedding, and I consider her a close friend.",Elana Meyers,Wedding
"Having made all the decisions, I think a wedding day is a day when you want to forget what you are wearing and be in the moment.",Jenny Packham,Wedding
"We've been seeing a lot of brides buying two dresses for their wedding, especially in America, and a lot of brides are talking about changing shoes halfway through. It is a very long day to be wearing one pair of shoes, however comfortable they are. It is about marrying that combination of style and comfort together.",Jenny Packham,Wedding
"There is definitely a 'red carpet moment' to a bride's wedding day, but when designing for bridal, it is important to focus on the details that will captivate and capture the imagination of the bride - she has to fall in love with the gown.",Jenny Packham,Wedding
"Old Hollywood icons such as Marilyn Monroe, Vivien Leigh, and Bette Davis are so inspiring; their style is romantic and feminine and their glamour mesmerizing. I love the idea of channeling that spirit on your wedding day.",Jenny Packham,Wedding
"Research the venue and location before outfit shopping, as it helps set the mood and style focus: a traditional wedding in the countryside offers a different set of sartorial rules to a tropical, beach vibe, for instance.",Jenny Packham,Wedding
"I got 'Scandal,' and that was, far and away, the biggest deal that had happened in my career. Simultaneously, the stress from planning my wedding and being in the public eye for the first time, combined with genetics - I got the diagnosis that I had psoriasis, and I was completely embarrassed and ashamed. I felt like a lesser person.",Katie Lowes,Wedding
I was a wedding planner's assistant for years. And I knew I did not want to have a traditional wedding because I had worked a million of them. So my husband and I got married at a sleepaway camp in the Berkshires.,Katie Lowes,Wedding
I've had the kind of complex life I write about. I was a single mother for 12 years. I'd been engaged. The wedding fell through. I then discovered I was pregnant and opted to have the child on my own. I was a professor. I was in my mid-30s. I could manage it financially.,Stephanie Coontz,Wedding
"Any experience of a girl picking out her wedding dress is amazing, but I have to say it was really special to work with David's dad, to see him in action with his team.",Lauren Bush,Wedding
"Even if I am going to an event or a wedding, I try to just look effortless. The more effortless you look, the more chic you look.",Jeanne Damas,Wedding
"If you have a guy over, and there's a whole bunch of china from your wedding, it's not a good idea.",Mayte Garcia,Wedding
"I originally thought I would be going into wedding dresses. I wanted to create gowns, especially for weddings. I liked the idea of dealing with just one color, and within that, you could design whatever you want.",Ashley Nell Tipton,Wedding
There was never any question of Prince Philip's four sisters being invited to his wedding to Princess Elizabeth. King George decided their connection to Nazi Germany was still too shaming.,Ingrid Seward,Wedding
I want a big wedding.,Karamo Brown,Wedding
"I went to a wedding in St. Maarten, and we took a boat ride over to Anguilla for a day. We went to a beach that had the whitest sand I had ever seen before in my life. I was in the water up to the middle of my chest and could still see my feet. It was the clearest water.",Tony Rock,Wedding
"The most important thing to Ben and me was starting a family, so as soon as we got engaged, we booked Gurney's in Montauk - which is just a few miles down the beach from our summer home - as our wedding venue a full year and a half out, and then we immediately started trying to get pregnant.",Jennifer Hyman,Wedding
"When choosing vendors for my wedding, I intentionally searched for women who were at the beginning of their own founder journeys.",Jennifer Hyman,Wedding
"Really, a wedding is the first and biggest party people throw in their lifetime, so there's a lot of challenges and a lot of pressure.",Ron Ben-Israel,Wedding
"The process of making a wedding cake is complex on its own, from designing, mis-en-place, baking, frosting, structuring, decorating, to delivering.",Ron Ben-Israel,Wedding
"I have been known to, on more than one occasion, look down my nose at items I deem to be tacky wedding fare... carnations, tulle, DIY invitations. And yet, the wedding I'm most embarrassed of having planned, the one I'd never put into my portfolio, is my own.",Rachel Hollis,Wedding
"In my experience, working with a bride-to-be, the last couple of weeks leading up to the wedding is uber-stressful.",David Kirsch,Wedding
"I feel like most movies about female friends derive their conflict from an extension of the high school movie rivalries, or there's some petty grievance: a competition over a guy or a wedding date or something. And I don't relate to any of that.",Susanna Fogel,Wedding
"I found my style in my aunt's attic. She hoarded all her '60s clothes there, along with the tiaras she'd won as a beauty queen, and I'd steal her wedding dress to wear around town.",Roisin Murphy,Wedding
