quotes,authors,categories
"I had a huge Indian wedding, and I did it for my wife, and I did it for my white friends.",Hasan Minhaj,Wedding
"When I was in high school, there was 'Superbad' and 'The Girl Next Door' and 'Wedding Crashers' and all these great movies. You hope to be a part of something that's smart, funny and in that Todd Phillips-vein. You want to make something like 'Superbad.' That movie was so good and so funny.",Miles Teller,Wedding
"I wouldn't call myself 'into the DJ scene.' I have friends who are DJs, like James Murphy. I was really into the DJ scene at his wedding. But generally, I'm not at the clubs. I've never been to a rave.",Greta Gerwig,Wedding
Valentino made my day suit for the wedding of Paloma Picasso in Paris.,Andre Leon Talley,Wedding
"My oldest daughter got married, she had a wedding in Hawaii and a reception in Nashville, and in between I had a Cup date in Dauphin, Manitoba.",Barry Trotz,Wedding
I hadn't been in Vegas 20 minutes when I got word that the bookmakers were offering three to one that Frank wouldn't show for my wedding.,"Sammy Davis, Jr.",Wedding
I only did karaoke once in my life. It was with Courtney Love and it was a total disaster. She pulled me on stage in front of 500 people at a wedding. I'd never done karaoke before.,Jared Leto,Wedding
"'That's What She Said' is not Hollywood's standard picture of women: preternaturally gorgeous, wedding obsessed, boy crazy, fashion focused, sexed up 'girl' women. These are real women, comically portrayed, who are trying to wrestle with the very expectations of womanhood that Hollywood movies set up.",Carrie Preston,Wedding
"My cooking attracted celebrities. I met Sylvester Stallone. He squeezed my bicep and said: 'I don't usually eat your kind of food, but for you, I ate it.' I haven't got a clue what he'd eaten but he asked me to cook for his wedding feast when he married Jennifer Flavin at Blenheim Palace.",Marco Pierre White,Wedding
"Your wedding is your red carpet moment, and while brides definitely can take some chances with style, you don't want to look like a fad.",Reem Acra,Wedding
I did get to keep the wedding dresses from 'Runaway Bride'. They're all boxed up in my garage. I've never opened them. It'll be fun one day when Hazel is taller. She can play dress-up with her friends.,Julia Roberts,Wedding
"I've always been the type to fall in love fast and, with every boyfriend, I plan out my wedding in my head.",Kim Kardashian,Wedding
"I thought I was attractive when I shot 'My Big Fat Greek Wedding.' Studio executives and movie reviewers let me know I had a confidence in my looks that was not shared by them. In other words, they labeled me with words like overweight, unattractive, unappealing.",Nia Vardalos,Wedding
"Even if you believe a creator god invented the laws of physics, would you so insult him as to suggest that he might capriciously and arbitrarily violate them in order to walk on water, or turn water into wine as a cheap party trick at a wedding?",Richard Dawkins,Wedding
"As a pastor, you get invited into the most poignant moments of people's lives. Whether it's a wedding or a funeral or a hospital visit, you get invited into the center of the event, whether or not you know the people.",Rob Bell,Wedding
"'Devdas' isn't a real film. It isn't in the same genre as Mira Nair's 'Monsoon Wedding,' where the camera's presence is so understated it almost disappears.",Sanjay Leela Bhansali,Wedding
"Before 'Insecure,' I was a wedding emcee - a host for weddings. That's a world that a lot of people are not familiar with.",Yvonne Orji,Wedding
"I've always had a very dry sense of humor, and I've pretty much grown up on Will Ferrell, first on 'Saturday Night Live,' then 'Old School' and 'Wedding Crashers.'",Blake Griffin,Wedding
"For me, the only thing that mattered was getting married in the presence of my family and very close friends. We did not want a big fat wedding.",Ishita Dutta,Wedding
"After my wedding to Nandish Sandhu, I wanted a break and that is why I quit 'Uttaran.'",Rashami Desai,Wedding
"A big part of being in a wedding is the financial obligation, and that's something that people don't really talk about, but if you're asked to be in a wedding, you're gonna have to fork over some cash.",Kristen Wiig,Wedding
Salaam Bombay' and 'Monsoon Wedding' are the two Mira Nair films I go back to.,Rasika Dugal,Wedding
"Aamir and I are still boyfriend-girlfriend. The other day we were discussing how we don't feel like husband-wife; however, the only thing that has changed after my wedding is that I get to meet my guy every day.",Sanjeeda Sheikh,Wedding
"I actually love being a little older and doing this wedding thing. At 38, I know what I like and what I don't.",Brooke Baldwin,Wedding
"After 'Muriel's Wedding,' I first went to America, and I was sent all these scripts about fat girls overcoming hurdles. Something in me knew not to go down that road, even if it was a good script.",Toni Collette,Wedding
I'll never have a wedding. I don't want to marry just to do what everybody else is doing.,Mr. T,Wedding
"I love both real and fake jewelry. My kids make me necklaces, and I wear those, too. Every day, I wear my gold wedding band and the Cartier watch my husband gave me.",Aerin Lauder,Wedding
"At first, when we got engaged, I asked him if we could just go to Vegas and get married by Elvis, just because I didn't want to deal with planning a wedding.",Italia Ricci,Wedding
I've thought about it a hundred times. I even buy bridal magazines sometimes. I want David Tutera to do my wedding.,Marlen Esparza,Wedding
"Whenever there's a big national event that brings the country together - whether it's the Olympics, a royal wedding or the 'Bake Off' final - there are inevitably a few contrarian voices speaking out against it.",Ed Davey,Wedding
"Choosing elements for your wedding day should be fun, but these choices won't make any difference in the stuff that matters. For better or worse, you'll end that day married to your partner, and that's the truly exciting part.",Rachel Hollis,Wedding
"Dealing with wedding stuff is a bit of a double-edged sword - it seems that divorcees are expected to either burn it all on the front lawn, tears silently coursing down their faces, or keep the stuff, shrine-like, concealed somewhere in their homes.",Emily V. Gordon,Wedding
"Growing up, I was never the kind of girl to dream about wedding dresses and pretty houses.",Louise Nurding,Wedding
"The Hiltons know how to put on a good wedding, that's all I can say.",Conrad Sewell,Wedding
"A lot of people think I'm that guy in 'Betsy's Wedding', but I'm not. What it is for me is that, on some level, I connect with the character emotionally.",Anthony LaPaglia,Wedding
"After eight years of fighting, and multiple rounds of chemotherapy, surgery, and radiation, my mother lost her battle with cancer. I think about her every day. I miss her terribly, and wish she were there to walk me down the aisle at my wedding and to cheer when my sister received her college diploma.",Leana S. Wen,Wedding
"I spent so many years in terror of 'making it legal' because the expression rang all too true - the wedding ritual struck me as nothing but a flowery front for the fulfilment of countless, tedious contracts and obligations.",Lynn Coady,Wedding
Weddings happen once. That's the point. They're a bluster of confetti and hope all wrapped up in sticky wedding cake and four-year-old girls in big dresses with massive bows.,Claudia Winkleman,Wedding
"There's been a lot of wedding songs and proposals. It's cool because when they play it at weddings so, it means a lot to them. That's a big deal. They're always going to remember 'Head Over Boots' as played at their wedding.",Jon Pardi,Wedding
"I've been married before, but I've never had my dream wedding in Vegas. I wanted to do it there because it's casual, quick, not religious and, most of all, very romantic.",Sinead O'Connor,Wedding
"When I was 23, I went to my dad's second wedding, full of tightly repressed rage, given expression only by my wedding outfit. I wore a suit, because it was a wedding, but I also went for a bright red T-shirt with the word 'ANTI' printed on it, a necklace with a silver gun pendant and a brooch that looked a bit like a swastika.",Simon Amstell,Wedding
It should be a small intimate wedding not like a big grand show happening. You can interact with all your guests.,Disha Parmar,Wedding
"Jealousy, greed, fear. We're all full of these things. But also love and compassion. If you saw a drowning baby, it wouldn't matter if you were wearing a tuxedo on the way to your own wedding. You'd jump in to save him.",John McAfee,Wedding
"It is sweet that people want to know everything about my wedding, but they should also respect my privacy.",Divyanka Tripathi,Wedding
You won't believe when I attend any wedding I also enjoy biryani or even first fry or chicken cutlet. But I balance it out in my next meals. That's how it works.,Koel Mallick,Wedding
"A wedding, a great wedding, is just a blast. A celebration of romance and community and love... What is unfun about that? Nothing.",Ariel Levy,Wedding
"It's very nice to be asked to anybody's wedding. Particularly if it's the Prince of Wales. I learned a lot from it, which was to end early and get away. I suppose one would have to look back historically and see who other royals had at their weddings. Were there people at Queen Elizabeth's wedding who were common like myself?",Jools Holland,Wedding
"Everywhere I go, people ask me about Jennifer Aniston's wedding. Everywhere I go. I always say to her, I'm like, 'Being friends with you is a burden. You think it's hard to be friends with me?'",Chelsea Handler,Wedding
"My husband, Jim, converted to Judaism just before our wedding.",Anita Diament,Wedding
She tells enough white lies to ice a wedding cake.,Margot Asquith,Wedding
"There are so many moving parts to a wedding, and I, it turns out, am a bit of a perfectionist.",Jeremiah Brent,Wedding
"'Veerey Ki Wedding' is a comedy of errors in more ways than one. It's one of those basic, perky comedies. We're not trying to give out a message or anything.",Kriti Kharbanda,Wedding
"After I had the Caesarean, I was told I had really strong stomach muscles and so would heal very quickly. And I did. I was up walking about within three hours. Six days after having her, I was out shopping and shortly after that I made it to David Walliams' wedding.",Denise Van Outen,Wedding
"When I saw Kate Moss's champagne tower from her wedding, I was like, 'Okay, check - I want that. I want fireworks.'",Nikki Bella,Wedding
Take off your wedding ring prior to swimming!,Gad Saad,Wedding
"There was a thing on Facebook that said, 'Describe George Clooney's wedding in three words,' and my answer was, 'Not invited again.'",Michael O'Keefe,Wedding
"A wedding, people decide to get married, it comes out of such love for one another and then women can turn into these other people. They're planning something that's the biggest event they'll ever plan in their lives and it turns them into this other person, so it's not totally the guy's fault that he's feeling disconnected from this person.",Alison Brie,Wedding
"My wedding dress is a piece of art that I'll treasure forever. It was designed and created by Zac Posen. I gave him only the tiniest bit of direction when he started, and the end product was more beautiful than anything I could have imagined.",Coco Rocha,Wedding
"I simply can't dance, so an opening dance at our wedding is a no-go.",Kiki Bertens,Wedding
"Who doesn't like a good wedding? Even the most jaded, can be moved to enjoy the hopefulness of a young couple.",Martha MacCallum,Wedding
I made a wedding planning book and a whole double page is dedicated to the dogs.,Stacey Solomon,Wedding
"So many little girls dream about their wedding day. But with actresses, sometimes it's the inverse, because we get to be the centre of attention, looked up and down, dressed up for premieres all the time. The pull isn't quite as great.",Natalie Dormer,Wedding
"The day of the wedding went like these things generally do, full of anxious moments interspersed with black comedy.",Janet Street-Porter,Wedding
"A walk through the storage facility of the community museum where I worked might easily have convinced you that people in the past wore only wedding dresses, carried silver candlesticks, and played with porcelain dolls.",Susanna Kearsley,Wedding
I never planned out my wedding.,Kirstin Maldonado,Wedding
"Thinking of it now, I didn't do a thing for my wedding. I was sleepwalking through it at all.",Rupali Ganguly,Wedding
"Well, I'll tell you something, this wedding is something that I will always, always cherish. It was a show of love and support and kindness like I'd never seen from the people, and that's who I entertain. I entertain the people.",Liza Minnelli,Wedding
"Even if it's your wedding, if you're a guy, it's boring.",Blake Shelton,Wedding
I found out I was pregnant seven days after my wedding. I was on honeymoon with my family.,Bryce Dallas Howard,Wedding
"My Best Friend's Wedding,' that was one of my favorite films growing up. There are a lot of people who say it doesn't hold up well, but there is something about it that I find so intriguing.",Ariana DeBose,Wedding
"We are all trained by Disney to believe that the wedding is the finish line, but the wedding is just another starting line. In light of this fact, we should quit the huge, fancy, debt-inducing weddings.",Glennon Doyle Melton,Wedding
"I didn't finish my dress until about three days before my wedding - I had the flu and was stitching it from my bed. And the tulle came back from India all brown. We had to wash it for hours, but that didn't dissuade me from wearing it.",Georgina Chapman,Wedding
I met Prince William at a musical festival and he let me know he was a fan of my music. But the invitation to sing at his wedding reception came completely out of the blue. The fact that Kate and William knew the words to my songs was very touching.,Ellie Goulding,Wedding
"During the send-off at my wedding to the groom's house, I embraced my mother tight, and that was when I realized that I was not going to stay with my mom anymore and be under her guidance, protection and watchful eyes, and that I would be in a different house.",Meghana Raj,Wedding
We were pretty good mates until the Beatles started to split up and Yoko came into it. It was more like old army buddies splitting up on account of wedding bells.,Paul McCartney,Wedding
"It might be a selfish choice, but I find it quite difficult to design for individuals and prefer the distance of larger schemes. It's the same reason why, as a designer, I don't do wedding dresses.",John Rocha,Wedding
I just wrapped this movie called 'The Wedding Crashers' which was a pretty big break for me.,Bradley Cooper,Wedding
"I moved to the city in August of 1980, and someone I thought was a friend had an apartment in this wedding cake of a building, so I slept on her couch for a few days.",Holly Hunter,Wedding
"My sister, singer Jessie Ware, and I are always exchanging music. We brainstormed her wedding playlist for months.",Hannah Ware,Wedding
"I watched John Goodman in 'Barton Fink,' or Paul Giamatti stealing a scene in 'My Best Friend's Wedding,' and I would think, That's me in 10 or 12 years.",Paul Walter Hauser,Wedding
You know how Oprah has her moment about bread? Mine's about boots. You could wear it to a meeting at work. You could wear it to a date.You could wear it to a wedding with a suit.,Tan France,Wedding
There was a moment at my wedding in 1997 when I got the bumps from all my male friends. We were in the garden and they grabbed me and threw me up and down in the air. It was a fantastic moment of complete irreverence.,Adrian Lester,Wedding
"The wedding took place in Vermont, where they have legalized gay civil unions, and I married a woman.",Craig Ferguson,Wedding
"Every wedding is slightly different from the other. But you always get to meet the funny uncle and the weirdo relatives, and there's always someone trying to beat you up for not playing enough Beatles songs or something.",Jens Lekman,Wedding
Wedding dress shopping is basically like dating. You pick the one based on how you feel.,Brooke Baldwin,Wedding
"Anyone out there considering doing a Christmas wedding, definitely do it!",Chloe Madeley,Wedding
"Let's say you go to a friend's wedding, or Thanksgiving, or Halloween. It'd be great the next day to see what went on with your friends' Thanksgiving weekend, or all the costumes they wore on Halloween, and be able to look back and see what they wore the year before, and the year before that.",Mike McCue,Wedding
"Having this whole wedding situation, people should warn you how stressful it is.",Erica Mena,Wedding
"Now that I think about it, my 40th birthday was the most anxiety I've ever had, and my wedding was also the second time I've had that much anxiety. So I'm starting to realize that I can't be throwing these big bash parties because I need to own that I get anxiety with a lot of people diverting their attention to me.",Jeannie Mai,Wedding
"We always talk about how the first several seasons were faithful to the books, and anybody who wanted to could go onto Wikipedia and learn Ned Stark gets beheaded or about The Red Wedding, and most people don't want to know - because why ruin a story?",David Benioff,Wedding
Most kids don't get to go their parents' wedding.,Ken Livingstone,Wedding
"Initially, when I saw some of the things Vince was doing, I thought he was killing the business. There was the comedy stuff, the wedding on TV.",Ted DiBiase Sr.,Wedding
"Hierarchical formulations died because their wedding cake levels posited a multiply fractured cosmos that does not match the Space Age revelation of a unified universe in which the earth is clearly in, rather than separated from, the heavens. Hierarchical representations do not reflect what either the world or we are like.",Eugene Kennedy,Wedding
All my tattoos except my first were not planned. I would just go into the shop late at night with friends and ask for something on the spot. My first is my parents' wedding date. I thought it would soften the blow of getting a tattoo.,Hailey Baldwin,Wedding
"The biggest rivalries I've had were with Eddie Guerrero and The Undertaker. I had long, long feuds with both of these men, and both were groomsmen at my wedding.",John Layfield,Wedding
"Not everyone can be successful selling fashion at $25,000 for a wedding outfit. Certain designers are able to do that. And there is only a certain amount of consumers who can do that. The real opportunity is in that $25 garment.",Imran Amed,Wedding
"I love going to weddings. I love movie scenes of weddings. Even, like, TV-show weddings - I cry at every wedding.",Frankie Cosmos,Wedding
"The white hot publicity that came from 'My Big Fat Greek Wedding' was appreciated but not sought, so I was happy to walk away from it and then write.",Nia Vardalos,Wedding
"What an electric thrill it sends up and down the spine, how it sets the heart racing: A Royal Romance! A Royal Wedding! The pomp and the pageantry!",Hamish Bowles,Wedding
"I felt very unstressed on my wedding day. I'm very grateful for that... spending the day on my own, being super quiet and happy and just puttering around doing my own thing.",Sonya Walger,Wedding
"In New York, I have a photo of my parents on their wedding day in 1947. They're beaming at home plate in Houston's Buffalo Stadium. I love the photo because my dad is smiling. He didn't smile much in his later years.",Keith Hernandez,Wedding
"I have a crusade against fondant, also shortening. There's no reason why wedding cakes can't taste good if you know what you're doing.",Ron Ben-Israel,Wedding
"I wear my wedding ring. We talk about when we're going to get married again, which we hope is going to take place some time in this incredibly hectic calendar year.",Jim Lampley,Wedding
I would never hold my children back from that. I would never want them to resent me for holding them back from their father's wedding.,Camille Grammer,Wedding
"Be it a private event or a college fest or the occasional wedding sangeet, my visits to Noida are frequent.",Neha Kakkar,Wedding
People's hands fascinate me. It's tempting to look at a businessman's left hand and see if there's an indentation from a missing wedding ring. Or maybe there's a tan line and the skin is pressed down where's he's worked a ring off his finger.,Benedict Cumberbatch,Wedding
I am the center of attention in my job every single day; the thought of a wedding to me is exhausting. Why would I put myself through that?,Lady Gaga,Wedding
Wedding rings need to be sparkly to remind us not to have sex with other people.,Andrea Savage,Wedding
I heard there was a bit of talk that there might be a second 'Wedding Crashers' film. It would certainly get my support.,Tim Henman,Wedding
That's basically all my act is - it's just listening all the time and watching for what people do with their hands and so on. It gets on people's nerves a bit - especially when you're at a wedding and you're scribbling on a table and they go 'stop doing that' and you go 'I can't.',Peter Kay,Wedding
"My favorite time to dance is at, like, wedding receptions, when it's all ages and everyone seems to be having fun.",Neil Patrick Harris,Wedding
"I used to love to create outfits, and I still do - I just don't have the time. How can you wear one thing and never wear it again? Even my wedding dress - I had a dress made that I could wear again. I'm a child of the depression, so I'm very, very practical.",Iris Apfel,Wedding
"I'm a married gay man, so you might think that I appreciate the government forcing a Christian baker or photographer or florist to act against their religion in order to cater, photograph, or decorate my wedding. But you'd be wrong. A government that can force Christians to violate their conscience can force me to violate mine.",Dave Rubin,Wedding
"I love going to other people's weddings, but I have never desired a big white wedding for myself, and it has never been put on me as a pressure, an expectation.",Katherine Kelly,Wedding
"I love pizza. I want to marry it, but it would just be to eat her family at the wedding.",Mike Birbiglia,Wedding
"It's a destination wedding, I can't reveal the place - but for sure it's not in Mumbai.",Madalsa Sharma,Wedding
"Recently, I was in Bernalda, my dad's ancestral home town in Italy. He has just refurbished a palazzo and turned it into a hotel, so we had my sister's wedding there. It was beautiful.",Roman Coppola,Wedding
"Something that I think extends to a lot of African cultures is that the line between performer and audience is blurry. My mom would lead the wedding song regularly, and she isn't a professional singer. Even as an audience member, you're expected to clap and sing the response to the lead.",Kelela,Wedding
I just fell in love with someone who happens to be amazing. We had a beautiful wedding and there was a lot of love.,James Righton,Wedding
There's nothing standard about a wedding dress or shoes anymore.,Jenny Packham,Wedding
I wrote a song for my sister's wedding.,Lou Barlow,Wedding
"My wedding won't be a hush-hush affair. When I get married, everyone will get to know about it... there'll be nothing speculative about my wedding.",Bipasha Basu,Wedding
I always envisioned myself having a traditional and elegant wedding.,Ivanka Trump,Wedding
"A lawyer I once knew told me of a strange case, a suffragette who had never married. After her death, he opened her trunk and discovered 50 wedding gowns.",Marguerite Young,Wedding
"If you had asked me when I was 28 and in my wedding dress if I ever thought I would end up in my forties flipping my husband the bird over potato chips, I'd say you were crazy.",Jenna McCarthy,Wedding
The only time I ever look good dancing is if I'm next to my dad at a wedding.,Cat Deeley,Wedding
"I would like to sing for the Pope. And the Queen, and at Simon Cowell's wedding.",Jackie Evancho,Wedding
And we've got a toaster and everything. So there is no reason for the wedding.,Karl Pilkington,Wedding
"If it wasn't for technology and the Internet, I wouldn't have been able to plan a wedding because I'm never home.",Brie Bella,Wedding
"I don't really have a treasured possession, but I do love my family's proper old photo album. We all have hundreds of photos on our phones now, but you can't beat the old albums stuffed with black-and-white wedding photographs and 1970s Polaroids.",Nicola Walker,Wedding
"In terms of wedding gifts, I like to buy people experiences.",Alexander Gilkes,Wedding
"When Andrew went with the girls, we were talking all morning and he was saying, 'It's okay. Just remember we had such a good day. Our wedding was so perfect.' Because we're such a unit together. He made me feel very part of the day on April the 29th.",Sarah Ferguson,Wedding
"'The Wedding Singer' was my first role ever! It took me, like, 20 takes to say my one line. I went home and cried!",Shanna Moakler,Wedding
"I love auditioning. Since 'The Notebook' and 'Wedding Crashers,' I don't have to audition anymore, and I miss it. You get to show your interpretation of the character. I get nervous when I don't audition. What if they hate what I want to do?",Rachel McAdams,Wedding
"Where does it stop? You get offered money for your wedding, then for your kids, new houses, holidays... We earn enough from football and sponsorships, why do you need any more?",Ryan Giggs,Wedding
"You can't make a rule about it. The minute you make a rule, it's like putting your wedding pictures in 'In Style' magazine - you're divorced.",Frances McDormand,Wedding
