quotes,authors,categories
The journey of a thousand miles begins with one step.,Lao Tzu,Wisdom
"If you don't know where you are going, any road will get you there.",Lewis Carroll,Wisdom
The only true wisdom is in knowing you know nothing.,Socrates,Wisdom
He is no fool who gives what he cannot keep to gain what he cannot lose.,Jim Elliot,Wisdom
"Give me a lever long enough and a fulcrum on which to place it, and I shall move the world.",Archimedes,Wisdom
"It's not what happens to you, but how you react to it that matters.",Epictetus,Wisdom
"It's not what you look at that matters, it's what you see.",Henry David Thoreau,Wisdom
Never interrupt your enemy when he is making a mistake.,Napoleon Bonaparte,Wisdom
"O, what a tangled web we weave when first we practise to deceive!",Walter Scott,Wisdom
"If you talk to a man in a language he understands, that goes to his head. If you talk to him in his language, that goes to his heart.",Nelson Mandela,Wisdom
"By three methods we may learn wisdom: First, by reflection, which is noblest; Second, by imitation, which is easiest; and third by experience, which is the bitterest.",Confucius,Wisdom
"Reality is merely an illusion, albeit a very persistent one.",Albert Einstein,Wisdom
The wisdom of the wise and the experience of the ages are perpetuated by quotations.,Benjamin Disraeli,Wisdom
"Set your course by the stars, not by the lights of every passing ship.",Omar N. Bradley,Wisdom
"The greater danger for most of us lies not in setting our aim too high and falling short; but in setting our aim too low, and achieving our mark.",Michelangelo,Wisdom
Everything that irritates us about others can lead us to an understanding of ourselves.,Carl Jung,Wisdom
Discipline is the bridge between goals and accomplishment.,Jim Rohn,Wisdom
Plodding wins the race.,Aesop,Wisdom
The pessimist complains about the wind; the optimist expects it to change; the realist adjusts the sails.,William Arthur Ward,Wisdom
Talent is God given. Be humble. Fame is man-given. Be grateful. Conceit is self-given. Be careful.,John Wooden,Wisdom
I'd rather regret the things I've done than regret the things I haven't done.,Lucille Ball,Wisdom
We are what our thoughts have made us; so take care about what you think. Words are secondary. Thoughts live; they travel far.,Swami Vivekananda,Wisdom
"For beautiful eyes, look for the good in others; for beautiful lips, speak only words of kindness; and for poise, walk with the knowledge that you are never alone.",Audrey Hepburn,Wisdom
In every walk with nature one receives far more than he seeks.,John Muir,Wisdom
"There are many ways of going forward, but only one way of standing still.",Franklin D. Roosevelt,Wisdom
Work like you don't need the money. Love like you've never been hurt. Dance like nobody's watching.,Satchel Paige,Wisdom
"Even if you're on the right track, you'll get run over if you just sit there.",Will Rogers,Wisdom
"Step with care and great tact, and remember that Life's a Great Balancing Act.",Dr. Seuss,Wisdom
Beware of false knowledge; it is more dangerous than ignorance.,George Bernard Shaw,Wisdom
You are a product of your environment. So choose the environment that will best develop you toward your objective. Analyze your life in terms of its environment. Are the things around you helping you toward success - or are they holding you back?,W. Clement Stone,Wisdom
Adopt the pace of nature: her secret is patience.,Ralph Waldo Emerson,Wisdom
Once you label me you negate me.,Soren Kierkegaard,Wisdom
"A man must be big enough to admit his mistakes, smart enough to profit from them, and strong enough to correct them.",John C. Maxwell,Wisdom
Obstacles are those frightful things you see when you take your eyes off your goal.,Henry Ford,Wisdom
Never interrupt someone doing what you said couldn't be done.,Amelia Earhart,Wisdom
"The way you see people is the way you treat them, and the way you treat them is what they become.",Johann Wolfgang von Goethe,Wisdom
It is impossible to love and to be wise.,Francis Bacon,Wisdom
Knowledge is of no value unless you put it into practice.,Anton Chekhov,Wisdom
"If you set out to be liked, you would be prepared to compromise on anything at any time, and you would achieve nothing.",Margaret Thatcher,Wisdom
"Always be a first-rate version of yourself, instead of a second-rate version of somebody else.",Judy Garland,Wisdom
Use what talents you possess; the woods would be very silent if no birds sang there except those that sang best.,Henry Van Dyke,Wisdom
That old law about 'an eye for an eye' leaves everybody blind. The time is always right to do the right thing.,"Martin Luther King, Jr.",Wisdom
"The young man knows the rules, but the old man knows the exceptions.","Oliver Wendell Holmes, Sr.",Wisdom
"With pride, there are many curses. With humility, there come many blessings.",Ezra Taft Benson,Wisdom
"The more you like yourself, the less you are like anyone else, which makes you unique.",Walt Disney,Wisdom
"Dost thou love life? Then do not squander time, for that is the stuff life is made of.",Benjamin Franklin,Wisdom
Being entirely honest with oneself is a good exercise.,Sigmund Freud,Wisdom
"Commitment is an act, not a word.",Jean-Paul Sartre,Wisdom
The time to repair the roof is when the sun is shining.,John F. Kennedy,Wisdom
Genius is one percent inspiration and ninety-nine percent perspiration.,Thomas A. Edison,Wisdom
We cannot become what we need to be by remaining what we are.,Max de Pree,Wisdom
Experience is not what happens to you; it's what you do with what happens to you.,Aldous Huxley,Wisdom
"Just as treasures are uncovered from the earth, so virtue appears from good deeds, and wisdom appears from a pure and peaceful mind. To walk safely through the maze of human life, one needs the light of wisdom and the guidance of virtue.",Buddha,Wisdom
Only put off until tomorrow what you are willing to die having left undone.,Pablo Picasso,Wisdom
"I will not follow where the path may lead, but I will go where there is no path, and I will leave a trail.",Muriel Strode,Wisdom
Never tell people how to do things. Tell them what to do and they will surprise you with their ingenuity.,George S. Patton,Wisdom
"Keep me away from the wisdom which does not cry, the philosophy which does not laugh and the greatness which does not bow before children.",Khalil Gibran,Wisdom
"Sorrow is knowledge, those that know the most must mourn the deepest, the tree of knowledge is not the tree of life.",Lord Byron,Wisdom
"If you only have a hammer, you tend to see every problem as a nail.",Abraham Maslow,Wisdom
He who lives in harmony with himself lives in harmony with the universe.,Marcus Aurelius,Wisdom
"If the world were perfect, it wouldn't be.",Yogi Berra,Wisdom
"Today's mighty oak is just yesterday's nut, that held its ground.",David Icke,Wisdom
"A tree is known by its fruit; a man by his deeds. A good deed is never lost; he who sows courtesy reaps friendship, and he who plants kindness gathers love.",Saint Basil,Wisdom
"My father said there were two kinds of people in the world: givers and takers. The takers may eat better, but the givers sleep better.",Marlo Thomas,Wisdom
Everything comes to us that belongs to us if we create the capacity to receive it.,Rabindranath Tagore,Wisdom
It's better to be a lion for a day than a sheep all your life.,Elizabeth Kenny,Wisdom
"Yesterday is history, tomorrow is a mystery, today is God's gift, that's why we call it the present.",Joan Rivers,Wisdom
"From the errors of others, a wise man corrects his own.",Publilius Syrus,Wisdom
Start with what is right rather than what is acceptable.,Franz Kafka,Wisdom
Patience is the companion of wisdom.,Saint Augustine,Wisdom
"The higher we are placed, the more humbly we should walk.",Marcus Tullius Cicero,Wisdom
"As you walk down the fairway of life you must smell the roses, for you only get to play one round.",Ben Hogan,Wisdom
The best way to predict the future is to invent it.,Alan Kay,Wisdom
The greatest obstacle to discovery is not ignorance - it is the illusion of knowledge.,Daniel J. Boorstin,Wisdom
"A wise man is superior to any insults which can be put upon him, and the best reply to unseemly behavior is patience and moderation.",Moliere,Wisdom
Slow and steady wins the race.,Robert Lloyd,Wisdom
To win without risk is to triumph without glory.,Pierre Corneille,Wisdom
Knowledge is proud that it knows so much; wisdom is humble that it knows no more.,William Cowper,Wisdom
The smallest deed is better than the greatest intention.,John Burroughs,Wisdom
"Knowledge comes, but wisdom lingers. It may not be difficult to store up in the mind a vast quantity of facts within a comparatively short time, but the ability to form judgments requires the severe discipline of hard work and the tempering heat of experience and maturity.",Calvin Coolidge,Wisdom
Wisdom is the reward you get for a lifetime of listening when you'd have preferred to talk.,Doug Larson,Wisdom
"Beware, so long as you live, of judging men by their outward appearance.",Jean de La Fontaine,Wisdom
"If you're trying to achieve, there will be roadblocks. I've had them; everybody has had them. But obstacles don't have to stop you. If you run into a wall, don't turn around and give up. Figure out how to climb it, go through it, or work around it.",Michael Jordan,Wisdom
"The truth is not for all men, but only for those who seek it.",Ayn Rand,Wisdom
Spectacular achievement is always preceded by unspectacular preparation.,Robert H. Schuller,Wisdom
Turn your wounds into wisdom.,Oprah Winfrey,Wisdom
Your sacred space is where you can find yourself again and again.,Joseph Campbell,Wisdom
"Start wide, expand further, and never look back.",Arnold Schwarzenegger,Wisdom
The man of knowledge must be able not only to love his enemies but also to hate his friends.,Friedrich Nietzsche,Wisdom
Always seek out the seed of triumph in every adversity.,Og Mandino,Wisdom
One's philosophy is not best expressed in words; it is expressed in the choices one makes... and the choices we make are ultimately our responsibility.,Eleanor Roosevelt,Wisdom
Blessed are those who give without remembering and take without forgetting.,Elizabeth Bibesco,Wisdom
The art of being wise is the art of knowing what to overlook.,William James,Wisdom
Every man is a damn fool for at least five minutes every day; wisdom consists in not exceeding the limit.,Elbert Hubbard,Wisdom
Never let your head hang down. Never give up and sit down and grieve. Find another way. And don't pray when it rains if you don't pray when the sun shines.,Richard M. Nixon,Wisdom
"My advice to you is not to inquire why or whither, but just enjoy your ice cream while it's on your plate.",Thornton Wilder,Wisdom
Wisdom doesn't necessarily come with age. Sometimes age just shows up all by itself.,Tom Wilson,Wisdom
The future has already arrived. It's just not evenly distributed yet.,William Gibson,Wisdom
The road of excess leads to the palace of wisdom.,William Blake,Wisdom
You always have two choices: your commitment versus your fear.,"Sammy Davis, Jr.",Wisdom
The soul's joy lies in doing.,Percy Bysshe Shelley,Wisdom
Regret for the things we did can be tempered by time; it is regret for the things we did not do that is inconsolable.,Sydney J. Harris,Wisdom
"When you doubt, abstain.",Ambrose Bierce,Wisdom
"It is better to risk starving to death then surrender. If you give up on your dreams, what's left?",Jim Carrey,Wisdom
The superior man blames himself. The inferior man blames others.,Don Shula,Wisdom
"The opinion which other people have of you is their problem, not yours.",Elisabeth Kubler-Ross,Wisdom
It is a common experience that a problem difficult at night is resolved in the morning after the committee of sleep has worked on it.,John Steinbeck,Wisdom
Always keep an open mind and a compassionate heart.,Phil Jackson,Wisdom
A long habit of not thinking a thing wrong gives it a superficial appearance of being right.,Thomas Paine,Wisdom
Talent is God-given; be humble. Fame is man-given; be thankful. Conceit is self-given; be careful.,Harvey Mackay,Wisdom
Wisdom is knowing what to do next; virtue is doing it.,David Starr Jordan,Wisdom
It requires wisdom to understand wisdom: the music is nothing if the audience is deaf.,Walter Lippmann,Wisdom
Make it your habit not to be critical about small things.,Edward Everett Hale,Wisdom
How many cares one loses when one decides not to be something but to be someone.,Coco Chanel,Wisdom
I praise loudly. I blame softly.,Catherine the Great,Wisdom
Be happy. It's one way of being wise.,Sidonie Gabrielle Colette,Wisdom
"It is like the seed put in the soil - the more one sows, the greater the harvest.",Orison Swett Marden,Wisdom
"Strong characters are brought out by change of situation, and gentle ones by permanence.",Jean Paul,Wisdom
"It is not who is right, but what is right, that is of importance.",Thomas Huxley,Wisdom
"Let us act on what we have, since we have not what we wish.",John Henry Newman,Wisdom
We should not judge people by their peak of excellence; but by the distance they have traveled from the point where they started.,Henry Ward Beecher,Wisdom
Nothing that you have not given away will ever be really yours.,C. S. Lewis,Wisdom
The fall of dropping water wears away the Stone.,Lucretius,Wisdom
It's easier to resist at the beginning than at the end.,Leonardo da Vinci,Wisdom
"The day of fortune is like a harvest day, We must be busy when the corn is ripe.",Torquato Tasso,Wisdom
We never understand how little we need in this world until we know the loss of it.,James M. Barrie,Wisdom
None knows the weight of another's burden.,George Herbert,Wisdom
No man was ever wise by chance.,Lucius Annaeus Seneca,Wisdom
A day of worry is more exhausting than a week of work.,John Lubbock,Wisdom
Perhaps too much of everything is as bad as too little.,Edna Ferber,Wisdom
"All things must come to the soul from its roots, from where it is planted.",Saint Teresa of Avila,Wisdom
What happens is not as important as how you react to what happens.,Ellen Glasgow,Wisdom
It has long been an axiom of mine that the little things are infinitely the most important.,Arthur Conan Doyle,Wisdom
Our character is what we do when we think no one is looking.,"H. Jackson Brown, Jr.",Wisdom
"When a thing is done, it's done. Don't look back. Look forward to your next objective.",George C. Marshall,Wisdom
"If you do not express your own original ideas, if you do not listen to your own being, you will have betrayed yourself.",Rollo May,Wisdom
A man begins cutting his wisdom teeth the first time he bites off more than he can chew.,Herb Caen,Wisdom
A ruffled mind makes a restless pillow.,Charlotte Bronte,Wisdom
"Knowledge comes, but wisdom lingers.",Alfred Lord Tennyson,Wisdom
The sweetest of all sounds is praise.,Xenophon,Wisdom
A closed mouth catches no flies.,Miguel de Cervantes,Wisdom
Common sense in an uncommon degree is what the world calls wisdom.,Samuel Taylor Coleridge,Wisdom
"The less you talk, the more you're listened to.",Pauline Phillips,Wisdom
"Life is a travelling to the edge of knowledge, then a leap taken.",D. H. Lawrence,Wisdom
"Avoid having your ego so close to your position that when your position falls, your ego goes with it.",Colin Powell,Wisdom
Nine-tenths of wisdom is being wise in time.,Theodore Roosevelt,Wisdom
Never cut what you can untie.,Joseph Joubert,Wisdom
Never does nature say one thing and wisdom another.,Juvenal,Wisdom
A promise made is a debt unpaid.,Robert W. Service,Wisdom
"Singleness of purpose is one of the chief essentials for success in life, no matter what may be one's aim.",John D. Rockefeller,Wisdom
"A fool flatters himself, a wise man flatters the fool.",Edward G. Bulwer-Lytton,Wisdom
Don't taunt the alligator until after you've crossed the creek.,Dan Rather,Wisdom
But life is long. And it is the long run that balances the short flare of interest and passion.,Sylvia Plath,Wisdom
A mistake is simply another way of doing things.,Katharine Graham,Wisdom
Never reach out your hand unless you're willing to extend an arm.,Pope Paul VI,Wisdom
Wisdom is a sacred communion.,Victor Hugo,Wisdom
"If you want to go east, don't go west.",Ramakrishna,Wisdom
"Between saying and doing, many a pair of shoes is worn out.",Iris Murdoch,Wisdom
The wheel that squeaks the loudest is the one that gets the grease.,Josh Billings,Wisdom
A charming woman... doesn't follow the crowd. She is herself.,Loretta Young,Wisdom
Honesty is the best policy.,Benjamin Franklin,Wisdom
"It is always our own self that we find at the end of the journey. The sooner we face that self, the better.",Ella Maillart,Wisdom
"The more one pleases everybody, the less one pleases profoundly.",Stendhal,Wisdom
Never find fault with the absent.,Alexander Pope,Wisdom
He who lives by the crystal ball soon learns to eat ground glass.,Edgar Fiedler,Wisdom
It is the neglect of timely repair that makes rebuilding necessary.,Richard Whately,Wisdom
"If you believe the doctors, nothing is wholesome; if you believe the theologians, nothing is innocent; if you believe the military, nothing is safe.",Lord Salisbury,Wisdom
Wisdom is the power to put our time and our knowledge to the proper use.,Thomas J. Watson,Wisdom
Some folks are wise and some are otherwise.,Tobias Smollett,Wisdom
Be as you wish to seem.,Socrates,Wisdom
"It takes a great man to give sound advice tactfully, but a greater to accept it graciously.",Logan Pearsall Smith,Wisdom
Every silver lining has a cloud.,Mary Kay Ash,Wisdom
Repeat anything often enough and it will start to become you.,Tom Hopkins,Wisdom
A mouse does not rely on just one hole.,Plautus,Wisdom
The teacher who is indeed wise does not bid you to enter the house of his wisdom but rather leads you to the threshold of your mind.,Khalil Gibran,Wisdom
"When it is obvious that the goals cannot be reached, don't adjust the goals, adjust the action steps.",Confucius,Wisdom
Wisdom is not wisdom when it is derived from books alone.,Horace,Wisdom
Memory is the mother of all wisdom.,Aeschylus,Wisdom
It is better to rust out than wear out.,Edwin Markham,Wisdom
"Applause is a receipt, not a bill.",Dale Carnegie,Wisdom
A man should always consider how much he has more than he wants.,Joseph Addison,Wisdom
Suffering is one of life's great teachers.,Bryant H. McGill,Wisdom
Wisdom outweighs any wealth.,Sophocles,Wisdom
Wisdom comes by disillusionment.,George Santayana,Wisdom
"Deliberately seek opportunities for kindness, sympathy, and patience.",Evelyn Underhill,Wisdom
"When you give yourself, you receive more than you give.",Antoine de Saint-Exupery,Wisdom
"You must accept responsibility for your actions, but not the credit for your achievements.",Denis Waitley,Wisdom
Nobody can give you wiser advice than yourself.,Marcus Tullius Cicero,Wisdom
"When I can look life in the eyes, grown calm and very coldly wise, life will have given me the truth, and taken in exchange - my youth.",Sara Teasdale,Wisdom
Fear cannot be without hope nor hope without fear.,Baruch Spinoza,Wisdom
Wise kings generally have wise counselors; and he must be a wise man himself who is capable of distinguishing one.,Diogenes,Wisdom
Wisdom is found only in truth.,Johann Wolfgang von Goethe,Wisdom
It's the little details that are vital. Little things make big things happen.,John Wooden,Wisdom
"I have just three things to teach: simplicity, patience, compassion. These three are your greatest treasures.",Lao Tzu,Wisdom
"When in doubt, don't.",Benjamin Franklin,Wisdom
"People spend too much time finding other people to blame, too much energy finding excuses for not being what they are capable of being, and not enough energy putting themselves on the line, growing out of the past, and getting on with their lives.",J. Michael Straczynski,Wisdom
Wisdom sails with wind and time.,John Florio,Wisdom
The greater our knowledge increases the more our ignorance unfolds.,John F. Kennedy,Wisdom
"If you call failures experiments, you can put them in your resume and claim them as achievements.",Mason Cooley,Wisdom
"Let me warn you, if you start chasing after views, you'll be left without bread and without views.",Nikolai Gogol,Wisdom
"All of us, at certain moments of our lives, need to take advice and to receive help from other people.",Alexis Carrel,Wisdom
"Please all, and you will please none.",Aesop,Wisdom
"Above all, you must fight conceit, envy, and every kind of ill-feeling in your heart.",Abraham Cahan,Wisdom
"You must learn day by day, year by year to broaden your horizon. The more things you love, the more you are interested in, the more you enjoy, the more you are indignant about, the more you have left when anything happens.",Ethel Barrymore,Wisdom
We gain the strength of the temptation we resist.,Ralph Waldo Emerson,Wisdom
It is a characteristic of wisdom not to do desperate things.,Henry David Thoreau,Wisdom
I didn't get where I am today by worryin' about how I'd feel tomorrow.,Ron White,Wisdom
Few of the many wise apothegms which have been uttered have prevented a single foolish action.,Thomas Babington Macaulay,Wisdom
"In action a great heart is the chief qualification. In work, a great head.",Arthur Schopenhauer,Wisdom
"The best way to obtain truth and wisdom is not to ask from books, but to go to God in prayer, and obtain divine teaching.","Joseph Smith, Jr.",Wisdom
Leave no stone unturned.,Euripides,Wisdom
If fortune favors you do not be elated; if she frowns do not despond.,Ausonius,Wisdom
Many of us spend half of our time wishing for things we could have if we didn't spend half our time wishing.,Alexander Woollcott,Wisdom
"When defeat is inevitable, it is wisest to yield.",Quintilian,Wisdom
"If you want a thing done well, do it yourself.",Napoleon Bonaparte,Wisdom
"True wisdom comes to each of us when we realize how little we understand about life, ourselves, and the world around us.",Socrates,Wisdom
"You have to find out what's right for you, so it's trial and error. You are going to be all right if you accept realistic goals for yourself.",Teri Garr,Wisdom
A good head and a good heart are always a formidable combination.,Nelson Mandela,Wisdom
Imagination is more important than knowledge.,Albert Einstein,Wisdom
Meditation is the soul's perspective glass.,Owen Feltham,Wisdom
"It's not the having, it's the getting.",Elizabeth Taylor,Wisdom
In seeking wisdom thou art wise; in imagining that thou hast attained it - thou art a fool.,"Philip Stanhope, 4th Earl of Chesterfield",Wisdom
"Knowledge can be communicated, but not wisdom. One can find it, live it, be fortified by it, do wonders through it, but one cannot communicate and teach it.",Hermann Hesse,Wisdom
A little knowledge that acts is worth infinitely more than much knowledge that is idle.,Khalil Gibran,Wisdom
"Our deeds determine us, as much as we determine our deeds.",George Eliot,Wisdom
People don't notice whether it's winter or summer when they're happy.,Anton Chekhov,Wisdom
"If I don't have wisdom, I can teach you only ignorance.",Leo Buscaglia,Wisdom
The older I grow the more I distrust the familiar doctrine that age brings wisdom.,H. L. Mencken,Wisdom
Everything important always begins from something trivial.,Donald Hall,Wisdom
Man's wisdom is his best friend; folly his worst enemy.,William Temple,Wisdom
"The golden opportunity you are seeking is in yourself. It is not in your environment; it is not in luck or chance, or the help of others; it is in yourself alone.",Orison Swett Marden,Wisdom
"The motto of chivalry is also the motto of wisdom; to serve all, but love only one.",Honore de Balzac,Wisdom
To conquer fear is the beginning of wisdom.,Bertrand Russell,Wisdom
"There are three faithful friends - an old wife, an old dog, and ready money.",Benjamin Franklin,Wisdom
A prudent question is one-half of wisdom.,Francis Bacon,Wisdom
Think big thoughts but relish small pleasures.,"H. Jackson Brown, Jr.",Wisdom
"Honesty is the rarest wealth anyone can possess, and yet all the honesty in the world ain't lawful tender for a loaf of bread.",Josh Billings,Wisdom
Nature and books belong to the eyes that see them.,Ralph Waldo Emerson,Wisdom
Ignorant men raise questions that wise men answered a thousand years ago.,Johann Wolfgang von Goethe,Wisdom
The wisdom of the wise is an uncommon degree of common sense.,William Inge,Wisdom
"What is man's ultimate direction in life? It is to look for love, truth, virtue, and beauty.",Shinichi Suzuki,Wisdom
True knowledge exists in knowing that you know nothing.,Socrates,Wisdom
"Knowing others is wisdom, knowing yourself is Enlightenment.",Lao Tzu,Wisdom
"Whatever you do in life, surround yourself with smart people who'll argue with you.",John Wooden,Wisdom
"It is the nature of the wise to resist pleasures, but the foolish to be a slave to them.",Epictetus,Wisdom
"When you betray somebody else, you also betray yourself.",Isaac Bashevis Singer,Wisdom
"We are made wise not by the recollection of our past, but by the responsibility for our future.",George Bernard Shaw,Wisdom
An ounce of cheerfulness is worth a pound of sadness to serve God with.,Thomas Fuller,Wisdom
"When written in Chinese, the word 'crisis' is composed of two characters. One represents danger and the other represents opportunity.",John F. Kennedy,Wisdom
"The three great essentials to achieve anything worth while are: Hard work, Stick-to-itiveness, and Common sense.",Thomas A. Edison,Wisdom
Success is not to be pursued; it is to be attracted by the person you become.,Jim Rohn,Wisdom
"Combine the extremes, and you will have the true center.",Karl Wilhelm Friedrich Schlegel,Wisdom
"Habit, if not resisted, soon becomes necessity.",Saint Augustine,Wisdom
You can observe a lot by watching.,Yogi Berra,Wisdom
