quotes,authors,categories
"Wisdom ceases to be wisdom when it becomes too proud to weep, too grave to laugh, and too selfish to seek other than itself.",Khalil Gibran,Wisdom
You've got to go out on a limb sometimes because that's where the fruit is.,Will Rogers,Wisdom
A poem begins in delight and ends in wisdom.,Robert Frost,Wisdom
Better be wise by the misfortunes of others than by your own.,Aesop,Wisdom
"The more sand that has escaped from the hourglass of our life, the clearer we should see through it.",Jean Paul,Wisdom
Wisdom is always an overmatch for strength.,Phil Jackson,Wisdom
Each of us has been put on earth with the ability to do something well. We cheat ourselves and the world if we don't use that ability as best we can.,"George Allen, Sr.",Wisdom
"There is a wisdom of the head, and a wisdom of the heart.",Charles Dickens,Wisdom
No one wants advice - only corroboration.,John Steinbeck,Wisdom
Quick decisions are unsafe decisions.,Sophocles,Wisdom
"To wear your heart on your sleeve isn't a very good plan; you should wear it inside, where it functions best.",Margaret Thatcher,Wisdom
"Almost every wise saying has an opposite one, no less wise, to balance it.",George Santayana,Wisdom
"I believe that we are solely responsible for our choices, and we have to accept the consequences of every deed, word, and thought throughout our lifetime.",Elisabeth Kubler-Ross,Wisdom
"If you wish to reach the highest, begin at the lowest.",Publilius Syrus,Wisdom
First appearance deceives many.,Ovid,Wisdom
Climb the mountains and get their good tidings.,John Muir,Wisdom
Better mad with the rest of the world than wise alone.,Baltasar Gracian,Wisdom
Perspective is worth 80 IQ points.,Alan Kay,Wisdom
Look around for a place to sow a few seeds.,Henry Van Dyke,Wisdom
"Who is wise in love, love most, say least.",Alfred Lord Tennyson,Wisdom
Look twice before you leap.,Charlotte Bronte,Wisdom
"Wise sayings often fall on barren ground, but a kind word is never thrown away.",Arthur Helps,Wisdom
The lure of the distant and the difficult is deceptive. The great opportunity is where you are.,John Burroughs,Wisdom
"To be satisfied with a little, is the greatest wisdom; and he that increaseth his riches, increaseth his cares; but a contented mind is a hidden treasure, and trouble findeth it not.",Akhenaton,Wisdom
Wisdom begins at the end.,Daniel Webster,Wisdom
"When an opponent comes forward, move in and greet him; if he wants to pull back, send him on his way.",Morihei Ueshiba,Wisdom
"He dares to be a fool, and that is the first step in the direction of wisdom.",James Huneker,Wisdom
"Wisdom, compassion, and courage are the three universally recognized moral qualities of men.",Confucius,Wisdom
The difference between chirping out of turn and a faux pas depends on what kind of a bar you're in.,Wilson Mizner,Wisdom
All this worldly wisdom was once the unamiable heresy of some wise man.,Henry David Thoreau,Wisdom
"Tis but a part we see, and not a whole.",Alexander Pope,Wisdom
Habit is the nursery of errors.,Victor Hugo,Wisdom
This is the highest wisdom that I own; freedom and life are earned by those alone who conquer them each day anew.,Johann Wolfgang von Goethe,Wisdom
Man is only great when he acts from passion.,Benjamin Disraeli,Wisdom
The doorstep to the temple of wisdom is a knowledge of our own ignorance.,Benjamin Franklin,Wisdom
Wisdom is the quality that keeps you from getting into situations where you need it.,Doug Larson,Wisdom
Counsel woven into the fabric of real life is wisdom.,Walter Benjamin,Wisdom
"Rarely promise, but, if lawful, constantly perform.",William Penn,Wisdom
"Wisdom we know is the knowledge of good and evil, not the strength to choose between the two.",John Cheever,Wisdom
Wisdom begins in wonder.,Socrates,Wisdom
The truest wisdom is a resolute determination.,Napoleon Bonaparte,Wisdom
"A heart well prepared for adversity in bad times hopes, and in good times fears for a change in fortune.",Horace,Wisdom
Cleverness is not wisdom.,Euripides,Wisdom
Self-suggestion makes you master of yourself.,W. Clement Stone,Wisdom
"Wisdom stands at the turn in the road and calls upon us publicly, but we consider it false and despise its adherents.",Khalil Gibran,Wisdom
Does wisdom perhaps appear on the earth as a raven which is inspired by the smell of carrion?,Friedrich Nietzsche,Wisdom
It is great folly to wish to be wise all alone.,Francois de La Rochefoucauld,Wisdom
"Seek the lofty by reading, hearing and seeing great work at some moment every day.",Thornton Wilder,Wisdom
"In dwelling, live close to the ground. In thinking, keep to the simple. In conflict, be fair and generous. In governing, don't try to control. In work, do what you enjoy. In family life, be completely present.",Lao Tzu,Wisdom
"It isn't what you do, but how you do it.",John Wooden,Wisdom
Appearances are often deceiving.,Aesop,Wisdom
"The chief condition on which, life, health and vigor depend on, is action. It is by action that an organism develops its faculties, increases its energy, and attains the fulfillment of its destiny.",Colin Powell,Wisdom
"Don't follow any advice, no matter how good, until you feel as deeply in your spirit as you think in your mind that the counsel is wise.",Joan Rivers,Wisdom
The doors of wisdom are never shut.,Benjamin Franklin,Wisdom
All human wisdom works and has worries and grief as reward.,Johann Georg Hamann,Wisdom
Of prosperity mortals can never have enough.,Aeschylus,Wisdom
Wisdom is the supreme part of happiness.,Sophocles,Wisdom
"It is astonishing with how little wisdom mankind can be governed, when that little wisdom is its own.",William Inge,Wisdom
"It is the mind that maketh good or ill, That maketh wretch or happy, rich or poor.",Michel de Montaigne,Wisdom
To advise is not to compel.,Anton Chekhov,Wisdom
He who devotes sixteen hours a day to hard study may become at sixty as wise as he thought himself at twenty.,Mary Wilson Little,Wisdom
"Learning sleeps and snores in libraries, but wisdom is everywhere, wide awake, on tiptoe.",Josh Billings,Wisdom
Wise men make more opportunities than they find.,Francis Bacon,Wisdom
Let deeds match words.,Plautus,Wisdom
"This is what I learned: that everybody is talented, original and has something important to say.",Brenda Ueland,Wisdom
We are wiser than we know.,Ralph Waldo Emerson,Wisdom
Giving opens the way for receiving.,Florence Scovel Shinn,Wisdom
"It is wisdom in prosperity, when all is as thou wouldn't have it, to fear and suspect the worst.",Desiderius Erasmus,Wisdom
It is while you are patiently toiling at the little tasks of life that the meaning and shape of the great whole of life dawn on you.,Phillips Brooks,Wisdom
The opportunity for brotherhood presents itself every time you meet a human being.,Jane Wyman,Wisdom
"Eventually, we reach the point where we start to realize that we are not going to find peace, contentment, happiness, strength, fearlessness - all of the things that in our heart of hearts we wish we had - outside of us.",Guy Finley,Wisdom
If you want to be found stand where the seeker seeks.,Sidney Lanier,Wisdom
It is much more difficult to measure nonperformance than performance.,Harold S. Geneen,Wisdom
Everything in the world may be endured except continual prosperity.,Johann Wolfgang von Goethe,Wisdom
Trouble shared is trouble halved.,Lee Iacocca,Wisdom
Public opinion is no more than this: what people think that other people think.,Alfred Austin,Wisdom
"People seldom refuse help, if one offers it in the right way.",A. C. Benson,Wisdom
"Virtues are acquired through endeavor, which rests wholly upon yourself.",Sidney Lanier,Wisdom
"Good nature is worth more than knowledge, more than money, more than honor, to the persons who possess it.",Henry Ward Beecher,Wisdom
"You can't sweep other people off their feet, if you can't be swept off your own.",Clarence Day,Wisdom
"He who learns must suffer. And even in our sleep pain that cannot forget falls drop by drop upon the heart, and in our own despair, against our will, comes wisdom to us by the awful grace of God.",Aeschylus,Wisdom
"God grant me the serenity to accept the things I cannot change, the courage to change the things I can, and the wisdom to know the difference.",Reinhold Niebuhr,Wisdom
Don't gain the world and lose your soul; wisdom is better than silver or gold.,Bob Marley,Wisdom
Honesty is the first chapter in the book of wisdom.,Thomas Jefferson,Wisdom
"To acquire knowledge, one must study; but to acquire wisdom, one must observe.",Marilyn vos Savant,Wisdom
"Wisdom is the right use of knowledge. To know is not to be wise. Many men know a great deal, and are all the greater fools for it. There is no fool so great a fool as a knowing fool. But to know how to use knowledge is to have wisdom.",Charles Spurgeon,Wisdom
It is not wisdom but Authority that makes a law.,Thomas Hobbes,Wisdom
"We are drowning in information, while starving for wisdom. The world henceforth will be run by synthesizers, people able to put together the right information at the right time, think critically about it, and make important choices wisely.",E. O. Wilson,Wisdom
Science is organized knowledge. Wisdom is organized life.,Immanuel Kant,Wisdom
Where is the Life we have lost in living? Where is the wisdom we have lost in knowledge? Where is the knowledge we have lost in information?,T. S. Eliot,Wisdom
Knowledge is knowing that a tomato is a fruit. Wisdom is knowing not to put it in a fruit salad.,Brian O'Driscoll,Wisdom
A loving heart is the truest wisdom.,Charles Dickens,Wisdom
"Data is not information, information is not knowledge, knowledge is not understanding, understanding is not wisdom.",Clifford Stoll,Wisdom
"Bitcoin is a swarm of cyber hornets serving the goddess of wisdom, feeding on the fire of truth, exponentially growing ever smarter, faster, and stronger behind a wall of encrypted energy.",Michael J. Saylor,Wisdom
"Knowledge speaks, but wisdom listens.",Jimi Hendrix,Wisdom
"Grief can be the garden of compassion. If you keep your heart open through everything, your pain can become your greatest ally in your life's search for love and wisdom.",Rumi,Wisdom
All human wisdom is summed up in two words; wait and hope.,Alexandre Dumas,Wisdom
To make no mistakes is not in the power of man; but from their errors and mistakes the wise and good learn wisdom for the future.,Plutarch,Wisdom
"Outside of the cross of Jesus Christ, there is no hope in this world. That cross and resurrection at the core of the Gospel is the only hope for humanity. Wherever you go, ask God for wisdom on how to get that Gospel in, even in the toughest situations of life.",Ravi Zacharias,Wisdom
"The figure a poem makes. It begins in delight and ends in wisdom... in a clarification of life - not necessarily a great clarification, such as sects and cults are founded on, but in a momentary stay against confusion.",Robert Frost,Wisdom
The saddest aspect of life right now is that science gathers knowledge faster than society gathers wisdom.,Isaac Asimov,Wisdom
"There are three classes of men; lovers of wisdom, lovers of honor, and lovers of gain.",Plato,Wisdom
What wisdom can you find that is greater than kindness?,Jean-Jacques Rousseau,Wisdom
Love is the wisdom of the fool and the folly of the wise.,Samuel Johnson,Wisdom
We don't receive wisdom; we must discover it for ourselves after a journey that no one can take for us or spare us.,Marcel Proust,Wisdom
Let no one be slow to seek wisdom when he is young nor weary in the search of it when he has grown old. For no age is too early or too late for the health of the soul.,Epicurus,Wisdom
"We learn from each other. We learn from others' mistakes, from their experience, their wisdom. It makes it easier for us to come to better decisions in our own lives.",Adrian Grenier,Wisdom
Democracy is a pathetic belief in the collective wisdom of individual ignorance.,H. L. Mencken,Wisdom
"But what is liberty without wisdom, and without virtue? It is the greatest of all possible evils; for it is folly, vice, and madness, without tuition or restraint.",Edmund Burke,Wisdom
This age thinks better of a gilded fool Than of a threadbare saint in wisdom's school.,Thomas Dekker,Wisdom
"Kindness is more important than wisdom, and the recognition of this is the beginning of wisdom.",Theodore Isaac Rubin,Wisdom
"We learn wisdom from failure much more than from success. We often discover what will do, by finding out what will not do; and probably he who never made a mistake never made a discovery.",Samuel Smiles,Wisdom
"Logic is the beginning of wisdom, not the end.",Leonard Nimoy,Wisdom
"Wisdom is nothing but a preparation of the soul, a capacity, a secret art of thinking, feeling and breathing thoughts of unity at every moment of life.",Hermann Hesse,Wisdom
Start with God - the first step in learning is bowing down to God; only fools thumb their noses at such wisdom and learning.,King Solomon,Wisdom
"Fear is the main source of superstition, and one of the main sources of cruelty. To conquer fear is the beginning of wisdom.",Bertrand Russell,Wisdom
To profit from good advice requires more wisdom than to give it.,Wilson Mizner,Wisdom
"The virtue of justice consists in moderation, as regulated by wisdom.",Aristotle,Wisdom
"Because you are women, people will force their thinking on you, their boundaries on you. They will tell you how to dress, how to behave, who you can meet and where you can go. Don't live in the shadows of people's judgement. Make your own choices in the light of your own wisdom.",Amitabh Bachchan,Wisdom
"Let us be about setting high standards for life, love, creativity, and wisdom. If our expectations in these areas are low, we are not likely to experience wellness. Setting high standards makes every day and every decade worth looking forward to.",Greg Anderson,Wisdom
"In youth and beauty, wisdom is but rare!",Homer,Wisdom
"Don't ask for a million dollars. Ask for the stuff that'll get you a million dollars - your health, your brain, your sanity, wisdom. Prepare me for when I do get that million. Make sure I don't go crazy, make sure I help my family.",Future,Wisdom
"Tragedy is a tool for the living to gain wisdom, not a guide by which to live.",Robert Kennedy,Wisdom
"It's a horrible idea that God, this paragon of wisdom and knowledge, power, couldn't think of a better way to forgive us our sins than to come down to Earth in his alter ego as his son and have himself hideously tortured and executed so that he could forgive himself.",Richard Dawkins,Wisdom
Swim upstream. Go the other way. Ignore the conventional wisdom.,Sam Walton,Wisdom
Music is a higher revelation than all wisdom and philosophy.,Ludwig van Beethoven,Wisdom
"Where there is charity and wisdom, there is neither fear nor ignorance.",Francis of Assisi,Wisdom
"In complete darkness we are all the same, it is only our knowledge and wisdom that separates us, don't let your eyes deceive you.",Janet Jackson,Wisdom
"The philosophy of life is this: Life is not a struggle, not a tension... Life is bliss. It is eternal wisdom, eternal existence.",Maharishi Mahesh Yogi,Wisdom
Wisdom is oftentimes nearer when we stoop than when we soar.,William Wordsworth,Wisdom
"Great wisdom is generous; petty wisdom is contentious. Great speech is impassioned, small speech cantankerous.",Zhuangzi,Wisdom
"We respect our elders. There is wisdom that comes from experience, and I am not going to stop learning from wise counsel.",Marcia Fudge,Wisdom
Knowledge is a process of piling up facts; wisdom lies in their simplification.,Martin H. Fischer,Wisdom
"Nobility of spirit has more to do with simplicity than ostentation, wisdom rather than wealth, commitment rather than ambition.",Riccardo Muti,Wisdom
The most certain sign of wisdom is cheerfulness.,Michel de Montaigne,Wisdom
Silence is true wisdom's best reply.,Euripides,Wisdom
In wisdom gathered over time I have found that every experience is a form of exploration.,Ansel Adams,Wisdom
"I think that music opens portals and doorways into unknown sectors that it takes courage to leap into. I always think that there's a potential that we all have, and we can emerge, rise up to this potential, when necessary. We have to be fearless, courageous, and draw upon wisdom that we think we don't have.",Wayne Shorter,Wisdom
"We humans have lost the wisdom of genuinely resting and relaxing. We worry too much. We don't allow our bodies to heal, and we don't allow our minds and hearts to heal.",Thich Nhat Hanh,Wisdom
"What makes Superman a hero is not that he has power, but that he has the wisdom and the maturity to use the power wisely. From an acting point of view, that's how I approached the part.",Christopher Reeve,Wisdom
"Always keep your mind as bright and clear as the vast sky, the great ocean, and the highest peak, empty of all thoughts. Always keep your body filled with light and heat. Fill yourself with the power of wisdom and enlightenment.",Morihei Ueshiba,Wisdom
"Hatred is corrosive of a person's wisdom and conscience; the mentality of enmity can poison a nation's spirit, instigate brutal life and death struggles, destroy a society's tolerance and humanity, and block a nation's progress to freedom and democracy.",Liu Xiaobo,Wisdom
"Authority without wisdom is like a heavy ax without an edge, fitter to bruise than polish.",Anne Bradstreet,Wisdom
"Wisdom is the knowledge of good and evil, not the strength to choose between the two.",John Cheever,Wisdom
"The Universal Zulu Nation stands to acknowledge wisdom, understanding, freedom, justice, and equality, peace, unity, love, and having fun, work, overcoming the negative through the positive, science, mathematics, faith, facts, and the wonders of God, whether we call him Allah, Jehovah, Yahweh, or Jah.",Afrika Bambaataa,Wisdom
"The greatest obstacle to being heroic is the doubt whether one may not be going to prove one's self a fool; the truest heroism is to resist the doubt; and the profoundest wisdom, to know when it ought to be resisted, and when it be obeyed.",Nathaniel Hawthorne,Wisdom
"The way a woman carries herself and the way she dresses ought to promote the following types of words: modesty, discretion, wisdom, beauty, elegance and refinement, but not sensuality, luxury, extravagance.",Paul Washer,Wisdom
Our happiness depends on wisdom all the way.,Sophocles,Wisdom
I prefer the folly of enthusiasm to the indifference of wisdom.,Anatole France,Wisdom
"Our wisdom comes from our experience, and our experience comes from our foolishness.",Sacha Guitry,Wisdom
I gave my beauty and my youth to men. I am going to give my wisdom and experience to animals.,Brigitte Bardot,Wisdom
"True wisdom is less presuming than folly. The wise man doubteth often, and changeth his mind; the fool is obstinate, and doubteth not; he knoweth all things but his own ignorance.",Akhenaton,Wisdom
"Know what's important and what isn't. Have the wisdom to know the right thing to do, the integrity to do it, the character to stand up to those who don't, and the courage to stop those who won't.",Mark Goulston,Wisdom
Pain makes man think. Thought makes man wise. Wisdom makes life endurable.,John Patrick,Wisdom
"We must expect reverses, even defeats. They are sent to teach us wisdom and prudence, to call forth greater energies, and to prevent our falling into greater disasters.",Robert E. Lee,Wisdom
Wisdom consists of the anticipation of consequences.,Norman Cousins,Wisdom
"No one has a monopoly on truth, and science continues to advance. Yesterday's heresies may be tomorrow's conventional wisdom.",Dean Ornish,Wisdom
A monarchy conducted with infinite wisdom and infinite benevolence is the most perfect of all possible governments.,Ezra Stiles,Wisdom
"The more tranquil a man becomes, the greater is his success, his influence, his power for good. Calmness of mind is one of the beautiful jewels of wisdom.",James Allen,Wisdom
"A thought transfixed me: for the first time in my life, I saw the truth as it is set into song by so many poets, proclaimed as the final wisdom by so many thinkers. The truth - that love is the ultimate and the highest goal to which man can aspire.",Viktor E. Frankl,Wisdom
"Wisdom too often never comes, and so one ought not to reject it merely because it comes late.",Felix Frankfurter,Wisdom
"Wisdom and penetration are the fruit of experience, not the lessons of retirement and leisure. Great necessities call out great virtues.",Abigail Adams,Wisdom
"My aim, then, was to whip the rebels, to humble their pride, to follow them to their inmost recesses, and make them fear and dread us. Fear is the beginning of wisdom.",William Tecumseh Sherman,Wisdom
"To know how to grow old is the master work of wisdom, and one of the most difficult chapters in the great art of living.",Herman Melville,Wisdom
"Influential people are never satisfied with the status quo. They're the ones who constantly ask, 'What if?' and 'Why not?' They're not afraid to challenge conventional wisdom, and they don't disrupt things for the sake of being disruptive; they do it to make things better.",Travis Bradberry,Wisdom
"People usually compare the computer to the head of the human being. I would say that hardware is the bone of the head, the skull. The semiconductor is the brain within the head. The software is the wisdom. And data is the knowledge.",Masayoshi Son,Wisdom
Knowledge shrinks as wisdom grows.,Alfred North Whitehead,Wisdom
You have to know when to stop - that's wisdom.,Hubert de Givenchy,Wisdom
A man may learn wisdom even from a foe.,Aristophanes,Wisdom
"The price of wisdom is innocence. So, I have definitely become wiser but sadly a little less innocent.",Mahira Khan,Wisdom
I do not believe in the collective wisdom of individual ignorance.,Thomas Carlyle,Wisdom
"God has already done everything He's going to do. The ball is now in your court. If you want success, if you want wisdom, if you want to be prosperous and healthy, you're going to have to do more than meditate and believe; you must boldly declare words of faith and victory over yourself and your family.",Joel Osteen,Wisdom
"Without courage, wisdom bears no fruit.",Baltasar Gracian,Wisdom
It is unwise to be too sure of one's own wisdom. It is healthy to be reminded that the strongest might weaken and the wisest might err.,Mahatma Gandhi,Wisdom
Even wisdom has to yield to self-interest.,Pindar,Wisdom
Our shared values define us more than our differences. And acknowledging those shared values can see us through our challenges today if we have the wisdom to trust in them again.,John McCain,Wisdom
We all admire the wisdom of people who come to us for advice.,Arthur Helps,Wisdom
"Even when you have doubts, take that step. Take chances. Mistakes are never a failure - they can be turned into wisdom.",Cat Cora,Wisdom
I don't have the strength or wisdom to get through a single day without guidance and grace from God.,Tony Dungy,Wisdom
"I love being. There's so much wisdom in it. You wake up in the morning and you think, Hey, isn't it great just being?",Gwyneth Paltrow,Wisdom
Vanity can easily overtake wisdom. It usually overtakes common sense.,Julian Casablancas,Wisdom
"Besides the noble art of getting things done, there is the noble art of leaving things undone. The wisdom of life consists in the elimination of non-essentials.",Lin Yutang,Wisdom
"If people can't acknowledge the wisdom of indigenous cultures, then that's their loss.",Jay Griffiths,Wisdom
Life is the only real counselor; wisdom unfiltered through personal experience does not become a part of the moral tissue.,Edith Wharton,Wisdom
"Music is your own experience, your own thoughts, your wisdom.",Charlie Parker,Wisdom
"Authority is supposedly grounded in wisdom, but I could see from a very early age that authority was only a system of control. And it didn't have any inherent wisdom. I quickly realized that you either became a power or you were crushed.",Joe Strummer,Wisdom
Mistakes are the usual bridge between inexperience and wisdom.,Phyllis Theroux,Wisdom
"Whenever you argue with another wiser than yourself in order that others may admire your wisdom, they will discover your ignorance.",Saadi,Wisdom
"Few people have the wisdom to prefer the criticism that would do them good, to the praise that deceives them.",Francois de La Rochefoucauld,Wisdom
"I'm not wise, but the beginning of wisdom is there; it's like relaxing into - and an acceptance of - things.",Tina Turner,Wisdom
Books are the ever burning lamps of accumulated wisdom.,George William Curtis,Wisdom
"If suffering brings wisdom, I would wish to be less wise.",William Butler Yeats,Wisdom
The stupidity of people comes from having an answer for everything. The wisdom of the novel comes from having a question for everything.,Milan Kundera,Wisdom
"Children also have artistic ability, and there is wisdom in there having it! The more helpless they are, the more instructive are the examples they furnish us; and they must be preserved free of corruption from an early age.",Paul Klee,Wisdom
There's a beauty to wisdom and experience that cannot be faked. It's impossible to be mature without having lived.,Amy Grant,Wisdom
"I believe that when an elder dies, a library is burned: vast sums of wisdom and knowledge are lost. Throughout the world libraries are ablaze with scant attention.",Elizabeth Kapu'uwailani Lindsey,Wisdom
He who is taught to live upon little owes more to his father's wisdom than he who has a great deal left him does to his father's care.,William Penn,Wisdom
"The wisdom of the wise and the experience of the ages is preserved into perpetuity by a nation's proverbs, fables, folk sayings and quotations.",William Feather,Wisdom
