quotes,authors,categories
The all-seeing eye of God beheld our deplorable state; infinite pity touched the heart of the Father of mercies; and infinite wisdom laid the plan of our recovery.,David Brainerd,Wisdom
"The problem with Google is you have 360 degrees of omnidirectional information on a linear basis, but the algorithms for irony and ambiguity are not there. And those are the algorithms of wisdom.",William Hurt,Wisdom
"Never give up, which is the lesson I learned from boxing. As soon as you learn to never give up, you have to learn the power and wisdom of unconditional surrender, and that one doesn't cancel out the other; they just exist as contradictions. The wisdom of it comes as you get older.",Kris Kristofferson,Wisdom
"I love wisdom. And you can never be great at anything unless you love it. Not be in love with it, but love the thing, admire the thing. And it seems that if you love the thing, and you don't just want to possess it, it will find you.",Maya Angelou,Wisdom
A proverb is the wisdom of many and the wit of one.,Lord John Russell,Wisdom
The invariable mark of wisdom is to see the miraculous in the common.,Ralph Waldo Emerson,Wisdom
"I think it's nice to age gracefully. OK, you lose the youth, a certain stamina and dewy glow, but what you gain on the inside as a human being is wonderful: the wisdom, the acceptance and the peace of mind. It's a fair exchange.",Cherie Lunghi,Wisdom
Wisdom oft times consists of knowing what to do next.,Herbert Hoover,Wisdom
Science is always discovering odd scraps of magical wisdom and making a tremendous fuss about its cleverness.,Aleister Crowley,Wisdom
"Every day, every birthday candle I blow out, every penny I throw over my shoulder in a wishing well, every time my daughter says, 'Let's make a wish on a star,' there's one thing I wish for: wisdom.",Rene Russo,Wisdom
"Mixing one's wines may be a mistake, but old and new wisdom mix admirably.",Bertolt Brecht,Wisdom
"The key to wisdom is this - constant and frequent questioning, for by doubting we are led to question and by questioning we arrive at the truth.",Peter Abelard,Wisdom
"The Founding Fathers in their wisdom decided that children were an unnatural strain on parents. So they provided jails called schools, equipped with tortures called an education.",John Updike,Wisdom
The pine stays green in winter... wisdom in hardship.,Norman Douglas,Wisdom
Experiences are savings which a miser puts aside. Wisdom is an inheritance which a wastrel cannot exhaust.,Karl Kraus,Wisdom
"To avoid entangling alliances has been a maxim of our policy ever since the days of Washington, and its wisdom no one will attempt to dispute.",James Buchanan,Wisdom
Silence is the sleep that nourishes wisdom.,Francis Bacon,Wisdom
"It doesn't matter how much wisdom you have. If you don't have position, you have nothing. That's the tragedy of India.",Rahul Gandhi,Wisdom
"Cynicism masquerades as wisdom, but it is the furthest thing from it. Because cynics don't learn anything. Because cynicism is a self-imposed blindness: a rejection of the world because we are afraid it will hurt us or disappoint us. Cynics always say 'no.' But saying 'yes' begins things. Saying 'yes' is how things grow.",Stephen Colbert,Wisdom
The older I get the more wisdom I find in the ancient rule of taking first things first. A process which often reduces the most complex human problem to a manageable proportion.,Dwight D. Eisenhower,Wisdom
Preconceived notions are the locks on the door to wisdom.,Mary Browne,Wisdom
"There is a universal, intelligent, life force that exists within everyone and everything. It resides within each one of us as a deep wisdom, an inner knowing. We can access this wonderful source of knowledge and wisdom through our intuition, an inner sense that tells us what feels right and true for us at any given moment.",Shakti Gawain,Wisdom
I have studied many philosophers and many cats. The wisdom of cats is infinitely superior.,Hippolyte Taine,Wisdom
"The art of storytelling is reaching its end because the epic side of truth, wisdom, is dying out.",Walter Benjamin,Wisdom
"No party has a monopoly on wisdom. No democracy works without compromise. But when Governor Romney and his allies in Congress tell us we can somehow lower our deficit by spending trillions more on new tax breaks for the wealthy - well, you do the math. I refuse to go along with that. And as long as I'm President, I never will.",Barack Obama,Wisdom
"There is as much wisdom in listening as there is in speaking - and that goes for all relationships, not just romantic ones.",Daniel Dae Kim,Wisdom
"No one ever found wisdom without also being a fool. Writers, alas, have to be fools in public, while the rest of the human race can cover its tracks.",Erica Jong,Wisdom
"I have devoted my life to uncertainty. Certainty is the death of wisdom, thought, creativity.",Shekhar Kapur,Wisdom
"Year's end is neither an end nor a beginning but a going on, with all the wisdom that experience can instill in us.",Hal Borland,Wisdom
Kisses are a better fate than wisdom.,e. e. cummings,Wisdom
"Through consciousness, our minds have the power to change our planet and ourselves. It is time we heed the wisdom of the ancient indigenous people and channel our consciousness and spirit to tend the garden and not destroy it.",Bruce Lipton,Wisdom
Doubt is the vestibule through which all must pass before they can enter into the temple of wisdom.,Charles Caleb Colton,Wisdom
Unhappy is that Grandeur which makes us too great to be good; and that Wit which sets us at a distance from true Wisdom.,Mary Astell,Wisdom
"The man who makes everything that leads to happiness depends upon himself, and not upon other men, has adopted the very best plan for living happily. This is the man of moderation, the man of manly character and of wisdom.",Plato,Wisdom
"The truest greatness lies in being kind, the truest wisdom in a happy mind.",Ella Wheeler Wilcox,Wisdom
"An owl is traditionally a symbol of wisdom, so we are neither doves nor hawks but owls, and we are vigilant when others are resting.",Urjit Patel,Wisdom
"Community organizing is all about building grassroots support. It's about identifying the people around you with whom you can create a common, passionate cause. And it's about ignoring the conventional wisdom of company politics and instead playing the game by very different rules.",Tom Peters,Wisdom
Earthly wisdom is doing what comes naturally. Godly wisdom is doing what the Holy Spirit compels us to do.,Charles Stanley,Wisdom
"If you have the guts to keep making mistakes, your wisdom and intelligence leap forward with huge momentum.",Holly Near,Wisdom
"History is filled with tragic examples of wars that result from diplomatic impasse. Whether in our local communities or in international relations, the skillful use of our communicative capacities to negotiate and resolve differences is the first evidence of human wisdom.",Daisaku Ikeda,Wisdom
"The philosophies of one age have become the absurdities of the next, and the foolishness of yesterday has become the wisdom of tomorrow.",William Osler,Wisdom
"As you walk in God's divine wisdom, you will surely begin to see a greater measure of victory and good success in your life.",Joseph Prince,Wisdom
"The arts, quite simply, nourish the soul. They sustain, comfort, inspire. There is nothing like that exquisite moment when you first discover the beauty of connecting with others in celebration of larger ideals and shared wisdom.",Gordon Gee,Wisdom
Discipline is wisdom and vice versa.,M. Scott Peck,Wisdom
Each of us finds his unique vehicle for sharing with others his bit of wisdom.,Ram Dass,Wisdom
One part of wisdom is knowing what you don't need anymore and letting it go.,Jane Fonda,Wisdom
"I am profoundly indebted to the legacy of Wilhelm Reich, whose monumental contribution to the understanding of energy was taught to me by Philip Curcurruto, a man of simple wisdom and compassionate heart.",Peter A. Levine,Wisdom
Our experience is composed rather of illusions lost than of wisdom acquired.,Joseph Roux,Wisdom
Wisdom denotes the pursuing of the best ends by the best means.,Francis Hutcheson,Wisdom
"To enjoy good health, to bring true happiness to one's family, to bring peace to all, one must first discipline and control one's own mind. If a man can control his mind he can find the way to Enlightenment, and all wisdom and virtue will naturally come to him.",Buddha,Wisdom
Contemplation and wisdom are highest achievements and man is not totally at home with them.,Gabriel Marcel,Wisdom
"People always blame the girl; she should have said no. A monosyllable, but conventional wisdom has always been that boys can't manage it.",Anna Quindlen,Wisdom
Wit and playfulness represent a desperately serious transcendence of evil. Humor is both a form of wisdom and a means of survival.,Tom Robbins,Wisdom
"All the great evils which men cause to each other because of certain intentions, desires, opinions, or religious principles, are likewise due to non-existence, because they originate in ignorance, which is absence of wisdom.",Maimonides,Wisdom
"After the knowledge of, and obedience to, the will of God, the next aim must be to know something of His attributes of wisdom, power, and goodness as evidenced by His handiwork.",James Prescott Joule,Wisdom
"Most things break, including hearts. The lessons of life amount not to wisdom, but to scar tissue and callus.",Wallace Stegner,Wisdom
"What a company's been earning doesn't mean anything. What you have to look at is what people think it's going to earn. If you can see something in two years is going to be entirely different than the conventional wisdom, that's how you make money.",Stanley Druckenmiller,Wisdom
There is a trade off - as you grow older you gain wisdom but you lose spontaneity.,Kenny Rogers,Wisdom
With age comes common sense and wisdom.,Nas,Wisdom
"Because in the school of the Spirit man learns wisdom through humility, knowledge by forgetting, how to speak by silence, how to live by dying.",Johannes Tauler,Wisdom
Wisdom comes from within. Knowledge is acquired and can sometimes put a screen on your wisdom.,A. R. Rahman,Wisdom
"It is essential to employ, trust, and reward those whose perspective, ability, and judgment are radically different from yours. It is also rare, for it requires uncommon humility, tolerance, and wisdom.",Dee Hock,Wisdom
"Clearly older women and especially older women who have led an active life or elder women who successfully maneuver through their own family life have so much to teach us about sharing, patience, and wisdom.",Alice Walker,Wisdom
"A lot of people tell me a lot of things about my conduct, my game, my future... but I try to stay away from their words of wisdom. I don't let it distract me. On the field, you will be facing the ball alone. If you fail, you will the only one to blame. So, you should be the one deciding for yourself.",Virat Kohli,Wisdom
"There is no pain equal to that which two lovers can inflict on one another. This should be made clear to all who contemplate such a union. The avoidance of this pain is the beginning of wisdom, for it is strong enough to contaminate the rest of our lives.",Cyril Connolly,Wisdom
"I have learned throughout my life as a composer chiefly through my mistakes and pursuits of false assumptions, not by my exposure to founts of wisdom and knowledge.",Igor Stravinsky,Wisdom
"Science gives us knowledge, but only philosophy can give us wisdom.",Will Durant,Wisdom
Who in their infinite wisdom decreed that Little League uniforms be white? Certainly not a mother.,Erma Bombeck,Wisdom
"The more I draw and write, the more I realise that accidents are a necessary part of any creative act, much more so than logic or wisdom. Sometimes a mistake is the only way of arriving at an original concept, and the history of successful inventions is full of mishaps, serendipity and unintended results.",Shaun Tan,Wisdom
"I learned some valuable lessons about the legislative process, the importance of bipartisan cooperation and the wisdom of taking small steps to get a big job done.",Hillary Clinton,Wisdom
Kindness is wisdom.,Philip James Bailey,Wisdom
"I imagine God to be like my father. My father was always the voice of certainty in my life. Certainty in the wisdom, certainty in the path, certainty always in God. For me God is certainty in everything. Certainty that everything is good and everything is God.",Yehuda Berg,Wisdom
"This land, which we have watered with our tears and our blood, is now our mother country, and we are well satisfied to stay where wisdom abounds and gospel is free.",Richard V. Allen,Wisdom
Has fortune dealt you some bad cards. Then let wisdom make you a good gamester.,Francis Quarles,Wisdom
The enemy of the conventional wisdom is not ideas but the march of events.,John Kenneth Galbraith,Wisdom
"Of all the many leaders I have met in the course of my life, none made a deeper impression on me than Nelson Mandela. His courage, compassion, humility and wisdom were without parallel on the world stage, and he himself was an enduring source of inspiration.",Klaus Schwab,Wisdom
"Who knows for what we live, and struggle, and die? Wise men write many books, in words too hard to understand. But this, the purpose of our lives, the end of all our struggle, is beyond all human wisdom.",Alan Paton,Wisdom
"There is often, in the affairs of government, more efficiency and wisdom in non-action than in action.",John C. Calhoun,Wisdom
"As great as Ed is, the wisdom out here is that he can't carry a movie. They'll pay him $3 million to be the second banana in Julia Roberts things. But they won't put up $3 million for an Ed Harris movie.",George A. Romero,Wisdom
"Wisdom lies neither in fixity nor in change, but in the dialectic between the two. A constant coming and going: wisdom lies in the momentary.",Octavio Paz,Wisdom
"It is not from reason that justice springs, but goodness is born of wisdom.",Maurice Maeterlinck,Wisdom
"A cardinal rule in budgeting and saving is to pay yourself first. Once your paycheck hits your account, wisdom has it that you should move some amount to savings even before you pay the bills.",John Rampton,Wisdom
"It seems to me that, in every culture, I come across a chapter headed 'Wisdom.' And then I know exactly what is going to follow: 'Vanity of vanities, all is vanity.'",Ludwig Wittgenstein,Wisdom
"Humanity's legacy of stories and storytelling is the most precious we have. All wisdom is in our stories and songs. A story is how we construct our experiences. At the very simplest, it can be: 'He/she was born, lived, died.' Probably that is the template of our stories - a beginning, middle, and end. This structure is in our minds.",Doris Lessing,Wisdom
"When you get older, you learn certain life lessons. You apply that wisdom, and suddenly you say, 'Hey, I've got a new lease on this thing. So let's go.'",Robert Redford,Wisdom
"Whatever one thinks of the wisdom of building a mosque near Ground Zero, this controversy now affords us an immense opportunity to examine who we are as a people. It provides us with the opportunity to get back to our foundational ideals, which have always stood as a beacon for the rest of the world.",Hamza Yusuf,Wisdom
The wisdom of man never yet contrived a system of taxation that would operate with perfect equality.,Andrew Jackson,Wisdom
"The seat of knowledge is in the head; of wisdom, in the heart. We are sure to judge wrong, if we do not feel right.",William Hazlitt,Wisdom
"The first point of wisdom is to discern that which is false; the second, to know that which is true.",Lactantius,Wisdom
"I always want to be a messenger, a person that, you know, that's not afraid to pass on wisdom.",Mary J. Blige,Wisdom
"In regard of the rich grace and wisdom of his love toward his people; for who sees not, but that it is a curse to be unready as these foolish virgins, who were therefore shut out.",Thomas Shepard,Wisdom
"True wisdom listens more, talks less and can get along with all types of people.",Kiana Tom,Wisdom
"Thinking is not enough. There is no final enough of wisdom, experience - any... thing.",William S. Burroughs,Wisdom
"I hope our wisdom will grow with our power, and teach us, that the less we use our power the greater it will be.",Thomas Jefferson,Wisdom
A wholesome oblivion of one's neighbours is the beginning of wisdom.,Richard Le Gallienne,Wisdom
"I'll come to you with gifts of knowledge, wisdom and truth.",Barry White,Wisdom
To embrace the whole world in friendship is wisdom. This wisdom is not changeable like the flowers that bloom and fade.,Thiruvalluvar,Wisdom
"Knowing that you are going to die is, I suspect, the beginning of wisdom.",Terry Pratchett,Wisdom
"It's one thing to really dream and have a vision and want all these cool things, but it's a whole other thing when you actually have wisdom and understand things. Then you can truly make the best decisions.",Ciara,Wisdom
All free governments are managed by the combined wisdom and folly of the people.,James A. Garfield,Wisdom
"The gateways to wisdom and learning are always open, and more and more I am choosing to walk through them. Barriers, blocks, obstacles, and problems are personal teachers giving me the opportunity to move out of the past and into the Totality of Possibilities.",Louise L. Hay,Wisdom
"Back of every mistaken venture and defeat is the laughter of wisdom, if you listen.",Carl Sandburg,Wisdom
"Hurricane Katrina overwhelmed levees and exploded the conventional wisdom about a shared American prosperity, exposing a group of people so poor they didn't have $50 for a bus ticket out of town. If we want to learn something from this disaster, the lesson ought to be: America's poor deserve better than this.",Michael Eric Dyson,Wisdom
"The best wisdom is earned through experience, particularly mistakes.",Sophia Amoruso,Wisdom
"The wisdom of crowds works when the crowd is choosing the price of an ox, when there's a single numeric average. But if it's a design or something that matters, the decision is made by committee, and that's crap. You want people and groups who are able to think thoughts before they share.",Jaron Lanier,Wisdom
"I am ever thankful to my fans for making me who I am today. I feel I have a real commitment to them-the responsibility to make music with soul, warmth and a bit of wisdom.",Jose Jose,Wisdom
"Many spiritual teachers - in Buddhism, in Islam - have talked about first-hand experience of the world as an important part of the path to wisdom, to enlightenment.",bell hooks,Wisdom
"The hours of folly are measured by the clock; but of wisdom, no clock can measure.",William Blake,Wisdom
The world is a diverse place. Nobody has a monopoly on virtue or wisdom.,Lee Hsien Loong,Wisdom
"God, give us grace to accept with serenity the things that cannot be changed, courage to change the things which should be changed and the wisdom to distinguish the one from the other.",Reinhold Niebuhr,Wisdom
"Imagination allows us to escape the predictable. It enables us to reply to the common wisdom that we cannot soar by saying, 'Just watch!'",Bill Bradley,Wisdom
A short saying often contains much wisdom.,Sophocles,Wisdom
"One could surely argue that the Buddhist tradition, taken as a whole, represents the richest source of contemplative wisdom that any civilization has produced.",Sam Harris,Wisdom
There is more wisdom in your body than in your deepest philosophy.,Friedrich Nietzsche,Wisdom
"Of all the things which wisdom provides to make us entirely happy, much the greatest is the possession of friendship.",Epicurus,Wisdom
Government is a contrivance of human wisdom to provide for human wants. People have the right to expect that these wants will be provided for by this wisdom.,Jimmy Carter,Wisdom
Our own physical body possesses a wisdom which we who inhabit the body lack. We give it orders which make no sense.,Henry Miller,Wisdom
Follow your instincts. That's where true wisdom manifests itself.,Oprah Winfrey,Wisdom
"People, my age, people older, people younger, it's like they look up to me. They listen to my lyrics for wisdom. They listen to my lyrics for like game. They listen to my lyrics for real deal beneficial purposes.",Young Dolph,Wisdom
Wisdom is a gift but has nothing to do with age. That was probably the case with me.,Ruby Bridges,Wisdom
Every nation whose affairs betray a want of wisdom and stability may calculate on every loss which can be sustained from the more systematic policy of its wiser neighbors.,James Madison,Wisdom
We can be knowledgable with other men's knowledge but we cannot be wise with other men's wisdom.,Michel de Montaigne,Wisdom
"If I have brought any message today, it is this: Have the courage to have your wisdom regarded as stupidity. Be fools for Christ. And have the courage to suffer the contempt of the sophisticated world.",Antonin Scalia,Wisdom
"We thought, because we had power, we had wisdom.",Stephen Vincent Benet,Wisdom
It's very hard to know what wisdom is.,James Hillman,Wisdom
"No one who cooks, cooks alone. Even at her most solitary, a cook in the kitchen is surrounded by generations of cooks past, the advice and menus of cooks present, and the wisdom of cookbook writers.",Laurie Colwin,Wisdom
Wisdom comes alone through suffering.,Aeschylus,Wisdom
"Those who improve with age embrace the power of personal growth and personal achievement and begin to replace youth with wisdom, innocence with understanding, and lack of purpose with self-actualization.",Bo Bennett,Wisdom
"They must often change, who would be constant in happiness or wisdom.",Confucius,Wisdom
'Star Trek' was an attempt to say humanity will reach maturity and wisdom on the day that it begins not just to tolerate but take a special delight in differences in ideas and differences in lifeforms.,Gene Roddenberry,Wisdom
"It is the province of knowledge to speak, and it is the privilege of wisdom to listen.","Oliver Wendell Holmes, Sr.",Wisdom
Not by age but by capacity is wisdom acquired.,Plautus,Wisdom
We are to seek wisdom and understanding only in the length of days.,Robert Hall,Wisdom
"I've led a school whose faculty and students examine and discuss and debate every aspect of our law and legal system. And what I've learned most is that no one has a monopoly on truth or wisdom. I've learned that we make progress by listening to each other, across every apparent political or ideological divide.",Elena Kagan,Wisdom
"The extreme limit of wisdom, that's what the public calls madness.",Jean Cocteau,Wisdom
"I keep my friends as misers do their treasure, because, of all the things granted us by wisdom, none is greater or better than friendship.",Pietro Aretino,Wisdom
"Being a philosopher is to think, seek wisdom, and have principles that guide and influence what you do. It's to give meaning to things, find your way in the world, believe that in the end, in every instance, good will overcome evil, even if there's a bit of suffering along the way.",Andrea Pirlo,Wisdom
The function of wisdom is to discriminate between good and evil.,Marcus Tullius Cicero,Wisdom
"When you're used to being prepared to reject conventional wisdom, it leaves you open to learn more.",Mayim Bialik,Wisdom
"The more I work with the body, keeping my assumptions in a temporary state of reservation, the more I appreciate and sympathize with a given disease. The body no longer appears as a sick or irrational demon, but as a process with its own inner logic and wisdom.",George MacDonald,Wisdom
Gardening is seen as a pastime that is almost like belonging to the Church of England - a sign of maturity and wisdom and right thinking.,Monty Don,Wisdom
Pessimism is only the name that men of weak nerves give to wisdom.,Bernard DeVoto,Wisdom
I have no agenda except to be funny. Neither I or the writers profess to offer any worldly wisdom.,Julia Louis-Dreyfus,Wisdom
"And when the world is created, it is created in such a way that those eternal objects of God's loving wisdom become actualities - interacting with one another, relating to God in the finite realm.",Rowan Williams,Wisdom
Knowledge without justice ought to be called cunning rather than wisdom.,Plato,Wisdom
Wisdom does not show itself so much in precept as in life - in firmness of mind and a mastery of appetite. It teaches us to do as well as to talk; and to make our words and actions all of a color.,Lucius Annaeus Seneca,Wisdom
"In garden arrangement, as in all other kinds of decorative work, one has not only to acquire a knowledge of what to do, but also to gain some wisdom in perceiving what it is well to let alone.",Gertrude Jekyll,Wisdom
"What could be more lonely than to be enveloped in silence, to be the last of your people to speak your native tongue, to have no way to pass on the wisdom of the elders, to anticipate the promise of the children. This tragic fate is indeed the plight of someone somewhere roughly every two weeks.",Wade Davis,Wisdom
"Mainstream media tend to just mouth the conventional wisdom, to see everything through the filter of right and left.",Arianna Huffington,Wisdom
Putting is like wisdom - partly a natural gift and partly the accumulation of experience.,Arnold Palmer,Wisdom
That which seems the height of absurdity in one generation often becomes the height of wisdom in another.,Adlai Stevenson I,Wisdom
"When we looked at the life cycle in our 40s, we looked to old people for wisdom. At 80, though, we look at other 80-year-olds to see who got wise and who not. Lots of old people don't get wise, but you don't get wise unless you age.",Erik Erikson,Wisdom
"Your art kind of changes as you get older, by nature of the fact that you're hopefully gaining wisdom and you're starting to watch things with a better overview.",Sheryl Crow,Wisdom
