quotes,authors,categories
"Pure, holy simplicity confounds all the wisdom of this world and the wisdom of the flesh.",Francis of Assisi,Wisdom
"There are three methods to gaining wisdom. The first is reflection, which is the highest. The second is limitation, which is the easiest. The third is experience, which is the bitterest.",Confucius,Wisdom
With age comes wisdom and a high sex drive. And the wisdom to enjoy it.,Amber Valletta,Wisdom
"Surely, God on high has not refused to give us enough wisdom to find ways to bring us an improvement in relations between the two great nations on earth.",Mikhail Gorbachev,Wisdom
Men always talk about the most important things to perfect strangers. In the perfect stranger we perceive man himself; the image of a God is not disguised by resemblances to an uncle or doubts of wisdom of a mustache.,Gilbert K. Chesterton,Wisdom
Ignorance and bungling with love are better than wisdom and skill without.,Henry David Thoreau,Wisdom
"In science, as in art, and, as I believe, in every other sphere of human activity, there may be wisdom in a multitude of counsellors, but it is only in one or two of them.",Thomas Huxley,Wisdom
"He was gifted with the sly, sharp instinct for self-preservation that passes for wisdom among the rich.",Evelyn Waugh,Wisdom
"I am deeply impressed with the gravity and wisdom with which most federal judges approach the responsibility of sentencing. It is a difficult, soul-searching task at best.",Robert Kennedy,Wisdom
Rich people without wisdom and learning are but sheep with golden fleeces.,Solon,Wisdom
"I'm not an academic philosopher, and don't agree with the way the universities approach the subject. I'm a philosopher only in the very loose sense of someone interested in wisdom and well-being attained through reason. But I'm as interested in psychoanalysis and art as I am in philosophy.",Alain de Botton,Wisdom
"Come, come, leave business to idlers, and wisdom to fools: they have need of 'em: wit be my faculty, and pleasure my occupation, and let father Time shake his glass.",William Congreve,Wisdom
"I decided that it was not wisdom that enabled poets to write their poetry, but a kind of instinct or inspiration, such as you find in seers and prophets who deliver all their sublime messages without knowing in the least what they mean.",Socrates,Wisdom
The tradition is a fence around the law; tithes are a fence around riches; vows are a fence around abstinence; a fence around wisdom is silence.,Akiva ben Joseph,Wisdom
Cunning... is but the low mimic of wisdom.,Plato,Wisdom
"And I pray thee, loving Jesus, that as Thou hast graciously given me to drink in with delight the words of Thy knowledge, so Thou wouldst mercifully grant me to attain one day to Thee, the fountain of all wisdom and to appear forever before Thy face.",Venerable Bede,Wisdom
"I'm very accepting with my age. It's like notches on your belt: experience, wisdom, and a different kind of beauty. There comes a day when you've become comfortable in your skin.",Zoe Saldana,Wisdom
"I know that inner wisdom is more precious than wealth. The more you spend it, the more you gain.",Oprah Winfrey,Wisdom
"Pain and foolishness lead to great bliss and complete knowledge, for Eternal Wisdom created nothing under the sun in vain.",Khalil Gibran,Wisdom
Our bodies are at once the receiving and transmitting stations for life itself. It is the highest wisdom to recognize this fact and train our bodies to render them sensitive and responsive to nature. art and religion.,Ruth St. Denis,Wisdom
I am thinking of taking a fifth wife. Why not? Solomon had a thousand wives and he is a synonym for wisdom.,John Barrymore,Wisdom
Rightly defined philosophy is simply the love of wisdom.,Marcus Tullius Cicero,Wisdom
"To know one's self is wisdom, but not to know one's neighbors is genius.",Minna Antrim,Wisdom
Wisdom is knowledge which has become a part of one's being.,Orison Swett Marden,Wisdom
"We live in a society bloated with data yet starved for wisdom. We're connected 24/7, yet anxiety, fear, depression and loneliness is at an all-time high. We must course-correct.",Elizabeth Kapu'uwailani Lindsey,Wisdom
"Champions invariably have fervent philosophical beliefs. Philosophy, in its simplest terms, means 'the love of wisdom.'",Zig Ziglar,Wisdom
"Lord, bless me with the ability to achieve all that I can, and the wisdom to realize it doesn't all have to be by tomorrow!",William Eardley IV,Wisdom
"The Relation we bear to the Wisdom of the Father, the Son of His Love, gives us indeed a dignity which otherwise we have no pretence to. It makes us something, something considerable even in God's Eyes.",Mary Astell,Wisdom
"If you're a Supreme Court justice, the American people have elevated you to one of the highest offices in the land out of the goodness of their heart and out of deference to your legal wisdom. You get a lifetime appointment, limitless prestige, a great office, and what I have to assume is a very comfortable chair.",Donna Brazile,Wisdom
"America's freedom of religion, and freedom from religion, offers every wisdom tradition an opportunity to address our soul-deep needs: Christianity, Judaism, Islam, Buddhism, Hinduism, secular humanism, agnosticism and atheism among others.",Parker Palmer,Wisdom
"It was the Michael Jordan/Nike phenomenon that really let people see that athletes were OK, and black athletes were OK. Defying a previous wisdom - not only that black athletes wouldn't sell in white America, but that the NBA as a predominantly black sport could not sell in white America.",David Stern,Wisdom
"We give advice, but we cannot give the wisdom to profit by it.",Francois de La Rochefoucauld,Wisdom
"Age does not bring you wisdom, age brings you wrinkles.",Estelle Getty,Wisdom
"Wisdom has its root in goodness, not goodness its root in wisdom.",Ralph Waldo Emerson,Wisdom
I believe the continually advancing Information Revolution will lend us the wisdom and strength to address humanity's previously unsolvable problems and help us make a positive impact on all of society.,Masayoshi Son,Wisdom
"We learned in World War II that no single nation holds a monopoly on wisdom, morality or right to power, but that we must fight for the weak and promote democracy.",Joe Baca,Wisdom
Wisdom is humble that he knows no more.,William Cowper,Wisdom
"If you were to offer a thirsty man all wisdom, you would not please him more than if you gave him a drink.",Sophocles,Wisdom
To light one candle to God and another to the Devil is the principle of wisdom.,Jose Bergamin,Wisdom
It is good even for old men to learn wisdom.,Aeschylus,Wisdom
"Those who govern, having much business on their hands, do not generally like to take the trouble of considering and carrying into execution new projects. The best public measures are therefore seldom adopted from previous wisdom, but forced by the occasion.",Benjamin Franklin,Wisdom
My mother is a great source of advice and wisdom and consolation for me.,Katherine Heigl,Wisdom
"I acknowledge the privilege of being alive in a human body at this moment, endowed with senses, memories, emotions, thoughts, and the space of mind in its wisdom aspect.",Alex Grey,Wisdom
"Books are but waste paper unless we spend in action the wisdom we get from thought - asleep. When we are weary of the living, we may repair to the dead, who have nothing of peevishness, pride, or design in their conversation.",William Butler Yeats,Wisdom
"The wisdom of the wise, and the experience of ages, may be preserved by quotation.",Isaac D'Israeli,Wisdom
"Every indication of wisdom, taken from the effect, is equally an indication of power to execute what wisdom planned.",Thomas Reid,Wisdom
"Where can we find greater structural clarity than in the wooden buildings of old? Where else can we find such unity of material, construction and form? here, the wisdom of whole generations is stored.",Ludwig Mies van der Rohe,Wisdom
"Though sages may pour out their wisdom's treasure, there is no sterner moralist than pleasure.",Lord Byron,Wisdom
Silence and reserve will give anyone a reputation for wisdom.,Myrtle Reed,Wisdom
Wisdom is knowing when you can't be wise.,Paul Engle,Wisdom
The wisdom acquired with the passage of time is a useless gift unless you share it.,Esther Williams,Wisdom
"Knowledge is the consequence of time, and multitude of days are fittest to teach wisdom.",Jeremy Collier,Wisdom
"At sixty, I know little more about wisdom than I did at thirty, but I know a great deal more about folly.",Mason Cooley,Wisdom
"To think the world therefore a general Bedlam, or place of madmen, and oneself a physician, is the most necessary point of present wisdom: an important imagination, and the way to happiness.",Thomas Traherne,Wisdom
The hunger for facile wisdom is the root of all false philosophy.,George Santayana,Wisdom
"'Swan,' by Mary Oliver. Poems and prose. Reading from this book is as if visiting a very wise friend. There is wisdom and welcoming kindness on every page.",Jessye Norman,Wisdom
"So confident am I in the intentions, as well as wisdom, of the government, that I shall always be satisfied that what is not done, either cannot, or ought not to be done.",Thomas Jefferson,Wisdom
"After a gig I always head back to the hotel, remembering granny's words of wisdom. I cancel the late-night pizza and watch the Jonathan Ross show instead.",Jimmy Carr,Wisdom
Practical wisdom is what's called for in situations that have a moral dimension to them.,Barry Schwartz,Wisdom
Wisdom is keeping a sense of fallibility of all our views and opinions.,Gerald Brenan,Wisdom
"Only a well-rounded intellect, a spirit nourished in the eternal sources of intelligence and culture, of justice and wisdom, is a safeguard against both indifference and skepticism.",Ameen Rihani,Wisdom
"I'm married. My wife, Stella - a beautiful woman. She's brought a lot of peace to my life, a lot of wisdom.",Anthony Hopkins,Wisdom
"Contrary to conventional wisdom, the blue blazer's a bit of a loose cannon. A suit decided long ago what it wanted to be, and it doesn't want to hear your ideas, but a blue blazer only got around to half the job. So it leaves it up to you to find its bottoms. Gray slacks, blue jeans, patterns, white pants and different blue shades all work.",Willie Geist,Wisdom
"Ask Elizabeth is a community of voices, it's not me standing on a podium telling people how to run their lives, it's girls helping each other sharing their wisdom and advice and I create a space for them to do it.",Elizabeth Berkley,Wisdom
"Books give not wisdom where none was before. But where some is, there reading makes it more.",Elizabeth Hardwick,Wisdom
"I have the responsibility of over four million people, and I am in a position to do good, to be able to bring about a new life for my people, and I will continue to move in that direction. It's a burden, but it needs to be done, and you have to have the courage and wisdom to see it through.",Abdullah II of Jordan,Wisdom
"Age is a terrible avenger. The lessons of life give you so much to work with, but by the time you've got all this great wisdom, you don't get to be young anymore.",Elizabeth Wurtzel,Wisdom
Every speaker has a mouth; An arrangement rather neat. Sometimes it's filled with wisdom. Sometimes it's filled with feet.,Robert Orben,Wisdom
"Many sophisticated, intelligent people lack wisdom and common sense.",Joyce Meyer,Wisdom
"The Divine of the Lord in heaven is love, for the reason that love is receptive of all things of heaven, such as peace, intelligence, wisdom and happiness.",Emanuel Swedenborg,Wisdom
"One of the most beautiful passages of Rousseau is that in the sixth book of Confessions, where he describes the awakening in him of the literary sense. Of such wisdom, the poetic passion, the desire of beauty, the love of art for its own sake, has most.",Walter Pater,Wisdom
"Not a single illegal immigrant should or need enter the United States, not one. Contrary to the common wisdom, the borders are easy to seal, and controlling entry is hardly totalitarian.",Mark Helprin,Wisdom
"Normally street children are shown in terms of the tragedy of their lives - which is true - but there's also another dimension: their wisdom, dignity and enormous capacity for survival.",Henning Mankell,Wisdom
"I feel increasingly like age is very irrelevant. Quite often, cynicism is confused with wisdom, and my scorn is confused with a knowing, which I don't have.",Laura Marling,Wisdom
Wisdom finds its literary expression in wisdom literature.,Paul Ricoeur,Wisdom
"We are all responsible to Jesus first, and then, under him, to various other persons and offices. Discerning the path of love and obedience when two or more of these submissive relationships collide is a call to humble, Bible-saturated, spiritual wisdom.",John Piper,Wisdom
"Conventional wisdom notwithstanding, there is no reason either in football or in poetry why the two should not meet in a man's life if he has the weight and cares about the words.",Archibald MacLeish,Wisdom
"We all have within us a deep wisdom, but sometimes we don't know we have it.",Shakti Gawain,Wisdom
I think I got a lot of life skills; I got a lot of wisdom; I've seen a lot of bad things happen to a lot of good people.,Young Jeezy,Wisdom
Strength and wisdom are not opposing values.,William J. Clinton,Wisdom
"If we can return to a government that the Founders, in their wisdom, envisioned for us, we can return to a government that will allow our economy to thrive again, and our people to live in liberty.",Nan Hayworth,Wisdom
"God the Father, the supreme Architect, had already built this cosmic home we behold, the most sacred temple of His godhead, by the laws of His mysterious wisdom.",Giovanni Pico della Mirandola,Wisdom
To keep your secret is wisdom; to expect others to keep it is folly.,William Samuel Johnson,Wisdom
"The ultimate wisdom which deals with beginnings, remains locked in a seed. There it lies, the simplest fact of the universe and at the same time the one which calls faith rather than reason.",Hal Borland,Wisdom
"Received wisdom is that if you spend time up front getting the design right, you avoid costs later. But the longer you spend getting the design right, the more your upfront costs are, and the longer it takes for the software to start earning.",Kent Beck,Wisdom
"While people are quick to praise the wisdom of the crowd, being an old-school journalist, I look at the wisdom of the crowd and know it can quickly turn into a mob mentality.",Jason Calacanis,Wisdom
Any successful nominee should possess both the temperament to interpret the law and the wisdom to do so fairly. The next Supreme Court Justice should have a record of protecting individual rights and a strong willingness to put aside any political agenda.,Bennie Thompson,Wisdom
"Through mutual understanding, sincerity and goodwill, and with great wisdom and broad views, the leaders on both sides should jointly initiate new opportunities for peace, stability, cooperation and mutual benefit.",Chen Shui-bian,Wisdom
"In particular, for younger researchers on whom the future of mankind may depend. We believe that they are working with all the scientific wisdom at their disposal for the preservation of the inheritance of the earth and for the lasting survival of mankind.",Kenichi Fukui,Wisdom
"Remembering is painful, it's difficult, but it can be inspiring and it can give wisdom.",Paul Greengrass,Wisdom
In the vain laughter of folly wisdom hears half its applause.,George Eliot,Wisdom
"Money can be taken away from you, by the IRS or by pistol. That's why I always measure riches in terms of wisdom. No one can ever take from you what you know.",Juan Gabriel,Wisdom
"What I lack in energy, I have in wisdom.",Marcia Cross,Wisdom
"Dr. Johnson has said that the chief glory of a country arises from its authors. But then that is only as they are oracles of wisdom; unless they teach virtue, they are more worthy of a halter than of the laurel.",Jane Porter,Wisdom
"It may almost be a question whether such wisdom as many of us have in our mature years has not come from the dying out of the power of temptation, rather than as the results of thought and resolution.",Anthony Trollope,Wisdom
"Instead of looking at life as a narrowing funnel, we can see it ever widening to choose the things we want to do, to take the wisdom we've learned and create something.",Liz Carpenter,Wisdom
Men who know themselves are no longer fools. They stand on the threshold of the door of Wisdom.,Havelock Ellis,Wisdom
"Evil can be a teacher, if you look at the wisdom of its negative power.","Tom Brown, Jr.",Wisdom
"The most excellent and divine counsel, the best and most profitable advertisement of all others, but the least practiced, is to study and learn how to know ourselves. This is the foundation of wisdom and the highway to whatever is good.",Pierre Charron,Wisdom
"No man is the wiser for his learning; it may administer matter to work in, or objects to work upon; but wit and wisdom are born with a man.",John Selden,Wisdom
"As far as feeling freedom in my career now versus five years ago... I think if I feel any more free it's simply because of the experiences that I've had, and the wisdom I've accumulated from that time.",Mary Chapin Carpenter,Wisdom
"As I visited the various neighborhoods in the campaign, I learned fast that it's a mistake to think that all of the wisdom and possible solutions to our problems are available only in this building.",Jane Byrne,Wisdom
"However great an evil immorality may be, we must not forget that it is not without its beneficial consequences. It is only through extremes that men can arrive at the middle path of wisdom and virtue.",Wilhelm von Humboldt,Wisdom
Wisdom consists not so much in knowing what to do in the ultimate as knowing what to do next.,Herbert Hoover,Wisdom
"A man of strength and wisdom, John Paul became an inspiration to generations of both Catholics and non-Catholics throughout the world by encouraging freedom, promoting peace and respecting all faiths.",Greg Walden,Wisdom
"I have sympathy for young people, for their growing pains, but I balk when these growing pains are pushed into the foreground, when you make these young people the only vehicles of life's wisdom.",Wislawa Szymborska,Wisdom
"Robots have already surpassed human beings in calculation and memory, but I have no doubt that the time will come when they will surpass in wisdom as well.",Masayoshi Son,Wisdom
What is all wisdom save a collection of platitudes?,Norman Douglas,Wisdom
"Big money is not a good thing for a little soul: it will only ensnare his feet, and he will fall to his ruin. Wealth is safe only for those who have a wealth of wisdom.",Edwin Markham,Wisdom
"Many people have their reputations as reporters and analysts because they are on television, batting around conventional wisdom. A lot of these people have never reported a story.",Bob Woodward,Wisdom
"Because of my upbringing, I believe in things like limited government, fiscal responsibility and personal accountability. I believe in the wisdom of our founders and the sanctity of our Constitution.",John Thune,Wisdom
"I continue to believe, contrary to the given wisdom, that it's more interesting to have an album - or, indeed, an individual song - which has variety rather than homogeneity.",Peter Hammill,Wisdom
"The woods were a boon; all too often, the forest offered danger and mystery. Yet it could be liberating. If you entered that wild place on its own terms, you might be accorded wisdom.",John Burnside,Wisdom
"If they can prove that I am wrong by that time, I will give it up to their wisdom, but not after to any one's judgment, till I see the end of another year; for the Lord will begin with a new century; and I will see what he will do, before I will hearken to any man's judgment.",Joanna Southcott,Wisdom
"The DISCLOSE Act is a testament to the wisdom of the Supreme Court's decision in Citizens United. The First Amendment sought to place political speech beyond the government's control, and we can be glad that it did.",Bradley A. Smith,Wisdom
"There is this difference between happiness and wisdom: he that thinks himself the happiest man, really is so; but he that thinks himself the wisest, is generally the greatest fool.",Charles Caleb Colton,Wisdom
The 'wisdom of the crowds' is the most ridiculous statement I've heard in my life. Crowds are dumb.,Drew Curtis,Wisdom
"Without wisdom, the future has no meaning, no valuable purpose.",Herbie Hancock,Wisdom
"Most of our pocket wisdom is conceived for the use of mediocre people, to discourage them from ambitious attempts, and generally console them in their mediocrity.",Robert Louis Stevenson,Wisdom
"Wisdom alone is true ambition's aim, wisdom is the source of virtue and of fame; obtained with labour, for mankind employed, and then, when most you share it, best enjoyed.",Alfred North Whitehead,Wisdom
"Christian, learn from Christ how you ought to love Christ. Learn a love that is tender, wise, strong; love with tenderness, not passion, wisdom, not foolishness, and strength, lest you become weary and turn away from the love of the Lord.",Saint Bernard,Wisdom
"If the highest things are unknowable, then the highest capacity or virtue of man cannot be theoretical wisdom.",Leo Strauss,Wisdom
"The weak have remedies, the wise have joys; superior wisdom is superior bliss.",Edward Young,Wisdom
"As a youngster, I used to try to pick up any bits of wisdom about the guitar I could. It's not like now where you have books and books about every aspect of anything. Any little pearl of wisdom was welcome back then.",Johnny Marr,Wisdom
The left has come to regard common sense - the traditional wisdom and folkways of the community - as an obstacle to progress and enlightenment.,Christopher Lasch,Wisdom
"F. Lee Bailey had been an inspiration to me. It was my desire to have him behind the scenes, to rely on his great wisdom and his brainpower, but I did not feel he should be in the courtroom.",Robert Shapiro,Wisdom
Full of wisdom are the ordinations of fate.,Friedrich Schiller,Wisdom
"They see me as being this Super Mom on TV who also can more than handle a difficult husband, and they assume I'm going to be just full of wisdom as a mother and wife myself.",Patricia Richardson,Wisdom
I covered my face because they had taken my wisdom teeth out.,Josh Brolin,Wisdom
I do interviews because it's a chance to be myself. I sometimes wonder what I could have to say that would be of any interest. I don't have any great wisdom.,Parker Stevenson,Wisdom
"After all my possessions had been burned, God gave me the wisdom to return to Jerusalem.",Shmuel Yosef Agnon,Wisdom
"I quite like the idea - just as an abstract idea - of 12 people's collective life experience and wisdom being this formidable thing. People say juries can be led - I think 12 people from different backgrounds, different races, different genders, different ages, it's hard to hoodwink.",Peter Morgan,Wisdom
"Purity engenders Wisdom, Passion avarice, and Ignorance folly, infatuation and darkness.",Cyril Connolly,Wisdom
More helpful than all wisdom is one draught of simple human pity that will not forsake us.,George Eliot,Wisdom
"There's the conventional wisdom, of which I have none, where you get a record deal, you get a publicist, you get a campaign, and you do the tour, but none of that adds up to things like nuance and subtlety and dynamic.",Chris Robinson,Wisdom
"If religion comes into the public square, it is as vulnerable as any other human institution to be pelted with produce. Ignorance does not become wisdom just because you gussy it up with the Gospels.",Charlie Pierce,Wisdom
We just don't subscribe to the conventional wisdom that you can't have an action series led by a female character. It's kinda nonsense to us.,Bryan Konietzko,Wisdom
There is no wisdom of man that can change men or change nations; it is the power and wisdom of God that can.,Yemi Osinbajo,Wisdom
"I chose Sony Classics, not just because of their practical experience, not just because of their wisdom in marketing, but mainly because of their integrity.",Arthur Cohn,Wisdom
"In justice to human society it may perhaps be said of almost all the polities and civil institutions in the world, however imperfect, that they have been founded in and carried on with very considerable wisdom.",Ezra Stiles,Wisdom
"I don't see the wisdom in modern politicians that I once saw in men like Dean Acheson, David Bruce, or George Marshall. In my day, the northeastern establishment dominated foreign policy formulation, but the composition and distribution of our population is very different today.",Henry Kissinger,Wisdom
"Now that I am sixty, I see why the idea of elder wisdom has passed from currency.",John Updike,Wisdom
"Lessons of wisdom have the most power over us when they capture the heart through the groundwork of a story, which engages the passions.",Laurence Sterne,Wisdom
"Economists often like startling theorems, results which seem to run counter to conventional wisdom.",Joseph Stiglitz,Wisdom
"Man is wise and constantly in quest of more wisdom; but the ultimate wisdom, which deals with beginnings, remains locked in a seed. There it lies, the simplest fact of the universe and at the same time the one which calls forth faith rather than reason.",Hal Borland,Wisdom
Novels are the Socratic dialogues of our time. Practical wisdom fled from school wisdom into this liberal form.,Karl Wilhelm Friedrich Schlegel,Wisdom
We have heeded no wisdom offering guidance.,Dora Russell,Wisdom
It may be assumed as an axiom that Providence has never gifted any political party with all of political wisdom or blinded it with all of political folly.,John George Nicolay,Wisdom
