quotes,authors,categories
"Any of us can be happy and have a good attitude when everything is going our way. But I believe it's the real test of your character and of your faith to say, 'Things are not going our way, but I'm still being good to people; I'm still attending church; I still have a good attitude.'",Joel Osteen,Attitude
"Acting tough is all about developing an attitude and a persona that says, 'Look at how great I am.' But often, that tough exterior is meant to hide self-doubt. Mentally strong people invest more energy into working on their weaknesses rather than trying to cover them up.",Amy Morin,Attitude
"Money brings you security and choice. You can make decisions in a different way if you have a lot of money. But when you have nothing, you have a naivety, and a more fearless attitude because you have nothing to lose.",Simon Cowell,Attitude
"I was kicked out of school because of my attitude. I was not assimilating. So I went to work, taking any jobs I could get.",Richard Pryor,Attitude
"I don't know, I've always written songs that are mainly about attitude, not me personally.",Lemmy,Attitude
"The directors I respect are the ones who have a collaborative attitude, who collaborate with actors.",Eric Braeden,Attitude
All I can control is myself and just keep having a positive attitude.,Rose Namajunas,Attitude
"I was fortunate to play for Pete Rose and have teammates like Ken Griffey Sr., Tony Perez and Dave Concepcion. I grew up in the game with a mature attitude. I've always known it was better to be seen and not heard.",Eric Davis,Attitude
"I can only control myself, my actions, my work ethic, and my attitude.",Ali Krieger,Attitude
"When I go to the clinic next and sit with a tube in my arm and watch the poison go in, I'm in an attitude of abject passivity. It doesn't feel like fighting at all; it just feels like submitting.",Christopher Hitchens,Attitude
"Reproach is shame, blame, disgrace, disapproval and a disrespectful attitude toward yourself. When you're under reproach, your behavior shows it.",Joyce Meyer,Attitude
There is a need for financial reform along ethical lines that would produce in its turn an economic reform to benefit everyone. This would nevertheless require a courageous change of attitude on the part of political leaders.,Pope Francis,Attitude
"For me, bomber jackets are smart, but they are also street and have a lot of attitude.",The Weeknd,Attitude
"Having a child makes you strong and gives you chutzpah. It relaxed my attitude to the job; my center of focus shifted, which I think is very helpful, because even if you're not a very indulgent actor you spend a lot of time thinking about yourself. I don't think that is particularly healthy.",Imelda Staunton,Attitude
"Success or failure depends more upon attitude than upon capacity successful men act as though they have accomplished or are enjoying something. Soon it becomes a reality. Act, look, feel successful, conduct yourself accordingly, and you will be amazed at the positive results.",William James,Attitude
You don't have to have an attitude if you're famous.,Adriana Lima,Attitude
"The world is fortunate - for the time being, at least - that it has an American president in Obama who is prepared to take a conciliatory and concessive attitude towards America's decline and that it has a Chinese leadership which has been extremely cautious about expressing an opinion, let alone flexing its muscles.",Martin Jacques,Attitude
"My agent says that I'm a 'repeat business guy.' If you hire me to come do a movie, I'll be on time, know all my material, be ready to go, have a good attitude. I'm here to work, so I get hired over and over again by the same producers. If you just be a team player on set you can work so much more often.",Dean Cain,Attitude
"It's just sad that one's attitude is always speculated, even if you've not done something.",Karan Patel,Attitude
"My attitude is, do as much as I can while I'm free. And if I'm arrested I'll still do as much as I can.",Aung San Suu Kyi,Attitude
"If I had been asked to write 1,200 words for a newspaper tomorrow, on any subject, I would just do it rather than leave a white hole in the page. And I think it's a very healthy attitude to take to writing anything.",Tom Stoppard,Attitude
"Oh, I don't think Tom Sowell would tell anybody to join the administration. That's not his style. But I think his attitude has always been if it had to be done he'd prefer me to do it than somebody else.",Clarence Thomas,Attitude
You can learn what you want to learn through hard work. And a good employer will teach you what you want to learn as long as you show the right attitude and behaviors.,Gerald Chertavian,Attitude
The novelist teaches the reader to comprehend the world as a question. There is wisdom and tolerance in that attitude. In a world built on sacrosanct certainties the novel is dead.,Milan Kundera,Attitude
"You don't know how many celebrities I've gone into recording sessions with who first are kind of weirded out by us freaky voiceover people, then when the day is over, they want to stay. They haven't had that much fun acting in ages. It's hard to have any attitude about it.",Jeff Bennett,Attitude
"I met my grandfather just before he died, and it was the first time that I had seen Dad with a relative of his. It was interesting to see my own father as a son and the body language and alteration in attitude that comes with that, and it sort of changed our relationship for the better.",Christian Bale,Attitude
Italian style is a natural attitude. It is about a life of good taste. It doesn't have to be expensive. Simple but with good taste. Luxury is possible to buy. Good taste is not.,Diego Della Valle,Attitude
One of the things that's unique about Louisiana politics is that people here have a much more realistic attitude about who their politicians are. They know they are human and not saints or Mormons or Eagle Scouts.,Mark Frost,Attitude
"For me, running against the Poles and Czechs would be like running against high school kids. And I hate all this gung-ho, run-for-the-red-white-and-blue attitude that the AAU spouts. If that's important to some people, fine, more power to 'em. But, damn it, I wish they'd leave me alone to do what I want to do - run against the best.",Steve Prefontaine,Attitude
"We got shorted when it comes to recognition for the '80s war. Everybody talks about the 'Monday Night Wars' and the 'Attitude Era,' but it was neck and neck in the '80s.",Jim Cornette,Attitude
"I became a librarian at the Sainte-Genevieve Library in Paris. I made this gesture to rid myself of a certain milieu, a certain attitude, to have a clean conscience, but also to make a living. I was twenty-five. I had been told that one must make a living, and I believed it.",Marcel Duchamp,Attitude
"I've always been a guy who's pretty supportive, its just my nature, so I came in to the situation with the attitude that I wanted to support Johnny and make it work.",Rick Derringer,Attitude
You can't beat the beehive for glam punkette attitude.,Rob Sheffield,Attitude
You can't study comedy; it's within you. It's a personality. My humor is an attitude.,Don Rickles,Attitude
"Design is about point of view, and there should be some sort of woman or lifestyle or attitude in one's head as a designer.",Vera Wang,Attitude
"If you look hard at it, if you look hard at the bleeding heart attitude to always throw money at issues, throw money at problems, what you're in fact probably saying is you're exercising a prejudicism of low expectations.",Andrew Forrest,Attitude
"The idea of modernity is beginning to lose its vitality. It is losing it because modernity is no longer a critical attitude but an accepted, codified convention.",Octavio Paz,Attitude
"Like success, failure is many things to many people. With Positive Mental Attitude, failure is a learning experience, a rung on the ladder, a plateau at which to get your thoughts in order and prepare to try again.",W. Clement Stone,Attitude
You'd like more people to recognise what you do is special. But I take the attitude that the best thing I can do for my sport is to be the best at it. The best way people will come to recognise that track and field is a great sport is to see athletes excelling at it. Which is what I intend to do.,Maurice Greene,Attitude
"Adopting a really positive attitude can work wonders to adding years to your life, a spring to your step, a sparkle to your eye, and all of that.",Christie Brinkley,Attitude
"Before the sacred, people lose all sense of power and all confidence; they occupy a powerless and humble attitude toward it. And yet no thing is sacred of itself, but by my declaring it sacred, by my declaration, my judgment, my bending the knee; in short, by my - conscience.",Max Stirner,Attitude
"You tell your kids that no matter what, you set your goals and you go for them. Whatever it is you achieve, never give up. You want your kids to have that good attitude, the confidence, and the will power to believe in themselves.",Joel Parkinson,Attitude
"The attitude of insolent haughtiness is characteristic of the relationships Americans form with what is alien to them, with others.",Jose Saramago,Attitude
"As a child, my parents' attitude rubbed off on me; I have an old teenage diary that marks the moment when my parents decided to buy a colour television. I was very much against it and wrote that it was a waste of money.",Lucy Worsley,Attitude
"I wouldn't ever say if you're having tough times then there must be something wrong with you or your attitude. Life's a fight. It's a good fight of faith. I encourage people to stay up, stay hopeful, stay faith-filled.",Joel Osteen,Attitude
"There's always the motivation of wanting to win. Everybody has that. But a champion needs, in his attitude, a motivation above and beyond winning.",Pat Riley,Attitude
"When you Google me, you'll find a lot of people don't like Richard Dreyfuss. Because I'm cocky and I present a cocky attitude. But no one has ever disagreed with the notion I represent, that we need more civic education. So far there's 100 percent support for that.",Richard Dreyfuss,Attitude
Your attitude towards failure determines your altitude after failure.,John C. Maxwell,Attitude
Part of the punk attitude was that you should project your music through your whole body... show your personality as much as possible.,Billy Idol,Attitude
The idea of politics is just so uninteresting to me - I've never paid much attention to it. I don't believe things can really change. It doesn't matter who's president. Nothing really gets resolved. I don't know. I guess that's not the right attitude to take.,Trent Reznor,Attitude
The attitude is we live and let live. This is actually an amazing change in values in a rather short time and it's an example of freedom from religion.,Tom Wolfe,Attitude
"I was born with a happy heart, and I try to keep a good attitude. It's not true that I'm happy all the time because nobody is, and we all go through our things.",Dolly Parton,Attitude
It will be disastrous when a leader or manager shows up with one attitude one day and treats people with a different attitude the next day.,Zig Ziglar,Attitude
Choosing an attitude of faith will release peace out of your spirit and into your soul.,Joyce Meyer,Attitude
"From the beginning, I've always had a knack for catchy melodies. But I went through a period when I was trying to be rock n' roll and have a rock n' roll attitude. I was fighting my nature by trying to play really hard and sing really hard. But at a certain point, I realized that I loved syrupy pop music with tons of harmony.",Juliana Hatfield,Attitude
"I think that we all plateau, from fitness experts to regular folks at every fitness level. What that means is we need to change our exercise routine, food, and attitude.",David Kirsch,Attitude
The attitude and identity that we want to play with doesn't change.,Dan Quinn,Attitude
"Yes, we're still five little people with a noisy attitude.",Angus Young,Attitude
A positive impact stems from our admission that we were wrong or our thinking was wrong. 'I'm wrong' are two little words that can help improve our own positive attitude.,Richard M. DeVos,Attitude
"In the business world today, failure is apparently not an option. We need to change this attitude toward failure - and celebrate the idea that only by falling on our collective business faces do we learn enough to succeed down the road.",Naveen Jain,Attitude
Always keep that happy attitude. Pretend that you are holding a beautiful fragrant bouquet.,Earl Nightingale,Attitude
"I have such an extreme attitude about work, where I can just completely be derelict of my responsibilities and then when I am not derelict, I am completely indulged in it. I swing pretty wildly from the two extremes.",Geddy Lee,Attitude
"If you like energy, if you like attitude, if you like tough beats with black rhythms with a bit of soul and a bit of realness, come and check out the Prodigy.",Keith Flint,Attitude
"I love to write about Nabokov and also to think about him. I love his attitude that he is incomparable, his lofty judgments and general scorn of other writers - not all of them, of course.",James Salter,Attitude
When you have vision it affects your attitude. Your attitude is optimistic rather than pessimistic.,Charles R. Swindoll,Attitude
"I don't mean this in a stuck-up way, but I needed an attitude song.",Gwen Stefani,Attitude
People in tough times - it doesn't mean they don't have a great attitude.,Joel Osteen,Attitude
"I want to look my best for God. So many people have the attitude that if you're a Christian you've got to dress bad, wear an old color, not do anything to your hair, have nothing. It's no wonder that Christianity is not very attractive. I mean, how many people do you know in a Western culture that's going to go, 'Yeah, give me some of that?'",Joyce Meyer,Attitude
"There must be something solemn, serious, and tender about any attitude which we denominate religious. If glad, it must not grin or snicker; if sad, it must not scream or curse.",William James,Attitude
The only reason to have a positive mental attitude is that it makes life better. It doesn't cure cancer.,Molly Ivins,Attitude
I have a saddened and weakening attitude toward the media and press.,Terry Fox,Attitude
The best way to inspire people to superior performance is to convince them by everything you do and by your everyday attitude that you are wholeheartedly supporting them.,Harold S. Geneen,Attitude
"I know there's millions of problems in the world, but if you dwell on those, then you're going to be miserable. I think my meditation helps me to transcend and get beyond the grip of all the negativity and regenerate from within a more positive attitude, which comes in very handy when you're going to do 150 concerts a year.",Mike Love,Attitude
"Stiletto, I look at it more as an attitude as opposed to a high-heeled shoe.",Lita Ford,Attitude
"I believe that when you think of the negative, and you get up discouraged - 'There's nothing good in my future' - I really believe it almost ties the hands of God. God works where there's an attitude of faith. I believe faith is all about hope.",Joel Osteen,Attitude
"My motto is more, 'If you want to find something new, look for something new!' There is a certain amount of risk in this attitude, as even the slightest failure tends to be resounding, but you are so happy when you succeed that it is worth taking the risk.",Yves Chauvin,Attitude
"I have a political attitude, but I'm certainly not a politician.",Kgalema Motlanthe,Attitude
"I saw 'Taxi Driver,' and 'Taxi Driver' kind of saved my life. The scene where Robert De Niro is looking at himself in the mirror saying, 'You talkin' to me? You talkin' to me? Who the hell else are you talkin' to?' That's the scene that changed my life by changing my attitude about acting.",Michael Biehn,Attitude
American films look at films with a larger than life attitude while the French films look at life as it is.,Priyadarshan,Attitude
"I think failure is nothing more than life's way of nudging you that you are off course. My attitude to failure is not attached to outcome, but in not trying. It is liberating. Most people attach failure to something not working out or how people perceive you. This way, it is about answering to yourself.",Sara Blakely,Attitude
"If you take the contempt some Americans have for yuppies and multiply it by 10 you might come close to understanding their attitude towards the City, as they call it - London, the people of the south.",Martin Cruz Smith,Attitude
"Look, everything that you experience as a kid is the foundation of how you are today. I was brought up in a working class family in Leeds and when it comes to money both my parents worked hard and instilled the same attitude into me.",Mel B,Attitude
"I mean, the shoe - there is a music to it, there is attitude, there is sound, it's a movement. Clothes - it's a different story. There are a million things I'd rather do before designing clothes: directing, landscaping.",Christian Louboutin,Attitude
"I trained as a writer before I became a lawyer. I was headed for a life as an English professor, but that just wasn't me. I'm not a scholar; I didn't have a scholar's attitude toward literature.",Scott Turow,Attitude
"I want to say something very clearly. I understand that I'm a self-confident person who might come off with the wrong attitude sometimes, but I don't mean to. I just believe in certain things, and I know exactly what I want. I've always sacrificed things in order to become the best musician I could be.",Yngwie Malmsteen,Attitude
I was bringing my attitude as a regular person 'cause this is my attitude.,Glenn Danzig,Attitude
You can measure a programmer's perspective by noting his attitude on the continuing vitality of FORTRAN.,Alan Perlis,Attitude
"In the late '70s, maybe just before I started, there was still an attitude that if you did film you didn't do TV and vice versa, but that's gone now.",Robert Carlyle,Attitude
"Neapolitans are extremely empathetic, whereas the typical northern attitude is more about not showing or sharing your feelings.",Toni Servillo,Attitude
"To me, Shane Warne is a great turner of the ball. I like his aggressive attitude, I love the way he attacks batsmen, and I give him 100 per cent for that, as not enough spinners bowl with that approach, but in my estimation, Subhash Gupte was a better leg-spinner.",Garfield Sobers,Attitude
The reason I wanted to be a WWE Superstar was because of The Rock. I used to watch him in The Attitude Era. There was no one more electrifying and no one more must-see than The Rock.,The Miz,Attitude
"The attitude is different in the U.S. I feel like, in Canada, there is more of a sense of community and more of a sense of, 'I'll take the shirt off my back to help you because you're my neighbour.' There is not many of us, right? So each and every Canadian is very special.",Patrick Chan,Attitude
There is definitely something sexy about a girl with an attitude and a pair of leather pants.,Eliza Dushku,Attitude
"When you're walking at the airport, you're expected to smile at people because they know you... I find that tough. I'm only trying to protect myself. So I don't take my eyes off the floor. People can take that as attitude. But it's actually shyness. Yes, it is a bad habit. But it's a defense mechanism.",Katrina Kaif,Attitude
"I've always had that attitude about my career: it's something that I do, but it's not my whole life. I have a real life, a personal life: I've got a lot of chickens, I've got a horse, I've got a kitty-cat, I've got a lot of goats, I've got animals all over the place.",Buffy Sainte-Marie,Attitude
"In Gnosticism, the physical world did not ultimately matter - which meant physical suffering did not matter either. Seeking 'enlightenment' meant cultivating an attitude of detachment, even indifference.",Nancy Pearcey,Attitude
"I think anything's possible for me with my attitude and my desire to want to get better every single day as a person and as a basketball player, I think anything's possible for me.",Avery Bradley,Attitude
"I think that generally music should be a positive thing, I like Bob Marley's attitude: he said that his goal in life was to single handedly fight all the evil in the world with nothing but music, and when he went to a place he didn't go to play, he went to conquer.",Jon Fishman,Attitude
"As athletes, the biggest asset that we bring to the workplace is our work ethic, our confidence, our never-say-die attitude. We're about winning.",Katrina Adams,Attitude
An aristocratic culture does not advertise its emotions. In its forms of expression it is sober and reserved. Its general attitude is stoic.,Johan Huizinga,Attitude
"The attitude of physiological psychology to sensations and feelings, considered as psychical elements, is, naturally, the attitude of psychology at large.",Wilhelm Wundt,Attitude
Everybody seems to be wasting their time online. There is such a narcissistic attitude. It's such a strange world.,Sebastian Maniscalco,Attitude
This is the paradox for me: in failure alone is there any possibility of success. I don't think I'm alone in this - nor do I think it's an attitude that only prevails among people whose work is obviously 'creative'.,Will Self,Attitude
"It's a fundamental, social attitude that the 1% supports symphonies and operas and doesn't support Johnny learning to program hip-hop beats. When I put it like that, it sounds like, 'Well, yeah,' but you start to think, 'Why not, though?' What makes one more valuable than another?",David Byrne,Attitude
"Peace is a never-ending process, the work of many decisions by many people in many countries. It is an attitude, a way of life, a way of solving problems and resolving conflicts.",scar Arias,Attitude
"If philosophy is practice, a demand to know the manner in which its history is to be studied is entailed: a theoretical attitude toward it becomes real only in the living appropriation of its contents from the texts.",Karl Jaspers,Attitude
"What irritates me is the bland way people go around saying, 'Oh, our attitude has changed. We don't dislike these people any more.' But by the strangest coincidence, they haven't taken away the injustice; the laws are still on the books.",Christopher Isherwood,Attitude
I grew up in a rough environment. You want to be strong and have your presence felt out there. That attitude reflects how people see you.,Mekhi Phifer,Attitude
"The attitude of the business community towards investment in Austria and Germany has always been positive, as both the countries have earned their reputation as countries with a consistent economic environment.",Yelena Baturina,Attitude
"Regardless of what one's attitude towards prohibition may be, temperance is something against which, at a time of war, no reasonable protest can be made.",William Lyon Mackenzie King,Attitude
"My father instilled in me the attitude of prevailing. If there's a challenge, go for it. If there's a wall to break down, break it down.",Donny Osmond,Attitude
"For myself and my attitude, I have, every day, to work on it.",Simona Halep,Attitude
"I expect if people have had a problem with me or my attitude, then they come and take it directly with me, face to face.",Ada Hegerberg,Attitude
"There are a lot of inaccuracies out there when it comes to the SEAL training process. You will see guys carrying logs around on television. They think that the hardest part about being on a SEAL team is getting through that training. The fact of the matter is, if you have a good attitude, that training is fun. I had a blast.",Jocko Willink,Attitude
"I ended my journey with 'Balika'... on a good note, but I've been hearing that I threw tantrums on the set and had an attitude problem.",Pratyusha Banerjee,Attitude
"Liberalism is an attitude rather than a set of dogmas - an attitude that insists upon questioning all plausible and self-evident propositions, seeking not to reject them but to find out what evidence there is to support them rather than their possible alternatives.",Morris Raphael Cohen,Attitude
"The worst thing about being the laureate has been the attitude of a tiny minority of adults who haven't liked some of the things I'm supposed to have said and who have used it as an opportunity to be verbally abusive and nasty, but I haven't let it rule my world!",Malorie Blackman,Attitude
"I've never run into a guy who could win at the top level in anything today and didn't have the right attitude, didn't give it everything he had, at least while he was doing it; wasn't prepared and didn't have the whole program worked out.",Ted Turner,Attitude
"I've always been that person: If it gets into my head, I've got to do it until I get it perfect - a perfectionist's attitude.",Brendon Urie,Attitude
"There's a different kind of attitude when you come from Western New York. You work for everything you get, and nothing's really handed to you... You realize good work turns to good things, and that's the edge I always came up with.",Luke Harper,Attitude
"Refuse to be a lazy Christian, and resist a passive, apathetic attitude.",Joyce Meyer,Attitude
What sculptors do is represent the essence of gesture. What is important in mime is attitude.,Marcel Marceau,Attitude
Indians are sometimes accused of being condescending toward Westerners and of being excessively preachy in their attitude toward other nations. That accusation is sometimes correct.,Gary Weiss,Attitude
My attitude is different. And no one understands me the way my friends do.,Hima Das,Attitude
The reality is I'm not this person with this driving 'get it done' attitude.,Greg Giraldo,Attitude
