quotes,authors,categories
Attitude is a little thing that makes a big difference.,Winston Churchill,Attitude
Ability is what you're capable of doing. Motivation determines what you do. Attitude determines how well you do it.,Lou Holtz,Attitude
Weakness of attitude becomes weakness of character.,Albert Einstein,Attitude
"Your attitude, not your aptitude, will determine your altitude.",Zig Ziglar,Attitude
"People may hear your words, but they feel your attitude.",John C. Maxwell,Attitude
"Excellence is not a skill, it's an attitude.",Ralph Marston,Attitude
"You cannot control what happens to you, but you can control your attitude toward what happens to you, and in that, you will be mastering change rather than allowing it to master you.",Brian Tracy,Attitude
"For success, attitude is equally as important as ability.",Walter Scott,Attitude
Reject your sense of injury and the injury itself disappears.,Marcus Aurelius,Attitude
Your living is determined not so much by what life brings to you as by the attitude you bring to life; not so much by what happens to you as by the way your mind looks at what happens.,Khalil Gibran,Attitude
"If you are going to achieve excellence in big things, you develop the habit in little matters. Excellence is not an exception, it is a prevailing attitude.",Colin Powell,Attitude
Adopting the right attitude can convert a negative stress into a positive one.,Hans Selye,Attitude
"We cannot change our past. We can not change the fact that people act in a certain way. We can not change the inevitable. The only thing we can do is play on the one string we have, and that is our attitude.",Charles R. Swindoll,Attitude
A positive attitude can really make dreams come true - it did for me.,David Bailey,Attitude
Attitude determines the altitude of life.,Edwin Louis Cole,Attitude
"Everything can be taken from a man but one thing: the last of human freedoms - to choose one's attitude in any given set of circumstances, to choose one's own way.",Viktor E. Frankl,Attitude
"The secret of genius is to carry the spirit of the child into old age, which means never losing your enthusiasm.",Aldous Huxley,Attitude
It is in the character of very few men to honor without envy a friend who has prospered.,Aeschylus,Attitude
Nothing can stop the man with the right mental attitude from achieving his goal; nothing on earth can help the man with the wrong mental attitude.,Thomas Jefferson,Attitude
"A positive attitude causes a chain reaction of positive thoughts, events and outcomes. It is a catalyst and it sparks extraordinary results.",Wade Boggs,Attitude
The greatest discovery of my generation is that a human being can alter his life by altering his attitudes.,William James,Attitude
Some people say I have attitude - maybe I do... but I think you have to. You have to believe in yourself when no one else does - that makes you a winner right there.,Venus Williams,Attitude
Character is the result of two things: mental attitude and the way we spend our time.,Elbert Hubbard,Attitude
"My attitude is that if you push me towards something that you think is a weakness, then I will turn that perceived weakness into a strength.",Michael Jordan,Attitude
Our attitude toward life determines life's attitude towards us.,John N. Mitchell,Attitude
"Watch your manner of speech if you wish to develop a peaceful state of mind. Start each day by affirming peaceful, contented and happy attitudes and your days will tend to be pleasant and successful.",Norman Vincent Peale,Attitude
"My attitude is, if someone's going to criticize me, tell me to my face.",Simon Cowell,Attitude
"Acting is magical. Change your look and your attitude, and you can be anyone.",Alicia Witt,Attitude
"Take the attitude of a student, never be too big to ask questions, never know too much to learn something new.",Og Mandino,Attitude
Choosing to be positive and having a grateful attitude is going to determine how you're going to live your life.,Joel Osteen,Attitude
Attitude is everything.,Diane von Furstenberg,Attitude
Morality is simply the attitude we adopt towards people whom we personally dislike.,Oscar Wilde,Attitude
"Our environment, the world in which we live and work, is a mirror of our attitudes and expectations.",Earl Nightingale,Attitude
Wearing the correct dress for any occasion is a matter of good manners.,Loretta Young,Attitude
Having a positive mental attitude is asking how something can be done rather than saying it can't be done.,Bo Bennett,Attitude
"It is not the body's posture, but the heart's attitude that counts when we pray.",Billy Graham,Attitude
Attitudes are more important than facts.,George MacDonald,Attitude
The ideal attitude is to be physically loose and mentally tight.,Arthur Ashe,Attitude
Good humor is one of the best articles of dress one can wear in society.,William Makepeace Thackeray,Attitude
"Pink isn't just a color, it's an attitude!",Miley Cyrus,Attitude
"But the attitude of faith is to let go, and become open to truth, whatever it might turn out to be.",Alan Watts,Attitude
Time plays a role in almost every decision. And some decisions define your attitude about time.,John Cale,Attitude
"There is little difference in people, but that little difference makes a big difference. The little difference is attitude. The big difference is whether it is positive or negative.",W. Clement Stone,Attitude
"The meaning of things lies not in the things themselves, but in our attitude towards them.",Antoine de Saint-Exupery,Attitude
"If your ego starts out, 'I am important, I am big, I am special,' you're in for some disappointments when you look around at what we've discovered about the universe. No, you're not big. No, you're not. You're small in time and in space. And you have this frail vessel called the human body that's limited on Earth.",Neil deGrasse Tyson,Attitude
A complainer is like a Death Eater because there's a suction of negative energy. You can catch a great attitude from great people.,Barbara Corcoran,Attitude
The greatest discovery of my generation is that man can alter his life simply by altering his attitude of mind.,James Truslow Adams,Attitude
"Civilization is a method of living, an attitude of equal respect for all men.",Jane Addams,Attitude
Bad attitudes will ruin your team.,Terry Bradshaw,Attitude
"I think it's my adventure, my trip, my journey, and I guess my attitude is, let the chips fall where they may.",Leonard Nimoy,Attitude
"Eagles come in all shapes and sizes, but you will recognize them chiefly by their attitudes.",E. F. Schumacher,Attitude
Cock your hat - angles are attitudes.,Frank Sinatra,Attitude
"When you ain't got no money, you gotta get an attitude.",Richard Pryor,Attitude
Our future cannot depend on the government alone. The ultimate solutions lie in the attitudes and the actions of the American people.,Joe Biden,Attitude
"Between stimulus and response, there is a space where we choose our response.",Stephen Covey,Attitude
"The attitude is very important. Because, your behavior radiates how you feel.",Lou Ferrigno,Attitude
The reactionary is always willing to take a progressive attitude on any issue that is dead.,Theodore Roosevelt,Attitude
What is pride? A rocket that emulates the stars.,William Wordsworth,Attitude
"Happiness is an attitude of mind, born of the simple determination to be happy under all outward circumstances.",J. Donald Walters,Attitude
You know what's funny to me? Attitude.,Don Rickles,Attitude
Most of us start out with a positive attitude and a plan to do our best.,Marilu Henner,Attitude
"Our attitudes control our lives. Attitudes are a secret power working twenty-four hours a day, for good or bad. It is of paramount importance that we know how to harness and control this great force.",Irving Berlin,Attitude
The biggest challenge is how to affect public attitudes and make people care.,Jim Fowler,Attitude
"You live in the image you have of the world. Every one of us lives in a different world, with different space and different time.",Alejandro Jodorowsky,Attitude
How do you nurture a positive attitude when all the statistics say you're a dead man? You go to work.,Patrick Swayze,Attitude
Punk was defined by an attitude rather than a musical style.,David Byrne,Attitude
"If you're looking for can-do, earthy-crunchy attitude then you've got to go to Wisconsin.",Dar Williams,Attitude
"When you are thwarted, it is your own attitude that is out of order.",Meister Eckhart,Attitude
"There are no menial jobs, only menial attitudes.","William J. Brennan, Jr.",Attitude
"The key to life is your attitude. Whether you're single or married or have kids or don't have kids, it's how you look at your life, what you make of it. It's about making the best of your life wherever you are in life.",Candace Bushnell,Attitude
"Really you just gotta keep chugging along and keep a positive attitude and get through all the problems. You gotta face them, otherwise you don't get through.",Lesley Gore,Attitude
"Abhorrence of apartheid is a moral attitude, not a policy.",Edward Heath,Attitude
"My attitudes have changed, but somebody would have to read all my books to find out how they have.",Irwin Shaw,Attitude
"A positive attitude is not going to save you. What it's going to do is, everyday, between now and the day you die, whether that's a short time from now or a long time from now, that every day, you're going to actually live.",Elizabeth Edwards,Attitude
"If you get a diagnosis, get on a therapy, keep a good attitude and keep your sense of humor.",Teri Garr,Attitude
Surfers have the most attitude.,Shaun White,Attitude
"China and the U.S. are two societies with very different attitudes towards opinion and criticism. In China, I am constantly under surveillance. Even my slightest, most innocuous move can - and often is - censored by Chinese authorities.",Ai Weiwei,Attitude
"I've always had a 'Work hard, play hard' attitude to life - I still do - but sometimes you get involved in something that needs a calm, methodical approach.",Damian Lewis,Attitude
I am shocked by the easy attitude of many in the media towards disclosing our Nation's secrets.,Todd Tiahrt,Attitude
Vanity can create a very cruel space for you if you don't know how to manage it.,Lady Gaga,Attitude
"Every baseball crowd, like every theatre audience, has its own distinctive attitude and atmosphere.",Bill Veeck,Attitude
Funny is an attitude.,Flip Wilson,Attitude
"With my talent, I can make people laugh and give them another attitude about life. What a blessing that is for me.",Doris Roberts,Attitude
I was always the guy getting kicked out of my classes at school for having an attitude problem.,Chevy Chase,Attitude
"I always spend time exploring the customs and attitudes of the countries I'm using for locations, and interviewing the people who live there. I've visited over 90 countries thus far.",Sidney Sheldon,Attitude
But Jesus changes your attitude towards yourself and towards other people.,Cliff Richard,Attitude
"It is one of the most effective attitudes of the neurotic to measure thumbs down, so to speak, a real person by an ideal, since in doing so he can depreciate him as much as he wishes.",Alfred Adler,Attitude
"Coaches will eventually notice a great attitude, and they respect that.",Heather O'Reilly,Attitude
I have a Woody Allen Jewish attitude to life: that it's all going to be disastrous. That it hasn't all been that way is simply down to some random quirk of fate.,Antony Sher,Attitude
"It is our attitude at the beginning of a difficult task which, more than anything else, will affect its successful outcome.",William James,Attitude
"I'm only going to stand before God and give an account for my life, not for somebody else's life. If I have a bad attitude, then I need to say there's no point in me blaming you for what's wrong in my life.",Joyce Meyer,Attitude
Our attitude towards others determines their attitude towards us.,Earl Nightingale,Attitude
Keep a good attitude and do the right thing even when it's hard. When you do that you are passing the test. And God promises you your marked moments are on their way.,Joel Osteen,Attitude
The greatest day in your life and mine is when we take total responsibility for our attitudes. That's the day we truly grow up.,John C. Maxwell,Attitude
Great effort springs naturally from great attitude.,Pat Riley,Attitude
You cannot tailor-make the situations in life but you can tailor-make the attitudes to fit those situations.,Zig Ziglar,Attitude
"When a woman puts on a heel, she has a different posture, a different attitude. She really stands up and has a consciousness of her body.",Christian Louboutin,Attitude
Stop this attitude that older people ain't any good anymore! We're as good as we ever were - if we ever were any good.,Dolly Parton,Attitude
"Whenever you're in conflict with someone, there is one factor that can make the difference between damaging your relationship and deepening it. That factor is attitude.",William James,Attitude
"Individuals need to be willing to face truth about their attitudes, behaviors, even what we want out of life.",Joyce Meyer,Attitude
"Develop an attitude of gratitude, and give thanks for everything that happens to you, knowing that every step forward is a step toward achieving something bigger and better than your current situation.",Brian Tracy,Attitude
"Our lives are not determined by what happens to us but how we react to what happens, not by what life brings us but the attitude we bring to life.",Wade Boggs,Attitude
"The remarkable thing is, we have a choice everyday regarding the attitude we will embrace for that day.",Charles R. Swindoll,Attitude
"I think whether you're having setbacks or not, the role of a leader is to always display a winning attitude.",Colin Powell,Attitude
"My general attitude to life is to enjoy every minute of every day. I never do anything with a feeling of, 'Oh God, I've got to do this today.'",Richard Branson,Attitude
I hope the millions of people I've touched have the optimism and desire to share their goals and hard work and persevere with a positive attitude.,Michael Jordan,Attitude
"There's a certain elitism that has crept into the attitudes of some in journalism, and it played out perfectly over the issue of these little American flag lapel pins.",Brit Hume,Attitude
"As the time goes by, you change, your learn new things, your attitude is different. For the moment, I'm still enjoying ski racing so much that it would be difficult for me to think about ending my career.",Hermann Maier,Attitude
When you pray for anyone you tend to modify your personal attitude toward him.,Norman Vincent Peale,Attitude
"If you don't like something, change it. If you can't change it, change your attitude.",Maya Angelou,Attitude
Style is a reflection of your attitude and your personality.,Shawn Ashmore,Attitude
"If you have a positive attitude and constantly strive to give your best effort, eventually you will overcome your immediate problems and find you are ready for greater challenges.",Pat Riley,Attitude
"Being sexy is all about attitude, not body type. It's a state of mind.",Amisha Patel,Attitude
The only disability in life is a bad attitude.,Scott Hamilton,Attitude
"Your attitude is like a box of crayons that color your world. Constantly color your picture gray, and your picture will always be bleak. Try adding some bright colors to the picture by including humor, and your picture begins to lighten up.",Allen Klein,Attitude
Positive energy and attitude is sexy to me.,Mya,Attitude
The greatest discovery of all time is that a person can change his future by merely changing his attitude.,Oprah Winfrey,Attitude
"Life is hard. Life is difficult. Life is going to punch you in the gut. But when you change your attitude, you change your behavior. When your behavior changes, so do your results.",Will Hurd,Attitude
"If I could talk to my younger self, I would just say that the path to great things is filled with a lot of stumbles, suffering, and challenges along the way. But if you have the right attitude and know that hard times will pass - and you get up each time - you will reach your destination.",Jonny Kim,Attitude
"It is the hopeful, buoyant, cheerful attitude of mind that wins. Optimism is a success builder; pessimism an achievement killer.",Orison Swett Marden,Attitude
"Too much self-centered attitude, you see, brings, you see, isolation. Result: loneliness, fear, anger. The extreme self-centered attitude is the source of suffering.",Dalai Lama,Attitude
"Everyone has their own greatness. Whether you reach your own greatness depends on your environment, your structure, the company you keep and your attitude.",Ed Reed,Attitude
A strong positive mental attitude will create more miracles than any wonder drug.,Patricia Neal,Attitude
Positive attitude plus effort equals performance.,Tommy Tuberville,Attitude
"Happiness doesn't depend on any external conditions, it is governed by our mental attitude.",Dale Carnegie,Attitude
Always have an attitude of gratitude.,Sterling K. Brown,Attitude
"Many big and small things happen in our lives, almost on daily basis, and I hope that everyone would not lose the trust that they have in themselves, and never lose positive attitude.",Gong Hyo-jin,Attitude
"Your attitude will go a long way in determining your success, your recognition, your reputation and your enjoyment in being a lawyer.",Joe Jamail,Attitude
A healthy attitude is contagious but don't wait to catch it from others. Be a carrier.,Tom Stoppard,Attitude
Attitude and enthusiasm play a big part in my life. I get excited about the things that inspire me. I also believe in laughing and having a good time.,Dwayne Johnson,Attitude
"A positive attitude is something everyone can work on, and everyone can learn how to employ it.",Joan Lunden,Attitude
Spending time with negative people can be the fastest way to ruin a good mood. Their pessimistic outlooks and gloomy attitude can decrease our motivation and change the way we feel. But allowing a negative person to dictate your emotions gives them too much power in your life. Make a conscious effort to choose your attitude.,Amy Morin,Attitude
Leadership is practiced not so much in words as in attitude and in actions.,Harold S. Geneen,Attitude
You can control two things: your work ethic and your attitude about anything.,Ali Krieger,Attitude
"The special ops guys and the firefighters around the world have this great phrase. They say, 'Slow is smooth, and smooth is fast,' and that is true. Everything I've accomplished in my life has been because of that attitude.",Jeff Bezos,Attitude
"The winner's edge is not in a gifted birth, a high IQ, or in talent. The winner's edge is all in the attitude, not aptitude. Attitude is the criterion for success.",Denis Waitley,Attitude
"When you view your world with an attitude of gratitude, you are training yourself to focus on the good in life.",Paul J. Meyer,Attitude
"Attitude is attitude, whether you're a West Coast gangster or East Coast gangster, you know?",Paul Walker,Attitude
"Watch out for the joy-stealers: gossip, criticism, complaining, faultfinding, and a negative, judgmental attitude.",Joyce Meyer,Attitude
"I think that life is difficult. People have challenges. Family members get sick, people get older, you don't always get the job or the promotion that you want. You have conflicts in your life. And really, life is about your resilience and your ability to go through your life and all of the ups and downs with a positive attitude.",Jennifer Hyman,Attitude
"Everybody is a political person, whether you say something or you are silent. A political attitude is not whether you go to parliament; it's how you deal with your life, with your surroundings.",Paulo Coelho,Attitude
"My attitude has always been, if you fall flat on your face, at least you're moving forward. All you have to do is get back up and try again.",Richard Branson,Attitude
"You can call it what you want: bad attitude, immature. You can say, 'He's a thug.' But I'm a competitor.",DeMarcus Cousins,Attitude
"It hasn't always been easy. There's a lot of hard moments. Sometimes you learn from the end of the bench. Sometimes you learn from injuries. Sometimes you learn the most through the hard things. If you can keep a good attitude and keep on working, eventually situations change, and you can put those things to use.",Kyle Korver,Attitude
Fairness is not an attitude. It's a professional skill that must be developed and exercised.,Brit Hume,Attitude
"No, we don't control who our parents are. We don't control what color we are. We don't control what home we are born into. But we control our attitude. We control our work ethic. We control our drive and our commitment.",Dabo Swinney,Attitude
"I believe I have the attitude of a champion and a winner, and I'm not apologetic for it.",Jon Jones,Attitude
People have often asked if I'm gay because I don't go out of my way to spit and scratch and give people attitude.,Jason Bateman,Attitude
"Whatever your situation might be, set your mind to whatever you want to do and put a good attitude in it, and I believe that you can succeed. You are not going to get anywhere just sitting on your butt and moping around.",Bethany Hamilton,Attitude
I walk tall; I got a tall attitude.,Dolly Parton,Attitude
Being black is not a matter of pigmentation - being black is a reflection of a mental attitude.,Steven Biko,Attitude
"When I pray, I always thank Mother Nature for all the beauty in the world. It's about having an attitude of gratitude.",Miranda Kerr,Attitude
"I don't think punk ever really dies, because punk rock attitude can never die.",Billy Idol,Attitude
"Be sure what you want and be sure about yourself. Fashion is not just beauty, it's about good attitude. You have to believe in yourself and be strong.",Adriana Lima,Attitude
"A fit body gives you confidence. And there's nothing more impressive than a great attitude, which you can wear on your sleeve. But you'll have to remember the difference between being rude and being confident.",Virat Kohli,Attitude
The higher the better. It's more about an attitude. High heels empower women in a way.,Christian Louboutin,Attitude
"A positive atmosphere nurtures a positive attitude, which is required to take positive action.",Richard M. DeVos,Attitude
Age and size are only numbers. It's the attitude you bring to clothes that make the difference.,Donna Karan,Attitude
"I am responsible. Although I may not be able to prevent the worst from happening, I am responsible for my attitude toward the inevitable misfortunes that darken life.",Walter Anderson,Attitude
Never walk into a hospital crying. Have an attitude that you will make someone else's life better.,Jim Kelly,Attitude
"If you can't change your fate, change your attitude.",Charles Revson,Attitude
The smile helps me keep a positive attitude and go on to the next play.,Jordan Larson,Attitude
You need to have a can-do attitude. There is always a way.,Alan Mulally,Attitude
I'm not going to take this defeatist attitude and listen to all this crap any more from all these people who have nothing except doomsday to predict.,Carroll Shelby,Attitude
"I like to say it's an attitude of not just thinking outside the box, but not even seeing the box.",Safra A. Catz,Attitude
It's sort of a mental attitude about critical thinking and curiosity. It's about mindset of looking at the world in a playful and curious and creative way.,Adam Savage,Attitude
"Animals have a much better attitude to life and death than we do. They know when their time has come. We are the ones that suffer when they pass, but it's a healing kind of grief that enables us to deal with other griefs that are not so easy to grab hold of.",Emmylou Harris,Attitude
"Any revolutionary change must be preceded by a passive, affirmative, non-challenging attitude toward change among the mass of our people. They must feel so frustrated, so defeated, so lost, so futureless in the prevailing system that they are willing to let go of the past and chance the future.",Saul Alinsky,Attitude
"I was looking for something a lot heavier, yet melodic at the same time. Something different from heavy metal, a different attitude.",Kurt Cobain,Attitude
"Certain thoughts are prayers. There are moments when, whatever be the attitude of the body, the soul is on its knees.",Victor Hugo,Attitude
Creativity is not talent but attitude.,Jenova Chen,Attitude
"The attitude of the West and of Russia towards a crisis like Ukraine is diametrically different. The West is trying to establish the legality of any established border. For Russia, Ukraine is part of the Russian patrimony.",Henry Kissinger,Attitude
"If somebody says no to you, or if you get cut, Michael Jordan was cut his first year, but he came back and he was the best ever. That is what you have to have. The attitude that I'm going to show everybody, I'm going to work hard to get better and better.",Magic Johnson,Attitude
"I don't want to impugn the motives of my colleagues, but my attitude is, speaking just for me, you either believe in border security or you don't.",John Kennedy,Attitude
"My grandfather was a man, when he talked about freedom, his attitude was really interesting. His view was that you had obligations or you had responsibilities, and when you fulfilled those obligations or responsibilities, that then gave you the liberty to do other things.",Clarence Thomas,Attitude
My life's attitude is simple: 'Make the best of what you have got. And move to the next. Thank God for what is coming my way and enjoy it completely.',Abhinav Bindra,Attitude
I think a lot of times we don't pay enough attention to people with a positive attitude because we assume they are naive or stupid or unschooled.,Amy Adams,Attitude
