quotes,authors,categories
"Never doubt that a small group of thoughtful, committed citizens can change the world; indeed, it's the only thing that ever has.",Margaret Mead,Environmental
"Water and air, the two essential fluids on which all life depends, have become global garbage cans.",Jacques Yves Cousteau,Environmental
"The only way forward, if we are going to improve the quality of the environment, is to get everybody involved.",Richard Rogers,Environmental
We could have saved the Earth but we were too damned cheap.,Kurt Vonnegut,Environmental
"Sooner or later, we will have to recognise that the Earth has rights, too, to live without pollution. What mankind must know is that human beings cannot live without Mother Earth, but the planet can live without humans.",Evo Morales,Environmental
The time is right for electric cars - in fact the time is critical.,Carlos Ghosn,Environmental
The environment is everything that isn't me.,Albert Einstein,Environmental
"We're running the most dangerous experiment in history right now, which is to see how much carbon dioxide the atmosphere... can handle before there is an environmental catastrophe.",Elon Musk,Environmental
Try to leave the Earth a better place than when you arrived.,Sidney Sheldon,Environmental
We must return to nature and nature's god.,Luther Burbank,Environmental
The Earth does not belong to us: we belong to the Earth.,Chief Seattle,Environmental
"Thank God men cannot fly, and lay waste the sky as well as the earth.",Henry David Thoreau,Environmental
"Keep close to Nature's heart... and break clear away, once in awhile, and climb a mountain or spend a week in the woods. Wash your spirit clean.",John Muir,Environmental
"Plans to protect air and water, wilderness and wildlife are in fact plans to protect man.",Stewart Udall,Environmental
"We have enslaved the rest of the animal creation, and have treated our distant cousins in fur and feathers so badly that beyond doubt, if they were able to formulate a religion, they would depict the Devil in human form.",William Inge,Environmental
We don't have to sacrifice a strong economy for a healthy environment.,Dennis Weaver,Environmental
"The most important thing about global warming is this. Whether humans are responsible for the bulk of climate change is going to be left to the scientists, but it's all of our responsibility to leave this planet in better shape for the future generations than we found it.",Mike Huckabee,Environmental
"We may achieve climate, but weather is thrust upon us.",O. Henry,Environmental
"Climate change is happening, humans are causing it, and I think this is perhaps the most serious environmental issue facing us.",Bill Nye,Environmental
The future will either be green or not at all.,Bob Brown,Environmental
"If you can't be in awe of Mother Nature, there's something wrong with you.",Alex Trebek,Environmental
Raising awareness on the most pressing environmental issues of our time is more important than ever.,Leonardo DiCaprio,Environmental
It is horrifying that we have to fight our own government to save the environment.,Ansel Adams,Environmental
Environmental pollution is an incurable disease. It can only be prevented.,Barry Commoner,Environmental
"They claim this mother of ours, the Earth, for their own use, and fence their neighbors away from her, and deface her with their buildings and their refuse.",Sitting Bull,Environmental
"If all mankind were to disappear, the world would regenerate back to the rich state of equilibrium that existed ten thousand years ago. If insects were to vanish, the environment would collapse into chaos.",E. O. Wilson,Environmental
"You will die but the carbon will not; its career does not end with you. It will return to the soil, and there a plant may take it up again in time, sending it once more on a cycle of plant and animal life.",Jacob Bronowski,Environmental
There is a muscular energy in sunlight corresponding to the spiritual energy of wind.,Annie Dillard,Environmental
By polluting clear water with slime you will never find good drinking water.,Aeschylus,Environmental
We learned that economic growth and environmental protection can and should go hand in hand.,Christopher Dodd,Environmental
"Climate change is a terrible problem, and it absolutely needs to be solved. It deserves to be a huge priority.",Bill Gates,Environmental
"A true conservationist is a man who knows that the world is not given by his fathers, but borrowed from his children.",Unknown,Environmental
People need to be cautious because anything built by man can be destroyed by Mother Nature.,Russel Honore,Environmental
You cannot achieve environmental security and human development without addressing the basic issues of health and nutrition.,Gro Harlem Brundtland,Environmental
"Mother Nature comes up against reality, and the reality is that the system doesn't work.",John Garamendi,Environmental
I think the cost of energy will come down when we make this transition to renewable energy.,Al Gore,Environmental
Every drop in the ocean counts.,Yoko Ono,Environmental
"I did not become a vegetarian for my health, I did it for the health of the chickens.",Isaac Bashevis Singer,Environmental
Mother Nature is not sweet.,John Shelby Spong,Environmental
Green-tech could be the largest economic opportunity of the 21st Century.,John Doerr,Environmental
"You may be able to fool the voters, but not the atmosphere.",Donella Meadows,Environmental
"In a few decades, the relationship between the environment, resources and conflict may seem almost as obvious as the connection we see today between human rights, democracy and peace.",Wangari Maathai,Environmental
People blame their environment. There is only one person to blame - and only one - themselves.,Robert Collier,Environmental
"When all the world appears to be in a tumult, and nature itself is feeling the assault of climate change, the seasons retain their essential rhythm. Yes, fall gives us a premonition of winter, but then, winter, will be forced to relent, once again, to the new beginnings of soft greens, longer light, and the sweet air of spring.",Madeleine M. Kunin,Environmental
"Population, when unchecked, goes on doubling itself every 25 years or increases in a geometrical ratio.",Thomas Malthus,Environmental
I think the government has to reposition environment on top of their national and international priorities.,Brian Mulroney,Environmental
"Sadly, it's much easier to create a desert than a forest.",James Lovelock,Environmental
"If you cut down a forest, it doesn't matter how many sawmills you have if there are no more trees.",Susan George,Environmental
"Nature is the mother and the habitat of man, even if sometimes a stepmother and an unfriendly home.",John Dewey,Environmental
"We live in a world bathed in 5,000 times more energy than we consume as a species in the year, in the form of solar energy. It's just not in usable form yet.",Peter Diamandis,Environmental
"It seems to me like Mother Nature's mercy and forgiveness have run dry, as we ceaselessly abuse her and take her for granted in order for us to continue our addiction to using fossil fuels. I've gotta say, I don't blame her. Not one bit.",Gloria Reuben,Environmental
I think the environment should be put in the category of our national security. Defense of our resources is just as important as defense abroad. Otherwise what is there to defend?,Robert Redford,Environmental
Nuclear power will help provide the electricity that our growing economy needs without increasing emissions. This is truly an environmentally responsible source of energy.,Michael C. Burgess,Environmental
"I think so long as fossil fuels are cheap, people will use them and it will postpone a movement towards new technologies.",Paul Krugman,Environmental
"The sooner we get started with alternative energy sources and recognize that fossil fuels makes us less secure as a nation, and more dangerous as a planet, the better off we'll be.",Lindsey Graham,Environmental
All is connected... no one thing can change by itself.,Paul Hawken,Environmental
"I can find God in nature, in animals, in birds and the environment.",Pat Buckley,Environmental
"Birds are indicators of the environment. If they are in trouble, we know we'll soon be in trouble.",Roger Tory Peterson,Environmental
"No one is an environmentalist by birth. It is only your path, your life, your travels that awaken you.",Yann Arthus-Bertrand,Environmental
"Public discourse has been polluted now for decades by corporate-funded disinformation - not just with climate change but with a host of health, environmental and societal threats. The implications for the planet are grim.",Michael E. Mann,Environmental
Conservation is a state of harmony between men and land.,Aldo Leopold,Environmental
"Just as modern mass production requires the standardization of commodities, so the social process requires standardization of man, and this standardization is called equality.",Erich Fromm,Environmental
Energy conservation is the foundation of energy independence.,Tom Allen,Environmental
"Ten percent of the big fish still remain. There are still some blue whales. There are still some krill in Antarctica. There are a few oysters in Chesapeake Bay. Half the coral reefs are still in pretty good shape, a jeweled belt around the middle of the planet. There's still time, but not a lot, to turn things around.",Sylvia Earle,Environmental
"If we do not permit the earth to produce beauty and joy, it will in the end not produce food, either.",Joseph Wood Krutch,Environmental
I think the future for solar energy is bright.,Ken Salazar,Environmental
"Unless we keep this planet healthy, everything else is for naught.",Victoria Principal,Environmental
"Nature is regulating our climate for free. Mother Nature, she's been doing that for free, for a long, long time. Now do you really want to get in there and do geo-engineering and all this kind of stuff?",Thomas Friedman,Environmental
"We can have technology, prosperity, nice homes and cars, but at the same time we must be conscious of what we are dumping into the water, the air and our food.",Kevin Richardson,Environmental
There is no place where we can safely store worn-out reactors or their garbage. No place!,David R. Brower,Environmental
Without the oceans there would be no life on Earth.,Peter Benchley,Environmental
Within 10 years it will be impossible to travel to the North Pole by dog team. There will be too much open water.,Will Steger,Environmental
"Biofuels such as ethanol require enormous amounts of cropland and end up displacing either food crops or natural wilderness, neither of which is good.",Elon Musk,Environmental
"We are aware only of the empty space in the forest, which only yesterday was filled with trees.",Anna Freud,Environmental
Local innovation and initiative can help us better understand how to protect our environment.,Gale Norton,Environmental
"For me, going vegan was an ethical and environmental decision. I'm doing the right thing by the animals.",Alexandra Paul,Environmental
I'm very concerned for the future of the earth and its amazing creatures. We've got to be careful and make sure we don't foul our own nest.,John Lithgow,Environmental
"Saving our planet, lifting people out of poverty, advancing economic growth... these are one and the same fight. We must connect the dots between climate change, water scarcity, energy shortages, global health, food security and women's empowerment. Solutions to one problem must be solutions for all.",Ban Ki-moon,Environmental
It appears to be a law that you cannot have a deep sympathy with both man and nature.,Henry David Thoreau,Environmental
I don't think we're going to save anything if we go around talking about saving plants and animals only; we've got to translate that into what's in it for us.,Jim Fowler,Environmental
Journey with me to a true commitment to our environment. Journey with me to the serenity of leaving to our children a planet in equilibrium.,Paul Tsongas,Environmental
"It's not unexpected that shooting massive amounts of water, sand, and chemicals at high pressure into the earth to shatter shale and release natural gas might shake things up. But earthquakes aren't the worst problem with fracking.",David Suzuki,Environmental
The Endangered Species Act is the strongest and most effective tool we have to repair the environmental harm that is causing a species to decline.,Norm Dicks,Environmental
Moral codes adjust themselves to environmental conditions.,Will Durant,Environmental
"When we try to pick out anything by itself, we find it hitched to everything else in the universe.",John Muir,Environmental
"Much of the debate over global warming is predicated on fear, rather than science.",Jim Inhofe,Environmental
The government should set a goal for a clean environment but not mandate how that goal should be implemented.,Dixie Lee Ray,Environmental
Destroying rainforest for economic gain is like burning a Renaissance painting to cook a meal.,E. O. Wilson,Environmental
Mankind has probably done more damage to the Earth in the 20th century than in all of previous human history.,Jacques Yves Cousteau,Environmental
"After all, sustainability means running the global environment - Earth Inc. - like a corporation: with depreciation, amortization and maintenance accounts. In other words, keeping the asset whole, rather than undermining your natural capital.",Maurice Strong,Environmental
"Our world faces a true planetary emergency. I know the phrase sounds shrill, and I know it's a challenge to the moral imagination.",Al Gore,Environmental
"The reality is gas prices should be much more expensive then they are because we're not incorporating the true damage to the environment and the hidden costs of mining oil and transporting it to the U.S. Whenever you have an unpriced externality, you have a bit of a market failure, to the degree that eternality remains unpriced.",Elon Musk,Environmental
"In today's world, it is no longer unimaginable to think that business can operate - and even thrive - in an environmentally-friendly manner.",Olympia Snowe,Environmental
A knowledgeable and courageous U.S. president could help enormously in leading the world's nations toward saving the climate.,Donella Meadows,Environmental
"The high prices also highlight the fact that the U.S. is too heavily dependent on fossil fuels that we import from unstable parts of the world. To protect our national security, we must become more energy secure.",Dan Lipinski,Environmental
"We are using resources as if we had two planets, not one. There can be no 'plan B' because there is no 'planet B.'",Ban Ki-moon,Environmental
"Every creature is better alive than dead, men and moose and pine trees, and he who understands it aright will rather preserve its life than destroy it.",Henry David Thoreau,Environmental
We won't have a society if we destroy the environment.,Margaret Mead,Environmental
Environmental policy must strike a balance between the earth's best interests and our citizen's pressing needs.,Jim Clyburn,Environmental
"I see humanity now as one vast plant, needing for its highest fulfillment only love, the natural blessings of the great outdoors, and intelligent crossing and selection.",Luther Burbank,Environmental
"In Kenya women are the first victims of environmental degradation, because they are the ones who walk for hours looking for water, who fetch firewood, who provide food for their families.",Wangari Maathai,Environmental
"If people destroy something replaceable made by mankind, they are called vandals; if they destroy something irreplaceable made by God, they are called developers.",Joseph Wood Krutch,Environmental
I think Captain Cousteau might be the father of the environmental movement.,Ted Turner,Environmental
"Nevertheless, there is another threat on the horizon. I see this threat in environmentalism which is becoming a new dominant ideology, if not a religion. Its main weapon is raising the alarm and predicting the human life endangering climate change based on man-made global warming.",Vaclav Klaus,Environmental
Harmony with land is like harmony with a friend; you cannot cherish his right hand and chop off his left.,Aldo Leopold,Environmental
If we gave up eating beef we would have roughly 20 to 30 times more land for food than we have now.,James Lovelock,Environmental
"Take air quality in the United States today: It's about 30 percent better than it was 25 years ago, even though there are now more people driving more cars.",Jared Diamond,Environmental
"Under the Environmental Protection Agency's Energy Star Program, homes are independently verified to be measurably more energy efficient than average houses.",Melissa Bean,Environmental
"If we bestow but a very little attention to the economy of the animal creation, we shall find manifest examples of premeditation, perseverance, resolution, and consumate artifice, in order to effect their purpose.",William Bartram,Environmental
"I'm anti-tax, but I'm pro-carbon tax.",Elon Musk,Environmental
"I would point out that if you're a believer in the Bible, one would have to say the Great Flood is an example of climate change and that certainly wasn't because mankind had overdeveloped hydrocarbon energy.",Joe Barton,Environmental
"Take a course in good water and air; and in the eternal youth of Nature you may renew your own. Go quietly, alone; no harm will befall you.",John Muir,Environmental
"In addition to contributing to erosion, pollution, food poisoning, and the dead zone, corn requires huge amounts of fossil fuel - it takes a half gallon of fossil fuel to produce a bushel of corn.",Michael Pollan,Environmental
"If we're destroying our trees and destroying our environment and hurting animals and hurting one another and all that stuff, there's got to be a very powerful energy to fight that. I think we need more love in the world. We need more kindness, more compassion, more joy, more laughter. I definitely want to contribute to that.",Ellen DeGeneres,Environmental
We are now heading down a centuries-long path toward increasing the productivity of our natural capital - the resource systems upon which we depend to live - instead of our human capital.,Paul Hawken,Environmental
"The hydrogen powered car, with its high fuel mileage and zero emission rate, is just one example of the products under development that will help increase our energy independence.",Dan Lipinski,Environmental
The real cure for our environmental problems is to understand that our job is to salvage Mother Nature. We are facing a formidable enemy in this field. It is the hunters... and to convince them to leave their guns on the wall is going to be very difficult.,Jacques Yves Cousteau,Environmental
Maintaining healthy forests is essential to those who make a living from the land and for those of us who use them for recreational purposes.,Cathy McMorris Rodgers,Environmental
"In fact, because of their connection to the land, farmers do more to protect and preserve our environment than almost anyone else. They are some of the best environmentalists around.",Ike Skelton,Environmental
"Fracking has been used for more than 60 years to successfully drill over a million oil and gas wells in the U.S. Nonetheless, the prevailing mythology on the radical left is that the technology is 'poisoning our children' by polluting the water we drink and the air we breathe.",Bob Beauprez,Environmental
"If a man walks in the woods for love of them half of each day, he is in danger of being regarded as a loafer. But if he spends his days as a speculator, shearing off those woods and making the earth bald before her time, he is deemed an industrious and enterprising citizen.",Henry David Thoreau,Environmental
"It's coming home to roost over the next 50 years or so. It's not just climate change; it's sheer space, places to grow food for this enormous horde. Either we limit our population growth or the natural world will do it for us, and the natural world is doing it for us right now.",David Attenborough,Environmental
Environmentalism is a form of pagan fundamentalism. These green wackos are fanatics like al-Quaida. Just like them.,G. Gordon Liddy,Environmental
"To be clear, climate change is a true 800 pound gorilla in the room. The effects of global warming threaten global environmental upheaval over the coming century. But for South Florida and the Everglades, it could be our death knell if urgent action is not taken.",Debbie Wasserman Schultz,Environmental
"China will soon emit more greenhouse gases than America, but its regime knows if it caps aspirations there will be a revolution.",James Lovelock,Environmental
"As you heat the planet up, it's just like boiling a pot.",Elon Musk,Environmental
"A majority of American citizens are now becoming skeptical of the claim that our carbon footprints, resulting from our use of fossil fuels, are going to lead to climatic calamities. But governments are not yet listening to the citizens.",John Coleman,Environmental
The environment has fallen to the wayside in politics.,Craig Venter,Environmental
Not all is doom and gloom. We are beginning to understand the natural world and are gaining a reverence for life - all life.,Roger Tory Peterson,Environmental
"There are plenty of problems in the world, and doubtless climate change - or whatever the currently voguish phrase for it all is - certainly is one of them. But it's low on my list.",P. J. O'Rourke,Environmental
The cheapest natural gas in the world is in the United States.,T. Boone Pickens,Environmental
"The quicker we humans learn that saving open space and wildlife is critical to our welfare and quality of life, maybe we'll start thinking of doing something about it.",Jim Fowler,Environmental
I had never been able to get a car that said how much I cared about the environment until I drove electric.,Alexandra Paul,Environmental
"It seems that every time mankind is given a lot of energy, we go out and wreck something with it.",David R. Brower,Environmental
"We assume that everything's becoming more efficient, and in an immediate sense that's true; our lives are better in many ways. But that improvement has been gained through a massively inefficient use of natural resources.",Paul Hawken,Environmental
"'Being green' is commendable, but I hope that people don't take too much pride and self-adoration because they shut off the water when they brushed their teeth. The truth of the matter is, conservation alone will do little to save our planet.",Naveen Jain,Environmental
"We must move away from our dependency on fossil fuels, and I am glad that GM has invested over $1 billion in hydrogen fuel cells cars to meet this goal.",Albert Wynn,Environmental
"When we realize we can make a buck cleaning up the environment, it will be done!",Dennis Weaver,Environmental
Mankind is considered (by the radical environmentalists) the lowest and the meanest of all species and is blamed for everything.,Dixie Lee Ray,Environmental
You don't have to live in the country and grow your own food to be green.,Shalom Harlow,Environmental
"Yet, despite our many advances, our environment is still threatened by a range of problems, including global climate change, energy dependence on unsustainable fossil fuels, and loss of biodiversity.",Dan Lipinski,Environmental
"If we don't continue to pursue alternative, emissions-free energy sources like nuclear fuel, we are at risk of increasing our dependence on costly natural gas.",Judy Biggert,Environmental
No one should be able to enter a wilderness by mechanical means.,Garrett Hardin,Environmental
"Why are ecologists and environmentalists so feared and hated? This is because in part what they have to say is new to the general public, and the new is always alarming.",Garrett Hardin,Environmental
I find it interesting that many of the people who want to restrict fossil fuels live in well-developed countries where abundant and affordable energy is readily available.,Lee R. Raymond,Environmental
"It's obvious nonsense, but it makes nice people feel good about themselves to do their bit for the planet. It's vanity of a grotesque kind to believe that mankind, and our 'carbon footprint', has more impact on the future of Earth than Nature, which bends our planet to its will, as it sees fit.",Charles Saatchi,Environmental
Why has it seemed that the only way to protect the environment is with heavy-handed government regulation?,Gale Norton,Environmental
"Every time I have some moment on a seashore, or in the mountains, or sometimes in a quiet forest, I think this is why the environment has to be preserved.",Bill Bradley,Environmental
"I do believe very strongly that all of us and all of the other things in the context of our planet with Mother Nature, all of these things absolutely have a profound effect.",Kiefer Sutherland,Environmental
We need to accept the seemingly obvious fact that a toxic environment can make people sick and that no amount of medical intervention can protect us. The health care community must become a powerful political lobby for environmental policy and legislation.,Andrew Weil,Environmental
"In places where this beauty has already disappeared, we will reconstruct it.",Fritz Todt,Environmental
"We have no reason to think that climate change is harmful if you look at the world as a whole. Most places, in fact, are better off being warmer than being colder. And historically, the really bad times for the environment and for people have been the cold periods rather than the warm periods.",Freeman Dyson,Environmental
"In the environmental movement, every time you lose a battle it's for good, but our victories always seem to be temporary and we keep fighting them over and over again.",David Suzuki,Environmental
