quotes,authors,categories
I'm sad that it's uncool or offensive to talk about environmental or human rights issues.,Grimes,Environmental
"It is one of the issues that will have to be worked through however let me make the point and I think anyone would accept that if you set it up properly, not only will you get better environmental outcomes, you have a chance to create more wealth with the available resource.",John Anderson,Environmental
"The government employs scientists of many varieties in technical capacities, from estimating the environmental toxicity of a chemical to the structural soundness of a bridge. But when it comes to forming policies, these scientists and, especially, behavioral scientists are rarely at the table with the lawyers and the economists.",Richard Thaler,Environmental
We have fought for social justice. We have fought for economic justice. We have fought for environmental justice. We have fought for criminal justice. Now we must add a new fight - the fight for electoral justice.,Barbara Boxer,Environmental
"When my father finished his Ph.D., my mother went back for another bachelor's degree, this time in environmental science.",Celeste Ng,Environmental
"While the leading environmental alarmists burn fossil fuels like they're going out of style, the United States under President Trump has led the world in reducing carbon emissions.",Michael J. Knowles,Environmental
"Many times, I left the prison thinking, 'I'm smart. I can make it. I won't get caught up again.' But you get off downtown Skid Row, and you're a target for all of the environmental harms in that area. The pain and trauma in that area is so thick, you can almost reach your hand out and touch it.",Susan Burton,Environmental
"Congressional Republicans are dismantling the limited environmental protections initiated by Richard Nixon, who would be something of a dangerous radical in today's political scene.",Noam Chomsky,Environmental
"As congressional Republicans and the Trump administration continue to attack the Environmental Protection Agency (EPA), it came as no surprise that the House voted on two bills that would weaken emissions standards and, as a result, put our public health at risk.",Seth Moulton,Environmental
"As an environmental engineer I spent many years cleaning up PCB contamination, and I know firsthand the costs these efforts can place on individuals and communities.",Chris Sununu,Environmental
"As the former administrator of the Environmental Protection Agency and former governor of New Jersey, I have witnessed the impact of climate change firsthand.",Christine Todd Whitman,Environmental
Advertising is an environmental striptease for a world of abundance.,Marshall McLuhan,Environmental
The whole environmental policy in the Netherlands has no substance any more.,Pim Fortuyn,Environmental
"I always felt that if someone shot me, it would be great for the environmental movement, because they would make me a martyr. Our biggest fear was our children, because there was a tremendous amount of threat and intimidation, and my wife was terrified that the children might be grabbed or assaulted in some way. That was the real fear.",David Suzuki,Environmental
The Impact Channel and OurPlanet were created to increase awareness of environmental and social causes within the MySpace community.,Tom Anderson,Environmental
"MPs should be able to debate, amend and approve a mandate for the negotiation of any trade agreement before talks start, based on an independent impact assessment of what social, economic and environmental risks might be expected.",Barry Gardiner,Environmental
It's amazing how one introductory course in environmental science can turn a 20-year-old into an Biofuels expert.,Sean Evans,Environmental
"Many environmental battles are won by delaying a destructive project long enough to change the conversation - to allow new economic, political and social dynamics to emerge.",Frances Beinecke,Environmental
"I think people who speak and write about climate change and environmental degradation need to convey how interesting and important this topic is, because I'm not sure people will feel empowered to help if they don't feel engaged and called to action.",Tatiana Schlossberg,Environmental
"Congress created tax-exempt 501(c)(4)s to operate exclusively for social welfare purposes like early childhood education, environmental protection, and veteran's assistance. However, an IRS regulation allows 501(c)(4)s to operate primarily for the promotion of social welfare.",Michelle Lujan Grisham,Environmental
"If the U.S. fails to set the rules for global trade, then other countries with records of environmental and labor abuses, like China, will step in to fill the void.",Mike Quigley,Environmental
"I travel all over the country speaking to young people, and I am always amazed at how engaged in environmental conservation they are.","Philippe Cousteau, Jr.",Environmental
"China's environmental conundrums will not be solved by changes within government alone. New mechanisms are needed to allow the communities which may be affected by a given plan, and citizens concerned about the environment, to join in.",Ma Jun,Environmental
"I believe Forbes is an important outlet for broadening environmental journalism beyond the overwhelmingly alarmist approach taken by most reporters, and look forward to contributing heterodoxical pieces on energy and the environment in the future.",Michael Shellenberger,Environmental
"I think we'd be crazy to do anything to the integrity of our policy package, which is progressive, and really dealing with the key social and environmental issues that we face. We're not about to ditch our commitment to nuclear disarmament, for example, to somehow make ourselves more electable.",Caroline Lucas,Environmental
"With increasing fervor since the 1980s, sustainability has been the watchword of scientists, environmental activists, and indeed all those concerned about the complex, fragile systems on the sphere we inhabit. It has shaped debates about business, design, and our lifestyles.",Jamais Cascio,Environmental
"Greenhouse gas production, water usage and environmental issues more broadly are being mitigated by Canadian technological advances more and more each year.",Erin O'Toole,Environmental
"Toxins love to get you while you're young. Lead, mercury, secondhand smoke and sundry other environmental nasties do a lot more damage when tissue is immature, vulnerable and growing than when it's mature and comparatively fixed.",Jeffrey Kluger,Environmental
I think we should all try and do our bit to celebrate an eco-friendly Diwali to bring about an environmental change.,Mohit Raina,Environmental
The position I took at the time was that we hadn't really examined any of the potential environmental consequences of introducing genetically modified organisms.,Jeremy Rifkin,Environmental
That's what hurts the environmental movement - holding people to a standard they cannot meet. That just pushes people away.,Laurie David,Environmental
"My mom was an environmental activist in Australia in the late '60s and '70s, and I guess I've inherited that awareness from her.",Robin McLeavy,Environmental
"Five years after the Chernobyl disaster, in the summer of 1991, the last summer the Soviet Union was still in existence, I visited Ukraine. I trekked out to the 20-mile exclusion zone - it had been cleared of all people after the accident - together with some local environmental activists.",Anne Applebaum,Environmental
"As for testosterone, it's gotten a bum rap. Yes, it has tons to do with aggression but it doesn't cause aggression as much as sensitizes you to the environmental triggers of aggression.",Robert Sapolsky,Environmental
"So to hope to be able to have peace, to be able to have justice and environmental balance, are consequences of our behavior, not just our intentions.",Godfrey Reggio,Environmental
Complexity is one of the great problems in environmental design.,Christopher Alexander,Environmental
"There is a new wave of environmental consumers I like to call Pocketbook Environmentalists. They're going green primarily because it makes good financial sense, but the fact that it benefits their families' health and the environment also makes them feel good.",Lynn Jurich,Environmental
"If our system continues without modification involving environmental and social concern, we will face an economic and social breakdown of our outdated monetary and political system.",Jacque Fresco,Environmental
"As a longtime public servant and environmental expert, Michael Regan will help ensure that the EPA decisions are guided by science and will promote environmental justice.",Ben Ray Lujan,Environmental
"I have younger friends who are in this pinch where they feel they've been counted out before they've had a chance to prove themselves. They've inherited a lot of debt - not just student debt but environmental debt, political debt. They really feel squeezed.",G. Willow Wilson,Environmental
We have very strong environmental laws in the United States and elsewhere around the world. The problem is that they're seldom enforced.,"Robert Kennedy, Jr.",Environmental
"China leads the world in energy consumption, carbon emissions, and the release of major air and water pollutants, and the environmental impact is felt both regionally and globally.",Ma Jun,Environmental
We're taking climate change seriously. But it's not the only environmental issue that we face as a planet.,Andrew R. Wheeler,Environmental
"I've always been a big supporter of the Surfrider Foundation. I started my own foundation, Rob Machado Foundation, which focuses on environmental education for the little people of the world.",Rob Machado,Environmental
"This is absolutely bizarre that we continue to subsidize highways beyond the gasoline tax, airlines, and we don't subsidize, we don't want to subsidize a national rail system that has environmental impact.",Joe Biden,Environmental
"If Canada could simply apply the basic principles of sustainable development, such as the internalization of costs and 'polluters pay,' it would have long-term beneficial effects, both environmental and economic.",Andrew Nikiforuk,Environmental
"What I remain opposed to is the idea that David Cameron could go around and give up workers' rights, give up environmental protection, give up a whole load of things that are very important.",Jeremy Corbyn,Environmental
"Civilization has given us enormous successes: going to the moon, technology. But then this is the civilisation that took us to debt, environmental crisis, every single crisis. We need a civilization where we say goodbye to these things.",Muhammad Yunus,Environmental
"The NFL, sadly, has a fatal environmental problem: It kills its workers.",Matt Taibbi,Environmental
"In the rich world, the environmental situation has improved dramatically. In the United States, the most important environmental indicator, particulate air pollution, has been cut by more than half since 1955, rivers and coastal waters have dramatically improved, and forests are increasing.",Bjorn Lomborg,Environmental
"Business has a way of talking about how to create value, which is in some way isn't bad... We just need to start thinking about if the value we want to create is consistent with all social and environmental well being.",Peter Senge,Environmental
"Urban residents, most of them middle class, have a much better sense of their environmental rights, and they're willing to take to the streets.",Ma Jun,Environmental
"To avoid congestion, I get up at 5:10, grab a slice of raisin toast, and leave the house at 6 A.M. My husband, Tim Dunn, who works for an environmental agency, is still asleep when I slip out, and I find that rather annoying.",Ellen Stofan,Environmental
"For more than 30 years, the state of Nevada and local communities have rejected the Yucca Mountain project. In fact, the state has filed over 200 contentions against the Department of Energy's license application, challenging the adequacy of the department's environmental impact assessments.",Jacky Rosen,Environmental
"As President Trump quickly moved to limit immigration, civil rights, and environmental protections, I felt fear for my young children, and guilt, too - as if I'd somehow betrayed the unspoken contract all parents make to give our children a better life than ourselves.",Laura Moser,Environmental
Fossil fuel companies and their allies are funding a massive and sophisticated campaign to mislead the American people about the environmental harm caused by carbon pollution.,Sheldon Whitehouse,Environmental
The first time I was ever impressed with Patagonia as a brand was when they released the 'Don't Buy This Jacket' campaign. That campaign highlighted their understanding of their role in a larger environmental justice space.,DeRay Mckesson,Environmental
"Politicians usually get the blame for dragging their feet on environmental issues. And fair enough. Most of them do just that. But the blame isn't theirs alone. For politicians afraid of losing votes, a bristling media waiting to transform good green ideas into monsters is a colossal disincentive.",Zac Goldsmith,Environmental
"We're still expecting capitalism to solve problems: 'Maybe if we sell enough oil, we can give some profits to an environmental agency!' Capitalism isn't a moral system.",Anohni,Environmental
Technology is vital. We have to have development in new technology if we're going to solve these environmental problems without throwing humanity back in poverty.,Ramez Naam,Environmental
"I've been making pieces dealing with environmental issues at least since 2004; I mean, I did stuff for the Sierra Club and the Alaskan Wildlife Refuge even back in the 1990s. But somewhere a little after 2004, Hummer hits me up. I'm like, 'Are you kidding me?'",Shepard Fairey,Environmental
"We are a retailer - we are a merchant. That is our business. But we look for places to make a positive difference. There is such a thing as a double bottom line, whether it is the wage increase or what we do with environmental sustainability to limit waste.",Doug McMillon,Environmental
"What's it like to envision the ten-thousand-year environmental impact of tossing a plastic bottle into the trash bin, all in the single second it takes to actually toss it? Or the ten-thousand-year history of the fossil fuel being burned to drive to work or iron a shirt? It may be environmentally progressive, but it's not altogether pleasant.",Douglas Rushkoff,Environmental
"If you are lucky enough to never experience any sort of adversity, we won't know how resilient you are. It's only when you're faced with obstacles, stress, and other environmental threats that resilience, or the lack of it, emerges: Do you succumb or do you surmount?",Maria Konnikova,Environmental
"The portfolio standard was enacted when I was secretary of the Department of Environmental Protection. It created investment, generated jobs, and gave a boost to local economies, all when helping to protect the environment.",Katie McGinty,Environmental
I'd say that animal rights and environmental issues have always been at the forefront of my mind.,Corey Feldman,Environmental
"Certainly jellyfish are seasonal, and owing to a complex range of environmental features there are years when they will appear in far greater numbers.",Steve Backshall,Environmental
"In the end, I think the majority of Romanian society will understand that if we respect environmental protection standards, if we have benefits in taxes, royalties, jobs, we should do what all the modern countries in Europe and beyond are doing to take advantage of their natural resources.",Victor Ponta,Environmental
"Vegetarians have been around for a very long time - Pythagoreans forbade eating animals more than 2,500 years ago - but even as the environmental evidence mounted, they didn't appear to be winning the argument.",Tristram Stuart,Environmental
Environmental groups are not completely against dams. We approve of appropriate development.,Ma Jun,Environmental
"I think there's a green side to John Kerry, if you like, that he's an environmental activist. His record on the environment is as best as you have on a pro-environment record of anybody in the U.S. Senate.",Douglas Brinkley,Environmental
"Nature is not simply a technical or economical resource, and human beings are not mere numbers. To suggest that one can somehow align all the squabbling institutions of science, environmental management, government and diplomacy in an alliance of convenience to regulate the global climate seems to me optimistic.",James Buchan,Environmental
"I think an old style of addressing environmental problems is ebbing, but the rise of the so-called conservative, political movement in this country is not a trend towards the future but a reaction to this very broad shift that we are undergoing.",Paul Hawken,Environmental
I don't know if acting is genetic. Maybe it's environmental.,"Freddie Prinze, Jr.",Environmental
"It is the public that is illiterate in science and math, a lazy press, and environmental advocacy groups that manufacture fear for misconceptions about energy.",Rex Tillerson,Environmental
"Here on Earth, we've found organisms that thrive in environmental conditions we would have once thought uninhabitable. The presence of these extremophiles suggests that life could potentially take hold on worlds other than our own.",Nick Sagan,Environmental
"As an environmental engineer who spent the early part of my career cleaning up groundwater contamination, I know firsthand the challenges of cleaning up contaminants and the risks posed to human health if we fail.",Chris Sununu,Environmental
"Our land-healing ministry really is about cultivating relationships: between the people, the loving stewards, and the ecology of a place, what I call the environmental umbilical that we're nurturing here.",Joel Salatin,Environmental
"We should bring in an environmental attitude, and I think luxury should automatically be about sustainability and quality.",Jochen Zeitz,Environmental
"On April 16, 2010, 34 Chinese environmental organizations, including Friends of Nature, the Institute of Public and Environmental Affairs, and Green Beagle, questioned heavy metal pollution in a letter sent to CEO Steve Jobs.",Ma Jun,Environmental
"Though dams and artificial lakes can have significant negative environmental impacts, when carefully considered, mitigated, and managed, the benefits of hydropower often outweigh these costs.",Seth Moulton,Environmental
"To reduce the risk of a global environmental catastrophe, and to avoid reversing the course of human progress, the world must urgently bend the curve of global emissions away from fossil fuels.",Johan Rockstrom,Environmental
"The great challenge of the 21st century is to provide good standards of living for 7 billion people without depleting the earth's resources or running up massive levels of public debt. To achieve this, government and business alike will need to find new models of growth that are in both environmental and economic balance.",Paul Polman,Environmental
Harmful Algal Blooms are a serious environmental and economic threat to New Jersey.,Mikie Sherrill,Environmental
"Environmental disaster is the gravest threat to China's continued development. That's according to me, but it is not some wacko view.",James Fallows,Environmental
"Through our regulatory reforms, the Trump administration is proving that burdensome federal regulations are not necessary to drive environmental progress. What makes our actions effective and durable is our commitment to vigorously enforce them.",Andrew R. Wheeler,Environmental
"In a world of serious threats to the U.K. and to global stability, where we see violence and conflict pulling people back into poverty, international terrorism, migration crises, children dying from preventable diseases and global environmental concerns on the rise, Britain's leadership on the world stage is more important than ever.",Priti Patel,Environmental
"We can solve the car-bike conflict, and the solution unlocks a brighter, more inclusive economic and environmental future for Boston.",Michelle Wu,Environmental
"We know that the environment and political information is important, and we expose and teach the women about some of the environmental factors that lead to their incarceration.",Susan Burton,Environmental
Federal elections happen every two years in this country. Presidential elections every four years. And four years just isn't long enough to dismantle all the environmental laws we've got in this country.,Jared Diamond,Environmental
"Despite Arizona's remarkable growth in recent years, we have met the current federal health standards for ozone pollution and the Environmental Protection Agency recently approved our dust control plan.",Jane D. Hull,Environmental
I believe we should reframe our response to climate change as an imperative for growth rather than merely being a way of being green or meeting environmental commitments.,William Hague,Environmental
"While the Environmental Genome Project does not seek to assign allele frequencies, we are aware of the importance of accurate allele frequency estimates for future epidemiologic studies and the large sample sizes such estimates will require.",Samuel Wilson,Environmental
"I worked as a draftsman for the Department of Environmental Protection, and as a teacher, in N.Y.C.; at a big bank and a small ad agency, a tiny law firm and a few giant ones; as a cashier and a dishwasher; preparing deli sandwiches and stringing tennis racquets and pruning evergreens into conical Christmas-tree shapes.",Chris Pavone,Environmental
"I'm fortunate to be in a position to support nonprofits that align with my personal priorities, which include women's health issues, cancer research, environmental concerns, and education for women and children domestically and globally.",Channing Dungey,Environmental
"Textile manufacturers use complicated chemical and industrial processes to make clothing materials, from cotton to synthetic fibers. And while the environmental consequences aren't always clear, consumption is growing.",Tatiana Schlossberg,Environmental
"Grave security concerns can arise as a result of demographic trends, chronic poverty, economic inequality, environmental degradation, pandemic diseases, organized crime, repressive governance and other developments no state can control alone. Arms can't address such concerns.",Ban Ki-moon,Environmental
"The growth that we want is one that brings real benefits to the people, raises quality and efficiency of development, and contributes to energy conservation and environmental protection.",Li Keqiang,Environmental
The environmental crisis is all a result of rushing.,"Ed Begley, Jr.",Environmental
"We want to find a way to be an environmental leader in motor sports, as well as in sports in general.",Brian France,Environmental
"Climate change is an economic, public health, and environmental issue that we have a moral responsibility to address.",Brad Schneider,Environmental
"What I see are people who want affordable energy. They want strong environmental standards - they want a lot of things - but first and foremost they want affordable energy. And if you want affordable energy, you want oil, gas and coal.",John S. Watson,Environmental
"I'd like to avoid the environmental apocalypse if I could. Zombies, robots - I don't know - I'd probably do alright hidden in the middle of the herd and sacrificing people to keep myself alive, but where you gonna hide when all the food is gone?",Ben Peek,Environmental
"I think we have grave problems. I am very much concerned about environmental questions, even though in Finnish society, we are not facing the most urgent problems.",Harri Holkeri,Environmental
"Recognizing nuclear as renewable, and saving Diablo Canyon, would be a bold move for Governor Newsom. It would upset his traditional anti-nuclear environmental allies.",Michael Shellenberger,Environmental
"I wanted to help raise awareness, so I created an environmental foundation called Just Within Reach.",Kevin Richardson,Environmental
"The Environmental Protection Agency's first-ever limits on carbon pollution from power plants will create clean- energy jobs, improve public health, bring greater reliability to our electric power grid, bolster our national security, demonstrate the United States' resolve to combat climate change and maybe even reduce our utility bills.",Martin Luther King III,Environmental
EarthEcho Expeditions represents the culmination of more than a decade of working with educators and youth from around the world. EarthEcho Expeditions uses the thrill of adventure to inspire and empower a new generation of environmental champions.,"Philippe Cousteau, Jr.",Environmental
"From a planning perspective, economic degradation begets environmental degradation, which begets social degradation.",Majora Carter,Environmental
"For TPP to get my vote, it must benefit America's middle class, raise wages, and safeguard the consumer and environmental protections that we rely upon.",Dan Lipinski,Environmental
"We had a great chance in the mid-2000s to reach an accord with the Chinese on both energy and environmental issues. That deal would have essentially been that the U.S. could provide the equipment and expertise, and the Chinese would help close the trade gap. It was a huge opportunity that we failed to exploit.",David E. Sanger,Environmental
"I always thought we had an environmental problem, but I hadn't realized how urgent it was. James Lovelock writes that by the end of this century there will be one billion people left.",Vivienne Westwood,Environmental
