quotes,authors,categories
"Satan, the leader or dictator of devils, is the opposite, not of God, but of Michael.",C. S. Lewis,God
"God preordained, for his own glory and the display of His attributes of mercy and justice, a part of the human race, without any merit of their own, to eternal salvation, and another part, in just punishment of their sin, to eternal damnation.",John Calvin,God
"It is not a God, just and good, but a devil, under the name of God, that the Bible describes.",Thomas Paine,God
"To you I'm an atheist; to God, I'm the Loyal Opposition.",Woody Allen,God
"God is a God of the present. God is always in the moment, be that moment hard or easy, joyful and painful.",Henri Nouwen,God
Hope is like peace. It is not a gift from God. It is a gift only we can give one another.,Elie Wiesel,God
Nothing reflects so much honor on a workman as a trial of his work and its endurance of it. So it is with God. It honors Him when His saints preserve their integrity.,Charles Spurgeon,God
The greatest act of faith is when a man understands he is not God.,"Oliver Wendell Holmes, Jr.",God
"God made the Idiot for practice, and then He made the School Board.",Mark Twain,God
Outside the kingdom of the Lord there is no nation which is greater than any other. God and history will remember your judgment.,Haile Selassie,God
God helps those who help themselves.,Benjamin Franklin,God
I attract perfect beings whom I can love and will love me in return. God and Goddesses of Love guide me to find my true love.,Walter Mercado,God
But God can only smile because only God can know what is coming next.,Desmond Tutu,God
"You were made by God and for God, and until you understand that, life will never make sense.",Rick Warren,God
Even Kings and emperors with heaps of wealth and vast dominion cannot compare with an ant filled with the love of God.,Guru Nanak,God
"God will prepare everything for our perfect happiness in heaven, and if it takes my dog being there, I believe he'll be there.",Billy Graham,God
"You can not divorce religious belief and public service. I've never detected any conflict between God's will and my political duty. If you violate one, you violate the other.",Jimmy Carter,God
"Act, and God will act.",Joan of Arc,God
"Courage, not compromise, brings the smile of God's approval.",Thomas S. Monson,God
The meaning of life. The wasted years of life. The poor choices of life. God answers the mess of life with one word: 'grace.',Max Lucado,God
"God wants you to be a winner, not a whiner.",Joel Osteen,God
"Before the throne of the Almighty, man will be judged not by his acts but by his intentions. For God alone reads our hearts.",Mahatma Gandhi,God
"As a blind man has no idea of colors, so have we no idea of the manner by which the all-wise God perceives and understands all things.",Isaac Newton,God
"From my point of view, God is the light that illuminates the darkness, even if it does not dissolve it, and a spark of divine light is within each of us.",Pope Francis,God
The sound of 'gentle stillness' after all the thunder and wind have passed will the ultimate Word from God.,Jim Elliot,God
"That deep emotional conviction of the presence of a superior reasoning power, which is revealed in the incomprehensible universe, forms my idea of God.",Albert Einstein,God
God can be realized through all paths. All religions are true. The important thing is to reach the roof. You can reach it by stone stairs or by wooden stairs or by bamboo steps or by a rope. You can also climb up by a bamboo pole.,Ramakrishna,God
I cannot believe in a God who wants to be praised all the time.,Friedrich Nietzsche,God
Your idol is shattered in the dust to prove that God's dust is greater than your idol.,Rabindranath Tagore,God
"God will never direct us to be prideful, arrogant and unforgiving, immoral or slothful or full of fear. We step into these things because we are insensitive to the leadership of the Holy Spirit within us.",Charles Stanley,God
"Do not borrow the productions of other men's brains and pens and recite them as a lesson; but make the most of the talents, the brain power, that God has given you.",Ellen G. White,God
"Reading about nature is fine, but if a person walks in the woods and listens carefully, he can learn more than what is in books, for they speak with the voice of God.",George Washington Carver,God
God's mercy is fresh and new every morning.,Joyce Meyer,God
The religious idea of God cannot do full duty for the metaphysical infinity.,Alan Watts,God
"Let go of yesterday. Let today be a new beginning and be the best that you can, and you'll get to where God wants you to be.",Joel Osteen,God
"Religion comes from the word 're' or again and 'ligare' meaning to bind or tie back. The purpose of religion is to unite the self with God or the creative force. Music, sacred spaces, and meaningful icons are the way we conjoin our minds with the transcendental.",Alex Grey,God
"Every day is a gift from God, no matter how old we are.",Billy Graham,God
"Being dragged off that bus was worth it just to see Barack Obama become president, because so many others gave their lives and didn't get to see it, and I thank God for letting me see it.",Claudette Colvin,God
"He who is unable to live in society, or who has no need because he is sufficient for himself, must be either a beast or a god.",Aristotle,God
"When I was a kid, people bullied me about my weight and being skinny. Throughout my teenage years, I had to just depend on the fact that, look, this is who God created me to be, so I'm going to depend on what's already there.",Letitia Wright,God
"My father always taught me that when you help other people, then God will give you double. And that's what has really happened to me. When I have helped other people who are in need, God has helped me more.",Cristiano Ronaldo,God
Why indeed must 'God' be a noun? Why not a verb - the most active and dynamic of all.,Mary Daly,God
"Art, as far as it is able, follows nature, as a pupil imitates his master; thus your art must be, as it were, God's grandchild.",Dante Alighieri,God
"It's always wonderful to get to know women, with the mystery and the joy and the depth. If you can make a woman laugh, you're seeing the most beautiful thing on God's Earth.",Keanu Reeves,God
"Fix reason firmly in her seat, and call to her tribunal every fact, every opinion. Question with boldness even the existence of a God; because, if there be one, he must more approve of the homage of reason, than that of blindfolded fear.",Thomas Jefferson,God
"I have never made but one prayer to God, a very short one: 'O Lord make my enemies ridiculous.' And God granted it.",Voltaire,God
Freedom prospers when religion is vibrant and the rule of law under God is acknowledged.,Ronald Reagan,God
God's delays are not God's denials.,Robert H. Schuller,God
"The righteousness of Jesus Christ is one of those great mysteries, which the angels desire to look into, and seems to be one of the first lessons that God taught men after the fall.",George Whitefield,God
"The end of life is to be like God, and the soul following God will be like Him.",Socrates,God
"Where there is devotional music, God is always at hand with His gracious presence.",Johann Sebastian Bach,God
"Surely God would not have created such a being as man, with an ability to grasp the infinite, to exist only for a day! No, no, man was made for immortality.",Abraham Lincoln,God
"What I call my 'self' now is hardly a person at all. It's mainly a meeting place for various natural forces, desires, and fears, etcetera, some of which come from my ancestors, and some from my education, some perhaps from devils. The self you were really intended to be is something that lives not from nature but from God.",C. S. Lewis,God
To be a man is to suffer for others. God help us to be men!,Cesar Chavez,God
"I plainly told them, 'Be ye sincerely converted, and with your whole heart, to the Lord our God, for nothing is impossible to Him, that He may today send you food on your road, even until you are satisfied, because He has everywhere abundance.' And, with God's help, it was so done: Behold! A herd of swine appeared in the road before our eyes.",Saint Patrick,God
"Darkness comes. In the middle of it, the future looks blank. The temptation to quit is huge. Don't. You are in good company... You will argue with yourself that there is no way forward. But with God, nothing is impossible. He has more ropes and ladders and tunnels out of pits than you can conceive. Wait. Pray without ceasing. Hope.",John Piper,God
A humble knowledge of thyself is a surer way to God than a deep search after learning.,Thomas a Kempis,God
"It's a horrible idea that God, this paragon of wisdom and knowledge, power, couldn't think of a better way to forgive us our sins than to come down to Earth in his alter ego as his son and have himself hideously tortured and executed so that he could forgive himself.",Richard Dawkins,God
The highest revelation is that God is in every man.,Ralph Waldo Emerson,God
Whatever I will become will be what God has chosen for me.,Elvis Presley,God
Faith comes by hearing and hearing by the word of God. Fear comes by hearing and a hearing by the word of the devil. The lies of Satan.,Kenneth Copeland,God
"Being human means you will make mistakes. And you will make mistakes, because failure is God's way of moving you in another direction.",Oprah Winfrey,God
"God, give us grace to accept with serenity the things that cannot be changed, courage to change the things which should be changed and the wisdom to distinguish the one from the other.",Reinhold Niebuhr,God
"As God has not made anything useless in this world, as all beings fulfill obligations or a role in the sublime drama of Creation, I cannot exempt from this duty, and small though it be, I too have a mission to fill, as for example: alleviating the sufferings of my fellowmen.",Jose Rizal,God
"I don't excercise. If God had wanted me to bend over, he would have put diamonds on the floor.",Joan Rivers,God
"If you suffer, thank God! It is a sure sign that you are alive.",Elbert Hubbard,God
I cannot imagine a God who rewards and punishes the objects of his creation and is but a reflection of human frailty.,Albert Einstein,God
"We can only learn to know ourselves and do what we can - namely, surrender our will and fulfill God's will in us.",Saint Teresa of Avila,God
"My word will never be as strong as God's word. All I am is just a vessel, doing His work.",Kendrick Lamar,God
"I came, I saw, God conquered.",Charles V,God
There is a power in God's gospel beyond all description.,Charles Spurgeon,God
God's purpose is more important than our plans.,Myles Munroe,God
Have faith in God; God has faith in you.,Edwin Louis Cole,God
"I knew that no matter what door you knock on in a Cretan village, it will be opened for you. A meal will be served in your honor, and you will sleep between the best sheets in the house. In Crete, the stranger is still the unknown god. Before him, all doors and all hearts are opened.",Nikos Kazantzakis,God
Don't let anybody make you think God chose America as His divine messianic force to be a sort of policeman of the whole world.,"Martin Luther King, Jr.",God
"God sent me on earth. He send me to do something, and nobody can stop me. If God want to stop me, then I stop. Man never can.",Bob Marley,God
Nature is my manifestation of God. I go to nature every day for inspiration in the day's work. I follow in building the principles which nature has used in its domain.,Frank Lloyd Wright,God
We may be surprised at the people we find in heaven. God has a soft spot for sinners. His standards are quite low.,Desmond Tutu,God
"Nature and nature's laws lay hid in the night. God said, Let Newton be! and all was light!",Alexander Pope,God
"I believe in God and his son, Jesus.",Lil Wayne,God
"I do not know myself, and God forbid that I should.",Johann Wolfgang von Goethe,God
"Death surrenders us totally to God: it makes us enter into him; we must, in return, surrender ourselves to death with absolute love and self-abandonment since, when death comes, all we can do is to surrender ourselves completely to the domination and guidance of God.",Pierre Teilhard de Chardin,God
"As for reputation, though it be a glorious instrument of advancing our Master's service, yet there is a better than that: a clean heart, a single eye, and a soul full of God. A fair exchange if, by the loss of reputation, we can purchase the lowest degree of purity of heart.",John Wesley,God
"When we put God first, all other things fall into their proper place or drop out of our lives.",Ezra Taft Benson,God
"The first step toward finding God, Who is Truth, is to discover the truth about myself: and if I have been in error, this first step to truth is the discovery of my error.",Thomas Merton,God
"Don't ever criticize yourself. Don't go around all day long thinking, 'I'm unattractive, I'm slow, I'm not as smart as my brother.' God wasn't having a bad day when he made you... If you don't love yourself in the right way, you can't love your neighbour. You can't be as good as you are supposed to be.",Joel Osteen,God
One of the peculiar sins of the twentieth century which we've developed to a very high level is the sin of credulity. It has been said that when human beings stop believing in God they believe in nothing. The truth is much worse: they believe in anything.,Malcolm Muggeridge,God
Where can we go to find God if we cannot see Him in our own hearts and in every living being.,Swami Vivekananda,God
"God is love, and His law is love. Its two great principles are love to God and love to man.",Ellen G. White,God
"Great and glorious God, and Thou Lord Jesus, I pray you shed abroad your light in the darkness of my mind. Be found of me, Lord, so that in all things I may act only in accordance with Thy holy will.",Francis of Assisi,God
"It is not the soul alone that should be healthy; if the mind is healthy in a healthy body, all will be healthy and much better prepared to give God greater service.",Saint Ignatius,God
"Part of me suspects that I'm a loser, and the other part of me thinks I'm God Almighty.",John Lennon,God
"If I had to choose a religion, the sun as the universal giver of life would be my god.",Napoleon Bonaparte,God
"Happiness is neither without us nor within us. It is in God, both without us and within us.",Blaise Pascal,God
All God wants of man is a peaceful heart.,Meister Eckhart,God
Conscience is God present in man.,Victor Hugo,God
"I've heard people say that God is the gift of desperation, and there's a lot to be said for having really reached a bottom where you've run out of any more good ideas or plans for everybody else's behavior; or how to save and fix and rescue; or just get out of a huge mess, possibly of your own creation.",Anne Lamott,God
God spoke to me and called me to His Service. What form this service was to take the voice did not say.,Florence Nightingale,God
You will never cease to be the most amazed person on earth at what God has done for you on the inside.,Oswald Chambers,God
"The chief difference between words and deeds is that words are always intended for men for their approbation, but deeds can be done only for God.",Leo Tolstoy,God
"Man's sin is in his failure to live what he is. Being the master of the earth, man forgets that he is the servant of God.",Abraham Joshua Heschel,God
"God's plan for enlarging His kingdom is so simple - one person telling another about the Savior. Yet we're busy and full of excuses. Just remember, someone's eternal destiny is at stake. The joy you'll have when you meet that person in heaven will far exceed any discomfort you felt in sharing the gospel.",Charles Stanley,God
God's gifts put man's best dreams to shame.,Elizabeth Barrett Browning,God
"I pray for my enemies, that God would forgive them.",Ruby Bridges,God
Man's mind is like a store of idolatry and superstition; so much so that if a man believes his own mind it is certain that he will forsake God and forge some idol in his own brain.,John Calvin,God
"What you wish to others, God wishes to you.",T. B. Joshua,God
"Pray, and let God worry.",Martin Luther,God
"I do not believe in God; his existence has been disproved by Science. But in the concentration camp, I learned to believe in men.",Jean-Paul Sartre,God
God Almighty has set before me two great objects: the suppression of the slave trade and the reformation of manners.,William Wilberforce,God
"Good man! Genuine gentleman! God bless George Thompson, the great-hearted friend of my race.",Sojourner Truth,God
"Thank you, God, for this good life and forgive us if we do not love it enough.",Garrison Keillor,God
"When his life was ruined, his family killed, his farm destroyed, Job knelt down on the ground and yelled up to the heavens, 'Why god? Why me?' and the thundering voice of God answered, 'There's just something about you that pisses me off.'",Stephen King,God
"Expect great things from God, attempt great things for God.",William Carey,God
Mankind must remember that peace is not God's gift to his creatures; peace is our gift to each other.,Elie Wiesel,God
"The wonderful news is that our Lord is a God of mercy, and He responds to repentance.",Billy Graham,God
"If a man reaches the heart of his own religion, he has reached the heart of the others, too. There is only one God, and there are many paths to him.",Mahatma Gandhi,God
"I try to give to the poor people for love what the rich could get for money. No, I wouldn't touch a leper for a thousand pounds; yet I willingly cure him for the love of God.",Mother Teresa,God
I live and love in God's peculiar light.,Michelangelo,God
"Faith, mighty faith, the promise sees, And looks to God alone; Laughs at impossibilities, And cries it shall be done.",Charles Wesley,God
God judged it better to bring good out of evil than to suffer no evil to exist.,Saint Augustine,God
"We see a new Ethiopia, a new Africa, stretching her hands of influence throughout the world, teaching man the way of life and peace, The Way to God.",Marcus Garvey,God
"But men must know, that in this theatre of man's life it is reserved only for God and angels to be lookers on.",Francis Bacon,God
"God knows when the end of time will come, not some fanatic... The world will end someday, but the end of the world and the end of time are two different things.",Dolly Parton,God
"In the end, you're trying to find God. That's the result of not being satisfied. And it doesn't matter how much money, or property, or whatever you've got, unless you're happy in your heart, then that's it. And unfortunately, you can never gain perfect happiness unless you've got that state of consciousness that enables that.",George Harrison,God
"I separated from the Southern Baptists when they adopted the discriminatory attitude towards women, because I believe what Paul taught in Galatians that there is no distinction in God's eyes between men and women, slaves and masters, Jews and non-Jews - everybody is created equally in the eyes of God.",Jimmy Carter,God
"People from different backgrounds may not have natural affinity, but when the Word of God is treated right and the Holy Spirit is allowed to engage, it can bring together things, people, backgrounds, histories, races, colors, and cultures and hold them together in a way that natural affinity may not be able to do.",Tony Evans,God
No man is much good unless he believes in God and obeys His laws.,Robert Baden-Powell,God
Keep a good attitude and do the right thing even when it's hard. When you do that you are passing the test. And God promises you your marked moments are on their way.,Joel Osteen,God
I believe in God. I believe that He's real and I believe He has control over a lot of things and I think throughout history there has been a lot of countries that have turned their back on Him and the result is not great.,Morgan Wallen,God
"Noah walked with God; he didn't only preach righteousness, he acted it. He went through water and didn't melt. He breasted the current of the popular opinion of his day, scorning alike the hatred and ridicule of the scoffers who mocked at the thought of there being but one way of salvation.",Charles Studd,God
"We know that men are saved by repentance and faith, and whoever does call upon the name of the Lord shall be saved. But salvation is a supernatural work of God that will always produce fruit. And the evidence, not the cause, but the evidence of salvation is a changed life, a changing life.",Paul Washer,God
How can we live in harmony? First we need to know we are all madly in love with the same God.,Thomas Aquinas,God
"I thank God that I'm a product of my parents. That they infected me with their intelligence and energy for life, with their thirst for knowledge and their love. I'm grateful that I know where I come from.",Shakira,God
"Man shall not live by bread alone, but by every word that proceeds from the mouth of God.",Jesus Christ,God
"God has equipped you to handle difficult things. In fact, He has already planted the seeds of discipline and self-control inside you. You just have to water those seeds with His Word to make them grow!",Joyce Meyer,God
"It is by the goodness of God that in our country we have those three unspeakably precious things: freedom of speech, freedom of conscience, and the prudence never to practice either of them.",Mark Twain,God
"When the faith is strong enough, it is sufficient just to be. It's a journey towards simplicity, towards quietness, towards a kind of joy that is not in time. It's a journey that has taken us from primary identification with our body and our psyche, on to an identification with God, and ultimately beyond identification.",Ram Dass,God
"The style of God venerated in the church, mosque, or synagogue seems completely different from the style of the natural universe.",Alan Watts,God
"Morality is of the highest importance - but for us, not for God.",Albert Einstein,God
"God knows I detest slavery but it is an existing evil, and we must endure it and give it such protection as is guaranteed by the Constitution.",Millard Fillmore,God
"God works wonders now and then; Behold a lawyer, an honest man.",Benjamin Franklin,God
"If I am capable of grasping God objectively, I do not believe, but precisely because I cannot do this I must believe.",Soren Kierkegaard,God
"I believe in God - not in a Catholic God; there is no Catholic God. There is God, and I believe in Jesus Christ, his incarnation. Jesus is my teacher and my pastor, but God, the Father, Abba, is the light and the Creator. This is my Being.",Pope Francis,God
I was in my thirteenth year when I heard a voice from God to help me govern my conduct. And the first time I was very much afraid.,Joan of Arc,God
"My speed is a gift from God, and I run for His glory. Whatever I do, it all comes from him.",Allyson Felix,God
"To work without attachment is to work without the expectation of reward or fear of any punishment in this world or the next. Work so done is a means to the end, and God is the end.",Ramakrishna,God
Prayer is simply a two-way conversation between you and God.,Billy Graham,God
The gifts of God should be enjoyed by all citizens in Mississippi.,Medgar Evers,God
"Faithful servants never retire. You can retire from your career, but you will never retire from serving God.",Rick Warren,God
Woman was God's second mistake.,Friedrich Nietzsche,God
"God is the same God, always and everywhere. He is omnipresent not virtually only, but also substantially, for virtue cannot subsist without substance.",Isaac Newton,God
"The will is a beast of burden. If God mounts it, it wishes and goes as God wills; if Satan mounts it, it wishes and goes as Satan wills; Nor can it choose its rider... the riders contend for its possession.",Martin Luther,God
"The hope of eternal life is not to be taken up upon slight grounds. It is a subject to be settled between God and your own soul; settled for eternity. A supposed hope, and nothing more, will prove your ruin.",Ellen G. White,God
"I gave in, and admitted that God was God.",C. S. Lewis,God
To believe in God is impossible not to believe in Him is absurd.,Voltaire,God
Live to the hilt every situation you believe to be the will of God.,Jim Elliot,God
"God made you a masterpiece - be blessed, secure, disciplined and equipped.",Joel Osteen,God
"The knower and the known are one. Simple people imagine that they should see God as if he stood there and they here. This is not so. God and I, we are one in knowledge.",Meister Eckhart,God
"God's dream is that you and I and all of us will realize that we are family, that we are made for togetherness, for goodness, and for compassion.",Desmond Tutu,God
"Saving faith is an immediate relation to Christ, accepting, receiving, resting upon Him alone, for justification, sanctification, and eternal life by virtue of God's grace.",Charles Spurgeon,God
"God cannot use you as He wishes until you come into the fullness of His Glory. Do not get alarmed, my friend, when doubts creep in. That is old Satan. Pray, pray, pray.",George Washington Carver,God
"Let each man think himself an act of God, His mind a thought, his life a breath of God; And let each try, by great thoughts and good deeds, To show the most of Heaven he hath in him.",Philip James Bailey,God
"Discernment is God's call to intercession, never to faultfinding.",Corrie Ten Boom,God
"As a child of God, I am greater than anything that can happen to me.",A. P. J. Abdul Kalam,God
"They say you can rap about anything except for Jesus, that means guns, sex, lies, video tapes, but if I talk about God my record won't get played Huh?",Kanye West,God
"Oh, these vast, calm, measureless mountain days, days in whose light everything seems equally divine, opening a thousand windows to show us God.",John Muir,God
