quotes,authors,categories
"You don't look out there for God, something in the sky, you look in you.",Alan Watts,God
"You can either be a host to God, or a hostage to your ego. It's your call.",Wayne Dyer,God
"I love to think of nature as an unlimited broadcasting station, through which God speaks to us every hour, if we will only tune in.",George Washington Carver,God
"I would rather die than do something which I know to be a sin, or to be against God's will.",Joan of Arc,God
"I have a fundamental belief in the Bible as the Word of God, written by those who were inspired. I study the Bible daily.",Isaac Newton,God
"God does not begin by asking our ability, only our availability, and if we prove our dependability, He will increase our capability.",Neal A. Maxwell,God
"I bade adieu to mechanical inventions, determined to devote the rest of my life to the study of the inventions of God.",John Muir,God
"The straight line belongs to men, the curved one to God.",Antoni Gaudi,God
"Keep your nose out the sky, keep your heart to god, and keep your face to the raising sun.",Kanye West,God
We cannot embrace God's forgiveness if we are so busy clinging to past wounds and nursing old grudges.,T. D. Jakes,God
"We all have different things that we go through in our everyday life, and it's really important to know just at the end of the day, it doesn't matter what you face, you know, that you're going to win at the end of the day. You got to believe in yourself. You got to believe in God, know that He's going to get you through it.",Kelly Rowland,God
"I think that the greatest gift God ever gave man is not the gift of sight but the gift of vision. Sight is a function of the eyes, but vision is a function of the heart.",Myles Munroe,God
God is in the details.,Ludwig Mies van der Rohe,God
Let us raise a standard to which the wise and honest can repair; the rest is in the hands of God.,George Washington,God
"God made the country, and man made the town.",William Cowper,God
Faith is deliberate confidence in the character of God whose ways you may not understand at the time.,Oswald Chambers,God
I'd describe myself as a Christian who doesn't believe in God.,Helen Mirren,God
"To do all that one is able to do, is to be a man; to do all that one would like to do, is to be a god.",Napoleon Bonaparte,God
A dog barks when his master is attacked. I would be a coward if I saw that God's truth is attacked and yet would remain silent.,John Calvin,God
"Music is God's gift to man, the only art of Heaven given to earth, the only art of earth we take to Heaven.",Walter Savage Landor,God
"God forgive you, but I never can.",Elizabeth I,God
God gave us memory so that we might have roses in December.,James M. Barrie,God
"Yesterday is history, tomorrow is a mystery, today is God's gift, that's why we call it the present.",Joan Rivers,God
"Those whom God wishes to destroy, he first makes mad.",Euripides,God
"Thank God men cannot fly, and lay waste the sky as well as the earth.",Henry David Thoreau,God
"Grow in the root of all grace, which is faith. Believe God's promises more firmly than ever. Allow your faith to increase in its fullness, firmness, and simplicity.",Charles Spurgeon,God
I give all the glory to God. It's kind of a win-win situation. The glory goes up to Him and the blessings fall down on me.,Gabby Douglas,God
"The thing to do, it seems to me, is to prepare yourself so you can be a rainbow in somebody else's cloud. Somebody who may not look like you. May not call God the same name you call God - if they call God at all. I may not dance your dances or speak your language. But be a blessing to somebody. That's what I think.",Maya Angelou,God
"Outside of the cross of Jesus Christ, there is no hope in this world. That cross and resurrection at the core of the Gospel is the only hope for humanity. Wherever you go, ask God for wisdom on how to get that Gospel in, even in the toughest situations of life.",Ravi Zacharias,God
God put me on this earth to accomplish a certain number of things. Right now I am so far behind that I will never die.,Bill Watterson,God
"Every morning that I wake up and I'm breathing, I can feel it and take a moment to say, you know, 'Thank God I'm alive for another day.'",Ron Cephas Jones,God
"Sure I believe in God and the Devil, but they don't have to have pitchforks and a long white beard.",Keanu Reeves,God
"So many times, people told me I can't do this or can't do that. My nature is that I don't listen very well. I'm very determined, and I believe in myself. My parents brought me up that way. Thank God for that. I don't let anything stand in my way.",Chantal Sutherland,God
Every man's life is a fairy tale written by God's fingers.,Hans Christian Andersen,God
"Thank God men cannot fly, and lay waste the sky as well as the earth.",Henry David Thoreau,God
"Every happening, great and small, is a parable whereby God speaks to us, and the art of life is to get the message.",Malcolm Muggeridge,God
God gave us memory so that we might have roses in December.,James M. Barrie,God
"To become a villain, you had to have become disillusioned, and in order to become disillusioned you had to have been passionate about something you believed in that was shaken and ripped from your grasp as a protagonist in that stage of your life, leaving you disillusioned with God, if you will.",Matthew Davis,God
"Our prayers should be for blessings in general, for God knows best what is good for us.",Socrates,God
"God will not look you over for medals degrees or diplomas, but for scars.",Elbert Hubbard,God
I will thank God for the day and the moment I have.,Jim Valvano,God
"There's a lot of things we go through and we don't even know why... At the end of the day, God has a purpose and a plan for you, and that's kind of how I take that.",Morgan Wallen,God
"Every day I feel is a blessing from God. And I consider it a new beginning. Yeah, everything is beautiful.",Prince,God
"God will never give you anything you can't handle, so don't stress.",Kelly Clarkson,God
"That little man in black there, he says women can't have as much rights as men 'cause Christ wasn't a woman! Where did your Christ come from? Where did your Christ come from? From God and a woman! Man had nothing to do with Him.",Sojourner Truth,God
"I am blessed to have so many great things in my life - family, friends and God. All will be in my thoughts daily.",Lil' Kim,God
"I thank you God for this most amazing day, for the leaping greenly spirits of trees, and for the blue dream of sky and for everything which is natural, which is infinite, which is yes.",e. e. cummings,God
And malt does more than Milton can to justify God's ways to man.,A. E. Housman,God
I am responsible only to God and history.,Francisco Franco,God
Reputation is what men and women think of us; character is what God and angels know of us.,Thomas Paine,God
I have offended God and mankind because my work didn't reach the quality it should have.,Leonardo da Vinci,God
"God has blessed me with an amazing family, friends and work colleagues that have been my joy, my support, and my sanity. I don't know what I'd do without them.",Josie Loren,God
"If you have God on your side, everything becomes clear.",Ayrton Senna,God
It is the quality of our work which will please God and not the quantity.,Mahatma Gandhi,God
"Therefore I am sure that this, my Coronation, is not the symbol of a power and a splendor that are gone but a declaration of our hopes for the future, and for the years I may, by God's Grace and Mercy, be given to reign and serve you as your Queen.",Queen Elizabeth II,God
"I feel absolutely blessed. No matter what has happened, I still thank God for all of it.",Porsha Williams,God
"We look at life from the back side of the tapestry. And most of the time, what we see is loose threads, tangled knots and the like. But occasionally, God's light shines through the tapestry, and we get a glimpse of the larger design with God weaving together the darks and lights of existence.",John Piper,God
"Woman is a ray of God. She is not that earthly beloved: she is creative, not created.",Rumi,God
God grant me the courage not to give up what I think is right even though I think it is hopeless.,Chester W. Nimitz,God
"Earth's crammed with heaven, And every common bush afire with God: But only he who sees takes off his shoes.",Elizabeth Barrett Browning,God
"I don't know what effect these men will have upon the enemy, but, by God, they frighten me.",Duke of Wellington,God
I'd describe myself as a Christian who doesn't believe in God.,Helen Mirren,God
"I'm far from being god, but I work god damn hard.",Jay-Z,God
"I always think about the idea that God never gives you more than you can handle, and just the idea that God would be looking at me and thinking, 'Eh, I think she can handle more.' And the angels thinking, 'What are you doing? You're a lunatic.' And God being like, 'No, no, trust me. She can handle this.'",Tig Notaro,God
"God is a comedian, playing to an audience too afraid to laugh.",H. L. Mencken,God
"God gives the nuts, but he does not crack them.",Franz Kafka,God
"I did my best, and God did the rest.",Hattie McDaniel,God
I believe that God put us in this jolly world to be happy and enjoy life.,Robert Baden-Powell,God
"To my young friends out there: Life can be great, but not when you can't see it. So, open your eyes to life: to see it in the vivid colors that God gave us as a precious gift to His children, to enjoy life to the fullest, and to make it count. Say yes to your life.",Nancy Reagan,God
"There is a painful joke that Europeans often tell of their Gallic neighbors: God created France, the most beautiful country in the world with so much good in it, and ended up feeling guilty about it. He had to do something to make it fair. And so, he created the French people.",Janine di Giovanni,God
It has been great journey from where I have started to where I am today. I am really blessed with God's grace.,Dhanush,God
"For God's sake hold your tongue, and let me love.",John Donne,God
Do your best and leave the rest to God.,Manisha Koirala,God
"If God listened to the prayers of men, all men would quickly have perished: for they are forever praying for evil against one another.",Epicurus,God
"Technology is a gift of God. After the gift of life it is perhaps the greatest of God's gifts. It is the mother of civilizations, of arts and of sciences.",Freeman Dyson,God
"All men are by nature equal, made all of the same earth by one Workman; and however we deceive ourselves, as dear unto God is the poor peasant as the mighty prince.",Plato,God
"Anyone can count the seeds in an apple, but only God can count the number of apples in a seed.",Robert H. Schuller,God
"Eskimo: 'If I did not know about God and sin, would I go to hell?' Priest: 'No, not if you did not know.' Eskimo: 'Then why did you tell me?'",Annie Dillard,God
"I most certainly believe that it is the gift of God that I am what I am. And so I dwell amongst barbarians, a proselyte and an exile, for the love of God.",Saint Patrick,God
I've looked on many women with lust. I've committed adultery in my heart many times. God knows I will do this and forgives me.,Jimmy Carter,God
"If you have not chosen the Kingdom of God first, it will in the end make no difference what you have chosen instead.",William Law,God
There is but One God. His name is Truth; He is the Creator. He fears none; he is without hate. He never dies; He is beyond the cycle of births and death. He is self-illuminated. He is realized by the kindness of the True Guru. He was True in the beginning; He was True when the ages commenced and has ever been True. He is also True now.,Guru Nanak,God
Let us never forget that the greatest man is never more than an animal disguised as a god.,Francis Picabia,God
The most important lesson that I have learned is to trust God in every circumstance. Lots of times we go through different trials and following God's plan seems like it doesn't make any sense at all. God is always in control and he will never leave us.,Allyson Felix,God
"Live your life while you have it. Life is a splendid gift. There is nothing small in it. Far the greatest things grow by God's law out of the smallest. But to live your life, you must discipline it.",Florence Nightingale,God
Remember that God under the Law ordained a Lamb to be offered up to Him every Morning and Evening.,Thomas Ken,God
"God gives every bird its food, but He does not throw it into its nest.",Josiah Gilbert Holland,God
"I can honestly say I am a Christian, but my spirituality has been developed on the road and is based on my experiences with God.",Justin Timberlake,God
The nature of God is a circle of which the center is everywhere and the circumference is nowhere.,Empedocles,God
"Suicide is man's way of telling God, 'You can't fire me - I quit.'",Bill Maher,God
Sorrow is a fruit. God does not make it grow on limbs too weak to bear it.,Victor Hugo,God
It is possible to become discouraged about the injustice we see everywhere. But God did not promise us that the world would be humane and just. He gives us the gift of life and allows us to choose the way we will use our limited time on earth. It is an awesome opportunity.,Cesar Chavez,God
"I'm a God-fearing man, go to church every Sunday, and have since I was a boy. But if I ever found out that God cared one way or another about a borderline illegal fist-fight on Saturday night, I would be so greatly disappointed that it would make rethink my entire belief system.",Chael Sonnen,God
"Is life so dear or peace so sweet as to be purchased at the price of chains and slavery? Forbid it, Almighty God! I know not what course others may take, but as for me, give me liberty, or give me death!",Patrick Henry,God
"God Almighty first planted a garden. And indeed, it is the purest of human pleasures.",Francis Bacon,God
"God made man in his own image, and man returned the favour.",Frank Wedekind,God
Sometimes I do get to places just when God's ready to have somebody click the shutter.,Ansel Adams,God
A baby is God's opinion that life should go on.,Carl Sandburg,God
"Until we meet again, may God bless you as he has blessed me.",Elvis Presley,God
"My philosophy is: Life is hard, but God is good. Try not to confuse the two.",Anne F. Beiler,God
"To doubt God is to doubt one's own conscience, and in consequence, it would be to doubt everything; and then what is life for?",Jose Rizal,God
"I die the king's faithful servant, but God's first.",Thomas More,God
Faith is not believing that God can. It is knowing that God will.,Ben Stein,God
"Although the life of a person is in a land full of thorns and weeds, there is always a space in which the good seed can grow. You have to trust God.",Pope Francis,God
God may not be there when you want him but he is always on time.,Terrell Owens,God
"I'm originally from Victorville, California, I grew up there. You know, it was a journey, because in Victorville, you know, it's tough out there. It's not like, the easiest place to grow up, so I had just faith in God that if I keep working hard, I could make a way for myself, so my faith in God is something I need, it's essential.",Ryan Garcia,God
"Glory be and praise to God. I didn't do any of this. God did. I don't have a recipe or a blueprint. I prayed for it, and my prayers are continuing to be answered.",Kevin Gates,God
"My dream is to live a good life and be loving, be close to God and be a good human being and bring peace to people.",Ziggy Marley,God
"Don't you know there ain't no devil, it's just god when he's drunk.",Tom Waits,God
"If you're white and you're wrong, then you're wrong; if you're black and you're wrong, you're wrong. People are people. Black, blue, pink, green - God make no rules about color; only society make rules where my people suffer, and that why we must have redemption and redemption now.",Bob Marley,God
Spiritual identity means we are not what we do or what people say about us. And we are not what we have. We are the beloved daughters and sons of God.,Henri Nouwen,God
"When we die our money, fame, and honors will be meaningless. We own nothing in this world. Everything we think we own is in reality only being loaned to us until we die. And on our deathbed at the moment of death, no one but God can save our souls.",Michael Huffington,God
"The greatest lesson I learned that year in Mrs. Henry's class was the lesson Dr. Martin Luther King, Jr., tried to teach us all: Never judge people by the color of their skin. God makes each of us unique in ways that go much deeper.",Ruby Bridges,God
"Man proposes, but God disposes.",Thomas a Kempis,God
"People have to go through trials and tribulations to get where they at. Do your thing - continue to rock it - because obviously, God wants you here.",Kendrick Lamar,God
"Resolution One: I will live for God. Resolution Two: If no one else does, I still will.",Jonathan Edwards,God
I have had a happy life and thank the Lord. Goodbye and may God bless all!,Christopher McCandless,God
"In the Lord's Prayer, the first petition is for daily bread. No one can worship God or love his neighbor on an empty stomach.",Woodrow Wilson,God
"Owners of dogs will have noticed that, if you provide them with food and water and shelter and affection, they will think you are God. Whereas owners of cats are compelled to realize that, if you provide them with food and water and affection, they draw the conclusion that they are God.",Christopher Hitchens,God
I just thank God for all of the blessings.,James Brown,God
"I thank God I was raised Catholic, so sex will always be dirty.",John Waters,God
"Above all, remember that God looks for solid virtues in us, such as patience, humility, obedience, abnegation of your own will - that is, the good will to serve Him and our neighbor in Him. His providence allows us other devotions only insofar as He sees that they are useful to us.",Saint Ignatius,God
"God is not willing to do everything, and thus take away our free will and that share of glory which belongs to us.",Niccolo Machiavelli,God
It's wonderful to climb the liquid mountains of the sky. Behind me and before me is God and I have no fears.,Helen Keller,God
The future is as bright as the promises of God.,William Carey,God
"The state can be a force for good. The Rule of law is absolutely essential to a good life. God has instituted government and leaders throughout history and throughout the Biblical narrative. However, the state is growing precisely as the church is fading as a force for good, and this does not seem to be a good trend.",Dave Brat,God
"Fight the good fight of faith, and God will give you spiritual mercies.",George Whitefield,God
"If God did not intend for us to eat animals, then why did he make them out of meat?",John Cleese,God
Of course God will forgive me; that's His job.,Heinrich Heine,God
"If you talk to God, you are praying; If God talks to you, you have schizophrenia.",Thomas Szasz,God
"We are not at peace with others because we are not at peace with ourselves, and we are not at peace with ourselves because we are not at peace with God.",Thomas Merton,God
"Life as we know it, with all its ups and downs, will soon be over. We all will give an accounting to God of how we have lived.",William Wilberforce,God
We are all atheists about most of the gods that societies have ever believed in. Some of us just go one god further.,Richard Dawkins,God
"We were born to die and we die to live. As seedlings of God, we barely blossom on earth; we fully flower in heaven.",Russell M. Nelson,God
I'm not really religious but very spiritual. I give money to this company that manufactures hearing aids on a regular basis. More people should really hear me sing. I have a gift from God.,Christina Aguilera,God
AIDS is not just God's punishment for homosexuals; it is God's punishment for the society that tolerates homosexuals.,Jerry Falwell,God
A year spent in artificial intelligence is enough to make one believe in God.,Alan Perlis,God
I can't believe that God put us on this earth to be ordinary.,Lou Holtz,God
Everything we do should be a result of our gratitude for what God has done for us.,Lauryn Hill,God
"I said to the almond tree, 'Friend, speak to me of God,' and the almond tree blossomed.",Nikos Kazantzakis,God
"He that can live alone resembles the brute beast in nothing, the sage in much, and God in everything.",Baltasar Gracian,God
Reason in man is rather like God in the world.,Thomas Aquinas,God
I will do my best. That is all I can do. I ask for your help - and God's.,Lyndon B. Johnson,God
"It was my duty to shoot the enemy, and I don't regret it. My regrets are for the people I couldn't save: Marines, soldiers, buddies. I'm not naive, and I don't romanticize war. The worst moments of my life have come as a SEAL. But I can stand before God with a clear conscience about doing my job.",Chris Kyle,God
"Rumi, who is one of the greatest Persian poets, said that the truth was a mirror in the hands of God. It fell, and broke into pieces. Everybody took a piece of it, and they looked at it and thought they had the truth.",Mohsen Makhmalbaf,God
"Your competition is not other people but the time you kill, the ill will you create, the knowledge you neglect to learn, the connections you fail to build, the health you sacrifice along the path, your inability to generate ideas, the people around you who don't support and love your efforts, and whatever god you curse for your bad luck.",James Altucher,God
"God is day and night, winter and summer, war and peace, surfeit and hunger.",Heraclitus,God
Destiny is not designed by mere mortals like us. It is crafted by God.,Rodrigo Duterte,God
I have long known that it is part of God's plan for me to spend a little time with each of the most stupid people on earth.,Bill Bryson,God
"Lo! The poor Indian, whose untutored mind sees God in clouds, or hears him in the wind.",Alexander Pope,God
God bless America. God save the Queen. God defend New Zealand and thank Christ for Australia.,Russell Crowe,God
"I believe in Jesus Christ as my Lord and savior. I believe that Jesus died for my sins, and rose again, and that's my belief. I still don't know what 'Christian' means. I'm a follower of Christ, but I keep making a whole bunch of mistakes. And I thank God for forgiveness.",Sherri Shepherd,God
"Do not worship me, I am not God. I'm only a man. I worship Jesus Christ.",Haile Selassie,God
I haven't been baptised. My dad's not in the church and is not a religious person. My mum is more spiritual - she does Thai-chi and goes to Stonehenge and things like that. I'm proud to be pagan. Finland is not really a religious country. I'm still looking for my god.,Ville Valo,God
"I never was in the Nation of Islam... I mean, what I call myself is a natural Muslim, 'cause it's just me and God. You know, going to the mosque, the ritual and the tradition, it's just not in me to do. So I don't do it.",Ice Cube,God
"If you can believe in God, then you can believe in anything. It's a gang mentality.",Greg Graffin,God
"When obedience ceases to be an irritant and becomes our quest, in that moment God will endow us with power.",Ezra Taft Benson,God
"I believe in the Devil. I believe there's a God, too. I met God at church - the Catholic Church.",Trippie Redd,God
Prayer is aligning ourselves with the purposes of God.,E. Stanley Jones,God
"As long as God gives me strength to work and try to make things real for my children, I'm going to work for it - even if it means making the ultimate sacrifice.",Medgar Evers,God
There is no surprise more magical than the surprise of being loved: It is God's finger on man's shoulder.,Charles Morgan,God
God is a metaphor for that which transcends all levels of intellectual thought. It's as simple as that.,Joseph Campbell,God
"The artist, like the God of the creation, remains within or behind or beyond or above his handiwork, invisible, refined out of existence, indifferent, paring his fingernails.",James Joyce,God
"If I were to say, 'God, why me?' about the bad things, then I should have said, 'God, why me?' about the good things that happened in my life.",Arthur Ashe,God
"But suppose God is black? What if we go to Heaven and we, all our lives, have treated the Negro as an inferior, and God is there, and we look up and He is not white? What then is our response?",Robert Kennedy,God
To be full of things is to be empty of God. To be empty of things is to be full of God.,Meister Eckhart,God
"We are all gifted, but we have to discover the gift, uncover the gift, nurture and develop the gift and use it for the Glory of God and for the liberation struggle of our people.",Louis Farrakhan,God
"That God does not exist, I cannot deny, That my whole being cries out for God I cannot forget.",Jean-Paul Sartre,God
"God sleeps in the minerals, awakens in plants, walks in animals, and thinks in man.",Arthur Young,God
"In the name of God, stop a moment, cease your work, look around you.",Leo Tolstoy,God
You are a child of God. Your playing small does not serve the world. There is nothing enlightened about shrinking so that other people won't feel insecure about you. We were born to manifest the glory of God that is within us.,Marianne Williamson,God
"I do put a lot of God in my music, but not because I'm super religious. There are a lot of demons in my music, too. I acknowledge both.",J. Cole,God
Healing rain is a real touch from God. It could be physical healing or emotional or whatever.,Michael W. Smith,God
A man with God is always in the majority.,John Knox,God
We have one life; it soon will be past; what we do for God is all that will last.,Charles Studd,God
The opposite of faith is not doubt: It is certainty. It is madness. You can tell you have created God in your own image when it turns out that he or she hates all the same people you do.,Anne Lamott,God
