quotes,authors,categories
"There is only one kind of love, but there are a thousand imitations.",Francois de La Rochefoucauld,Love
Keep love in your heart. A life without it is like a sunless garden when the flowers are dead.,Oscar Wilde,Love
We are born of love; Love is our mother.,Rumi,Love
Pains of love be sweeter far than all other pleasures are.,John Dryden,Love
It's important for us to latch onto the people that we love.,Connie Stevens,Love
I have decided to stick with love. Hate is too great a burden to bear.,"Martin Luther King, Jr.",Love
Gravitation is not responsible for people falling in love.,Albert Einstein,Love
In every living thing there is the desire for love.,D. H. Lawrence,Love
"Love can be unselfish, in the sense of being benevolent and generous, without being selfless.",Mortimer Adler,Love
"Love is all we have, the only way that each can help the other.",Euripides,Love
A woman knows the face of the man she loves as a sailor knows the open sea.,Honore de Balzac,Love
The love of our private friends is the only preparatory exercise for the love of all men.,John Henry Newman,Love
"Hatred does not cease by hatred, but only by love; this is the eternal rule.",Buddha,Love
"Love is of all passions the strongest, for it attacks simultaneously the head, the heart and the senses.",Lao Tzu,Love
Don't forget to love yourself.,Soren Kierkegaard,Love
"Love is like a friendship caught on fire. In the beginning a flame, very pretty, often hot and fierce, but still only light and flickering. As love grows older, our hearts mature and our love becomes as coals, deep-burning and unquenchable.",Bruce Lee,Love
Love is a sacred reserve of energy; it is like the blood of spiritual evolution.,Pierre Teilhard de Chardin,Love
Love is the beauty of the soul.,Saint Augustine,Love
"Love is like a faucet, it turns off and on.",Billie Holiday,Love
Love you will find only where you may show yourself weak without provoking strength.,Theodor W. Adorno,Love
"Love many things, for therein lies the true strength, and whosoever loves much performs much, and can accomplish much, and what is done in love is done well.",Vincent Van Gogh,Love
"Love possesses not nor will it be possessed, for love is sufficient unto love.",Khalil Gibran,Love
In love the paradox occurs that two beings become one and yet remain two.,Erich Fromm,Love
"Love looks through a telescope; envy, through a microscope.",Josh Billings,Love
"Love feels no burden, thinks nothing of trouble, attempts what is above its strength, pleads no excuse of impossibility; for it thinks all things lawful for itself, and all things possible.",Thomas a Kempis,Love
The ear is the avenue to the heart.,Voltaire,Love
Love is the only gold.,Alfred Lord Tennyson,Love
To say 'I love you' one must first be able to say the 'I.',Ayn Rand,Love
"If you wished to be loved, love.",Lucius Annaeus Seneca,Love
The one thing we can never get enough of is love. And the one thing we never give enough is love.,Henry Miller,Love
"Love is life. And if you miss love, you miss life.",Leo Buscaglia,Love
There is a woman at the beginning of all great things.,Alphonse de Lamartine,Love
Love is my religion - I could die for it.,John Keats,Love
"True love is quiescent, except in the nascent moments of true humility.",Bryant H. McGill,Love
"Love is, above all, the gift of oneself.",Jean Anouilh,Love
"If you find someone you love in your life, then hang on to that love.",Princess Diana,Love
"No, there's nothing half so sweet in life as love's young dream.",Thomas Moore,Love
"Lord, grant that I might not so much seek to be loved as to love.",Francis of Assisi,Love
Love conquers all.,Virgil,Love
"Love seeketh not itself to please, nor for itself hath any care, but for another gives its ease, and builds a Heaven in Hell's despair.",William Blake,Love
"The moment you have in your heart this extraordinary thing called love and feel the depth, the delight, the ecstasy of it, you will discover that for you the world is transformed.",Jiddu Krishnamurti,Love
Love is the difficult realization that something other than oneself is real.,Iris Murdoch,Love
Love is the difficult realization that something other than oneself is real.,Iris Murdoch,Love
"Love can be unselfish, in the sense of being benevolent and generous, without being selfless.",Mortimer Adler,Love
"If you find someone you love in your life, then hang on to that love.",Princess Diana,Love
"More than kisses, letters mingle souls.",John Donne,Love
"If it is your time, love will track you down like a cruise missile.",Lynda Barry,Love
The crime of loving is forgetting.,Maurice Chevalier,Love
Love is when you meet someone who tells you something new about yourself.,Andre Breton,Love
"The praise that comes from love does not make us vain, but more humble.",James M. Barrie,Love
"Love seeketh not itself to please, nor for itself hath any care, but for another gives its ease, and builds a Heaven in Hell's despair.",William Blake,Love
To love another person is to see the face of God.,Victor Hugo,Love
"Love possesses not nor will it be possessed, for love is sufficient unto love.",Khalil Gibran,Love
Love is the child of illusion and the parent of disillusion.,Miguel de Unamuno,Love
Love means to love that which is unlovable; or it is no virtue at all.,Gilbert K. Chesterton,Love
"One does not fall in love; one grows into love, and love grows in him.",Karl A. Menninger,Love
"Say what you will, 'tis better to be left than never to have been loved.",William Congreve,Love
"If you've got love you've got life, if you can love you can live.",Kim Casali,Love
Friendship is Love without his wings!,Lord Byron,Love
There is more pleasure in loving than in being beloved.,Thomas Fuller,Love
Love is a hole in the heart.,Ben Hecht,Love
Love is an emotion experienced by the many and enjoyed by the few.,George Jean Nathan,Love
"The god of love lives in a state of need. It is a need. It is an urge. It is a homeostatic imbalance. Like hunger and thirst, it's almost impossible to stamp out.",Plato,Love
Is it not by love alone that we succeed in penetrating to the very essence of being?,Igor Stravinsky,Love
Love ceases to be a pleasure when it ceases to be a secret.,Aphra Behn,Love
It's important for us to latch onto the people that we love.,Connie Stevens,Love
"As soon go kindle fire with snow, as seek to quench the fire of love with words.",William Shakespeare,Love
"Nobody loves a woman because she is handsome or ugly, stupid or intelligent. We love because we love.",Honore de Balzac,Love
No one has ever loved anyone the way everyone wants to be loved.,Mignon McLaughlin,Love
The highest function of love is that it makes the loved one a unique and irreplacable being.,Tom Robbins,Love
"Before I met my husband, I'd never fallen in love. I'd stepped in it a few times.",Rita Rudner,Love
"To love abundantly is to live abundantly, and to love forever is to live forever.",Henry Drummond,Love
"Down on your knees, and thank heaven, fasting, for a good man's love.",Euripides,Love
"Love is when he gives you a piece of your soul, that you never knew was missing.",Torquato Tasso,Love
Sometimes the heart sees what is invisible to the eye.,"H. Jackson Brown, Jr.",Love
"If you would be loved, love, and be loveable.",Benjamin Franklin,Love
The journey from teaching about love to allowing myself to be loved proved much longer than I realised.,Henri Nouwen,Love
Who ever loved that loved not at first sight?,Christopher Marlowe,Love
Love is the triumph of imagination over intelligence.,H. L. Mencken,Love
Love is only a dirty trick played on us to achieve continuation of the species.,W. Somerset Maugham,Love
"Can miles truly separate you from friends... If you want to be with someone you love, aren't you already there?",Richard Bach,Love
First love is only a little foolishness and a lot of curiosity.,George Bernard Shaw,Love
To good and true love fear is forever affixed.,Francois Rabelais,Love
"Love is the best thing in the world, and the thing that lives the longest.",Henry Van Dyke,Love
"Do not seek the because - in love there is no because, no reason, no explanation, no solutions.",Anais Nin,Love
"In matters of the heart, nothing is true except the improbable.",Madame de Stael,Love
The spring of love becomes hidden and soon filled up.,Max Muller,Love
There can be no deep disappointment where there is not deep love.,"Martin Luther King, Jr.",Love
The hunger for love is much more difficult to remove than the hunger for bread.,Mother Teresa,Love
"Tell me who admires and loves you, and I will tell you who you are.",Antoine de Saint-Exupery,Love
"There is no disguise which can hide love for long where it exists, or simulate it where it does not.",Francois de La Rochefoucauld,Love
When we are in love we seem to ourselves quite different from what we were before.,Blaise Pascal,Love
"I like not only to be loved, but also to be told I am loved.",George Eliot,Love
Love means not ever having to say you're sorry.,Erich Segal,Love
"When love is at its best, one loves so much that he cannot forget.",Helen Hunt Jackson,Love
All mankind love a lover.,Ralph Waldo Emerson,Love
"You don't want to love - your eternal and abnormal craving is to be loved. You aren't positive, you're negative. You absorb, absorb, as if you must fill yourself up with love, because you've got a shortage somewhere.",D. H. Lawrence,Love
"If thou must love me, let it be for naught except for love's sake only.",Elizabeth Barrett Browning,Love
"Who, being loved, is poor?",Oscar Wilde,Love
"The more one judges, the less one loves.",Honore de Balzac,Love
Love's greatest gift is its ability to make everything it touches sacred.,Barbara De Angelis,Love
"Love seeks one thing only: the good of the one loved. It leaves all the other secondary effects to take care of themselves. Love, therefore, is its own reward.",Thomas Merton,Love
"Nobody loves a woman because she is handsome or ugly, stupid or intelligent. We love because we love.",Honore de Balzac,Love
"Who loves, raves.",Lord Byron,Love
"I was born with an enormous need for affection, and a terrible need to give it.",Audrey Hepburn,Love
"I'm not saying that love always takes you to heaven. Your life can become a nightmare. But that said, it is worth taking the risk.",Paulo Coelho,Love
Love is the only sane and satisfactory answer to the problem of human existence.,Erich Fromm,Love
"I love that feeling of being in love, the effect of having butterflies when you wake up in the morning. That is special.",Jennifer Aniston,Love
"Love seeks one thing only: the good of the one loved. It leaves all the other secondary effects to take care of themselves. Love, therefore, is its own reward.",Thomas Merton,Love
Love him and let him love you. Do you think anything else under heaven really matters?,James Baldwin,Love
Love is energy of life.,Robert Browning,Love
We all need each other.,Leo Buscaglia,Love
Love has a tide!,Helen Hunt Jackson,Love
To witness two lovers is a spectacle for the gods.,Johann Wolfgang von Goethe,Love
All love is vanquished by a succeeding love.,Ovid,Love
Stand by your man. Give him two arms to cling to and something warm to come to.,Tammy Wynette,Love
"The god of love lives in a state of need. It is a need. It is an urge. It is a homeostatic imbalance. Like hunger and thirst, it's almost impossible to stamp out.",Plato,Love
Everything is clearer when you're in love.,John Lennon,Love
"Down on your knees, and thank heaven, fasting, for a good man's love.",Euripides,Love
Those who have never known the deep intimacy and the intense companionship of mutual love have missed the best thing that life has to give.,Bertrand Russell,Love
The only abnormality is the incapacity to love.,Anais Nin,Love
I was adored once too.,William Shakespeare,Love
Absence - that common cure of love.,Lord Byron,Love
To love is to act.,Victor Hugo,Love
A pair of powerful spectacles has sometimes sufficed to cure a person in love.,Friedrich Nietzsche,Love
"In the flush of love's light, we dare be brave. And suddenly we see that love costs all we are, and will ever be. Yet it is only love which sets us free.",Maya Angelou,Love
But love's a malady without a cure.,John Dryden,Love
At the center of non-violence stands the principle of love.,"Martin Luther King, Jr.",Love
"The fact is that love is of two kinds, one which commands, and one which obeys. The two are quite distinct, and the passion to which the one gives rise is not the passion of the other.",Honore de Balzac,Love
"My wife, my family, my friends - they've all taught me things about love and what that emotion really means. In a nutshell, loving someone is about giving, not receiving.",Nicholas Sparks,Love
Loved. You can't use it in the past tense. Death does not stop that love at all.,Ken Kesey,Love
Being in love is the only transcendent experience.,Armistead Maupin,Love
People happy in love have an air of intensity.,Stendhal,Love
The deep joy we take in the company of people with whom we have just recently fallen in love is undisguisable.,John Cheever,Love
How absurd and delicious it is to be in love with somebody younger than yourself. Everybody should try it.,Barbara Pym,Love
The highest function of love is that it makes the loved one a unique and irreplacable being.,Tom Robbins,Love
Darkness cannot drive out darkness; only light can do that. Hate cannot drive out hate; only love can do that.,"Martin Luther King, Jr.",Love
"When you arise in the morning, think of what a precious privilege it is to be alive - to breathe, to think, to enjoy, to love.",Marcus Aurelius,Love
"Love myself I do. Not everything, but I love the good as well as the bad. I love my crazy lifestyle, and I love my hard discipline. I love my freedom of speech and the way my eyes get dark when I'm tired. I love that I have learned to trust people with my heart, even if it will get broken. I am proud of everything that I am and will become.",Johnny Weir,Love
"If you do what you love, you'll never work a day in your life.",Marc Anthony,Love
"Never forget the three powerful resources you always have available to you: love, prayer, and forgiveness.","H. Jackson Brown, Jr.",Love
"Success is no accident. It is hard work, perseverance, learning, studying, sacrifice and most of all, love of what you are doing or learning to do.",Pele,Love
"Success is not the key to happiness. Happiness is the key to success. If you love what you are doing, you will be successful.",Albert Schweitzer,Love
"Love all, trust a few, do wrong to none.",William Shakespeare,Love
"Rather than love, than money, than fame, give me truth.",Henry David Thoreau,Love
"Your work is going to fill a large part of your life, and the only way to be truly satisfied is to do what you believe is great work. And the only way to do great work is to love what you do. If you haven't found it yet, keep looking. Don't settle. As with all matters of the heart, you'll know when you find it.",Steve Jobs,Love
Grief is the price we pay for love.,Queen Elizabeth II,Love
"There is a sacredness in tears. They are not the mark of weakness, but of power. They speak more eloquently than ten thousand tongues. They are the messengers of overwhelming grief, of deep contrition, and of unspeakable love.",Washington Irving,Love
I'm having fun. I'm being myself. I'm doing what I love. That's all that matters.,James Charles,Love
"Since love grows within you, so beauty grows. For love is the beauty of the soul.",Saint Augustine,Love
"Respect is what we owe; love, what we give.",Philip James Bailey,Love
It is easy to hate and it is difficult to love. This is how the whole scheme of things works. All good things are difficult to achieve; and bad things are very easy to get.,Confucius,Love
"There is only one happiness in this life, to love and be loved.",George Sand,Love
"Infuse your life with action. Don't wait for it to happen. Make it happen. Make your own future. Make your own hope. Make your own love. And whatever your beliefs, honor your creator, not by passively waiting for grace to come down from upon high, but by doing what you can to make grace happen... yourself, right now, right down here on Earth.",Bradley Whitford,Love
Life is a song - sing it. Life is a game - play it. Life is a challenge - meet it. Life is a dream - realize it. Life is a sacrifice - offer it. Life is love - enjoy it.,Sai Baba,Love
"If you love someone, set them free. If they come back they're yours; if they don't they never were.",Richard Bach,Love
"Love is all, it gives all, and it takes all.",Soren Kierkegaard,Love
Love is a serious mental disease.,Plato,Love
"Thousands have lived without love, not one without water.",W. H. Auden,Love
"True love doesn't happen right away; it's an ever-growing process. It develops after you've gone through many ups and downs, when you've suffered together, cried together, laughed together.",Ricardo Montalban,Love
"But I say to you, Love your enemies and pray for those who persecute you, so that you may be sons of your Father who is in heaven; for he makes his sun rise on the evil and on the good, and sends rain on the just and on the unjust.",Jesus Christ,Love
"Between men and women there is no friendship possible. There is passion, enmity, worship, love, but no friendship.",Oscar Wilde,Love
Let the beauty of what you love be what you do.,Rumi,Love
Love is a serious mental disease.,Plato,Love
"Happiness cannot be traveled to, owned, earned, worn or consumed. Happiness is the spiritual experience of living every minute with love, grace, and gratitude.",Denis Waitley,Love
"Respect is what we owe; love, what we give.",Philip James Bailey,Love
I love you the more in that I believe you had liked me for my own sake and for nothing else.,John Keats,Love
Be Impeccable With Your Word. Speak with integrity. Say only what you mean. Avoid using the word to speak against yourself or to gossip about others. Use the power of your word in the direction of truth and love.,Don Miguel Ruiz,Love
"If you love somebody, let them go, for if they return, they were always yours. And if they don't, they never were.",Khalil Gibran,Love
"Life is short and we have never too much time for gladdening the hearts of those who are travelling the dark journey with us. Oh be swift to love, make haste to be kind.",Henri Frederic Amiel,Love
Love is our true destiny. We do not find the meaning of life by ourselves alone - we find it with another.,Thomas Merton,Love
"Love recognizes no barriers. It jumps hurdles, leaps fences, penetrates walls to arrive at its destination full of hope.",Maya Angelou,Love
Things are beautiful if you love them.,Jean Anouilh,Love
"Did I offer peace today? Did I bring a smile to someone's face? Did I say words of healing? Did I let go of my anger and resentment? Did I forgive? Did I love? These are the real questions. I must trust that the little bit of love that I sow now will bear many fruits, here in this world and the life to come.",Henri Nouwen,Love
"It is not a lack of love, but a lack of friendship that makes unhappy marriages.",Friedrich Nietzsche,Love
I love deadlines. I like the whooshing sound they make as they fly by.,Douglas Adams,Love
Communism is not love. Communism is a hammer which we use to crush the enemy.,Mao Zedong,Love
Work like you don't need the money. Love like you've never been hurt. Dance like nobody's watching.,Satchel Paige,Love
"There is pleasure in the pathless woods, there is rapture in the lonely shore, there is society where none intrudes, by the deep sea, and music in its roar; I love not Man the less, but Nature more.",Lord Byron,Love
"Unable are the loved to die, for love is immortality.",Emily Dickinson,Love
Enjoy the journey and try to get better every day. And don't lose the passion and the love for what you do.,Nadia Comaneci,Love
"When the people you love are gone, you're alone.",Keanu Reeves,Love
"Behold, my friends, the spring is come; the earth has gladly received the embraces of the sun, and we shall soon see the results of their love!",Sitting Bull,Love
The good life is one inspired by love and guided by knowledge.,Bertrand Russell,Love
"Love and work... work and love, that's all there is.",Sigmund Freud,Love
"Just don't give up trying to do what you really want to do. Where there is love and inspiration, I don't think you can go wrong.",Ella Fitzgerald,Love
There is no sincerer love than the love of food.,George Bernard Shaw,Love
"God proved His love on the Cross. When Christ hung, and bled, and died, it was God saying to the world, 'I love you.'",Billy Graham,Love
"I love those who can smile in trouble, who can gather strength from distress, and grow brave by reflection. 'Tis the business of little minds to shrink, but they whose heart is firm, and whose conscience approves their conduct, will pursue their principles unto death.",Leonardo da Vinci,Love
I think the confidence that I have right now is something that was created by the fans who love me.,G-Dragon,Love
True love is selfless. It is prepared to sacrifice.,Sadhu Vaswani,Love
"The foundation stones for a balanced success are honesty, character, integrity, faith, love and loyalty.",Zig Ziglar,Love
"I will love the light for it shows me the way, yet I will endure the darkness because it shows me the stars.",Og Mandino,Love
Don't forget to tell yourself positive things daily! You must love yourself internally to glow externally.,Hannah Bronfman,Love
"Don't aim for success if you want it; just do what you love and believe in, and it will come naturally.",David Frost,Love
"It's always great to engage with people. You never know who you can make an effect on. And I love interacting with the fans, hearing what they have to say and joking around with them. Anytime I can reach out online and give encouragement, motivate people, be a better citizen, that's what it's all about, man.",Antonio Brown,Love
I want to thank all our fans all around the world for their unconditional love and support. It really means a lot to me.,Jennie,Love
"A successful marriage requires falling in love many times, always with the same person.",Mignon McLaughlin,Love
"When love and skill work together, expect a masterpiece.",John Ruskin,Love
"Where love rules, there is no will to power; and where power predominates, there love is lacking. The one is the shadow of the other.",Carl Jung,Love
"A man can be himself only so long as he is alone, and if he does not love solitude, he will not love freedom, for it is only when he is alone that he is really free.",Arthur Schopenhauer,Love
It is impossible to love and to be wise.,Francis Bacon,Love
"Lord, make me an instrument of thy peace. Where there is hatred, let me sow love.",Francis of Assisi,Love
"I'm just so happy, and I'm grateful for my fans. I just hope I keep doing work that they love.",Jennifer Aniston,Love
"True love is not a strong, fiery, impetuous passion. It is, on the contrary, an element calm and deep. It looks beyond mere externals, and is attracted by qualities alone. It is wise and discriminating, and its devotion is real and abiding.",Ellen G. White,Love
"Black as the devil, hot as hell, pure as an angel, sweet as love.",Charles Maurice de Talleyrand,Love
"To keep your marriage brimming, With love in the loving cup, Whenever you're wrong, admit it; Whenever you're right, shut up.",Ogden Nash,Love
I love being in a city with great weather.,Sean McVay,Love
"Let's practice motivation and love, not discrimination and hate.",Zendaya,Love
"Love is never defeated, and I could add, the history of Ireland proves it.",Pope John Paul II,Love
"Let us dream of tomorrow where we can truly love from the soul, and know love as the ultimate truth at the heart of all creation.",Michael Jackson,Love
"A good teacher can inspire hope, ignite the imagination, and instill a love of learning.",Brad Henry,Love
"Be happy with being you. Love your flaws. Own your quirks. And know that you are just as perfect as anyone else, exactly as you are.",Ariana Grande,Love
"I have found that if you love life, life will love you back.",Arthur Rubinstein,Love
"Surround yourself with good people who encourage and love you. There are always ups and downs, no matter how successful you are.",Liana Liberato,Love
"I love a man with a great sense of humor and who is intelligent - a man who has a great smile. He has to make me laugh. I like a man who is very ambitious and driven and who has a good heart and makes me feel safe. I like a man who is very strong and independent and confident - that is very sexy - but at the same time, he's very kind to people.",Nicole Scherzinger,Love
"You're not looking for perfection in your partner. Perfection is all about the ego. With soulmate love, you know that true love is what happens when disappointment sets in - and you're willing to deal maturely with these disappointments.",Karen Salmansohn,Love
"When you fish for love, bait with your heart, not your brain.",Mark Twain,Love
"A grateful heart is a beginning of greatness. It is an expression of humility. It is a foundation for the development of such virtues as prayer, faith, courage, contentment, happiness, love, and well-being.",James E. Faust,Love
"One cannot think well, love well, sleep well, if one has not dined well.",Virginia Woolf,Love
"There is no lonelier man in death, except the suicide, than that man who has lived many years with a good wife and then outlived her. If two people love each other there can be no happy end to it.",Ernest Hemingway,Love
"To all the other dreamers out there, don't ever stop or let the world's negativity disenchant you or your spirit. If you surround yourself with love and the right people, anything is possible.",Adam Green,Love
I am blessed to be surrounded by the people I love. I thank them for their patience and grace.,Matt Lauer,Love
