quotes,authors,categories
"Being deeply loved by someone gives you strength, while loving someone deeply gives you courage.",Lao Tzu,Love
"We're born alone, we live alone, we die alone. Only through our love and friendship can we create the illusion for the moment that we're not alone.",Orson Welles,Love
Love takes off masks that we fear we cannot live without and know we cannot live within.,James Baldwin,Love
'Tis better to have loved and lost than never to have loved at all.,Alfred Lord Tennyson,Love
You can't blame gravity for falling in love.,Albert Einstein,Love
Love is composed of a single soul inhabiting two bodies.,Aristotle,Love
"Love is friendship that has caught fire. It is quiet understanding, mutual confidence, sharing and forgiving. It is loyalty through good and bad times. It settles for less than perfection and makes allowances for human weaknesses.",Ann Landers,Love
"Time is too slow for those who wait, too swift for those who fear, too long for those who grieve, too short for those who rejoice, but for those who love, time is eternity.",Henry Van Dyke,Love
"True love is like ghosts, which everyone talks about and few have seen.",Francois de La Rochefoucauld,Love
"Let us always meet each other with smile, for the smile is the beginning of love.",Mother Teresa,Love
"You can search throughout the entire universe for someone who is more deserving of your love and affection than you are yourself, and that person is not to be found anywhere. You yourself, as much as anybody in the entire universe deserve your love and affection.",Buddha,Love
"Love and compassion are necessities, not luxuries. Without them humanity cannot survive.",Dalai Lama,Love
What we have once enjoyed we can never lose. All that we love deeply becomes a part of us.,Helen Keller,Love
Where there is love there is life.,Mahatma Gandhi,Love
"He who loves with purity considers not the gift of the lover, but the love of the giver.",Thomas a Kempis,Love
"To love for the sake of being loved is human, but to love for the sake of loving is angelic.",Alphonse de Lamartine,Love
Love is a friendship set to music.,Joseph Campbell,Love
Passion is momentary; love is enduring.,John Wooden,Love
"True love is eternal, infinite, and always like itself. It is equal and pure, without violent demonstrations: it is seen with white hairs and is always young in the heart.",Honore de Balzac,Love
"The world is not comprehensible, but it is embraceable: through the embracing of one of its beings.",Martin Buber,Love
Any time not spent on love is wasted.,Torquato Tasso,Love
Love is the power to see similarity in the dissimilar.,Theodor W. Adorno,Love
The richest love is that which submits to the arbitration of time.,Lawrence Durrell,Love
One is loved because one is loved. No reason is needed for loving.,Paulo Coelho,Love
I feel that there is nothing more truly artistic than to love people.,Vincent Van Gogh,Love
To love and be loved is to feel the sun from both sides.,David Viscott,Love
The love we give away is the only love we keep.,Elbert Hubbard,Love
Love yourself first and everything else falls into line. You really have to love yourself to get anything done in this world.,Lucille Ball,Love
Life is the flower for which love is the honey.,Victor Hugo,Love
For small creatures such as we the vastness is bearable only through love.,Carl Sagan,Love
The best thing to hold onto in life is each other.,Audrey Hepburn,Love
Love doesn't make the world go 'round. Love is what makes the ride worthwhile.,Franklin P. Jones,Love
"Love does not consist in gazing at each other, but in looking outward together in the same direction.",Antoine de Saint-Exupery,Love
Do you have to have a reason for loving?,Brigitte Bardot,Love
Love isn't something you find. Love is something that finds you.,Loretta Young,Love
"We waste time looking for the perfect lover, instead of creating the perfect love.",Tom Robbins,Love
Immature love says: 'I love you because I need you.' Mature love says 'I need you because I love you.',Erich Fromm,Love
"Once the realization is accepted that even between the closest human beings infinite distances continue, a wonderful living side by side can grow, if they succeed in loving the distance between them which makes it possible for each to see the other whole against the sky.",Rainer Maria Rilke,Love
Love is supreme and unconditional; like is nice but limited.,Duke Ellington,Love
We need 4 hugs a day for survival. We need 8 hugs a day for maintenance. We need 12 hugs a day for growth.,Virginia Satir,Love
Only do what your heart tells you.,Princess Diana,Love
"Love has no age, no limit; and no death.",John Galsworthy,Love
Faith makes all things possible... love makes all things easy.,Dwight L. Moody,Love
We loved with a love that was more than love.,Edgar Allan Poe,Love
Love is an irresistible desire to be irresistibly desired.,Robert Frost,Love
"Love is that condition in which the happiness of another person is essential to your own... Jealousy is a disease, love is a healthy condition. The immature mind often mistakes one for the other, or assumes that the greater the love, the greater the jealousy.",Robert A. Heinlein,Love
Love cures people - both the ones who give it and the ones who receive it.,Karl A. Menninger,Love
We love because it's the only true adventure.,Nikki Giovanni,Love
"Someday, after mastering the winds, the waves, the tides and gravity, we shall harness for God the energies of love, and then, for a second time in the history of the world, man will have discovered fire.",Pierre Teilhard de Chardin,Love
Love is a canvas furnished by nature and embroidered by imagination.,Voltaire,Love
"Friends can help each other. A true friend is someone who lets you have total freedom to be yourself - and especially to feel. Or, not feel. Whatever you happen to be feeling at the moment is fine with them. That's what real love amounts to - letting a person be what he really is.",Jim Morrison,Love
Love is like war: easy to begin but very hard to stop.,H. L. Mencken,Love
Love is the only reality and it is not a mere sentiment. It is the ultimate truth that lies at the heart of creation.,Rabindranath Tagore,Love
A loving heart is the truest wisdom.,Charles Dickens,Love
"A flower cannot blossom without sunshine, and man cannot live without love.",Max Muller,Love
"Love is always bestowed as a gift - freely, willingly and without expectation. We don't love to be loved; we love to love.",Leo Buscaglia,Love
We can only learn to love by loving.,Iris Murdoch,Love
The most powerful weapon on earth is the human soul on fire.,Ferdinand Foch,Love
Love takes up where knowledge leaves off.,Thomas Aquinas,Love
If you do not love me I shall not be loved If I do not love you I shall not love.,Samuel Beckett,Love
"Don't threaten me with love, baby. Let's just go walking in the rain.",Billie Holiday,Love
"Love is an act of endless forgiveness, a tender look which becomes a habit.",Peter Ustinov,Love
Fortune and love favor the brave.,Ovid,Love
Do you have to have a reason for loving?,Brigitte Bardot,Love
I believe that imagination is stronger than knowledge. That myth is more potent than history. That dreams are more powerful than facts. That hope always triumphs over experience. That laughter is the only cure for grief. And I believe that love is stronger than death.,Robert Fulghum,Love
We love because it's the only true adventure.,Nikki Giovanni,Love
Love is space and time measured by the heart.,Marcel Proust,Love
A kiss is a lovely trick designed by nature to stop speech when words become superfluous.,Ingrid Bergman,Love
Love is being stupid together.,Paul Valery,Love
People who throw kisses are hopelessly lazy.,Bob Hope,Love
"Love is the crowning grace of humanity, the holiest right of the soul, the golden link which binds us to duty and truth, the redeeming principle that chiefly reconciles the heart to life, and is prophetic of eternal good.",Petrarch,Love
"Whatever our souls are made of, his and mine are the same.",Emily Bronte,Love
Love is the wisdom of the fool and the folly of the wise.,Samuel Johnson,Love
"You can give without loving, but you can never love without giving.",Robert Louis Stevenson,Love
Be of love a little more careful than of anything.,e. e. cummings,Love
Love is the greatest refreshment in life.,Pablo Picasso,Love
Love can sometimes be magic. But magic can sometimes... just be an illusion.,Javan,Love
"In our life there is a single color, as on an artist's palette, which provides the meaning of life and art. It is the color of love.",Marc Chagall,Love
People protect what they love.,Jacques Yves Cousteau,Love
"Absence sharpens love, presence strengthens it.",Thomas Fuller,Love
Love has reasons which reason cannot understand.,Blaise Pascal,Love
Love makes your soul crawl out from its hiding place.,Zora Neale Hurston,Love
Love is metaphysical gravity.,R. Buckminster Fuller,Love
Affection is responsible for nine-tenths of whatever solid and durable happiness there is in our lives.,C. S. Lewis,Love
Love in its essence is spiritual fire.,Lucius Annaeus Seneca,Love
"Love is like an hourglass, with the heart filling up as the brain empties.",Jules Renard,Love
"Life is like an onion. You peel it off one layer at a time, and sometimes you weep.",Carl Sandburg,Love
Love knows not distance; it hath no continent; its eyes are for the stars.,Gilbert Parker,Love
Friendship often ends in love; but love in friendship - never.,Charles Caleb Colton,Love
Love is the attempt to form a friendship inspired by beauty.,Marcus Tullius Cicero,Love
A man is already halfway in love with any woman who listens to him.,Brendan Behan,Love
Love is a game that two can play and both win.,Eva Gabor,Love
The giving of love is an education in itself.,Eleanor Roosevelt,Love
"With our love, we could save the world.",George Harrison,Love
The art of love is largely the art of persistence.,Albert Ellis,Love
A part of kindness consists in loving people more than they deserve.,Joseph Joubert,Love
"Though lovers be lost, love shall not.",Dylan Thomas,Love
The way to love anything is to realize that it may be lost.,Gilbert K. Chesterton,Love
"Choose your love, Love your choice.",Thomas S. Monson,Love
"There's no bad consequence to loving fully, with all your heart. You always gain by giving love.",Reese Witherspoon,Love
Love is the great miracle cure. Loving ourselves works miracles in our lives.,Louise L. Hay,Love
Love is the ultimate expression of the will to live.,Tom Wolfe,Love
A gentle heart is tied with an easy thread.,George Herbert,Love
"Love is but the discovery of ourselves in others, and the delight in the recognition.",Alexander Smith,Love
There is no surprise more magical than the surprise of being loved: It is God's finger on man's shoulder.,Charles Morgan,Love
"I can live without money, but I cannot live without love.",Judy Garland,Love
"Love is not only something you feel, it is something you do.",David Wilkerson,Love
"When love is not madness, it is not love.",Pedro Calderon de la Barca,Love
A very small degree of hope is sufficient to cause the birth of love.,Stendhal,Love
The love we have in our youth is superficial compared to the love that an old man has for his old wife.,Will Durant,Love
"Follow love and it will flee, flee love and it will follow thee.",John Gay,Love
"We are all born for love. It is the principle of existence, and its only end.",Benjamin Disraeli,Love
"No, there's nothing half so sweet in life as love's young dream.",Thomas Moore,Love
"When you're in love you never really know whether your elation comes from the qualities of the one you love, or if it attributes them to her; whether the light which surrounds her like a halo comes from you, from her, or from the meeting of your sparks.",Natalie Clifford Barney,Love
To love is to admire with the heart; to admire is to love with the mind.,Theophile Gautier,Love
"If you can learn to love yourself and all the flaws, you can love other people so much better. And that makes you so happy.",Kristin Chenoweth,Love
Who so loves believes the impossible.,Elizabeth Barrett Browning,Love
Love is a mutual self-giving which ends in self-recovery.,Fulton J. Sheen,Love
The love of liberty is the love of others; the love of power is the love of ourselves.,William Hazlitt,Love
What the world really needs is more love and less paper work.,Pearl Bailey,Love
What the world really needs is more love and less paper work.,Pearl Bailey,Love
Our first and last love is self-love.,Christian Nestell Bovee,Love
This love is silent.,T. S. Eliot,Love
"I can live without money, but I cannot live without love.",Judy Garland,Love
"There's no bad consequence to loving fully, with all your heart. You always gain by giving love.",Reese Witherspoon,Love
It is difficult to know at what moment love begins; it is less difficult to know that it has begun.,Henry Wadsworth Longfellow,Love
"Gestures, in love, are incomparably more attractive, effective and valuable than words.",Francois Rabelais,Love
"All my life, my heart has yearned for a thing I cannot name.",Andre Breton,Love
"There is always something left to love. And if you ain't learned that, you ain't learned nothing.",Lorraine Hansberry,Love
Only divine love bestows the keys of knowledge.,Arthur Rimbaud,Love
The best proof of love is trust.,Joyce Brothers,Love
"Love is not only something you feel, it is something you do.",David Wilkerson,Love
"Love, having no geography, knows no boundaries.",Truman Capote,Love
"True love comes quietly, without banners or flashing lights. If you hear bells, get your ears checked.",Erich Segal,Love
Love is what you've been through with somebody.,James Thurber,Love
I don't know that love changes. People change. Circumstances change.,Nicholas Sparks,Love
"It is love, not reason, that is stronger than death.",Thomas Mann,Love
"It is sad not to love, but it is much sadder not to be able to love.",Miguel de Unamuno,Love
Stolen kisses are always sweetest.,Leigh Hunt,Love
"Come live in my heart, and pay no rent.",Samuel Lover,Love
To love is to admire with the heart; to admire is to love with the mind.,Theophile Gautier,Love
"You learn to speak by speaking, to study by studying, to run by running, to work by working; in just the same way, you learn to love by loving.",Anatole France,Love
"Let no one who loves be unhappy, even love unreturned has its rainbow.",James M. Barrie,Love
"When you love a man, he becomes more than a body. His physical limbs expand, and his outline recedes, vanishes. He is rich and sweet and right. He is part of the world, the atmosphere, the blue sky and the blue water.",Gwendolyn Brooks,Love
Sometimes it's hard to be a woman giving all your love to just one man.,Tammy Wynette,Love
Who would give a law to lovers? Love is unto itself a higher law.,Boethius,Love
"Love is the hardest habit to break, and the most difficult to satisfy.",Drew Barrymore,Love
"Woe to the man whose heart has not learned while young to hope, to love - and to put its trust in life.",Joseph Conrad,Love
The truth is that there is only one terminal dignity - love. And the story of a love is not important - what is important is that one is capable of love. It is perhaps the only glimpse we are permitted of eternity.,Helen Hayes,Love
"I think it is all a matter of love: the more you love a memory, the stronger and stranger it is.",Vladimir Nabokov,Love
Love is blind.,Geoffrey Chaucer,Love
"The truth is that love smashes into your life like an ice floe, and even if your heart is built like the Titanic you go down.",Jeanette Winterson,Love
Self-love is the source of all our other loves.,Pierre Corneille,Love
People think love is an emotion. Love is good sense.,Ken Kesey,Love
"A man reserves his true and deepest love not for the species of woman in whose company he finds himself electrified and enkindled, but for that one in whose company he may feel tenderly drowsy.",George Jean Nathan,Love
Sometimes it's a form of love just to talk to somebody that you have nothing in common with and still be fascinated by their presence.,David Byrne,Love
Love is the magician that pulls man out of his own hat.,Ben Hecht,Love
Love is suffering. One side always loves more.,Catherine Deneuve,Love
There are never enough I Love You's.,Lenny Bruce,Love
Ultimately love is everything.,M. Scott Peck,Love
"The cure for all the ills and wrongs, the cares, the sorrows, and the crimes of humanity, all lie in the one word 'love'. It is the divine vitality that everywhere produces and restores life.",Lydia M. Child,Love
Love will draw an elephant through a key-hole.,Samuel Richardson,Love
There isn't any formula or method. You learn to love by loving - by paying attention and doing what one thereby discovers has to be done.,Aldous Huxley,Love
There is no person that love cannot heal; there is no soul that love cannot save.,Carlos Santana,Love
It is easier to love humanity as a whole than to love one's neighbor.,Eric Hoffer,Love
Love is never wrong.,Melissa Etheridge,Love
"Your words are my food, your breath my wine. You are everything to me.",Sarah Bernhardt,Love
Great thoughts come from the heart.,Luc de Clapiers,Love
You will find as you look back upon your life that the moments when you have truly lived are the moments when you have done things in the spirit of love.,Henry Drummond,Love
"Suffering passes, while love is eternal. That's a gift that you have received from God. Don't waste it.",Laura Ingalls Wilder,Love
"Love is a springtime plant that perfumes everything with its hope, even the ruins to which it clings.",Gustave Flaubert,Love
The eyes those silent tongues of love.,Miguel de Cervantes,Love
You don't have to go looking for love when it's where you come from.,Werner Erhard,Love
Words may be false and full of art; Sighs are the natural language of the heart.,Thomas Shadwell,Love
We don't believe in rheumatism and true love until after the first attack.,Marie von Ebner-Eschenbach,Love
Love is always being given where it is not required.,E. M. Forster,Love
"Love is the word used to label the sexual excitement of the young, the habituation of the middle-aged, and the mutual dependence of the old.",John Ciardi,Love
"I am happier when I love than when I am loved. I adore my husband, my son, my grandchildren, my mother, my dog, and frankly, I don't know if they even like me. But who cares? Loving them is my joy.",Isabel Allende,Love
There is only one real deprivation... and that is not to be able to give one's gifts to those one loves most.,May Sarton,Love
Love is stronger than justice.,Sting,Love
The fate of love is that it always seems too little or too much.,Amelia Barr,Love
"Love has no errors, for all errors are the want for love.",William Law,Love
Each moment of a happy lover's hour is worth an age of dull and common life.,Aphra Behn,Love
Love without conversation is impossible.,Mortimer Adler,Love
"For above all things Love means sweetness, and truth, and measure; yea, loyalty to the loved one and to your word. And because of this I dare not meddle with so high a matter.",Marie de France,Love
"He who loves, flies, runs, and rejoices; he is free and nothing holds him back.",Henri Matisse,Love
Love is love's reward.,John Dryden,Love
"When we lose one we love, our bitterest tears are called forth by the memory of hours when we loved not enough.",Maurice Maeterlinck,Love
Bitterness imprisons life; love releases it.,Harry Emerson Fosdick,Love
Loving others always costs us something and requires effort. And you have to decide to do it on purpose. You can't wait for a feeling to motivate you.,Joyce Meyer,Love
Falling in love consists merely in uncorking the imagination and bottling the common sense.,Helen Rowland,Love
Love is an energy which exists of itself. It is its own value.,Thornton Wilder,Love
Love is a great beautifier.,Louisa May Alcott,Love
"In a full heart there is room for everything, and in an empty heart there is room for nothing.",Antonio Porchia,Love
The sweetest of all sounds is that of the voice of the woman we love.,Jean de la Bruyere,Love
Love is that splendid triggering of human vitality the supreme activity which nature affords anyone for going out of himself toward someone else.,Jose Ortega y Gasset,Love
I believe in the compelling power of love. I do not understand it. I believe it to be the most fragrant blossom of all this thorny existence.,Theodore Dreiser,Love
All love shifts and changes. I don't know if you can be wholeheartedly in love all the time.,Julie Andrews,Love
To enlarge or illustrate this power and effect of love is to set a candle in the sun.,Robert Burton,Love
The crime of loving is forgetting.,Maurice Chevalier,Love
"We love but once, for once only are we perfectly equipped for loving.",Cyril Connolly,Love
Familiar acts are beautiful through love.,Percy Bysshe Shelley,Love
Touch seems to be as essential as sunlight.,Diane Ackerman,Love
There is no limit to the power of loving.,John Morton,Love
"We may give without loving, but we cannot love without giving.",Bernard Meltzer,Love
Spread love everywhere you go. Let no one ever come to you without leaving happier.,Mother Teresa,Love
"We can't command our love, but we can our actions.",Arthur Conan Doyle,Love
Love is the greatest gift that God has given us. It's free.,Taraji P. Henson,Love
"I long for the raised voice, the howl of rage or love.",Leslie Fiedler,Love
"Sympathy constitutes friendship; but in love there is a sort of antipathy, or opposing passion. Each strives to be the other, and both together make up one whole.",Samuel Taylor Coleridge,Love
What force is more potent than love?,Igor Stravinsky,Love
"It's useless to hold a person to anything he says while he's in love, drunk, or running for office.",Shirley MacLaine,Love
"Love is much nicer to be in than an automobile accident, a tight girdle, a higher tax bracket or a holding pattern over Philadelphia.",Judith Viorst,Love
"The sweetest noise on earth, a woman's tongue; A string which hath no discord.",Bryan Procter,Love
"Oh, love will make a dog howl in rhyme.",Francis Beaumont,Love
To love oneself is the beginning of a lifelong romance.,Oscar Wilde,Love
Love dies only when growth stops.,Pearl S. Buck,Love
There is room in the smallest cottage for a happy loving pair.,Friedrich Schiller,Love
"Looking back, I have this to regret, that too often when I loved, I did not say so.",Ray Stannard Baker,Love
Life without love is like a tree without blossoms or fruit.,Khalil Gibran,Love
Love comes unseen; we only see it go.,Henry Austin Dobson,Love
"When love is at its best, one loves so much that he cannot forget.",Helen Hunt Jackson,Love
Selfishness is one of the qualities apt to inspire love.,Nathaniel Hawthorne,Love
The course of true love never did run smooth.,William Shakespeare,Love
Love means to commit yourself without guarantee.,Anne Campbell,Love
"If you've got love you've got life, if you can love you can live.",Kim Casali,Love
"A new command I give you: Love one another. As I have loved you, so you must love one another.",Jesus Christ,Love
"To fear love is to fear life, and those who fear life are already three parts dead.",Bertrand Russell,Love
It is impossible to repent of love. The sin of love does not exist.,Muriel Spark,Love
"I have found the paradox, that if you love until it hurts, there can be no more hurt, only more love.",Mother Teresa,Love
One must not trifle with love.,Alfred de Musset,Love
All love is lost but upon God alone.,William Dunbar,Love
Love is a better teacher than duty.,Albert Einstein,Love
Love is the flower you've got to let grow.,John Lennon,Love
The degree of loving is measured by the degree of giving.,Edwin Louis Cole,Love
At the touch of love everyone becomes a poet.,Plato,Love
"We love life, not because we are used to living but because we are used to loving.",Friedrich Nietzsche,Love
Kindness in words creates confidence. Kindness in thinking creates profoundness. Kindness in giving creates love.,Lao Tzu,Love
There is no remedy for love but to love more.,Henry David Thoreau,Love
"Love does not begin and end the way we seem to think it does. Love is a battle, love is a war; love is a growing up.",James Baldwin,Love
"If you want to be loved, be lovable.",Ovid,Love
Love does not dominate; it cultivates.,Johann Wolfgang von Goethe,Love
"The greatest happiness of life is the conviction that we are loved; loved for ourselves, or rather, loved in spite of ourselves.",Victor Hugo,Love
"If your heart is a volcano, how shall you expect flowers to bloom?",Khalil Gibran,Love
"If it is your time, love will track you down like a cruise missile.",Lynda Barry,Love
"Man must evolve for all human conflict a method which rejects revenge, aggression and retaliation. The foundation of such a method is love.","Martin Luther King, Jr.",Love
Love is the poetry of the senses.,Honore de Balzac,Love
Love is a smoke made with the fume of sighs.,William Shakespeare,Love
"True love cannot be found where it does not exist, nor can it be denied where it does.",Torquato Tasso,Love
"As the Father has loved me, so have I loved you.",Jesus Christ,Love
"Love is like a beautiful flower which I may not touch, but whose fragrance makes the garden a place of delight just the same.",Helen Keller,Love
Love is when the other person's happiness is more important than your own.,"H. Jackson Brown, Jr.",Love
The way to know life is to love many things.,Vincent Van Gogh,Love
First love is only a little foolishness and a lot of curiosity.,George Bernard Shaw,Love
"Love is a force more formidable than any other. It is invisible - it cannot be seen or measured, yet it is powerful enough to transform you in a moment, and offer you more joy than any material possession could.",Barbara De Angelis,Love
"If equal affection cannot be, let the more loving be me.",W. H. Auden,Love
"Love consists in this, that two solitudes protect and touch and greet each other.",Rainer Maria Rilke,Love
"I like not only to be loved, but also to be told I am loved.",George Eliot,Love
