quotes,authors,categories
"An experienced reader uses the poem as an agent of inquiry. This makes poetry very exciting, unstable, and interactive.",John Barton,Poetry
"It's after dark that I feel most inspired, I'm a nocturnal creature. I'll write poetry or streams of consciousness, play instruments, or teach myself to DJ by doing a silent solo set.",Arlo Parks,Poetry
"In fact a lot of them I think are absolute baloney. Those Charles Olsens and people like that. At first I was interested in seeing what they were up to, what they were doing, why they were doing it. They never moved me in the way that one is moved by true poetry.",Norman MacCaig,Poetry
Poetry is the key to the hieroglyphics of nature.,David Hare,Poetry
"Ted Hughes is dead. That's a fact, OK. Then there's something called the poetry of Ted Hughes. The poetry of Ted Hughes is more real, very soon, than the myth that Ted Hughes existed - because that can't be proven.",Derek Walcott,Poetry
"Around 10 years old I started being into church and being around the church. I started doing poetry - I was doing all clean poetry, totally clean.",Cupcakke,Poetry
"The office of poetry is not to make us think accurately, but feel truly.",Frederick William Robertson,Poetry
I think the best American poetry is the poetry that utilizes the resources of poetry rather than exploits the defects or triumphs of the poet's personality.,Mark Strand,Poetry
The quietest poetry can be an explosion of joy.,James Broughton,Poetry
"I have been writing poetry ever since I was in high school. My poetry mainly concerned the theme of love. And that, of course, is an endless subject.",Robert Indiana,Poetry
"He passes from lyric to epic poetry in order to speak about the world and the torment in the world through man, rationally and emotionally. The poet then becomes a danger.",Salvatore Quasimodo,Poetry
"I am fascinated by the engineering. The science of constructing and understanding why it stands. And I am drawn by the madness, the beauty, the theatricality, the poetry and soul of the wire. And you cannot be a wire-walker without mingling those two ways of seeing life.",Philippe Petit,Poetry
I think that it's more likely that in my 60s and 70s I will be writing poetry rather than fiction.,Robert Morgan,Poetry
"Perhaps no person can be a poet, or even enjoy poetry, without a certain unsoundness of mind.",Thomas Babington Macaulay,Poetry
"Theater is far superior to film in poetry, in abstract poetry.",Julie Taymor,Poetry
Theater and poetry were what helped people stay alive and want to go on living.,Vanessa Redgrave,Poetry
"I don't like poetry that just slaps violent words on a canvas, as it were.",Anne Stevenson,Poetry
"Distinctly American poetry is usually written in the context of one's geographic landscape, sometimes out of one's cultural myths, and often with reference to gender and race or ethnic origins.",Diane Wakoski,Poetry
"Frankly, writing poetry for children is plain old fun, and I consider myself blessed to have such a delightful career.",Jack Prelutsky,Poetry
"Local images have one kind of reality. 'U.S. 1' will, I hope, have that kind and another, too. Poetry can extend the document.",Muriel Rukeyser,Poetry
"A poem in form still has to have voice, gesture, a sense of discovery, a metaphoric connection, as any poetry does.",Robert Morgan,Poetry
"Poetry fills clubs, halls and venues. Poets and poems can talk to the deepest feelings and to the silliest. It can be like stand-up or rock music. It can be intimate, it can be pubic.",Michael Rosen,Poetry
"For while the subjects of poetry are few and recurrent, the moods of man are infinitely various and unstable. It is the same in all arts.",John Drinkwater,Poetry
"Poetry, being supremely useless, by its very existence represents a protest against the so-called 'real world' of busy-ness and moneymaking, so we must embrace, salute and support our poets.",Tom Hodgkinson,Poetry
"I always liked the magic of poetry but now I'm just starting to see behind the curtain of even the best poets, how they've used, tried and tested craft to create the illusion. Wonderful feeling of exhilaration to finally be there.",David Knopfler,Poetry
"My next project is to get back to that. Actually, to learn how to write poetry. I'm not kidding.",Harry Mathews,Poetry
"There's a fierce practicality and empiricism which the whole imaginative, lyrical aspect of poetry comes from.",David Whyte,Poetry
"It's a common notion that if you like Tagore, then he must have had an influence on your life. While I like Tagore's poetry and his thoughts, he doesn't influence my work.",Gulzar,Poetry
"But I am not political in the current events sense, and I have never wanted anyone to read my poetry that way.",Diane Wakoski,Poetry
"And yet, in a culture like ours, which is given to material comforts, and addicted to forms of entertainment that offer immediate gratification, it is surprising that so much poetry is written.",Mark Strand,Poetry
"In high school, my English teacher Celeste McMenamin introduced me to the great novels and Shakespeare and taught me how to write. Essays, poetry, critical analysis. Writing is a skill that was painful then but a love of mine now.",Aaron Lazar,Poetry
The young people have MTV and rock and roll. Why would they go to read poetry? Poetry belongs to the Stone Age. It awakens in us perceptions that go back to those times.,Robert Morgan,Poetry
It's not easy to define poetry.,Bob Dylan,Poetry
"As to London we must console ourselves with the thought that if life outside is less poetic than it was in the days of old, inwardly its poetry is much deeper.",Goldwin Smith,Poetry
My old teacher's definition of poetry is an attempt to understand.,Thom Gunn,Poetry
Poetry is what Milton saw when he went blind.,Don Marquis,Poetry
"The musician - if he be a good one - finds his own perception prompted by the poet's perception, and he translates the expression of that perception from the terms of poetry into the terms of music.",John Drinkwater,Poetry
"I was influenced by surrealist poetry and painting as were thousands of other people, and it seems to me to have become a part of the way I write, but it's not.",Kenneth Koch,Poetry
"When I rap, I get to express myself in a way where putting words together is like poetry, and sometimes it's better to talk in certain expressions than sing, you know? So I love, I love to rhyme when I want to express certain things.",Wyclef Jean,Poetry
It is true that short forms of poetry have been cultivated in the Far East more than in modern Europe; but in all European literature short forms of poetry are to be found - indeed quite as short as anything in Japanese.,Lafcadio Hearn,Poetry
I think poetry has lost an awful lot of its muscle because nobody knows any. Nobody has to memorize poetry.,Peter Davison,Poetry
"One of my greatest joys is poetry. I read it almost every day, and I've even taken a stab at writing some of my own. A poem I wrote for my mother when she was dying really helped me get through that hard time.",Maria Shriver,Poetry
"I have had much to learn from Sweden's poetry and, more especially, from her lyrics of the last generation.",Knut Hamsun,Poetry
"I think that concrete poetry seems to have, as far as I can see, come to a kind of a dead end. It doesn't seem to be going any further than it went in its high period of about five or six years ago.",James Laughlin,Poetry
"I always wrote poetry and stuff like that, so putting songs together wasn't that spectacular.",Amy Winehouse,Poetry
"One of the most powerful devices of poetry is the use of distortions. You can go from talking about the way a minute passes to the way a century passes, or a lifetime.",Robert Morgan,Poetry
"I knew what book we had to write, it was clear in my head; it was journals and poetry. So I passed on their offer. I told my agent this is our vision, and no one's done it this way.",Kenny Loggins,Poetry
I love poetry and I've kept everything I've written.,Neil Warnock,Poetry
One difference between poetry and lyrics is that lyrics sort of fade into the background. They fade on the page and live on the stage when set to music.,Stephen Sondheim,Poetry
It is certain that at certain times talent entirely overcomes thought or poetry.,John Singer Sargent,Poetry
"I write all the time - I write poetry, I love to write.",Colin Quinn,Poetry
"When I was writing pretty poor poetry, this girl with midnight black hair told me to go on.",Carl Sandburg,Poetry
And inasmuch as the bridge is a symbol of all such poetry as I am interested in writing it is my present fancy that a year from now I'll be more contented working in an office than ever before.,Hart Crane,Poetry
"Poetry should be able to reach everybody, and it should be able to appeal to all levels of understanding.",Peter Davison,Poetry
"In poetry, everything can be faked but the intensity of utterance.",Seamus Heaney,Poetry
How does one happen to write a poem: where does it come from? That is the question asked by the psychologists or the geneticists of poetry.,Allen Tate,Poetry
"I've done a number of readings at poetry lounges in Vancouver and Los Angeles. I've compiled a book of poetry that's completed, and two others I'm working on.",Corin Nemec,Poetry
I often imagine that the longer he studies English literature the more the Japanese student must be astonished at the extraordinary predominance given to the passion of love both in fiction and in poetry.,Lafcadio Hearn,Poetry
"Publishing the lyric books, poetry or comics of other musicians I know. That's the thing I really want to break into!",Frank Iero,Poetry
"That poetry survived in its formal agencies finally, and that prose survived to get something said.",Robert Creeley,Poetry
"A life is not sufficiently elevated for poetry, unless, of course, the life has been made into an art.",Mark Strand,Poetry
The poetry community here has been extraordinarily welcoming.,George Murray,Poetry
"My dream is that people will find a way back home, into their bodies, to connect with the earth, to connect with each other, to connect with the poor, to connect with the broken, to connect with the needy, to connect with people calling out all around us, to connect with the beauty, poetry, the wildness.",Eve Ensler,Poetry
"Well, the great thing for me about poetry is that in good poems the dislocation of words, that is to say, the distance between what they say they're saying and what they are actually saying is at its greatest.",Harry Mathews,Poetry
"My films are an extension of my poetry, using the white screen like the white page to be filled with images.",James Broughton,Poetry
"Serious poetry deals with the fundamental conflicts that cannot be logically resolved: we can state the conflicts rationally, but reason does not relieve us of them.",Allen Tate,Poetry
"Never fear: Thank Home, and Poetry, and the Force behind both.",Wilfred Owen,Poetry
"That's one of the great things about poetry; one realises that one does one's little turn - that you're just part of the great crop, as it were.",Paul Muldoon,Poetry
"Well you can't teach the poetry, but you can teach the craft.",David Hockney,Poetry
"One thing I do know is that poetry, to be understood, must be clear.",Mary Oliver,Poetry
"Poetry is the hardest thing that there is. It fascinates me, so I want to write more of it.",Steve Earle,Poetry
"I read, read enormously on all different fields of Islamic thought, from philosophy to Islamic literature, poetry, exegeses, knowledge of the Hadith, the teachings of the prophet. That's how I trained myself. And then I was appointed imam by a Sufi master from Istanbul, Turkey.",Feisal Abdul Rauf,Poetry
"Slowly poetry becomes visual because it paints images, but it is also musical: it unites two arts into one.",Eugenio Montale,Poetry
"Religious poetry, civic poetry, lyric or dramatic poetry are all categories of man's expression which are valid only if the endorsement of formal content is valid.",Salvatore Quasimodo,Poetry
"The great watershed of modern poetry is French, more than English.",Robert Morgan,Poetry
I do not go in search of poetry. I wait for poetry to visit me.,Eugenio Montale,Poetry
"A public expectation, it has to be said, not of poetry as such but of political positions variously approvable by mutually disapproving groups.",Seamus Heaney,Poetry
"I think that's what poetry does. It allows people to come together and identify with a common thing that is outside of themselves, but which they identify with from the interior.",Diane Wakoski,Poetry
"Such discussions help us very little to enjoy what has been well done in art or poetry, to discriminate between what is more and what is less excellent in them, or to use words like beauty, excellence, art, poetry, with a more precise meaning than they would otherwise have.",Walter Pater,Poetry
"I think if a poet wanted to lead, he or she would want the message to be unequivocally clear and free of ambiguity. Whereas poetry is actually the home of ambiguity, ambivalence and uncertainty.",Billy Collins,Poetry
"History shows us that in times of people feeling like they are in need of some sort of rebellion or protests, the artists rise because the poetry we create about pain and its relationship to culture in the world begins to soothe and heal people who are feeling confused or afraid.",Lady Gaga,Poetry
"So, poetry becomes a means for useful dialogue between people who are not only unknown, but mute to each other. It produces a dialogue among people that guards all of us against manipulation by our so-called leaders.",June Jordan,Poetry
"Perhaps there is an idea among Japanese students that one general difference between Japanese and Western poetry is that the former cultivates short forms and the latter longer ones, gut this is only in part true.",Lafcadio Hearn,Poetry
"In the world of poetry there are would-be poets, workshop poets, promising poets, lovesick poets, university poets, and a few real poets.",James Broughton,Poetry
"I learned to impersonate the kind of person that talks about poetry. It comes from teaching, I think.",Robert Morgan,Poetry
"Poetry has the virtue of being able to say twice as much as prose in half the time, and the drawback, if you do not give it your full attention, of seeming to say half as much in twice the time.",Christopher Fry,Poetry
"The poetry and transgression that was so much of surrealism's anarchic force has been recruited into mainstream culture. It has been made commonplace by television and magazine merchandising, by computer games and Internet visuals, by film and MTV, by the fashion shoot.",Graham Joyce,Poetry
"I want a fever, in poetry: a fever, and tranquillity.",James Dickey,Poetry
"There's a love of rhetorical skill in the Muslim world. Osama bin Laden doesn't just go on tape cassettes and say, 'America sucks.' He recites poetry; he finds things that 'America sucks' rhymes with.",P. J. O'Rourke,Poetry
"This proves that great lyric poetry can die, be reborn, die again, but will always remain one of the most outstanding creations of the human soul.",Eugenio Montale,Poetry
Gil Thorpe is a great diversion and is to book writing as poetry is to prose.,Jerry B. Jenkins,Poetry
"It could be that all awful dictators are frustrated artists - Mao with his poetry and Mussolini with his monuments. Stalin was once a journalistic hack, and I can personally testify to how frustrated they are. Pol Pot left a very edgy photo collection behind. And Osama seems quite interested in video.",P. J. O'Rourke,Poetry
Poetry remembers that it was an oral art before it was a written art.,Jorge Luis Borges,Poetry
"Thomas Davis was a great man where poetry is concerned, and a better than Thomas Moore. All over Ireland his poetry is, and he would have done other things but that he died young.",Lady Gregory,Poetry
"I wrote some bad poetry that I published in North African journals, but even as I withdrew into this reading, I also led the life of a kind of young hooligan.",Jacques Derrida,Poetry
"Poetry is a matter of life, not just a matter of language.",Lucille Clifton,Poetry
"My hobbies are playing piano and guitar, pining for girls, worrying about climate change, pining for girls, and the poetry of John Keats.",James Veitch,Poetry
"Especially in the world today, where science rightfully is so important in terms of technology, innovation, telecom, Internet, fighting diseases, I think it's equally important that poetry and painting have their share of support.",Leon Black,Poetry
"For a lot of people, well-meaning teaching has made poetry seem arcane, difficult, a kind of brown-knotting medicine that might be good for you but doesn't taste so good. So I tried to make a collection of poetry that would be fun. And that would bring out poetry as an art, rather than the challenge to say smart things.",Robert Pinsky,Poetry
"But the gravest difficulty, and perhaps the most important, in poetry meant solely for recitation, is the difficulty of achieving verbal beauty, or rather of making verbal beauty tell.",Lascelles Abercrombie,Poetry
"Poetry is one of the oldest of all art forms, and one of its powers for shamans and tribal leaders was the mnemonic.",Felix Dennis,Poetry
"For me concrete poetry was a particular way of using language which came out of a particular feeling, and I don't have control over whether this feeling is in me or not.",Ian Hamilton Finlay,Poetry
Writing poetry is the hard manual labor of the imagination.,Ishmael Reed,Poetry
Reform and exchange in English poetry are as slow as in the British constitution itself.,Austin Clarke,Poetry
Poetry can do a lot of things to people. I mean it can improve your imagination. It can take you to new places. It can give you this incredible form of verbal pleasure.,Billy Collins,Poetry
"In its truest manifestation, where it gives judgments, poetry is super-luxury. It would be interesting to see what would happen to a High Court judge if he were forced to follow the true poetic formula, doing the job for love, being forced into pubs for relief.",Patrick Kavanagh,Poetry
"'Dead Poets Society' was a very influential film on me and so talking about that movie with him, he just inspired me to continue writing poetry and we talked a lot about our favourite poets. My wrap present from Robin was a beautiful limited edition copy of Walt Whitman's 'Leaves of Grass' and that's a great memory for me.",Dante Basco,Poetry
"I think there's a certain poetry to having your body reflect what you feel inside of you. Perhaps you have a feeling that's so pure, or overwhelming inside of you that your body disfigures to it - contortions match your confusion.",Arca,Poetry
Writing dark poetry was always my escape.,Bishop Briggs,Poetry
"Poetry is something to make us wiser and better, by continually revealing those types of beauty and truth, which God has set in all men's souls.",James Russell Lowell,Poetry
"Beauty is not all there is of poetry. It must contain the truth. It is not simply an oak, rude and grand, neither is it simply a vine. It is both. Around the oak of truth runs the vine of beauty.",Robert Green Ingersoll,Poetry
Poetry carries the imagery which is large enough for the kind of life we want for ourselves.,David Whyte,Poetry
"For most Americans, poetry plays no role in their everyday lives. But also for most Americans, contemporary painting or jazz or sculpture play no role either. I'm not saying poetry is singled out as a special thing to ignore.",Billy Collins,Poetry
"If there were no poetry on any day in the world, poetry would be invented that day. For there would be an intolerable hunger.",Muriel Rukeyser,Poetry
Auden said poetry makes nothing happen. But I wonder if the opposite could be true. It could make something happen.,Carol Ann Duffy,Poetry
"Becoming interested in poetics got me interested in theater. Theater is supposed to be poetry, you know, before it's anything else. It just doesn't fly if it isn't musical.",Steve Earle,Poetry
I didn't want to deal in poetry. I got rid of that after a few months.,Tom Wesselmann,Poetry
"Poetry is one of the destinies of speech... One would say that the poetic image, in its newness, opens a future to language.",Gaston Bachelard,Poetry
"When I first started reading poetry, all the poets I read - Edgar Allan Poe, Oliver Wendell Holmes, John Greenleaf Whittier - were rhyme poets. That's what captured me.",Marv Levy,Poetry
"In a way, Anglo-Saxon poetry cannot be translated.",Seamus Heaney,Poetry
"When the poet is in love, he is incapable of writing poetry on love. He has to write when he remembers that he was in love.",Umberto Eco,Poetry
"Poetry is really about your mental state or intellectual, and where you are, and you're trying to evoke that, explain it to yourself, whatever, you're trying to dig into it, analyse yourself.",Jonathan Galassi,Poetry
"I was writing since I can remember - I just didn't know it was poetry yet, or that writing could be a career.",Amanda Gorman,Poetry
You will not find poetry anywhere unless you bring some of it with you.,Joseph Joubert,Poetry
"I really disliked Philadelphia society - really, deeply disliked it. I spent a lot of my teenage years writing poetry attacking it.",Martha Nussbaum,Poetry
"My junior high school teacher, Bennie Williams, was really more than a music teacher. She taught us poetry. She helped us put on school shows. She did all these kinds of things to help us stand in each other's shoes, and it was a really powerful time. That's when I discovered that I could sing.",Dianne Reeves,Poetry
"The reason why we do maths is because it's like poetry. It's about patterns, and that really turned me on. It made me feel that maths was in tune with the other things I liked doing.",Marcus du Sautoy,Poetry
"I began my writing life as a poet, so poetry has always been fundamental. I evolved from poetry to journalism to stories to novels. But poetry was always there.",Ben Okri,Poetry
"With my fiction, I focused on chapters and overall conceptions, while in poetry, I crawled along in the trenches of each sentence, examining every word for a sign of a deeper significance.",Philip Schultz,Poetry
"I never really liked poetry readings; I liked to read poetry by myself, but I liked singing, chanting my lyrics to this jazz group.",Leonard Cohen,Poetry
Poetry and novels are lists of our devotions. We love the feel of making the marks as the feelings are rising and falling.,Eileen Myles,Poetry
"I've been writing all my life, and playing bass came later on, when I was about 26. What I recognized with poetry and music that I had a different voice - there were things I wanted to express that I could not as an actor or even as a director. It was another avenue of expression that my soul needs.",Malcolm-Jamal Warner,Poetry
"Reading a piece of poetry with no beat in front of 20 people is way more challenging than rocking for 10,000 people.",Macklemore,Poetry
I think poetry can help children deal with the other subjects on the curriculum by enabling them to see a subject in a new way.,Carol Ann Duffy,Poetry
I came into music because I thought the presentation of poetry wasn't vibrant enough. So I merged improvised poetry with basic rock chords. That was my original mission.,Patti Smith,Poetry
"When you realize my best selling books are 'Owl Moon,' the 'How Do Dinosaur' books, and 'Devil's Arithmetic,' how can the public make sense of that! I have fans who think I only write picture books or only write SF and fantasy. I have fanatics of my poetry and are stunned to find out I write prose, too!",Jane Yolen,Poetry
"I read a lot of poetry, and I love what it does with language. I love music, too, and I think there's probably no coincidence there, that the rhythm of the words is almost as important as the words themselves, and when you can get the two working together, which usually takes me about 20 goes, I feel a huge satisfaction.",Kate Grenville,Poetry
"I have written some songs, but I would really call what I've done poetry at the end of the day, because I'll sit with my guitar for hours and hours on end for, like, a week and then I won't touch it for a month. I also just have no confidence. And you know what? I don't have time, because I'd rather be doing other things, like knitting.",Amanda Seyfried,Poetry
"I'm ashamed to admit that I very seldom read poetry, even though many of my friends are poets.",Celeste Ng,Poetry
"What can a pencil do for all of us? Amazing things. It can write transcendent poetry, uplifting music, or life-changing equations; it can sketch the future, give life to untold beauty, and communicate the full-force of our love and aspirations.",Adam Braun,Poetry
"I'm about 75 pages into a book on poetry. I don't know if anybody wants to read it. It's on any broad variety of subjects. I walk down the street and think of a topic and jot it down and say, 'Okay, that's another one.' They go from the humorous to the serious to every topic imaginable.",Marv Levy,Poetry
"Listening to music and lyrics and watching movies, I think, uses a lot of the same muscles we use in reading and experiencing poetry - and yet we somehow forget that we have those when it comes to sitting down with a book of poems.",Tracy K. Smith,Poetry
"The actual world, not some fantastic structure that has nothing to do with reality, must provide the material for modern poetry.",Muriel Rukeyser,Poetry
"No, what I should really like to do right now, in the full blaze of lights, before this illustrious assembly, is to shower every one of you with gifts, with flowers, with offerings of poetry - to be young once more, to ride on the crest of the wave.",Knut Hamsun,Poetry
"The flame that is naturally clear always gives the most light and heat. If I could blend my talent for poetry and music into one, the light would burn still clearer, and I might go far.",Robert Schumann,Poetry
