quotes,authors,categories
A woman is like a tea bag - you can't tell how strong she is until you put her in hot water.,Eleanor Roosevelt,Women
"If you want something said, ask a man; if you want something done, ask a woman.",Margaret Thatcher,Women
"Women, like men, should try to do the impossible. And when they fail, their failure should be a challenge to others.",Amelia Earhart,Women
Think like a queen. A queen is not afraid to fail. Failure is another steppingstone to greatness.,Oprah Winfrey,Women
"Women, can't live with them, can't live without them.",Desiderius Erasmus,Women
Women hold up half the sky.,Mao Zedong,Women
I measure the progress of a community by the degree of progress which women have achieved.,B. R. Ambedkar,Women
A girl should be two things: classy and fabulous.,Coco Chanel,Women
"Ah, women. They make the highs higher and the lows more frequent.",Friedrich Nietzsche,Women
Women who seek to be equal with men lack ambition.,Timothy Leary,Women
"Whatever women do, they must do twice as well as men to be thought half as good. Luckily, this is not difficult.",Charlotte Whitton,Women
"I write for those women who do not speak, for those who do not have a voice because they were so terrified, because we are taught to respect fear more than ourselves. We've been taught that silence would save us, but it won't.",Audre Lorde,Women
"Wives are young men's mistresses, companions for middle age, and old men's nurses.",Francis Bacon,Women
"Any time women come together with a collective intention, it's a powerful thing. Whether it's sitting down making a quilt, in a kitchen preparing a meal, in a club reading the same book, or around the table playing cards, or planning a birthday party, when women come together with a collective intention, magic happens.",Phylicia Rashad,Women
I do not wish women to have power over men; but over themselves.,Mary Shelley,Women
Man does not control his own fate. The women in his life do that for him.,Groucho Marx,Women
Women are the real architects of society.,Cher,Women
Men are by nature merely indifferent to one another; but women are by nature enemies.,Arthur Schopenhauer,Women
"As usual, there is a great woman behind every idiot.",John Lennon,Women
Women need real moments of solitude and self-reflection to balance out how much of ourselves we give away.,Barbara De Angelis,Women
No doubt exists that all women are crazy; it's only a question of degree.,W. C. Fields,Women
Clever and attractive women do not want to vote; they are willing to let men govern as long as they govern men.,George Bernard Shaw,Women
"Being a woman is a terribly difficult task, since it consists principally in dealing with men.",Joseph Conrad,Women
"In our society, the women who break down barriers are those who ignore limits.",Arnold Schwarzenegger,Women
"I guess at the end of the day, all women like to be appreciated and treated with respect and kindness.",Sofia Vergara,Women
"The connections between and among women are the most feared, the most problematic, and the most potentially transforming force on the planet.",Adrienne Rich,Women
"If men knew all that women think, they would be twenty times more audacious.",Alphonse Karr,Women
The age of a woman doesn't mean a thing. The best tunes are played on the oldest fiddles.,Ralph Waldo Emerson,Women
"How wrong it is for a woman to expect the man to build the world she wants, rather than to create it herself.",Anais Nin,Women
"There was a time when men thought it was sexy to have a housewife waiting for him to come home from work in her slippers, but in modern society, I think an independent woman is even more sexy.",Kat Graham,Women
"You see a lot of smart guys with dumb women, but you hardly ever see a smart woman with a dumb guy.",Erica Jong,Women
"After all those years as a woman hearing 'not thin enough, not pretty enough, not smart enough, not this enough, not that enough,' almost overnight I woke up one morning and thought, 'I'm enough.'",Anna Quindlen,Women
There's no evidence whatsoever that men are more rational than women. Both sexes seem to be equally irrational.,Albert Ellis,Women
"I don't know who invented high heels, but all women owe him a lot.",Marilyn Monroe,Women
Woman is the dominant sex. Men have to do all sorts of stuff to prove that they are worthy of woman's attention.,Camille Paglia,Women
"Girls have an unfair advantage over men: if they can't get what they want by being smart, they can get it by being dumb.",Yul Brynner,Women
Whether women are better than men I cannot say - but I can say they are certainly no worse.,Golda Meir,Women
You can tell the strength of a nation by the women behind its men.,Benjamin Disraeli,Women
"A woman should be like a single flower, not a whole bouquet.",Anna Held,Women
"If women can be railroad workers in Russia, why can't they fly in space?",Valentina Tereshkova,Women
"Until Eve arrived, this was a man's world.",Richard Armour,Women
Single women have a dreadful propensity for being poor. Which is one very strong argument in favor of matrimony.,Jane Austen,Women
Women don't realize how powerful they are.,Judith Light,Women
"Disguise our bondage as we will, 'Tis woman, woman, rules us still.",Thomas Moore,Women
Women with money and women in power are two uncomfortable ideas in our society.,Candace Bushnell,Women
"Women love always: when earth slips from them, they take refuge in heaven.",George Sand,Women
"Women have been called queens for a long time, but the kingdom given them isn't worth ruling.",Louisa May Alcott,Women
"God gave women intuition and femininity. Used properly, the combination easily jumbles the brain of any man I've ever met.",Farrah Fawcett,Women
"From birth to age 18 a girl needs good parents. From 18 to 35 she needs good looks. From 35 to 55 she needs a good personality. From 55 on, she needs good cash.",Sophie Tucker,Women
I demanded more rights for women because I know what women had to put up with.,Evita Peron,Women
Women have always been courageous... They are always fearless when protecting their children and in the last century they have been fearless in the fight for their rights.,Isabel Allende,Women
"When women go wrong, men go right after them.",Mae West,Women
Men are governed by lines of intellect - women: by curves of emotion.,James Joyce,Women
To understand how any society functions you must understand the relationship between the men and the women.,Angela Davis,Women
Women need not always keep their mouths shut and their wombs open.,Emma Goldman,Women
The sight of women talking together has always made men uneasy; nowadays it means rank subversion.,Germaine Greer,Women
"This man is frank and earnest with women. In Fresno, he's Frank and in Chicago he's Ernest.",Henny Youngman,Women
I feel there is something unexplored about woman that only a woman can explore.,Georgia O'Keeffe,Women
"Women wish to be loved without a why or a wherefore; not because they are pretty, or good, or well-bred, or graceful, or intelligent, but because they are themselves.",Henri Frederic Amiel,Women
The trouble with life is that there are so many beautiful women and so little time.,John Barrymore,Women
Women need not always keep their mouths shut and their wombs open.,Emma Goldman,Women
"Women want love to be a novel, men a short story.",Daphne du Maurier,Women
Women have always been courageous... They are always fearless when protecting their children and in the last century they have been fearless in the fight for their rights.,Isabel Allende,Women
"The labor of women in the house, certainly, enables men to produce more wealth than they otherwise could; and in this way women are economic factors in society. But so are horses.",Charlotte Perkins Gilman,Women
Women's value has been under-recognized for far too long.,Sidney Sheldon,Women
Only men who are not interested in women are interested in women's clothes. Men who like women never notice what they wear.,Anatole France,Women
"Most women set out to try to change a man, and when they have changed him they do not like him.",Marlene Dietrich,Women
The trouble with life is that there are so many beautiful women and so little time.,John Barrymore,Women
Women will never be as successful as men because they have no wives to advise them.,Dick Van Dyke,Women
"A woman has two smiles that an angel might envy, the smile that accepts a lover before words are uttered, and the smile that lights on the first born babe, and assures it of a mother's love.",Thomas Chandler Haliburton,Women
"Men are April when they woo, December when they wed. Maids are May when they are maids, but the sky changes when they are wives.",William Shakespeare,Women
"It may be the cock that crows, but it is the hen that lays the eggs.",Margaret Thatcher,Women
Women have always been the strong ones of the world. The men are always seeking from women a little pillow to put their heads down on. They are always longing for the mother who held them as infants.,Coco Chanel,Women
"I like intelligent women. When you go out, it shouldn't be a staring contest.",Frank Sinatra,Women
All women should know how to take care of children. Most of them will have a husband some day.,Franklin P. Jones,Women
"Women's Lib? Oh, I'm afraid it doesn't interest me one bit. I've been so liberated it hurts.",Lucille Ball,Women
"One can find women who have never had one love affair, but it is rare indeed to find any who have had only one.",Francois de La Rochefoucauld,Women
The test of civilization is its estimate of women.,George William Curtis,Women
Years ago women of my size were considered royalty.,Camryn Manheim,Women
The only really happy folk are married women and single men.,H. L. Mencken,Women
Women cannot complain about men anymore until they start getting better taste in them.,Bill Maher,Women
"Until Eve arrived, this was a man's world.",Richard Armour,Women
"I think today women are very scared to celebrate themselves, because then they just get labeled.",Charlize Theron,Women
People don't want to see women doing things they don't think women should do.,Joan Jett,Women
I think women are excellent social critics.,Laurie Anderson,Women
"I think God made a woman to be strong and not to be trampled under the feet of men. I've always felt this way because my mother was a very strong woman, without a husband.",Little Richard,Women
"I think that women just have a primeval instinct to make soup, which they will try to foist on anybody who looks like a likely candidate.",Dylan Moran,Women
Women get more unhappy the more they try to liberate themselves.,Brigitte Bardot,Women
"Women hate everything which strips off the tinsel of sentiment, and they are right, or it would rob them of their weapons.",Lord Byron,Women
"Being a sex symbol has to do with an attitude, not looks. Most men think it's looks, most women know otherwise.",Kathleen Turner,Women
A women who doesn't wear perfume has no future.,Coco Chanel,Women
"Women are made to be loved, not understood.",Oscar Wilde,Women
"In too many instances, the march to globalization has also meant the marginalization of women and girls. And that must change.",Hillary Clinton,Women
"When women are encouraged to be competitive, too many of them become disagreeable.",Benjamin Spock,Women
"When men reach their sixties and retire, they go to pieces. Women go right on cooking.",Gail Sheehy,Women
We're getting ready to take over the world. My group of girlfriends - we're renegades.,Lisa Bonet,Women
"In love, women are professionals, men are amateurs.",Francois Truffaut,Women
Women think with their whole bodies and they see things as a whole more than men do.,Dorothy Day,Women
The sight of women talking together has always made men uneasy; nowadays it means rank subversion.,Germaine Greer,Women
Women hear rhythm differently than men.,Elvis Costello,Women
Women need space and silence. We too quickly give away our energy. There's something about holding that richness.,Natalie Goldberg,Women
Honor your daughters. They are honorable.,Malala Yousafzai,Women
I believe women still face a glass ceiling that must be shattered.,Andrew Cuomo,Women
Women have simple tastes. They get pleasure out of the conversation of children in arms and men in love.,H. L. Mencken,Women
Plain women know more about men than beautiful women do.,Katharine Hepburn,Women
"It is easier for women to succeed in business, the arts, and politics in America than in Europe.",Hedy Lamarr,Women
"But, alas! what poor Woman is ever taught that she should have a higher Design than to get her a Husband?",Mary Astell,Women
Men mourn for what they have lost; women for what they ain't got.,Josh Billings,Women
"The term 'alpha female' originated in my field of animal behavior, but has acquired new meaning. It refers to women who are in charge, for example, by flirting and dating on their own terms. It is also used maliciously for a loud-mouthed, controlling woman who has no patience with deviating opinions.",Frans de Waal,Women
I don't know why women want any of the things men have when one of the things that women have is men.,Coco Chanel,Women
I am my own woman.,Evita Peron,Women
"On the whole, I think women wear too much and are to fussy. You can't see the person for all the clutter.",Julie Andrews,Women
"Women, you can have it all - a loving man, devoted husband, loving children, a fabulous career.",Jada Pinkett Smith,Women
Women are the sustaining force of any society - they think of the children and the next generation's chances.,Margo MacDonald,Women
Women today have more of an overview of their lives and how marriage is or is not a part of it.,Helen Reddy,Women
"When anything goes, it's women who lose.",Camille Paglia,Women
A homely face and no figure have aided many women heavenward.,Minna Antrim,Women
I'm not denyin' the women are foolish. God Almighty made 'em to match the men.,George Eliot,Women
"Women want mediocre men, and men are working to be as mediocre as possible.",Margaret Mead,Women
"If women were particular about men's characters, they would never get married at all.",George Bernard Shaw,Women
"A lot of women say they love being pregnant, but I wasn't such a big fan.",Marion Jones,Women
I owe nothing to Women's Lib.,Margaret Thatcher,Women
"And I think women have come a very, very long way, but they have a long way to go.",Lara Flynn Boyle,Women
"Clearly older women and especially older women who have led an active life or elder women who successfully maneuver through their own family life have so much to teach us about sharing, patience, and wisdom.",Alice Walker,Women
It is little men know of women; their smiles and their tears alike are seldom what they seem.,Amelia Barr,Women
"Childbirth is more admirable than conquest, more amazing than self-defense, and as courageous as either one.",Gloria Steinem,Women
"I'm supposed to have a Ph.D. on the subject of women. But the truth is I've flunked more often than not. I'm very fond of women; I admire them. But, like all men, I don't understand them.",Frank Sinatra,Women
They say that women talk too much. If you have worked in Congress you know that the filibuster was invented by men.,Clare Boothe Luce,Women
"My mother told me two things constantly. One was to be a lady and the other was to be independent, and the law was something most unusual for those times because for most girls growing up in the '40s, the most important degree was not your B.A. but your M.R.S.",Ruth Bader Ginsburg,Women
"There is a physical relationship with a woman that you don't have with anybody else, but that's not about love. Love is a spiritual thing.",Ziggy Marley,Women
"Women are naturally secretive, and they like to do their own secreting.",Arthur Conan Doyle,Women
Emancipation of women has made them lose their mystery.,Grace Kelly,Women
You women could make someone fall in love even with a lie.,Georg Buchner,Women
I think that maybe if women and children were in charge we would get somewhere.,James Thurber,Women
Women always excel men in that sort of wisdom which comes from experience. To be a woman is in itself a terrible experience.,H. L. Mencken,Women
"Men and women, women and men. It will never work.",Erica Jong,Women
I think women get caught up too much in having a plan - 'I'm going to get married at this age; I'm going to have a kid at this age' - and then they just try to find a guy who will fit into that picture. I don't want my life to be based on that.,Julia Stiles,Women
"I grew up in the Bronx where you would stay up late with your girlfriends, just being silly in our bedrooms, whatever. And I was always the clown.",Jennifer Lopez,Women
All women's issues are to some degree men's issues and all men's issues are to some degree women's issues because when either sex wins unilaterally both sexes lose.,Warren Farrell,Women
"I've yet to be on a campus where most women weren't worrying about some aspect of combining marriage, children, and a career. I've yet to find one where many men were worrying about the same thing.",Gloria Steinem,Women
"It is capitalist America that produced the modern independent woman. Never in history have women had more freedom of choice in regard to dress, behavior, career, and sexual orientation.",Camille Paglia,Women
Women have a predestination to suffering.,Bela Lugosi,Women
"The appalling thing is the degree of charity women are capable of. You see it all the time... love lavished on absolute fools. Love's a charity ward, you know.",Lawrence Durrell,Women
"Women must tell men always that they are the strong ones. They are the big, the strong, the wonderful. In truth, women are the strong ones. It is just my opinion, I am not a professor.",Coco Chanel,Women
"Women are clear-headed, they are more creative and for this reason, sometimes, also more fragile.",Emma Bonino,Women
Younger women have no problem in reconciling beauty with ambitions as a professional woman.,Camille Paglia,Women
One hair of a woman can draw more than a hundred pair of oxen.,James Howell,Women
Nature makes woman to be won and men to win.,George William Curtis,Women
Women don't take enough risks. Men are just 'foot on the gas pedal.' We're not going to close the achievement gap until we close the ambition gap.,Sheryl Sandberg,Women
"Were there no women, men might live like gods.",Thomas Dekker,Women
"Charm, in most men and nearly all women, is a decoration.",E. M. Forster,Women
"Friends are generally of the same sex, for when men and women agree, it is only in the conclusions; their reasons are always different.",George Santayana,Women
Women in love are less ashamed than men. They have less to be ashamed of.,Ambrose Bierce,Women
I don't love dolls. I love women. I love their bodies.,John Galliano,Women
The house a woman creates is a Utopia. She can't help it - can't help trying to interest her nearest and dearest not in happiness itself but in the search for it.,Marguerite Duras,Women
"I would not send a poor girl into the world, ignorant of the snares that beset her path; nor would I watch and guard her, till, deprived of self-respect and self-reliance, she lost the power or the will to watch and guard herself.",Anne Bronte,Women
"Women often postpone their lives, thinking that if they're not with a partner then it doesn't really count. They're still searching for their prince, in a way. And as much as we don't discuss that, because it's too embarrassing and too sad, I think it really does exist.",Jane Campion,Women
"Women are frightening. If you get to 41 as a man, you're quite battle-scarred.",Hugh Grant,Women
Women like to sit down with trouble - as if it were knitting.,Ellen Glasgow,Women
"I have been a woman for fifty years, and I've never yet been able to discover precisely what it is I am.",Jean Giraudoux,Women
"The most virtuous women have something within them, something that is never chaste.",Honore de Balzac,Women
Most women are indulgent of themselves. This is a mistake. It should be only the reward of old age.,Anna Held,Women
"What we women need to do, instead of worrying about what we don't have, is just love what we do have.",Cameron Diaz,Women
Women have this obsession with shoes.,Alexandra Paul,Women
"I'll always prefer to play with women and hang out with women, and I'll always be a feminist.",Courtney Love,Women
The only people you can really share certain things with in secret are your girlfriends.,Shirley Knight,Women
I never realized until lately that women were supposed to be the inferior sex.,Katharine Hepburn,Women
"In politics women type the letters, lick the stamps, distribute the pamphlets and get out the vote. Men get elected.",Clare Boothe Luce,Women
The No. 1 impediment to women succeeding in the workforce is now in the home.,Sheryl Sandberg,Women
"My advantage as a woman and a human being has been in having a mother who believed strongly in women's education. She was an early undergraduate at Oxford, and her own mother was a doctor.",Antonia Fraser,Women
"You're not working with models, you're working with real women who have, like, anatomy. Models do not have anatomy.",Isaac Mizrahi,Women
Women are incredible in groups together. Terrifying. Men have nothing on them.,Michael Hutchence,Women
"Women like myself, CEOs, can pave the way for more women to get to the top.",Andrea Jung,Women
"A man who graduated high in his class at Yale Law School and made partnership in a top law firm would be celebrated. A man who invested wisely would be admired, but a woman who accomplishes this is treated with suspicion.",Barbra Streisand,Women
"Women have a favorite room, men a favorite chair.",Bernard Williams,Women
All issues are women's issues - and there are several that are just women's business.,Eddie Bernice Johnson,Women
"Women are women, and hurray for that.",John Galliano,Women
"In life, single women are the most vulnerable adults. In movies, they are given imaginary power.",Elizabeth Wurtzel,Women
Relationships are made of talk - and talk is for girls and women.,Deborah Tannen,Women
Women are the first to jump on what is fashionable.,Gavin DeGraw,Women
"Men are allowed to have passion and commitment for their work... a woman is allowed that feeling for a man, but not her work.",Barbra Streisand,Women
"Why is it men are permitted to be obsessed about their work, but women are only permitted to be obsessed about men?",Barbra Streisand,Women
Women's liberation is the liberation of the feminine in the man and the masculine in the woman.,Corita Kent,Women
What bugs me is that movies don't reflect how interesting and vibrant women are. We don't treasure women as they get older.,Jill Clayburgh,Women
"Intimacies between women often go backwards, beginning in revelations and ending in small talk.",Elizabeth Bowen,Women
The women's movement completely changed attitudes all over the world in ways we'll never be able to count.,Holly Near,Women
I'm surrounded by very powerful women and very progressive men.,Christie Hefner,Women
"Women should try to increase their size rather than decrease it, because I believe the bigger we are, the more space we'll take up, and the more we'll have to be reckoned with.",Roseanne Barr,Women
"America is a land where men govern, but women rule.",John Mason Brown,Women
"I always say God should have given women one extra decade at least, especially if you want a family. You're trying to pack a lot in.",Christine Baranski,Women
You can't raise the standard of women's morals by raising their pay envelope. It lies deeper than that.,Billy Sunday,Women
"Women may not have it easy, but we are given a fairer chance to reach for the top.",Jessica Savitch,Women
It's incredibly unfair. You don't see a lot of 60-year-old women with 20-year-old men onscreen.,George Clooney,Women
There are few virtuous women who are not bored with their trade.,Francois de La Rochefoucauld,Women
"All the world's a stage, and all the men and women merely players: they have their exits and their entrances; and one man in his time plays many parts, his acts being seven ages.",William Shakespeare,Women
"Between men and women there is no friendship possible. There is passion, enmity, worship, love, but no friendship.",Oscar Wilde,Women
"I speak Spanish to God, Italian to women, French to men, and German to my horse.",Charles V,Women
Women are nothing but machines for producing children.,Napoleon Bonaparte,Women
Bachelors know more about women than married men; if they didn't they'd be married too.,H. L. Mencken,Women
Women are the largest untapped reservoir of talent in the world.,Hillary Clinton,Women
"Welcome to Lake Wobegon, where all the women are strong, all the men are good-looking, and all the children are above average.",Garrison Keillor,Women
A women's greatest asset is her beauty.,Alex Comfort,Women
I think women are foolish to pretend they are equal to men; they are far superior and always have been.,William Golding,Women
There's a personality trait known as agreeableness. Agreeable people are compassionate and polite. And agreeable people get paid less than disagreeable people for the same job. Women are more agreeable than men.,Jordan Peterson,Women
"When you're wounded and left on Afghanistan's plains, and the women come out to cut up what remains, jest roll to your rifle and blow out your brains and go to your gawd like a soldier.",Rudyard Kipling,Women
"A lot of people would say 'sexy' is about the body. But to me, 'sexy' is a woman with confidence. I admire women who have very little fear.",Allegra Versace,Women
"Numbers don't lie. Women lie, men lie, but numbers don't lie.",Max Holloway,Women
"Ninety percent I'll spend on good times, women and Irish Whiskey. The other ten percent I'll probably waste.",Tug McGraw,Women
"Women and cats will do as they please, and men and dogs should relax and get used to the idea.",Robert A. Heinlein,Women
"If you can't see it, you can't be it. It's just having those brilliant women break out and do something - then other girls can say, 'I can do it, too!'",Marianne Elliott,Women
