quotes,authors,categories
"Women are the victims of this patriarchal culture, but they are also its carriers. Let us keep in mind that every oppressive man was raised in the confines of his mother's home.",Shirin Ebadi,Women
"I'm very proud of being a woman, and as a woman, I don't even like the word 'feminism' because when I hear that word, I associate it with women trying to pretend to be men, and I'm not interested in trying to pretend to be a man. I don't want to embrace manhood; I want to embrace my womanhood.",Evangeline Lilly,Women
"I want more girls to be able to see themselves behind the camera creating images we all enjoy, and I want to call attention to the fact that women directors are here all over the world.",Ava DuVernay,Women
Women are treated differently by society for exactly the same reason that children and the mentally handicapped are treated differently.,Scott Adams,Women
"If you're comfortable with yourself, then you'll look beautiful. If you're not feeling comfortable with yourself, than that kind of shows. I think that as cheesy as the pageant industry can be seen at times, it actually does help women - boosting their confidence and growing into their own. I have to give it credit for that.",Olivia Culpo,Women
"I hope the fathers and mothers of little girls will look at them and say 'yes, women can.'",Dilma Rousseff,Women
"The path to diversity begins with supporting, mentoring, and sponsoring diverse women and men to become leaders and entrepreneurs.",Denise Morrison,Women
"Men know they are sexual exiles. They wander the earth seeking satisfaction, craving and despising, never content. There is nothing in that anguished motion for women to envy.",Camille Paglia,Women
"Fidelity, Bravery, and Integrity set the expectations for behavior; they set a standard for our work. More than just a motto, for the men and women of the FBI, Fidelity, Bravery, and Integrity is a way of life.",Robert Mueller,Women
"I wanted women to have the same basic wardrobe as a man. Blazer, trousers, and suit. They're so functional. I believed women wanted this and was right.",Yves Saint Laurent,Women
No other group in America has so had their identity socialized out of existence as have black women... When black people are talked about the focus tends to be on black men; and when women are talked about the focus tends to be on white women.,bell hooks,Women
"Honestly, I feel like we are a walking protest. The fact that we're women professional athletes says that in and of itself. We've been feeling the inequality; we've been struggling with pay equality or whatever it is, or sexism in sports.",Megan Rapinoe,Women
Women are better than men.,Ryan Gosling,Women
It's a rite of passage for all women to make sure the next generation is in a better place than you. I will play my part.,Lucy Bronze,Women
The extension of women's rights is the basic principle of all social progress.,Charles Fourier,Women
"Beautiful feet are coveted by all women, everywhere of all ages, especially when they want to look their best and show off those strappy heels.",Jacqueline Fernandez,Women
"There are a number of mechanical devices which increase sexual arousal, particularly in women. Chief among these is the Mercedes-Benz 380SL convertible.",P. J. O'Rourke,Women
Grace in women has more effect than beauty.,William Hazlitt,Women
"Osteoporosis is a disease that attacks the bones in your body. It happens to really almost everyone when they get really old. But for women, after menopause, they can lose up to 30 percent of their bone mass.",Ann Richards,Women
Women are considered deep - why? Because one can never discover any bottom to them. Women are not even shallow.,Friedrich Nietzsche,Women
"Consumerism diverts us from thinking about women's rights, it stops us from thinking about Iraq, it stops us from thinking about what's going on in Africa - it stops us from thinking in general.",Pink,Women
"Women are, in my view, natural peacemakers. As givers and nurturers of life, through their focus on human relationships and their engagement with the demanding work of raising children and protecting family life, they develop a deep sense of empathy that cuts through to underlying human realities.",Daisaku Ikeda,Women
I think actively promoting women in science is very important because the data has certainly shown that there has been an underrepresentation.,Carol W. Greider,Women
"Investing in women's lives is an investment in sustainable development, in human rights, in future generations - and consequently in our own long-term national interests.",Liya Kebede,Women
"You know, there's nothing damnable about being a strong woman. The world needs strong women. There are a lot of strong women you do not see who are guiding, helping, mothering strong men. They want to remain unseen. It's kind of nice to be able to play a strong woman who is seen.",Ginger Rogers,Women
"You can be a thousand different women. It's your choice which one you want to be. It's about freedom and sovereignty. You celebrate who you are. You say, 'This is my kingdom.'",Salma Hayek,Women
The one thing I have never been afraid of is standing before important people and speaking my mind. I represent women who may never have the opportunity to go to the UN or meet with a president. I'm never afraid to speak truth to power.,Leymah Gbowee,Women
Women are women's own worst enemy. They rip each other apart.,Keith Allen,Women
Let us leave pretty women to men devoid of imagination.,Marcel Proust,Women
There never will be complete equality until women themselves help to make laws and elect lawmakers.,Susan B. Anthony,Women
"Italians come to ruin most generally in three ways, women, gambling, and farming. My family chose the slowest one.",Pope John XXIII,Women
I wanted pretty pictures of older women - women who are trying too hard but succeeding - pulling off an extreme look. What I didn't know would creep into the portraits was a vulnerability behind the strong facade that most of them wear.,Cindy Sherman,Women
Why should I limit myself to only one woman when I can have as many women as I want?,George Gershwin,Women
I think Indian women are very beautiful. They have a sense of elegance and innocence.,Pierce Brosnan,Women
"Whether it's salary or a promotion or a job, I think it's important for women to ask for what they think they deserve.",Susan Wojcicki,Women
Women rule the world. It's not really worth fighting because they know what they're doing. Ask Napoleon. Ask Adam. Ask Richard Burton or Richie Sambora. Many a man has crumbled.,Jon Bon Jovi,Women
All women become like their mothers. That is their tragedy. No man does. That's his.,Oscar Wilde,Women
The level of confidence women are able to build in women-only groups is important.,Mae Jemison,Women
Old women should not seek to be perfumed.,Archilochus,Women
"It's like the riddle of the Sphinx... why are there so many great unmarried women, and no great unmarried men?",Sarah Jessica Parker,Women
"I go out with white women. This makes a lot of people unhappy, mostly black women.",Dennis Rodman,Women
"Youth is impulsive. When our young men grow angry at some real or imaginary wrong, and disfigure their faces with black paint, it denotes that their hearts are black, and that they are often cruel and relentless, and our old men and old women are unable to restrain them. Thus it has ever been.",Chief Seattle,Women
"Madam Walker was a master marketer. But her brilliance was in taking it to another level by training women, by traveling, by making very motivational speeches and by providing independent income for women who otherwise would have to be maids and sharecroppers.",A'Lelia Bundles,Women
Women don't go to war to kill other women. Wars and armies and nuclear weapons are essentially heterosexual hobbies.,Morrissey,Women
"I want to be a voice to young children and women and people of all ages to go for their dreams, to be resilient and have courage. Don't let fear motivate you. The American Dream says that all things are possible, and I genuinely believe that.",Lana,Women
"But when women are moved and lend help, when women, who are by nature calm and controlled, give encouragement and applause, when virtuous and knowledgeable women grace the endeavor with their sweet love, then it is invincible.",Jose Marti,Women
"Abortion does not just hurt women. Abortion hurts a family, and it has a domino effect of hurting those related and close to those families through the grief and reality of losing a child to abortion.",Abby Johnson,Women
"I want to say a little something that's long overdue, the disrespect to women has got to be through. To all the mothers and the sisters and the wives and friends, I wanna offer my love and respect till the end.",Adam Yauch,Women
"Imagine a country that flies into space, launches Sputniks, creates such a defense system, and it can't resolve the problem of women's pantyhose. There's no toothpaste, no soap powder, not the basic necessities of life. It was incredible and humiliating to work in such a government.",Mikhail Gorbachev,Women
"I grew up with all mothers, all women. I come from a long line of matriarchs, very strong women.",Erykah Badu,Women
"When I first started doing press interviews, the big question was, 'Do you think women are funny?' People would ask you that in an interview. In an interview! It's like, of course they are.",Matt Walsh,Women
People forget the punk thing was really good for women. It motivated them to pick up a guitar rather than be a chanteuse. It allowed us to be aggressive.,Siouxsie Sioux,Women
"Most companies target women as end users, but few are effectively utilizing female employees when it comes to innovating for female consumers. When women are empowered in the design and innovation process, the likelihood of success in the marketplace improves by 144%!",Indra Nooyi,Women
"It would be a much better country if women did not vote. That is simply a fact. In fact, in every presidential election since 1950 - except Goldwater in '64 - the Republican would have won, if only the men had voted.",Ann Coulter,Women
"Women must pay for everything. They do get more glory than men for comparable feats, but, they also get more notoriety when they crash.",Amelia Earhart,Women
"I believe that women have a capacity for understanding and compassion which man structurally does not have, does not have it because he cannot have it. He's just incapable of it.",Barbara Jordan,Women
Nothing changes the gender equation more significantly than women's economic freedom.,Gloria Steinem,Women
"It's true that, in Iran, women have half of the rights men do. And yet 66 per cent of students are women.",Marjane Satrapi,Women
"Nigeria's unity is one for which enough blood has been spilled and many hundreds of thousands of lives have been lost. Many have paid for the unity of this country with their lives, and it will be wrong of us, as men and women of goodwill in this generation, to toy with those sacrifices that have been made.",Yemi Osinbajo,Women
"People appreciate a confident man. They love a strong man, and when it comes to a woman, I don't know if people just expect women not to speak up for themselves or be weak or just always be the follow-behind, but I'm proud that I'm in a generation of leaders. I'm proud that I'm surrounded by very strong women.",LeToya Luckett,Women
Young women today often have very little appreciation for the real battles that took place to get women where they are today in this country. I don't know how much history young women today know about those battles.,Sandra Day O'Connor,Women
"When I was growing up, you didn't know there was a women's national team. Now girls grow up dreaming of playing for Canada.",Christine Sinclair,Women
"I really like women who get emotional about babies and puppies. I've met some incredibly cool women who are tough, but the woman you marry should have a really soft side.",Chris Evans,Women
"There is a growing strength in women but it's in the forehead, not the forearm.",Beverly Sills,Women
Women's virtue is man's greatest invention.,Cornelia Otis Skinner,Women
"Architecture is particularly difficult for women; there's no reason for it to be. I don't want to blame men or society, but I think it was for a long time, the clients were men, the building industry is all male.",Zaha Hadid,Women
We women of America tell you that America is not a democracy. Twenty million women are denied the right to vote.,Alice Paul,Women
"Women, if left to their own devices, are going to tend and trend Democratic. That is absolutely the case.",Kellyanne Conway,Women
"We burned to death 100,000 Japanese civilians in Tokyo - men, women and children. LeMay recognized that what he was doing would be thought immoral if his side had lost. But what makes it immoral if you lose and not immoral if you win?",Robert McNamara,Women
"There is a great stir about colored men getting their rights, but not a word about the colored women; and if colored men get their rights, and not colored women theirs, you see, the colored men will be masters over the women, and it will be just as bad as it was before.",Sojourner Truth,Women
The search for human freedom can never be complete without freedom for women.,Betty Ford,Women
"In the different voice of women lies the truth of an ethic of care, the tie between relationship and responsibility, and the origins of aggression in the failure of connection.",Carol Gilligan,Women
"The door might not be opened to a woman again for a long, long time, and I had a kind of duty to other women to walk in and sit down on the chair that was offered, and so establish the right of others long hence and far distant in geography to sit in the high seats.",Frances Perkins,Women
"When you look at women who have had plastic surgery, they have lost something - usually an expression, something unique to their face.",Bo Derek,Women
"They say Latina women are spicy. But we are more than that. We have power, and we run things.",Natti Natasha,Women
"We need to get more women into sport, whether that's young girls in karting or off the track. The more we get into sport, the more you are going to get rising to the top of the sport.",Susie Wolff,Women
"With women, I've got a long bamboo pole with a leather loop on the end. I slip the loop around their necks so they can't get away or come too close. Like catching snakes.",Marlon Brando,Women
"Don't get caught up in the 'look' thing. Sometimes, we as men and women, the first thing that attracts us to someone is their physical appearance, and that's not always a good thing because what's good on the outside is not always good on the inside.",Keith Sweat,Women
I'm interested in women's health because I'm a woman. I'd be a darn fool not to be on my own side.,Maya Angelou,Women
"My goal is to show young women and girls that our voices and ideas matter, and you are never too young to dream big!",Marsai Martin,Women
"For a long time, men weren't respecting women. They weren't understanding Mother Earth, Mother Nature, the Motherland, all the motherly stuff. And now we are.",Skepta,Women
Men who want to support women in our struggle for freedom and justice should understand that it is not terrifically important to us that they learn to cry; it is important to us that they stop the crimes of violence against us.,Andrea Dworkin,Women
"If it wasn't for women, I wouldn't be here. I'm a mamma's boy at heart. I love my mom. I have the deepest, utmost respect for women.",Roman Reigns,Women
"Natural life, lived naturally as it is lived in the countryside, has none of that progress which is the base of happiness. Men and women in rural communities can be compared to a spring that rises out of a rock and spreads in irregular ever-widening circles. But the general principle is static.",Patrick Kavanagh,Women
"Male nudity, full-frontal nudity, has always been considered a lot more taboo than female nudity. As far back as I can remember, there's been a double standard between men and women. I think it's time that men get equal time in terms of nudity.",Darren Star,Women
"I'm bisexual. And so, you know, I've dated men and women.",Rachel Dolezal,Women
"There's nothing women can't do. There's absolutely nothing we can't do. We're far stronger in a lot of ways than men. Way, way stronger than men. And that's my message to any woman I meet - that includes you - there's nothing you can't do, and you know that.",Betty Williams,Women
"To me, women have always been the sturdiest people in my life and have been incredible sources of energy.",Mac Miller,Women
"We say that slavery has vanished from European civilization, but this is not true. Slavery still exists, but now it applies only to women and its name is prostitution.",Victor Hugo,Women
The vote means nothing to women. We should be armed.,Edna O'Brien,Women
"A gender line... helps to keep women not on a pedestal, but in a cage.",Ruth Bader Ginsburg,Women
No struggle can ever succeed without women participating side by side with men.,Muhammad Ali Jinnah,Women
"Arab society features apartheid of women, apartheid of homosexuals, and apartheid of Christians, Jews, and democracy.",Yair Lapid,Women
"If black lives matter, then why is it that black women are more than five times as likely as a white woman to have an abortion? I think the womb that brings forth the black life should matter... Because black lives absolutely matter, what about the babies in that womb? What about that mama?",Alveda King,Women
"It's important to have strong images of women out there, women who aren't afraid of expressing themselves, women who aren't afraid of taking chances, women who aren't afraid of their own power.",Gina Torres,Women
"There are many, many different kinds of intersectional exclusions - not just black women but other women of color. Not just people of color, but people with disabilities. Immigrants. LGBTQ people. Indigenous people.",Kimberle Williams Crenshaw,Women
Women are as precious as they are stronger than any man that I have met.,Logic,Women
"I have a theory that women are generally given space and appointed to jobs when the situation is tough. I've observed that in many instances. In times of crisis, women eventually are called upon to sort out the mess, face the difficult issues and be completely focused on restoring the situation.",Christine Lagarde,Women
"Achieving gender equality requires the engagement of women and men, girls and boys. It is everyone's responsibility.",Ban Ki-moon,Women
"Women say they have sexual thoughts too. They have no idea. It's the difference between shooting a bullet and throwing it. If they knew what we were really thinking, they'd never stop slapping us.",Larry Miller,Women
"Guys are simple... women are not simple and they always assume that men must be just as complicated as they are, only way more mysterious. The whole point is guys are not thinking much. They are just what they appear to be. Tragically.",Dave Barry,Women
"I like all types of women. I accept them as they are when they come into my life... But I'm not a romantic. I'm just up-front. I like to be a part of something real, not make-believe. I tell women to tell me the truth, to just lay it out. Let me be the judge and decide if I want you around or not. Let me have my choice.",Future,Women
"The breakdown of the black community, in order to maintain slavery, began with the breakdown of the black family. Men and women were not legally allowed to get married because you couldn't have that kind of love. It might get in the way of the economics of slavery. Your children could be taken from you and literally sold down the river.",Kerry Washington,Women
"One mustn't ask apple trees for oranges, France for sun, women for love, life for happiness.",Gustave Flaubert,Women
Men and women have strengths that complement each other.,Edwin Louis Cole,Women
Women are the root of all evil. I ought to know. I'm Evel.,Evel Knievel,Women
We are used to women's narratives being defined through the male perspective. I challenge that as a concept.,Danai Gurira,Women
The prolonged slavery of women is the darkest page in human history.,Elizabeth Cady Stanton,Women
"Around me I saw women overworked and underpaid, doing men's work at half men's wages, not because their work was inferior, but because they were women.",Anna Howard Shaw,Women
"Write in such a way as that you can be readily understood by both the young and the old, by men as well as women, even by children.",Ho Chi Minh,Women
I am an example of what is possible when girls from the very beginning of their lives are loved and nurtured by people around them. I was surrounded by extraordinary women in my life who taught me about quiet strength and dignity.,Michelle Obama,Women
Education of both men and women is a wonderful contraceptive.,Henry W. Kendall,Women
Women's strong qualities have become despised because of their weakness. The obvious remedy is to create a feminine character with all the strength of Superman plus all the allure of a good and beautiful woman.,William Moulton Marston,Women
"That's the nature of women, not to love when we love them, and to love when we love them not.",Miguel de Cervantes,Women
I have two interests in life - markets and women. Both are concerned with four letter words - markets with the risk and woman with love.,Rakesh Jhunjhunwala,Women
"I come from a family of strong women, who have been positive role models for me.",Laura Harrier,Women
"If the abstract rights of man will bear discussion and explanation, those of women, by a parity of reasoning, will not shrink from the same test.",Mary Wollstonecraft,Women
"I've always been attracted to women who are assertive and have confidence - qualities older women possess. They've been on the Earth a little longer. They're more seasoned. They don't play games. They know what they want, and they're not afraid to tell you.",Taye Diggs,Women
"Women prefer to talk in twos, while men prefer to talk in threes.",Gilbert K. Chesterton,Women
I love women in suits.,Phoebe Bridgers,Women
"Gender is not an easy conversation to have. It makes people uncomfortable, sometimes even irritable. Both men and women are resistant to talk about gender or are quick to dismiss the problems of gender. Because thinking of changing the status quo is always uncomfortable.",Chimamanda Ngozi Adichie,Women
"If men are honest, everything they do and everywhere they go is for a chance to see women.",Jack Nicholson,Women
"All women, whatever be their position, should demand political equality as a means of a freer life, and one calculated to yield rich blessings to society.",Clara Zetkin,Women
"Women have to harness their power - its absolutely true. It's just learning not to take the first no. And if you can't go straight ahead, you go around the corner.",Cher,Women
I'm glad I'm not bisexual. I couldn't stand being rejected by men as well as women.,Bernard Manning,Women
Women are always beautiful.,Ville Valo,Women
I appreciate women so much. I think the part that they play is that I just admire women. I love every part of the woman. I think the woman is what is amazing.,Lil B,Women
"Sexuality and sensuality exists in every women, along with innocence, and I have represented only those through my characters.",Shweta Menon,Women
It is women who love horror. Gloat over it. Feed on it. Are nourished by it. Shudder and cling and cry out-and come back for more.,Bela Lugosi,Women
"If you don't love yourself, you can't love anybody else. And I think as women we really forget that.",Jennifer Lopez,Women
"I always say that drag queens are like an exaggeration of women, and I'm like an exaggeration of drag queens. People ask, 'Why do you do your makeup so differently?' and I always say, 'Well, in a subversive art form, ask yourself why so many drag queens do their makeup exactly the same.' If you can do anything, why does everybody do the same thing?",Trixie Mattel,Women
A bird cannot fly with one wing only. Human space flight cannot develop any further without the active participation of women.,Valentina Tereshkova,Women
"The animals of the world exist for their own reasons. They were not made for humans any more than black people were made for white, or women created for men.",Alice Walker,Women
"The girls and women of our race must not be afraid to take hold of business endeavor and, by patient industry, close economy, determined effort and close application to business, wring success out of a number of business opportunities that lie at their very doors.",Madam C. J. Walker,Women
"I'm very proud to be representing Latinas and women of color, young mothers and full-figured women. I just love that we're seeing different types of people on screen.",Dascha Polanco,Women
"I am interested in people living in the margins of society, and I do have a mission to tell the stories of women of colour in particular. I feel we've been present throughout history, but our voices have been neglected.",Lynn Nottage,Women
The history of men's opposition to women's emancipation is more interesting perhaps than the story of that emancipation itself.,Virginia Woolf,Women
"When women work together, it's a bond unlike any other.",Victoria Principal,Women
"Women are like elephants. I like to look at 'em, but I wouldn't want to own one.",W. C. Fields,Women
Sexual harassment on the job is not a problem for virtuous women.,Phyllis Schlafly,Women
I haven't trusted polls since I read that 62% of women had affairs during their lunch hour. I've never met a woman in my life who would give up lunch for sex.,Erma Bombeck,Women
