quotes,authors,categories
"Because I am a woman, I must make unusual efforts to succeed. If I fail, no one will say, 'She doesn't have what it takes'; They will say, 'Women don't have what it takes.'",Clare Boothe Luce,Women
"Nothing can be more absurd than the practice that prevails in our country of men and women not following the same pursuits with all their strengths and with one mind, for thus, the state instead of being whole is reduced to half.",Plato,Women
"I would go out with women my age, but there are no women my age.",George Burns,Women
Victoria's Secret is really about celebrating women and what they stand for: the strength.,Cara Delevingne,Women
"Women are hypocrites. Women are opportunists. Women are liars. They are abusers and bullies and manipulators. They are capable of cruelty, callousness, and evil. Just like men.",Bari Weiss,Women
"If women's rights are a problem for some modern Muslim men, it is neither because of the Quran nor the Prophet, nor the Islamic tradition, but simply because those rights conflict with the interests of a male elite.",Fatema Mernissi,Women
"Others have said it before me. If you don't have a seat at the table, you're probably on the menu. And so it is important that we have women in the United States Senate - strong women, women who are there to help advance an agenda that is important to women.",Elizabeth Warren,Women
"Women are capable of doing so many things these days, physically, emotionally, within relationships and career. There are so many things that women have evolved into and I feel really proud about where women are right now.",Cameron Diaz,Women
I like my coffee like I like my women. In a plastic cup.,Eddie Izzard,Women
"Women: You can't live with them, and you can't get them to dress up in a skimpy little Nazi costume and beat you with a warm squash or something.",Emo Philips,Women
Women are like teabags. We don't know our true strength until we are in hot water!,Unknown,Women
"I like women. I don't understand them, but I like them.",Sean Connery,Women
The man who loves other countries as much as his own stands on a level with the man who loves other women as much as he loves his own wife.,Theodore Roosevelt,Women
"I'd much rather be a woman than a man. Women can cry, they can wear cute clothes, and they're the first to be rescued off sinking ships.",Gilda Radner,Women
Old-fashioned ways which no longer apply to changed conditions are a snare in which the feet of women have always become readily entangled.,Jane Addams,Women
"Women are our most miraculous muse, an enchanted intangibility that encourages all art.",CeeLo Green,Women
"My advice to women in general: Even if you're doing a nine-to-five job, treat yourself like a boss. Not arrogant, but be sure of what you want - and don't allow people to run anything for you without your knowledge.",Nicki Minaj,Women
"When women reassert their relationship with the wildish nature, they are gifted with a permanent and internal watcher, a knower, a visionary, an oracle, an inspiratrice, an intuitive, a maker, a creator, an inventor, and a listener who guide, suggest, and urge vibrant life in the inner and outer world.",Clarissa Pinkola Estes,Women
"The big divide in this country is not between Democrats and Republicans, or women and men, but between talkers and doers.",Thomas Sowell,Women
"I was raised by strong women, and that DNA is in my daughter and wife.",Dwayne Johnson,Women
"I've been misunderstood when it comes to women. I've got a big heart and a little brain. But I love women being women; there's something about their skin. I do love strong, independent women, but they are definitely complicated.",Travis Fimmel,Women
I would like to tell the young men and women before me not to lose hope and courage. Success can only come to you by courageous devotion to the task lying in front of you.,C. V. Raman,Women
Gaming in general is a male thing. It isn't that gaming is designed to exclude women. Everybody who's tried to design a game to interest a large female audience has failed. And I think that has to do with the different thinking processes of men and women.,Gary Gygax,Women
"All right, then nobody can complain if we ask pregnant women to make parachute jumps.",Muammar al-Gaddafi,Women
I believe it's time that women truly owned their superpowers and used their beauty and strength to change the world around them.,Janelle Monae,Women
"The thing women must do to rise to power is to redefine their femininity. Once, power was considered a masculine attribute. In fact, power has no sex.",Katharine Graham,Women
"I'm not particularly a feminist, but if you get women off the animal cycle of reproduction and give them some say in how many children they'll have, immediately the floor will rise.",Christopher Hitchens,Women
"I like a women who's got some balls, some strength. As long as I can beat her at arm wrestling, that's fine.",James Hetfield,Women
"There can be no equality or opportunity if men and women and children be not shielded in their lives from the consequences of great industrial and social processes which they cannot alter, control, or singly cope with.",Woodrow Wilson,Women
"People think of Latina women as being fiery and fierce, which is usually true. But I think the quality that so many Latinas possess is strength. I'm very proud to have Latin blood.",Zoe Saldana,Women
"Like all women, my path to womanhood is unique. No two paths are the same. Each of us travel with different privileges, challenges, and perspectives - some limiting, others illuminating.",Sarah McBride,Women
Women like me aren't supposed to run for office.,Alexandria Ocasio-Cortez,Women
"Women should take care of each other, not tear each other down.",Jennifer Garner,Women
"Women are only children of a larger growth. A man of sense only trifles with them, plays with them, humours and flatters them, as he does with a sprightly and forward child; but he neither consults them about, nor trusts them with, serious matters.","Philip Stanhope, 4th Earl of Chesterfield",Women
"Really, every woman is an example to me, because as women we go through so much pain. We have to live this perfect life when we are messed up inside. We all go through trials and tribulations.",Mary J. Blige,Women
The higher the better. It's more about an attitude. High heels empower women in a way.,Christian Louboutin,Women
"When men talk about defense, they always claim to be protecting women and children, but they never ask the women and children what they think.",Patricia Schroeder,Women
"Here in America we are descended in blood and in spirit from revolutionists and rebels - men and women who dare to dissent from accepted doctrine. As their heirs, may we never confuse honest dissent with disloyal subversion.",Dwight D. Eisenhower,Women
Men always want to be a woman's first love - women like to be a man's last romance.,Oscar Wilde,Women
"Women's rights is not only an abstraction, a cause; it is also a personal affair. It is not only about us; it is also about me and you. Just the two of us.",Toni Morrison,Women
Feminism is not just about women; it's about letting all people lead fuller lives.,Jane Fonda,Women
"As women, we have super powers. We are sisters. We are healers. We are mothers. We are goddess warriors.",Merle Dandridge,Women
It is our duty as men and women to proceed as though the limits of our abilities do not exist.,Pierre Teilhard de Chardin,Women
The story of the human race is the story of men and women selling themselves short.,Abraham Maslow,Women
We can't destroy the inequities between men and women until we destroy marriage.,Robin Morgan,Women
The glory of justice and the majesty of law are created not just by the Constitution - nor by the courts - nor by the officers of the law - nor by the lawyers - but by the men and women who constitute our society - who are the protectors of the law as they are themselves protected by the law.,Robert Kennedy,Women
Men get to be a mixture of the charming mannerisms of the women they have known.,F. Scott Fitzgerald,Women
"All women are forces of nature, and I believe in their power.",Stephanie McMahon,Women
"As a woman leader, I thought I brought a different kind of leadership. I was interested in women's issues, in bringing down the population growth rate... as a woman, I entered politics with an additional dimension - that of a mother.",Benazir Bhutto,Women
There are so many men and women who hold no distinctive positions but whose contribution towards the development of society has been enormous.,Nelson Mandela,Women
"If you're gay, that doesn't mean I want to discriminate against you, belittle or bully you, abuse or offend you. Not at all. I don't want to go back to the dark days of criminalisation and the imprisonment of gay men and women; of Section 28 and legalised discrimination.",Mehdi Hasan,Women
I create women characters by watching the female staff at my studio. Half the staff are women.,Hayao Miyazaki,Women
Safety and security of women and children will determine the well-being and strength of our nations.,Rajnath Singh,Women
"Just as there is a wage gap between men and women in the workplace, there is a 'leisure gap' between them at home. Most women work one shift in the office or factory and a 'second shift' at home.",Arlie Russell Hochschild,Women
"It's really important that young women be reminded that their involvement matters and that their voice is heard. Even if it feels like it's small, it really can make an impact.",Meghan Markle,Women
I can hear the roar of women's silence.,Thomas Sankara,Women
I hate wars and violence but if they come then I don't see why we women should just wave our men a proud goodbye and then knit them balaclavas.,Nancy Wake,Women
"I think the main goal of the feminist movement was the status degradation of the full-time homemaker. They really wanted to get all women out of the homes and into the workforce. And again and again, they taught that the only fulfilling lifestyle was to be in the workforce reporting to a boss instead of being in the home reporting to a husband.",Phyllis Schlafly,Women
Strong women only marry weak men.,Bette Davis,Women
I don't get all the women that I want... I get all the women that want me.,David Lee Roth,Women
I didn't want to let women down. One of the stereotypes I see breaking is the idea of aging and older women not being beautiful.,Annie Leibovitz,Women
"There are two kinds of women, those who want power in the world and those who want power in bed.",Jackie Kennedy,Women
Women have very little idea of how much men hate them.,Germaine Greer,Women
"It was we, the people; not we, the white male citizens; nor yet we, the male citizens; but we, the whole people, who formed the Union. And we formed it, not to give the blessings of liberty, but to secure them; not to the half of ourselves and the half of our posterity, but to the whole people - women as well as men.",Susan B. Anthony,Women
"War is big business. It's a lot of money going to and fro, and unfortunately a lot of angst, and a lot of fear, and a lot of doubt. And eventually a lot of wonderful people, like soldiers, like men and women that are out there trying to do the best they can, they come back being wounded on many levels.",Jon Anderson,Women
Surrounding myself with beautiful women keeps me young.,Hugh Hefner,Women
"A Negro woman has the same kind of problems as other women, but she can't take the same things for granted.",Dorothy Height,Women
"Men kick friendship around like a football, but it doesn't seem to crack. Women treat it like glass and it goes to pieces.",Anne Morrow Lindbergh,Women
"There are women who can make you feel more with their bodies and their souls, but these are the exact women who will turn the knife into you right in front of the crowd. Of course, I expect this, but the knife still cuts.",Charles Bukowski,Women
Mr. President how long must women wait to get their liberty? Let us have the rights we deserve.,Alice Paul,Women
"Women can be powerful, graceful, and complex, with the ability to make any choice they desire.",Jessica Chastain,Women
Women want to attract a 'high-value' man. If that's the man you want to attract you have to be high value yourself.,Matthew Hussey,Women
The reason women don't play football is because 11 of them would never wear the same outfit in public.,Phyllis Diller,Women
"Women - always in trouble with them, but can't live without them.",Ayrton Senna,Women
"I want for myself what I want for other women, absolute equality.",Agnes Macphail,Women
I love women to death.,Playboi Carti,Women
"Women are in a position now to voice their opinion... women are getting empowered. The more power they get, the more voice they get to shift certain things around. Now I have a daughter, I understand. When I didn't have a daughter, I didn't understand.",Snoop Dogg,Women
"I was a child who went about in a world of colors... My friends, my companions, became women slowly; I became old in instants.",Frida Kahlo,Women
"Light-skinned women, we can break them down more easy.",Kodak Black,Women
"You can't forget that organizational success flows from the hearts and minds of the men and women you lead. Rather than treating your people as you'd like to be treated, treat them as they would like to be treated. Small gestures like opting for face-to-face meetings or sending personal notes can have an enormous impact on teams and their morale.",Marillyn Hewson,Women
People say I'm wearing heels because I'm short. I wear heels because the women like 'em.,Prince,Women
Women... can't live with 'em... can't shoot 'em.,Ivan Turgenev,Women
Unity is power; without unity women cannot fight for their rights anywhere.,Nawal El Saadawi,Women
"Men make the moral code and they expect women to accept it. They have decided that it is entirely right and proper for men to fight for their liberties and their rights, but that it is not right and proper for women to fight for theirs.",Emmeline Pankhurst,Women
"If men knew how women pass the time when they are alone, they'd never marry.",O. Henry,Women
"Men and women must be educated, in a great degree, by the opinions and manners of the society they live in.",Mary Wollstonecraft,Women
"When God created man and woman, he was thinking, 'Who shall I give the power to, to give birth to the next human being?' And God chose woman. And this is the big evidence that women are powerful.",Malala Yousafzai,Women
"I just think that knowing about your body at any age, whether it's educating yourself on fertility, getting mammograms, going through puberty - whatever it may be, is really important. I just really encourage women empowerment and being comfortable talking about these issues.",Khloe Kardashian,Women
"This position is untenable, and there can be no pause in the agitation for full political power and responsibility until these are granted to all the women of the nation.",Florence Kelley,Women
"Information, education, skills, healthcare, livelihood, financial inclusion, small and village enterprises, opportunities for women, conservation of natural resources, distributed clean energy - entirely new possibilities have emerged to change the development model.",Narendra Modi,Women
I like women. I love women.,ASAP Rocky,Women
"Women today have so many opportunities in fields like engineering. The work is new and engineers are making things work, making the impossible possible. I want girls to know about the opportunities out there.",Judith Love Cohen,Women
I want to be motivational and inspirational for everybody: my big aim is more women on bicycles.,Marianne Vos,Women
"Women are not one-dimensional, we come in different shapes and sizes, and we are all equally beautiful.",Zozibini Tunzi,Women
I could sooner reconcile all Europe than two women.,Louis XIV,Women
"A miracle is really the only way to describe motherhood and giving birth. It's unbelievable how God has made us women and babies to endure and be able to do so much. A miracle, indeed. Such an incredible blessing.",Jennie Finch,Women
How can smart women be so stupid about men sometimes? Lack of knowledge. It's what men have kept secret for so long.,Steve Harvey,Women
"The use of the atomic bomb, with its indiscriminate killing of women and children, revolts my soul.",Herbert Hoover,Women
"I want 'Scars to Your Beautiful' to reach different types of women. The girl I am talking about, it's me, it's you - it's every girl who has struggled with feeling not good enough. I want to talk about all the different extremes that girls go through to feel beautiful.",Alessia Cara,Women
"As women, we may not be a minority, but there is a bond that we all share. It is not a bond of geography. Or religion. Or culture. It is a bond of shared experience - experiences that only women go through and struggles that only women face.",Amal Clooney,Women
Boxing is the most beautiful thing after women.,Canelo Alvarez,Women
Women absolutely deserve respect.,Aretha Franklin,Women
"There was a time in my life when I thought I had everything - millions of dollars, mansions, cars, nice clothes, beautiful women, and every other materialistic thing you can imagine. Now I struggle for peace.",Richard Pryor,Women
"To a philosopher all news, as it is called, is gossip, and they who edit and read it are old women over their tea.",Henry David Thoreau,Women
I gotta be honest with you. I'm kind of jealous of the way my dad gets to talk to my mom sometimes. Where are all those old-school women you can just take your day out on? When did they stop making those angels?,Bill Burr,Women
Beauty is the first present nature gives to women and the first it takes away.,Fay Weldon,Women
I've never wanted to look like models on the cover of magazines. I represent the majority of women and I'm very proud of that.,Adele,Women
No longer shall I paint interiors with men reading and women knitting. I will paint living people who breathe and feel and suffer and love.,Edvard Munch,Women
"I'll always identify with the image of a strong woman. I believe that in what I do and in my sense of self, there's a vindication of women. There's power.",Rosalia,Women
"Human rights are women's rights, and women's rights are human rights.",Hillary Clinton,Women
"Women tend to be more intuitive, or to admit to being intuitive, and maybe the hard science approach isn't so attractive. The way that science is taught is very cold. I would never have become a scientist if I had been taught like that.",Jane Goodall,Women
I dress for women and I undress for men.,Angie Dickinson,Women
"Every day, women move mountains. It is an insult to have an international women's day.",Waris Dirie,Women
"In the public eye, girls and women with strong perspectives are hated. If you're a girl with an opinion, people just hate you. There are still people who are afraid of successful women, and that's so lame.",Billie Eilish,Women
"I like my women to be feminine, not sliding into tackles and covered in mud.",Brian Clough,Women
To be born woman is to know - although they do not speak of it at school - women must labor to be beautiful.,William Butler Yeats,Women
Women have no sympathy and my experience of women is almost as large as Europe.,Florence Nightingale,Women
"Within a culture possessed by the myth of feminine evil, the naming, describing, and theorizing about good and evil has constituted a maze/haze of deception. The journey of women becoming is breaking through this maze - springing into free space, which is an a-mazing process.",Mary Daly,Women
But what of black women?... I most sincerely doubt if any other race of women could have brought its fineness up through so devilish a fire.,W. E. B. Du Bois,Women
"We need women who are devoted to shepherding God's children along the covenant path toward exaltation; women who know how to receive personal revelation, who understand the power and peace of the temple endowment; women who know how to call upon the powers of heaven to protect and strengthen children and families; women who teach fearlessly.",Russell M. Nelson,Women
"We must not only imagine a better future for women, children, and persecuted minorities; we must work consistently to make it happen - prioritizing humanity, not war.",Nadia Murad,Women
So many women just don't know how great they really are. They come to us all vogue outside and vague on the inside.,Mary Kay Ash,Women
What made women's labour particularly attractive to the capitalists was not only its lower price but also the greater submissiveness of women.,Clara Zetkin,Women
"As we know, menstrual hygiene is an issue women have been facing over the years. It's great that the initiative to provide low-cost sanitary napkins has been undertaken. It is an empowering step for many women.",Radhika Apte,Women
"African women in general need to know that it's OK for them to be the way they are - to see the way they are as a strength, and to be liberated from fear and from silence.",Wangari Maathai,Women
"Ambition has developed into a passion which drives women, as well as men, to great works - and small deeds. Formerly competitors in the race for men, they are now competing in the race for social tasks and distinctions.",Ellen Key,Women
Men and women are like right and left hands; it doesn't make sense not to use both.,Jeannette Rankin,Women
"There are three roads to ruin; women, gambling and technicians. The most pleasant is with women, the quickest is with gambling, but the surest is with technicians.",Georges Pompidou,Women
Women make the world go round.,Megan Thee Stallion,Women
"If we mean to have heroes, statesmen and philosophers, we should have learned women.",Abigail Adams,Women
"Strong women, when respected, make the whole society stronger. One must be careful with such rapid changes, though, and make an effort to preserve, at the same time, the positive traditions of Indian culture.",Chitra Banerjee Divakaruni,Women
There's no limit to what free men and free women in a free market with free enterprise can accomplish when people are free to follow their dream.,Jack Kemp,Women
"It should be remarked that, as the principle of liberty is better understood, and more nobly interpreted, a broader protest is made in behalf of women. As men become aware that few have had a fair chance, they are inclined to say that no women have had a fair chance.",Margaret Fuller,Women
"If you've got the body and the chutzpah, a pencil skirt is so sexy on older women. Look for ones that fall just below the knee. Think 1940s, cinched-in jackets - imagine you are Lauren Bacall on a date with Humphrey Bogart and you just absolutely have to wear very high heels.",Twiggy,Women
"Men are not the enemy, but the fellow victims. The real enemy is women's denigration of themselves.",Betty Friedan,Women
Women are like ovens. We need 5 to 15 minutes to heat up.,Sandra Bullock,Women
The idea that women were oppressed throughout history is an appalling theory.,Jordan Peterson,Women
"Sometimes when we think about femininity, we think also fragile. But I think you can be feminine and very strong. I think make-up goes with that femininity. I think it's a natural gesture for women and one they do more for themselves than for others.",Monica Bellucci,Women
"The Iowa Women's Health Study, which has followed more than 35,000 women for decades, found eating more broccoli, cauliflower, kale and other cruciferous vegetables was associated with a lower risk of getting non-Hodgkin's lymphoma in the first place.",Michael Greger,Women
"Women make natural anarchists and revolutionaries because they've always been second-class citizens, kinda having had to claw their way up. I mean, who made up all the rules in the culture? Men - white male corporate society. So why wouldn't a woman want to rebel against that?",Kim Gordon,Women
"I love women, but I feel like you can't trust some of them. Some of them are liars, you know? Like I was in the park and I met this girl, she was cute and she had a dog. And I went up to her, we started talking. She told me her dog's name. Then I said, 'Does he bite?' She said, 'No.' And I said, 'Oh yeah? Then how does he eat?' Liar.",Demetri Martin,Women
"As women gain weight, they start judging themselves. But who cares! Embrace what you have. Say, 'Belly, you might be poking out today, but I'm going to choose to love you and nurture you.'",Ashley Graham,Women
"Everyone now knows how to find the meaning of life within himself. But mankind wasn't always so lucky. Less than a century ago, men and women did not have easy access to the puzzle boxes within them.",Kurt Vonnegut,Women
Leave women to find their sphere.,Lucy Stone,Women
I think women are amazing for being able to show what they feel. I admire women who do. I think it's a mistake when women cover their emotions to look tough. I say let's own who we are and use it as a strength.,Gal Gadot,Women
"Yet consider now, whether women are not quite past sense and reason, when they want to rule over men.",John Calvin,Women
The psychology of women hitherto actually represents a deposit of the desires and disappointments of men.,Karen Horney,Women
There appears to be no limit as to how far the women's revolution will take us.,Constance Baker Motley,Women
"When black women are down with you and in your corner, you have an ally that will move Heaven and Earth.",Tyler Perry,Women
"All successful people men and women are big dreamers. They imagine what their future could be, ideal in every respect, and then they work every day toward their distant vision, that goal or purpose.",Brian Tracy,Women
"I do not believe in using women in combat, because females are too fierce.",Margaret Mead,Women
"But really, we also need to learn how to love one another as women. How to appreciate and respect each other.",Chaka Khan,Women
You cannot make women contented with cooking and cleaning and you need not try.,Ellen Swallow Richards,Women
