quotes,authors,categories
I feel to invite women everywhere to rise to the great potential within you. I do not ask that you reach beyond your capacity. I hope you will not nag yourselves with thoughts of failure. I hope you will not try to set goals far beyond your capacity to achieve. I hope you will simply do what you can do in the best way you know.,Gordon B. Hinckley,Women
We women have to stick together.,Chelsea Handler,Women
"I guess I was a bad boy... Yes, yes, I've had lots of women in my life.",Kirk Douglas,Women
Anyone who says he can see through women is missing a lot.,Groucho Marx,Women
It is downright mockery to talk to women of their enjoyment of the blessings of liberty while they are denied the use of the only means of securing them provided by this democratic-republican government: the ballot.,Susan B. Anthony,Women
We must make it clear that a platform of 'I hate gay men and women' is not a way to become president of the United States.,Jimmy Carter,Women
I don't get my inspiration from books or a painting. I get it from the women I meet.,Carolina Herrera,Women
"In the adjustment of the new order of things, we women demand an equal voice; we shall accept nothing less.",Carrie Chapman Catt,Women
Feminism has never been about getting a job for one woman. It's about making life more fair for women everywhere. It's not about a piece of the existing pie; there are too many of us for that. It's about baking a new pie.,Gloria Steinem,Women
I've only slept with men I've been married to. How many women can make that claim?,Elizabeth Taylor,Women
"Women, as they grow older, rely more and more on cosmetics. Men, as they grow older, rely more and more on a sense of humor.",George Jean Nathan,Women
"When men and women agree, it is only in their conclusions; their reasons are always different.",George Santayana,Women
"There's this myth that women are supposed to compete with each other or something, or we're supposed to hate each other, and that's totally not productive.",Mitski,Women
"Reading, solitude, idleness, a soft and sedentary life, intercourse with women and young people, these are perilous paths for a young man, and these lead him constantly into danger.",Jean-Jacques Rousseau,Women
"In it not easy to remain rational and normal mentally in such a setting where, even in our airport in Montgomery, there is a white waiting room... There are restroom facilities for white ladies and colored women, white men and colored men. We stand outside after being served at the same ticket counter instead of sitting on the inside.",Rosa Parks,Women
"For quite some time, women at NASA only had scientific backgrounds.",Sally Ride,Women
Elections are won by men and women chiefly because most people vote against somebody rather than for somebody.,Franklin Pierce Adams,Women
"These impossible women! How they do get around us! The poet was right: Can't live with them, or without them.",Aristophanes,Women
If any come to my house to be instructed in the ways of God what rule have I to put them away? Do you think it not lawful for me to teach women and why do you call me to teach the court?,Anne Hutchinson,Women
Gifted women musicians and composers rarely received their due.,James Cook,Women
"Obviously, there are moments that you look back at and cringe - things in the past involving violence or disrespect to women or disrespect to other people that are so far away from what I want to put out there now. But it's actually a privilege to be able to change and be making records that reflect that change.",Mike D,Women
Women are not in love with me but with the picture of me on the screen. I am merely the canvas on which women paint their dreams.,Rudolph Valentino,Women
Equality is like gravity. We need it to stand on this earth as men and women.,Joss Whedon,Women
"I truly believe that women should be financially independent from their men. And let's face it, money gives men the power to run the show. It gives men the power to define value. They define what's sexy. And men define what's feminine. It's ridiculous.",Beyonce Knowles,Women
"The natural superiority of women is a biological fact, and a socially acknowledged reality.",Ashley Montagu,Women
"Hence, within the space of two generations there has been a complete revolution in the attitude of the trades-unions toward the women working in their trades.",Florence Kelley,Women
The fickleness of the women I love is only equalled by the infernal constancy of the women who love me.,George Bernard Shaw,Women
The battle for the individual rights of women is one of long standing and none of us should countenance anything which undermines it.,Eleanor Roosevelt,Women
"I'm a big perfectionist! I'm trying to channel super-confident women like Alicia Keys, Mariah Carey and Beyonce, because I realized that if you want something, you really have to go for it, just like they do.",Ariana Grande,Women
"Without women to nurture in this world, how do - how do men get by? How do children get by? How does society get by at all?",Raquel Welch,Women
"As Indian women, we are always balancing work, life, home, etc. It's important to know that while juggling rubber balls and glass balls, the former may bounce back when you miss, but the glass balls will crack if you let them fall. So prioritise, prioritise, prioritise.",Nita Ambani,Women
"I seem to be getting a lot of things pushed my way that are strong women. It's like people see Hackers and they send me offers to play tough women with guns, the kind who wear no bra and a little tank top. I'd like to play strong women who are also very feminine.",Angelina Jolie,Women
"I think the bottom of the totem pole is African-American women, or women of colour. I think they get the least opportunities in Hollywood.",Denzel Washington,Women
"Whenever people say 'women's soccer,' I want to correct them to say 'soccer.' Every girl has had their sport diminished because they're girls.",Alex Morgan,Women
"This world crisis came about without women having anything to do with it. If the women of the world had not been excluded from world affairs, things today might have been different.",Alice Paul,Women
To conclude that women are unfitted to the task of our historic society seems to me the equivalent of closing male eyes to female facts.,Lyndon B. Johnson,Women
Women have had the power of naming stolen from us.,Mary Daly,Women
"Men are angry at women because they aren't doing what they are supposed to do, which is support men. They are in the workplace claiming their own rights and often outdoing men. They are daring to bring charges of sexual assault and harassment. They are just not behaving themselves!",Martha Nussbaum,Women
"I can promise you that women working together - linked, informed and educated - can bring peace and prosperity to this forsaken planet.",Isabel Allende,Women
Women stand for the objective world for a man. They stand for the thing that you're not and that's what you always reach for in a song.,Leonard Cohen,Women
Do you know how many women in a survey reported experiences of sexual harassment on the job? Eighty percent. It is so common. It's normalized. And it's an abuse of power.,Maya Wiley,Women
I hate women because they always know where things are.,James Thurber,Women
I have always had a talent for irritating women since I was fourteen.,Marilyn Monroe,Women
"There is no such thing as society: there are individual men and women, and there are families.",Margaret Thatcher,Women
"Women and girls are naturally agents of change. If we teach one girl to code, she will go on to teach more - we've seen this in our own programs and workshops around the country.",Kimberly Bryant,Women
"Women are systematically degraded by receiving the trivial attentions which men think it manly to pay to the sex, when, in fact, men are insultingly supporting their own superiority.",Mary Wollstonecraft,Women
My sisters and mom raised me to respect women and open doors for them.,Milo Ventimiglia,Women
"I am truly free only when all human beings, men and women, are equally free. The freedom of other men, far from negating or limiting my freedom, is, on the contrary, its necessary premise and confirmation.",Mikhail Bakunin,Women
People are more violently opposed to fur than leather because it's safer to harass rich women than motorcycle gangs.,Alexei Sayle,Women
Women deeply want men who are competent and powerful. And I don't mean power in that they can exert tyrannical control over others. That's not power. That's just corruption.,Jordan Peterson,Women
"The more you win, the brand of women's cricket will go higher.",Mithali Raj,Women
"I have affected the way women are regarded, and that's important to me.",Barbara Walters,Women
"I come from a long line of strong and confident women out of New Orleans. My grandmother and great-grandmother were women who ran their homes and were leaders in their communities. I was never taught that there was anything that I couldn't do, and I believed that.",Stephanie Allain,Women
Social motherliness has made women's struggle for liberty the loveliest synthesis of egoism and altruism.,Ellen Key,Women
"My mother was a dominant force in our family. And I always saw her as the leader. And that was great for me as a young woman, because I never saw that women had to be dominated by men.",Dolores Huerta,Women
"I do feel that I have to use my voice for those that don't have one. I have to do the best I can in my own work to represent my culture, represent the women of my country, of Latin America. What we stand for. What we're made of.",Shakira,Women
Women may fall when there's no strength in men.,William Shakespeare,Women
"Everything is a risk in Pakistan: If you defend women, it's a risk. If you defend non-Muslims it's a risk. If you discuss religion, it's a risk. But you can't really sit there like a vegetable in your own society. And I'm committed to that society... and I feel I need to turn around and speak as I should.",Asma Jahangir,Women
"Women are the real reason we get up every day. I'm talking about real men. If there were no women, I would not even have to bathe, because why would I care? These are guys I'm hanging with. I wake up for a woman every day of my life to make it happen for her.",Steve Harvey,Women
But the true feminist deals out of a lesbian consciousness whether or not she ever sleeps with women.,Audre Lorde,Women
We've got to get women to sit at the table.,Sheryl Sandberg,Women
"I certainly don't think of my life as a fairy tale. I think of myself as a modern, contemporary woman who has had to deal with all kinds of problems that many women today have to deal with.",Grace Kelly,Women
"Aristotle maintained that women have fewer teeth than men; although he was twice married, it never occurred to him to verify this statement by examining his wives' mouths.",Bertrand Russell,Women
"I made 'LS4TS2' for women, my Day 1's, the trenches, and all those that doubted me.",Lil Durk,Women
"That's all I could ever hope for, to have a positive effect on women. 'Cos women are powerful, powerful beings. But they're also the most doubtful beings. They'll never know - we'll never know - how powerful we are.",Rihanna,Women
"The Montgomery Bus Boycott began in December 1955, and by 1956 NAACP leaders came to me and asked me to be part of a lawsuit they wanted to file on my behalf and that of three other women, to challenge segregation on public buses.",Claudette Colvin,Women
"The older I get, the more impressed I am with women. I have yet to meet a woman who is not strong. They don't exist.",Diane von Furstenberg,Women
I regard affirmative action as pernicious - a system that had wonderful ideals when it started but was almost immediately abused for the benefit of white middle-class women.,Camille Paglia,Women
"With young people, I always say, 'You're not doing anyone any favours by withholding your power.' As women, we do that a lot because we are afraid of being misunderstood or perceived as too strong. But the older I'm getting, the more I realise you have to let that go.",Idina Menzel,Women
"If photographers are responsible for creating or reflecting an image of women in society, then, I must say, there is only one way for the future, and this is to define women as strong and independent. This should be the responsibility of photographers today: to free women, and finally everyone, from the terror of youth and perfection.",Peter Lindbergh,Women
"As it stands, motherhood is a sort of wilderness through which each woman hacks her way, part martyr, part pioneer; a turn of events from which some women derive feelings of heroism, while others experience a sense of exile from the world they knew.",Rachel Cusk,Women
"Stupid as a man, say the women: cowardly as a woman, say the men. Stupidity in a woman is unwomanly.",Friedrich Nietzsche,Women
"For a very long time now I've been saying to young women, 'You can have it all, but not all at the same time.' How important it is to take very good care of yourself, of your mental and physical and spiritual wellbeing; it's hard to do. It's easier to be a workaholic than to have a truly balanced life.",Quentin Bryce,Women
"Sure, women sportswriters look when they're in the clubhouse. Read their stories. How else do you explain a capital letter in the middle of a word?",Bob Uecker,Women
Women have learned to flex their political muscles. You got to flex that muscle to get what you want.,Shirley Chisholm,Women
"If women are expected to do the same work as men, we must teach them the same things.",Saul Bellow,Women
You must make women count as much as men; you must have an equal standard of morals; and the only way to enforce that is through giving women political power so that you can get that equal moral standard registered in the laws of the country. It is the only way.,Emmeline Pankhurst,Women
"I do not demand equal pay for any women save those who do equal work in value. Scorn to be coddled by your employers; make them understand that you are in their service as workers, not as women.",Susan B. Anthony,Women
"It is not women's liberation, it is women's and men's liberation.",Ruth Bader Ginsburg,Women
"A church without women would be like the apostolic college without Mary. The Madonna is more important than the apostles, and the church herself is feminine, the spouse of Christ and a mother.",Pope Francis,Women
"The women I gravitate to are the ones who defy convention and reinvent themselves - hence, they reinvent the world around them.",Iman,Women
"Women in particular need to keep an eye on their physical and mental health, because if we're scurrying to and from appointments and errands, we don't have a lot of time to take care of ourselves. We need to do a better job of putting ourselves higher on our own 'to do' list.",Michelle Obama,Women
A pessimist is a man who thinks all women are bad. An optimist is one who hopes they are.,Chauncey Depew,Women
I will feel equality has arrived when we can elect to office women who are as incompetent as some of the men who are already there.,Maureen Reagan,Women
"Women are always told, 'You're not going to make it, its too difficult, you can't do that, don't enter this competition, you'll never win it,' - they need confidence in themselves and people around them to help them to get on.",Zaha Hadid,Women
"It's so clear that you have to cherish everyone. I think that's what I get from these older black women, that every soul is to be cherished, that every flower Is to bloom.",Alice Walker,Women
"When growing up, I saw segregation. I saw racial discrimination. I saw those signs that said white men, colored men. White women, colored women. White waiting. And I didn't like it.",John Lewis,Women
Women are the only exploited group in history to have been idealized into powerlessness.,Erica Jong,Women
Sexism isn't a one-size-fits-all phenomenon. It doesn't happen to black and white women the same way.,Kimberle Williams Crenshaw,Women
"Women are so powerful they're scary, and the incentive to squash this has been going on for so long that some of us actually believe we're subordinate.",Alanis Morissette,Women
"Women's propaganda must touch upon all those questions which are of great importance to the general proletarian movement. The main task is, indeed, to awaken the women's class consciousness and to incorporate them into the class struggle.",Clara Zetkin,Women
"I opened Leith's in Notting Hill in 1969 and it eventually worked its way into being awarded a Michelin star. At the time, there were a few women running small bistros - but I was the first woman to have a 'serious,' expensive restaurant.",Prue Leith,Women
"The silent killer of all great men and women of achievement - particularly men, I don't know why, maybe it's the testosterone - I think it's narcissism. Even more than hubris. And for women, too. Narcissism is the killer.",James Woods,Women
"Liberal-socialist women generalize about women as if they are some sort of monolithic voting block of disenfranchised, victimized citizens.",Charlie Kirk,Women
"Girls are supposed to be feminine and demure. Comedy isn't about that, so you just have to unlearn it. Certain women are so pretty, they can't go weird enough to be funny. You have to be willing to be ugly. I'm lucky my face can look so hideous.",Jennifer Coolidge,Women
I love women. My life revolves around them.,Nikki Sixx,Women
"I think, with never-ending gratitude, that the young women of today do not and can never know at what price their right to free speech and to speak at all in public has been earned.",Lucy Stone,Women
"If women want any rights more than they's got, why don't they just take them, and not be talking about it.",Sojourner Truth,Women
"I make decisions all day, so it's nice for a woman like me to go to dinner and have the man take the menu and say, 'Let me order.' Other women would be offended by that, but I'm like, 'Good. Because I can't make one more decision today.' I want someone to rub my feet without being asked.",Abby Lee Miller,Women
"Women tend to be conservative in youth and get more radical as they get older because they lose power with age. So if a young woman is not a feminist, I say, 'Just wait.'",Gloria Steinem,Women
"I am very sad for men and women trapped in any relationship where there is cruelty, dominance, inequity. I long for the liberation of all people.",Jasmine Guy,Women
"The Woman's Party is made up of women of all races, creeds and nationalities who are united on the one program of working to raise the status of women.",Alice Paul,Women
Women standing up for each other is critically important.,Hillary Clinton,Women
We Abolition Women are turning the world upside down.,Angelina Grimke,Women
"I just hope that more women realize that if your gut tells you you're doing a good job, you're doing a good job.",Whitney Wolfe Herd,Women
"Men marry because they are tired; women, because they are curious; both are disappointed.",Oscar Wilde,Women
You have to be very careful with women friends.,Heather Locklear,Women
"Women ought to have representatives, instead of being arbitrarily governed without any direct share allowed them in the deliberations of government.",Mary Wollstonecraft,Women
I like my wine like my women - ready to pass out.,Robin Williams,Women
I would like to see a lot of people more involved in practical solutions to practical problems. Women have got to the point where we can turn the world upside down.,Obiageli Ezekwesili,Women
"I saw women's boxing on television for the first time when I was 18, and that's when I wanted to do it. So, it didn't come from me watching my father. I didn't know the sport existed; therefore, I wasn't really interested in it until I saw it.",Laila Ali,Women
"Very learned women are to be found, in the same manner as female warriors; but they are seldom or ever inventors.",Voltaire,Women
"Aviation offered such fun as crossing the continent in planes large and small, trying the whirling rotors of an autogiro, making record flights. With these activities came opportunity to know women everywhere who shared my conviction that there is so much women can do in the modern world and should be permitted to do irrespective of their sex.",Amelia Earhart,Women
"It can't be articulated enough, that feminism means the desire to have equality between men and women. I believe that, and I act on those beliefs by going to marches and making a difference where I can.",Maya Hawke,Women
"I love African American women, but I just don't like my skin complexion.",Kodak Black,Women
"Feminism is a socialist, anti-family, political movement that encourages women to leave their husbands, kill their children, practice witchcraft, destroy capitalism and become lesbians.",Pat Robertson,Women
"One thing I've always been concerned about is the objectification of women in ads, and that's one thing where I was like, 'Well, if I become a part of advertising, I could change that.'",Yara Shahidi,Women
"Afghan women, as a group, I think their suffering has been equaled by very few other groups in recent world history.",Khaled Hosseini,Women
The unique and supreme voluptuousness of love lies in the certainty of committing evil. And men and women know from birth that in evil is found all sensual delight.,Charles Baudelaire,Women
"I don't believe in Women's Liberation. No, no, no, no, no. Not at all.",Tiny Tim,Women
"We need to hear stories from older women. There's a wealth of wisdom and real resilience there, but they're silenced.",Hannah Gadsby,Women
"As far as I knew white women were never lonely, except in books. White men adored them, Black men desired them and Black women worked for them.",Maya Angelou,Women
I grew up in a house full of women. I have two older sisters and my mum who is a very strong woman.,Patrick Dempsey,Women
"I have great respect for the men and women that have fought for this country. I have family, I have friends that have gone and fought for this country. And they fight for freedom, they fight for the people, they fight for liberty and justice, for everyone.",Colin Kaepernick,Women
"For me, a better democracy is a democracy where women do not only have the right to vote and to elect but to be elected.",Michelle Bachelet,Women
Everyone has a different beauty and different qualities and I think that women need to learn to love their qualities and be comfortable in the fact that everyone is different.,Miranda Kerr,Women
"I have always felt strongly about empowering women. I'm living proof that, with confidence and by believing in yourself, you can accomplish any goal.",Queen Latifah,Women
"Aging does not make women powerless objects of pity but colorful and entertaining individuals and, on occasion, fire-breathing dragons that wise people don't cross.",Florence King,Women
"Women are problem solvers, and often we don't get much credit for that because the typical image of a leader is someone who's loud, obnoxious, chest-pounding. That's not my vision of what true leadership is; true leaders are the ones who work with great commitment to get something done.",Mazie Hirono,Women
"Yes, it's a man's world, but that's all right because they're making a total mess of it. We're chipping away at their control, taking the parts we want. Some women think it's a difficult task, but it's not.",Cher,Women
"Including women in climate policy and solutions can enhance the results, leading to more economic growth and sustainable outcomes. However, we cannot take for granted that gender equality and women's empowerment in the field of climate change and sustainable development will happen automatically.",Patricia Espinosa,Women
"Women now have choices. They can be married, not married, have a job, not have a job, be married with children, unmarried with children. Men have the same choice we've always had: work, or prison.",Tim Allen,Women
Women. They are a complete mystery.,Stephen Hawking,Women
"For a man to strike any women is most brutal, and I, as well as everyone else, think this far worse than any attempt to shoot, which, wicked as it is, is at least more comprehensible and more courageous.",Queen Victoria,Women
"I separated from the Southern Baptists when they adopted the discriminatory attitude towards women, because I believe what Paul taught in Galatians that there is no distinction in God's eyes between men and women, slaves and masters, Jews and non-Jews - everybody is created equally in the eyes of God.",Jimmy Carter,Women
I don't care for the music when they're talking bad about women because I think women are God's greatest gift to the planet - I just like music.,B. B. King,Women
"Marriage, to women as to men, must be a luxury, not a necessity; an incident of life, not all of it.",Susan B. Anthony,Women
"Looks are temporary and don't mirror what's inside. And usually, a great looking man is so vain. Maybe most good-looking women are too. I hope I'm not!",Dorothy Stratten,Women
When men and women are able to respect and accept their differences then love has a chance to blossom.,John Gray,Women
No nation can rise to the height of glory unless your women are side by side with you.,Muhammad Ali Jinnah,Women
San Francisco is a mad city - inhabited for the most part by perfectly insane people whose women are of a remarkable beauty.,Rudyard Kipling,Women
The Bible and the Church have been the greatest stumbling blocks in the way of women's emancipation.,Elizabeth Cady Stanton,Women
I want people to be afraid of the women I dress.,Alexander McQueen,Women
What is sad for women of my generation is that they weren't supposed to work if they had families. What were they going to do when the children are grown - watch the raindrops coming down the window pane?,Jackie Kennedy,Women
"My mother was the most amazing person. She taught me to be kind to other women. She believed in family. She was with my father from the first day they met. All that I am, she taught me.",Sidney Poitier,Women
